bug_id,component,status,resolution,summary,changed,severity,number_comments,os,assignee_id,reporter_id,open_date,closed_date,fixed_by
1,GTK+ UI,RESOLVED,NOTABUG,Says Bogus IP while using UDP multicast,10/27/09 5:33,Major,7,Windows XP,bugzilla-admin,ulf.lamping,4/6/05 14:47,2008-08-26 12:51:08 UTC,michael.brace
2,GTK+ UI,RESOLVED,FIXED,ethereal's working great,7/10/08 9:57,Critical,3,Linux (other),bugzilla-admin,gram,4/6/05 20:50,2005-04-14 06:37:41 UTC,bugzilla-admin
3,GTK+ UI,RESOLVED,FIXED,another test bug,4/14/05 6:25,Blocker,2,Linux (other),bugzilla-admin,gram,4/6/05 20:56,2005-04-14 06:25:37 UTC,ulf.lamping
4,TShark,VERIFIED,FIXED,Buildbot found a bug,4/11/05 13:19,Critical,1,FreeBSD,gerald,buildbot-do-not-reply,4/7/05 13:48,2005-04-11 13:17:20 UTC,bugzilla-admin
5,TShark,RESOLVED,FIXED,Buildbot crash output,4/8/05 14:10,Critical,2,FreeBSD,gram,buildbot-do-not-reply,4/7/05 22:17,2005-04-08 14:10:59 UTC,gerald
6,TShark,RESOLVED,FIXED,Buildbot crash output,4/8/05 14:14,Critical,2,FreeBSD,bugzilla-admin,buildbot-do-not-reply,4/8/05 9:07,2005-04-08 14:14:21 UTC,gerald
7,TShark,RESOLVED,FIXED,Buildbot crash output,4/28/05 17:28,Critical,2,FreeBSD,bugzilla-admin,buildbot-do-not-reply,4/10/05 13:17,2005-04-28 17:28:06 UTC,gerald
8,TShark,RESOLVED,DUPLICATE,Fuzzed capture causes RPC exception,5/2/05 15:54,Blocker,6,Linux (other),bugzilla-admin,gerald,4/10/05 18:24,2005-05-02 15:54:55 UTC,gerald
9,TShark,VERIFIED,DUPLICATE,Buildbot crash output,4/11/05 9:40,Critical,2,FreeBSD,bugzilla-admin,buildbot-do-not-reply,4/10/05 20:39,2005-04-11 09:39:52 UTC,gerald
10,GTK+ UI,VERIFIED,FIXED,Automatic buil;dbot builds not longer available,4/11/05 9:07,Blocker,3,All,bugzilla-admin,ronniesahlberg,4/11/05 6:25,2005-04-11 08:51:55 UTC,anders.broman
11,GTK+ UI,RESOLVED,FIXED,protocol Messenger: message is truncated,5/29/05 6:24,Minor,3,Linux (other),bugzilla-admin,toralf.foerster,4/11/05 8:54,2005-05-29 06:24:10 UTC,ulf.lamping
12,TShark,VERIFIED,FIXED,Buildbot crash output,4/13/05 16:03,Critical,6,FreeBSD,bugzilla-admin,buildbot-do-not-reply,4/11/05 14:17,2005-04-13 16:00:32 UTC,gerald
13,TShark,VERIFIED,DUPLICATE,Buildbot crash output,4/13/05 16:01,Critical,2,FreeBSD,bugzilla-admin,buildbot-do-not-reply,4/11/05 14:47,2005-04-13 16:00:51 UTC,gerald
14,TShark,VERIFIED,DUPLICATE,Buildbot crash output,4/13/05 16:01,Critical,2,FreeBSD,bugzilla-admin,buildbot-do-not-reply,4/11/05 20:32,2005-04-13 16:01:32 UTC,gerald
15,GTK+ UI,RESOLVED,LATER,Revision: 14053: Sorting column by ip address is wrong,4/18/05 17:59,Enhancement,2,Linux (other),bugzilla-admin,toralf.foerster,4/12/05 7:21,2005-04-18 17:59:42 UTC,ulf.lamping
16,GTK+ UI,RESOLVED,FIXED,'View'->'Resize Columns' : no manual resizing possible,4/14/05 16:01,Minor,3,Linux (other),ulf.lamping,toralf.foerster,4/12/05 9:31,2005-04-14 16:01:23 UTC,ulf.lamping
17,GTK+ UI,RESOLVED,NOTABUG,live capture: filtering protocol 'PPP LCP' is not possible,4/21/05 13:01,Minor,3,Linux (other),bugzilla-admin,toralf.foerster,4/12/05 9:35,2005-04-21 13:01:05 UTC,toralf.foerster
18,GTK+ UI,RESOLVED,FIXED,gtk warning,4/21/05 6:20,Minor,3,Linux (other),ulf.lamping,toralf.foerster,4/12/05 9:45,2005-04-21 06:20:58 UTC,toralf.foerster
19,GTK+ UI,VERIFIED,FIXED,bugzilla: default severity of 'Blocker' is to high,4/13/05 15:45,Blocker,2,Linux (other),bugzilla-admin,toralf.foerster,4/12/05 9:46,2005-04-13 15:45:00 UTC,bugzilla-admin
20,TShark,VERIFIED,DUPLICATE,Buildbot crash output,4/13/05 16:02,Critical,2,FreeBSD,bugzilla-admin,buildbot-do-not-reply,4/12/05 15:32,2005-04-13 16:02:32 UTC,gerald
21,TShark,RESOLVED,DUPLICATE,Buildbot crash output,11/25/12 1:04,Critical,6,FreeBSD,bugzilla-admin,buildbot-do-not-reply,4/12/05 16:42,2005-04-13 16:03:03 UTC,huangqingjn
22,TShark,RESOLVED,FIXED,Buildbot crash output,4/13/05 16:20,Critical,2,FreeBSD,bugzilla-admin,buildbot-do-not-reply,4/12/05 19:22,2005-04-13 16:20:55 UTC,gerald
23,TShark,RESOLVED,FIXED,Buildbot crash output,4/14/05 14:53,Critical,2,FreeBSD,bugzilla-admin,buildbot-do-not-reply,4/13/05 16:32,2005-04-14 14:53:41 UTC,gerald
24,TShark,RESOLVED,FIXED,Buildbot crash output,4/14/05 15:01,Critical,2,FreeBSD,bugzilla-admin,buildbot-do-not-reply,4/13/05 17:07,2005-04-14 15:01:28 UTC,gerald
25,TShark,RESOLVED,FIXED,Buildbot crash output,4/14/05 15:34,Critical,6,FreeBSD,bugzilla-admin,buildbot-do-not-reply,4/13/05 17:37,2005-04-14 15:16:53 UTC,gerald
26,TShark,RESOLVED,FIXED,Buildbot crash output,4/14/05 15:30,Critical,2,FreeBSD,bugzilla-admin,buildbot-do-not-reply,4/13/05 18:07,2005-04-14 15:30:20 UTC,gerald
27,TShark,RESOLVED,DUPLICATE,Buildbot crash output,4/14/05 15:31,Critical,3,FreeBSD,bugzilla-admin,buildbot-do-not-reply,4/13/05 18:37,2005-04-14 15:31:54 UTC,gerald
28,TShark,RESOLVED,DUPLICATE,Buildbot crash output,4/14/05 15:33,Critical,3,FreeBSD,bugzilla-admin,buildbot-do-not-reply,4/13/05 19:12,2005-04-14 15:33:20 UTC,gerald
29,TShark,RESOLVED,DUPLICATE,Buildbot crash output,4/14/05 15:33,Critical,2,FreeBSD,bugzilla-admin,buildbot-do-not-reply,4/13/05 20:02,2005-04-14 15:33:53 UTC,gerald
30,TShark,RESOLVED,DUPLICATE,Buildbot crash output,4/14/05 15:34,Critical,2,FreeBSD,bugzilla-admin,buildbot-do-not-reply,4/13/05 23:17,2005-04-14 15:34:41 UTC,gerald
31,TShark,RESOLVED,FIXED,Buildbot crash output,4/15/05 9:01,Critical,2,FreeBSD,bugzilla-admin,buildbot-do-not-reply,4/14/05 0:02,2005-04-15 09:01:17 UTC,gerald
32,TShark,RESOLVED,FIXED,Buildbot crash output,4/15/05 9:18,Critical,2,FreeBSD,bugzilla-admin,buildbot-do-not-reply,4/14/05 0:32,2005-04-14 15:36:13 UTC,gerald
33,TShark,RESOLVED,FIXED,Buildbot crash output,4/14/05 15:37,Critical,2,FreeBSD,bugzilla-admin,buildbot-do-not-reply,4/14/05 2:22,2005-04-14 15:37:04 UTC,gerald
34,TShark,RESOLVED,FIXED,Buildbot crash output,4/14/05 15:46,Critical,2,FreeBSD,bugzilla-admin,buildbot-do-not-reply,4/14/05 4:57,2005-04-14 15:46:09 UTC,gerald
35,TShark,RESOLVED,FIXED,Buildbot crash output,4/16/05 17:15,Critical,2,FreeBSD,bugzilla-admin,buildbot-do-not-reply,4/14/05 5:27,2005-04-16 17:15:56 UTC,gerald
36,TShark,RESOLVED,FIXED,Buildbot crash output,4/15/05 9:57,Critical,2,FreeBSD,bugzilla-admin,buildbot-do-not-reply,4/14/05 15:17,2005-04-15 09:57:22 UTC,gerald
37,TShark,RESOLVED,FIXED,Buildbot crash output,4/15/05 9:59,Critical,2,FreeBSD,bugzilla-admin,buildbot-do-not-reply,4/14/05 15:52,2005-04-15 09:59:34 UTC,gerald
38,TShark,RESOLVED,FIXED,Buildbot crash output,5/2/05 15:54,Critical,6,FreeBSD,bugzilla-admin,buildbot-do-not-reply,4/14/05 16:22,2005-04-15 10:18:44 UTC,gerald
39,TShark,RESOLVED,DUPLICATE,Buildbot crash output,4/14/05 22:37,Critical,2,FreeBSD,bugzilla-admin,buildbot-do-not-reply,4/14/05 16:57,2005-04-14 22:37:53 UTC,gerald
40,TShark,RESOLVED,FIXED,Buildbot crash output,4/15/05 10:01,Critical,2,FreeBSD,bugzilla-admin,buildbot-do-not-reply,4/15/05 3:17,2005-04-15 10:01:22 UTC,gerald
41,TShark,RESOLVED,FIXED,Buildbot crash output,4/15/05 10:04,Critical,2,FreeBSD,bugzilla-admin,buildbot-do-not-reply,4/15/05 3:47,2005-04-15 10:04:05 UTC,gerald
42,TShark,RESOLVED,FIXED,Buildbot crash output,4/15/05 10:05,Critical,2,FreeBSD,bugzilla-admin,buildbot-do-not-reply,4/15/05 4:22,2005-04-15 10:05:12 UTC,gerald
43,TShark,RESOLVED,DUPLICATE,Buildbot crash output,4/15/05 10:19,Critical,2,FreeBSD,bugzilla-admin,buildbot-do-not-reply,4/15/05 10:17,2005-04-15 10:19:38 UTC,gerald
44,TShark,RESOLVED,FIXED,Buildbot crash output,4/16/05 17:28,Critical,2,FreeBSD,bugzilla-admin,buildbot-do-not-reply,4/15/05 11:57,2005-04-16 17:28:21 UTC,gerald
45,GTK+ UI,RESOLVED,FIXED,Crash when viewing capture,7/10/08 9:57,Major,4,Windows XP,gram,gram,4/15/05 15:23,2005-04-15 20:53:30 UTC,bugzilla-admin
46,TShark,RESOLVED,FIXED,Buildbot crash output,4/16/05 20:52,Critical,10,FreeBSD,bugzilla-admin,buildbot-do-not-reply,4/15/05 15:52,2005-04-16 20:42:25 UTC,gerald
47,TShark,RESOLVED,DUPLICATE,Buildbot crash output,4/16/05 20:44,Critical,2,FreeBSD,bugzilla-admin,buildbot-do-not-reply,4/15/05 17:17,2005-04-16 20:44:10 UTC,gerald
48,GTK+ UI,RESOLVED,FIXED,Fuzz capture produces dissector bug   NCP  ncp.mv_string,7/10/08 9:57,Major,4,Linux (other),gram,gram,4/15/05 20:49,2005-04-21 13:19:56 UTC,bugzilla-admin
49,GTK+ UI,RESOLVED,FIXED,Fuzz capture produces dissector bug   NCP  ncp.nds_deref_base,7/10/08 10:12,Major,4,Linux (other),bugzilla-admin,gram,4/15/05 21:01,2005-04-21 13:20:08 UTC,bugzilla-admin
50,GTK+ UI,RESOLVED,FIXED,Fuzz capture produces dissector bug  NCP  ncp.nds_name,7/10/08 10:12,Normal,4,Linux (other),bugzilla-admin,gram,4/15/05 21:03,2005-04-21 13:20:15 UTC,bugzilla-admin
51,GTK+ UI,RESOLVED,FIXED,Fuzz capture produces dissector bug  NCP  ncp.value_string,7/10/08 10:12,Normal,4,Linux (other),bugzilla-admin,gram,4/15/05 21:04,2005-04-21 13:20:23 UTC,bugzilla-admin
52,GTK+ UI,RESOLVED,DUPLICATE,Fuzz capture produces dissector bug   NFS  rpc assertion,7/10/08 10:12,Major,4,Linux (other),bugzilla-admin,gram,4/15/05 21:35,2005-04-15 21:52:32 UTC,bugzilla-admin
53,GTK+ UI,RESOLVED,FIXED,show file size of temp file during liev capture,4/18/05 17:12,Enhancement,2,Linux (other),bugzilla-admin,toralf.foerster,4/16/05 6:18,2005-04-18 17:12:51 UTC,ulf.lamping
54,TShark,RESOLVED,DUPLICATE,Buildbot crash output,4/16/05 20:45,Critical,2,FreeBSD,bugzilla-admin,buildbot-do-not-reply,4/16/05 6:32,2005-04-16 20:45:56 UTC,gerald
55,GTK+ UI,RESOLVED,WONTFIX,'Goto prev/next packet' button during live capture,7/30/14 19:53,Enhancement,2,All,bugzilla-admin,toralf.foerster,4/16/05 8:17,2014-07-30 19:53:12 UTC,guy
56,TShark,RESOLVED,DUPLICATE,Buildbot crash output,4/16/05 20:47,Critical,2,FreeBSD,bugzilla-admin,buildbot-do-not-reply,4/16/05 14:57,2005-04-16 20:47:19 UTC,gerald
57,TShark,RESOLVED,DUPLICATE,Buildbot crash output,4/16/05 20:48,Critical,2,FreeBSD,bugzilla-admin,buildbot-do-not-reply,4/16/05 15:32,2005-04-16 20:48:01 UTC,gerald
58,TShark,RESOLVED,DUPLICATE,Buildbot crash output,4/16/05 20:48,Critical,2,FreeBSD,bugzilla-admin,buildbot-do-not-reply,4/16/05 16:07,2005-04-16 20:48:46 UTC,gerald
59,TShark,RESOLVED,DUPLICATE,Buildbot crash output,4/16/05 20:49,Critical,2,FreeBSD,bugzilla-admin,buildbot-do-not-reply,4/16/05 16:42,2005-04-16 20:49:27 UTC,gerald
60,TShark,RESOLVED,DUPLICATE,Buildbot crash output,4/16/05 20:51,Critical,2,FreeBSD,bugzilla-admin,buildbot-do-not-reply,4/16/05 17:32,2005-04-16 20:51:25 UTC,gerald
61,TShark,RESOLVED,DUPLICATE,Buildbot crash output,4/16/05 20:52,Critical,2,FreeBSD,bugzilla-admin,buildbot-do-not-reply,4/16/05 18:07,2005-04-16 20:52:11 UTC,gerald
62,TShark,RESOLVED,FIXED,Buildbot crash output,4/17/05 0:15,Critical,2,FreeBSD,bugzilla-admin,buildbot-do-not-reply,4/16/05 23:32,2005-04-17 00:15:05 UTC,gerald
63,TShark,RESOLVED,FIXED,Buildbot crash output,4/17/05 15:45,Critical,2,FreeBSD,bugzilla-admin,buildbot-do-not-reply,4/17/05 1:02,2005-04-17 15:45:23 UTC,gerald
64,TShark,RESOLVED,FIXED,Buildbot crash output,4/1/16 9:24,Critical,2,FreeBSD,bugzilla-admin,buildbot-do-not-reply,4/17/05 3:02,2005-04-17 15:47:16 UTC,rmprint
65,TShark,RESOLVED,FIXED,Buildbot crash output,4/17/05 17:08,Critical,2,FreeBSD,bugzilla-admin,buildbot-do-not-reply,4/17/05 15:22,2005-04-17 17:08:40 UTC,gerald
66,TShark,RESOLVED,FIXED,Test from Buildbot,4/17/05 16:43,Trivial,1,FreeBSD,bugzilla-admin,buildbot-do-not-reply,4/17/05 16:43,2005-04-17 16:43:57 UTC,gerald
67,TShark,RESOLVED,FIXED,Buildbot crash output: editcap.out.1113782801,4/17/05 21:33,Critical,2,FreeBSD,bugzilla-admin,buildbot-do-not-reply,4/17/05 19:06,2005-04-17 21:33:40 UTC,gerald
68,TShark,RESOLVED,FIXED,Buildbot crash output: editcap.out.1113792985,4/21/05 10:13,Critical,8,FreeBSD,bugzilla-admin,buildbot-do-not-reply,4/17/05 21:56,2005-04-21 10:12:06 UTC,gerald
69,TShark,RESOLVED,DUPLICATE,Buildbot crash output: editcap.out.1113803062,4/21/05 10:12,Critical,2,FreeBSD,bugzilla-admin,buildbot-do-not-reply,4/18/05 0:44,2005-04-21 10:12:17 UTC,gerald
70,TShark,RESOLVED,FIXED,Buildbot crash output: editcap.out.1113822259,4/18/05 11:17,Critical,2,FreeBSD,bugzilla-admin,buildbot-do-not-reply,4/18/05 6:04,2005-04-18 11:17:18 UTC,gerald
71,TShark,RESOLVED,FIXED,Buildbot crash output: editcap.out.1113832580,4/18/05 11:30,Critical,2,FreeBSD,bugzilla-admin,buildbot-do-not-reply,4/18/05 8:56,2005-04-18 11:30:13 UTC,gerald
72,TShark,RESOLVED,FIXED,Buildbot crash output: editcap.out.1113845579,4/20/05 15:09,Critical,2,FreeBSD,bugzilla-admin,buildbot-do-not-reply,4/18/05 12:33,2005-04-20 15:09:14 UTC,gerald
73,TShark,RESOLVED,WORKSFORME,Buildbot crash output: editcap.out.1113855834,4/20/05 15:15,Critical,2,FreeBSD,bugzilla-admin,buildbot-do-not-reply,4/18/05 15:24,2005-04-20 15:15:42 UTC,gerald
74,TShark,RESOLVED,WORKSFORME,Buildbot crash output: editcap.out.,4/20/05 16:27,Critical,2,FreeBSD,bugzilla-admin,buildbot-do-not-reply,4/18/05 17:38,2005-04-20 16:27:48 UTC,gerald
75,TShark,RESOLVED,WORKSFORME,Buildbot crash output: editcap.out.,4/20/05 16:29,Critical,2,FreeBSD,bugzilla-admin,buildbot-do-not-reply,4/18/05 19:41,2005-04-20 16:29:15 UTC,gerald
76,TShark,RESOLVED,DUPLICATE,Buildbot crash output: editcap.out.,4/21/05 10:12,Critical,2,FreeBSD,bugzilla-admin,buildbot-do-not-reply,4/18/05 22:31,2005-04-21 10:12:29 UTC,gerald
77,TShark,RESOLVED,DUPLICATE,Buildbot crash output: editcap.426511ba.pcap,4/21/05 10:12,Critical,2,FreeBSD,bugzilla-admin,buildbot-do-not-reply,4/19/05 9:12,2005-04-21 10:12:43 UTC,gerald
78,GTK+ UI,RESOLVED,FIXED,Buffer Overflow in VoIP parser,7/10/08 10:12,Critical,3,Linux (other),gram,gram,4/19/05 16:31,2005-04-20 15:24:03 UTC,bugzilla-admin
79,TShark,RESOLVED,FIXED,Buildbot crash output: editcap.426595bb.pcap,4/20/05 11:24,Critical,2,FreeBSD,bugzilla-admin,buildbot-do-not-reply,4/19/05 18:35,2005-04-20 11:24:10 UTC,gerald
80,TShark,RESOLVED,FIXED,Buildbot crash output: editcap.4265b4a9.pcap,4/20/05 14:33,Critical,2,FreeBSD,bugzilla-admin,buildbot-do-not-reply,4/19/05 20:47,2005-04-20 14:33:28 UTC,gerald
81,TShark,RESOLVED,FIXED,Buildbot crash output: editcap.42666fcc.pcap,4/20/05 14:16,Critical,2,FreeBSD,bugzilla-admin,buildbot-do-not-reply,4/20/05 10:05,2005-04-20 14:16:17 UTC,gerald
82,TShark,RESOLVED,DUPLICATE,Buildbot crash output: editcap.42669775.pcap,4/21/05 10:12,Critical,2,FreeBSD,bugzilla-admin,buildbot-do-not-reply,4/20/05 12:55,2005-04-21 10:12:52 UTC,gerald
83,TShark,RESOLVED,WORKSFORME,Buildbot crash output: editcap.4266bfe9.pcap,4/20/05 16:01,Critical,2,FreeBSD,bugzilla-admin,buildbot-do-not-reply,4/20/05 15:47,2005-04-20 16:01:03 UTC,gerald
84,TShark,RESOLVED,DUPLICATE,Buildbot crash output: editcap.4266e798.pcap,4/21/05 10:13,Critical,2,FreeBSD,bugzilla-admin,buildbot-do-not-reply,4/20/05 18:36,2005-04-21 10:13:04 UTC,gerald
85,TShark,RESOLVED,DUPLICATE,Buildbot crash output: editcap.42670f58.pcap,4/21/05 10:13,Critical,2,FreeBSD,bugzilla-admin,buildbot-do-not-reply,4/20/05 21:26,2005-04-21 10:13:13 UTC,gerald
86,GTK+ UI,RESOLVED,FIXED,rsync: Pango-WARNING **: Invalid UTF-8 string passed to pango_layout_set_text(),5/29/05 7:28,Normal,6,Linux (other),bugzilla-admin,toralf.foerster,4/21/05 12:54,2005-05-29 07:28:00 UTC,ulf.lamping
87,TShark,RESOLVED,FIXED,Buildbot crash output: editcap.4267eb85.pcap,4/21/05 23:09,Critical,4,FreeBSD,bugzilla-admin,buildbot-do-not-reply,4/21/05 13:06,2005-04-21 23:09:21 UTC,gerald
88,TShark,RESOLVED,DUPLICATE,Buildbot crash output: editcap.4268187c.pcap,4/21/05 23:09,Critical,2,FreeBSD,bugzilla-admin,buildbot-do-not-reply,4/21/05 16:17,2005-04-21 23:09:44 UTC,gerald
89,TShark,RESOLVED,DUPLICATE,Buildbot crash output: editcap.426845d7.pcap,4/21/05 23:09,Critical,2,FreeBSD,bugzilla-admin,buildbot-do-not-reply,4/21/05 19:31,2005-04-21 23:09:54 UTC,gerald
90,TShark,RESOLVED,FIXED,Buildbot crash output: editcap.4268a1a2.pcap,4/22/05 9:56,Critical,2,FreeBSD,bugzilla-admin,buildbot-do-not-reply,4/22/05 2:03,2005-04-22 09:56:05 UTC,gerald
91,GTK+ UI,RESOLVED,FIXED,DCE RPC packet not all details are described,4/26/05 4:06,Enhancement,7,Linux (other),bugzilla-admin,toralf.foerster,4/22/05 4:40,2005-04-26 04:06:32 UTC,ronniesahlberg
92,TShark,RESOLVED,FIXED,Buildbot crash output: editcap.426939af.pcap,4/22/05 13:07,Critical,2,FreeBSD,bugzilla-admin,buildbot-do-not-reply,4/22/05 12:51,2005-04-22 13:07:12 UTC,gerald
93,GTK+ UI,RESOLVED,FIXED,changes to the columns has no effect until restart,6/4/07 20:16,Normal,6,All,wireshark-bugs,toralf.foerster,4/22/05 15:08,2007-06-04 20:16:36 UTC,stephenfisher
94,TShark,RESOLVED,FIXED,Buildbot crash output: editcap.4269620b.pcap,4/22/05 16:02,Critical,2,FreeBSD,bugzilla-admin,buildbot-do-not-reply,4/22/05 15:44,2005-04-22 16:02:43 UTC,gerald
95,GTK+ UI,RESOLVED,FIXED,Infinite loop in MEGACO,4/27/05 14:17,Critical,8,Linux (other),bugzilla-admin,gerald,4/23/05 20:00,2005-04-27 14:10:09 UTC,gerald
96,TShark,RESOLVED,FIXED,Buildbot crash output: editcap.426bc003.pcap,4/27/05 15:44,Critical,8,FreeBSD,bugzilla-admin,buildbot-do-not-reply,4/24/05 10:49,2005-04-27 15:26:07 UTC,gerald
97,TShark,RESOLVED,FIXED,Buildbot crash output: editcap.426be71e.pcap,4/25/05 10:28,Critical,3,FreeBSD,bugzilla-admin,buildbot-do-not-reply,4/24/05 13:36,2005-04-25 10:22:08 UTC,gerald
98,TShark,RESOLVED,FIXED,Buildbot crash output: editcap.426bf13f.pcap,4/25/05 10:28,Critical,2,FreeBSD,bugzilla-admin,buildbot-do-not-reply,4/24/05 14:19,2005-04-25 10:28:47 UTC,gerald
99,TShark,RESOLVED,DUPLICATE,Buildbot crash output: editcap.426c4992.pcap,4/25/05 10:28,Critical,2,FreeBSD,bugzilla-admin,buildbot-do-not-reply,4/24/05 20:36,2005-04-25 10:28:59 UTC,gerald
100,TShark,RESOLVED,FIXED,Buildbot crash output: editcap.426c6670.pcap,4/26/05 23:11,Critical,5,FreeBSD,bugzilla-admin,buildbot-do-not-reply,4/24/05 22:39,2005-04-26 23:09:35 UTC,gerald
101,TShark,RESOLVED,FIXED,Buildbot crash output: editcap.426d156c.pcap,4/26/05 15:55,Critical,2,FreeBSD,bugzilla-admin,buildbot-do-not-reply,4/25/05 11:06,2005-04-26 15:55:45 UTC,gerald
102,TShark,RESOLVED,FIXED,Buildbot crash output: editcap.426d32f0.pcap,4/26/05 17:06,Critical,2,FreeBSD,wireshark-bugs,buildbot-do-not-reply,4/25/05 13:12,2005-04-26 17:06:30 UTC,gerald
103,TShark,RESOLVED,DUPLICATE,Buildbot crash output: editcap.426d3d25.pcap,4/26/05 23:09,Critical,2,FreeBSD,wireshark-bugs,buildbot-do-not-reply,4/25/05 13:55,2005-04-26 23:09:58 UTC,gerald
104,GTK+ UI,RESOLVED,FIXED,Testing version template,4/26/05 15:51,Normal,2,Windows XP,wireshark-bugs,bugzilla-admin,4/25/05 15:00,2005-04-26 15:51:19 UTC,gerald
105,TShark,RESOLVED,FIXED,Bugs in RTCP and RTSP,5/4/05 11:41,Blocker,8,Windows XP,wireshark-bugs,bugzilla-admin,4/25/05 15:12,2005-05-04 11:41:40 UTC,bugzilla-admin
106,TShark,RESOLVED,FIXED,Buildbot crash output: editcap.426e007b.pcap,4/26/05 17:36,Critical,3,FreeBSD,wireshark-bugs,buildbot-do-not-reply,4/26/05 3:49,2005-04-26 17:20:17 UTC,gerald
107,TShark,RESOLVED,FIXED,Buildbot crash output: editcap.426e08a6.pcap,4/27/05 14:19,Critical,3,FreeBSD,wireshark-bugs,buildbot-do-not-reply,4/26/05 4:23,2005-04-27 04:38:01 UTC,Greg.Morris
108,TShark,RESOLVED,DUPLICATE,Buildbot crash output: editcap.426e111b.pcap,4/26/05 23:10,Critical,2,FreeBSD,wireshark-bugs,buildbot-do-not-reply,4/26/05 4:59,2005-04-26 23:10:27 UTC,gerald
109,TShark,RESOLVED,DUPLICATE,Buildbot crash output: editcap.426e5429.pcap,4/26/05 17:36,Critical,2,FreeBSD,wireshark-bugs,buildbot-do-not-reply,4/26/05 9:46,2005-04-26 17:36:31 UTC,gerald
110,GTK+ UI,RESOLVED,FIXED,assert after dragging file while capturing (windows),7/10/08 10:12,Critical,4,Windows 2000,wireshark-bugs,dave.nicoson,4/26/05 15:04,2005-04-27 14:59:03 UTC,bugzilla-admin
111,TShark,RESOLVED,DUPLICATE,Buildbot crash output: editcap.426eb73c.pcap,4/27/05 14:13,Critical,2,FreeBSD,wireshark-bugs,buildbot-do-not-reply,4/26/05 16:48,2005-04-27 14:13:20 UTC,gerald
112,TShark,RESOLVED,DUPLICATE,Buildbot crash output: editcap.426ec4fd.pcap,4/27/05 14:19,Critical,2,FreeBSD,wireshark-bugs,buildbot-do-not-reply,4/26/05 17:47,2005-04-27 14:19:31 UTC,gerald
113,TShark,RESOLVED,DUPLICATE,Buildbot crash output: editcap.426ed17e.pcap,4/27/05 14:14,Critical,2,FreeBSD,wireshark-bugs,buildbot-do-not-reply,4/26/05 18:40,2005-04-27 14:14:17 UTC,gerald
114,TShark,RESOLVED,DUPLICATE,Buildbot crash output: editcap.426ed9d9.pcap,4/26/05 23:11,Critical,2,FreeBSD,wireshark-bugs,buildbot-do-not-reply,4/26/05 19:16,2005-04-26 23:11:02 UTC,gerald
115,TShark,RESOLVED,DUPLICATE,Buildbot crash output: editcap.426f1b15.pcap,4/27/05 15:26,Critical,2,FreeBSD,wireshark-bugs,buildbot-do-not-reply,4/26/05 23:54,2005-04-27 15:26:57 UTC,gerald
116,TShark,RESOLVED,DUPLICATE,Buildbot crash output: editcap.426f445f.pcap,4/27/05 14:15,Critical,2,FreeBSD,wireshark-bugs,buildbot-do-not-reply,4/27/05 2:51,2005-04-27 14:15:27 UTC,gerald
117,GTK+ UI,RESOLVED,FIXED,[PATCH] Ethereal crashes when capture starts,4/27/05 15:53,Major,4,Linux (other),wireshark-bugs,rvokal,4/27/05 5:59,2005-04-27 15:53:46 UTC,ulf.lamping
118,TShark,RESOLVED,DUPLICATE,Buildbot crash output: editcap.426f732e.pcap,4/27/05 15:27,Critical,2,FreeBSD,wireshark-bugs,buildbot-do-not-reply,4/27/05 6:10,2005-04-27 15:27:29 UTC,gerald
119,GTK+ UI,RESOLVED,FIXED,RTP Analysis always crashes (reproducibly),4/27/05 9:00,Major,4,Linux (other),wireshark-bugs,thomas.anders,4/27/05 8:30,2005-04-27 09:00:04 UTC,ronniesahlberg
120,GTK+ UI,RESOLVED,DUPLICATE,RTP Analysis always crashes (reproducibly),10/11/06 2:29,Major,4,Linux (other),wireshark-bugs,thomas.anders,4/27/05 8:30,2005-04-27 09:00:34 UTC,jeff.morriss.ws
121,TShark,RESOLVED,DUPLICATE,Buildbot crash output: editcap.426fa936.pcap,4/27/05 14:16,Critical,2,FreeBSD,wireshark-bugs,buildbot-do-not-reply,4/27/05 10:01,2005-04-27 14:16:48 UTC,gerald
122,TShark,RESOLVED,DUPLICATE,Buildbot crash output: editcap.426fb53b.pcap,4/27/05 15:27,Critical,2,FreeBSD,wireshark-bugs,buildbot-do-not-reply,4/27/05 10:52,2005-04-27 15:27:54 UTC,gerald
123,TShark,RESOLVED,DUPLICATE,Buildbot crash output: editcap.426fc313.pcap,4/27/05 14:17,Critical,2,FreeBSD,wireshark-bugs,buildbot-do-not-reply,4/27/05 11:51,2005-04-27 14:17:50 UTC,gerald
124,TShark,RESOLVED,DUPLICATE,Buildbot crash output: editcap.426fcd97.pcap,4/27/05 15:28,Critical,2,FreeBSD,wireshark-bugs,buildbot-do-not-reply,4/27/05 12:36,2005-04-27 15:28:19 UTC,gerald
125,GTK+ UI,RESOLVED,FIXED,Bug in reading capture data from a pipe,7/10/08 10:12,Normal,4,FreeBSD,wireshark-bugs,mcondell,4/27/05 14:49,2005-05-26 15:03:06 UTC,bugzilla-admin
126,TShark,RESOLVED,DUPLICATE,Buildbot crash output: editcap.426fee52.pcap,4/27/05 15:29,Critical,2,FreeBSD,wireshark-bugs,buildbot-do-not-reply,4/27/05 14:56,2005-04-27 15:29:16 UTC,gerald
127,TShark,RESOLVED,DUPLICATE,Buildbot crash output: editcap.426ff8fb.pcap,4/27/05 15:44,Critical,2,FreeBSD,wireshark-bugs,buildbot-do-not-reply,4/27/05 15:41,2005-04-27 15:44:21 UTC,gerald
128,TShark,RESOLVED,FIXED,Buildbot crash output: editcap.42700772.pcap,4/27/05 22:31,Critical,2,FreeBSD,wireshark-bugs,buildbot-do-not-reply,4/27/05 16:43,2005-04-27 22:31:41 UTC,gerald
129,TShark,RESOLVED,FIXED,Buildbot crash output: editcap.4270184c.pcap,4/27/05 22:48,Critical,2,FreeBSD,wireshark-bugs,buildbot-do-not-reply,4/27/05 17:55,2005-04-27 22:48:22 UTC,gerald
130,TShark,RESOLVED,FIXED,Buildbot crash output: editcap.4270751c.pcap,4/28/05 13:07,Critical,2,FreeBSD,wireshark-bugs,buildbot-do-not-reply,4/28/05 0:31,2005-04-28 13:07:55 UTC,gerald
131,TShark,RESOLVED,FIXED,Buildbot crash output: editcap.4270b1cd.pcap,4/28/05 9:54,Critical,1,FreeBSD,wireshark-bugs,buildbot-do-not-reply,4/28/05 4:50,2005-04-28 09:54:15 UTC,tuexen
132,TShark,RESOLVED,FIXED,Buildbot crash output: editcap.4270ca7d.pcap,4/28/05 13:34,Critical,2,FreeBSD,wireshark-bugs,buildbot-do-not-reply,4/28/05 6:35,2005-04-28 13:34:24 UTC,gerald
133,GTK+ UI,RESOLVED,WONTFIX,"align buttons ""+ Expression"" ""Clear"" ""Apply"" to the right if the filter expressions exceeds the window",7/21/14 16:07,Enhancement,9,Linux (other),wireshark-bugs,toralf.foerster,4/28/05 6:48,2014-07-21 16:07:34 UTC,Christopher.Maynard
134,GTK+ UI,RESOLVED,WORKSFORME,RX protocol incorrectly identified as RUDP,7/10/08 10:08,Blocker,8,Linux (other),wireshark-bugs,jbuehler,4/28/05 7:26,2005-09-20 06:10:41 UTC,bugzilla-admin
135,GTK+ UI,RESOLVED,FIXED,'ethereal -v' does not work on the console,6/23/05 16:38,Trivial,8,Linux (other),wireshark-bugs,toralf.foerster,4/28/05 7:36,2005-06-23 16:38:37 UTC,ulf.lamping
136,TShark,RESOLVED,FIXED,Buildbot crash output: editcap.4270e4d0.pcap,4/28/05 15:03,Critical,3,FreeBSD,wireshark-bugs,buildbot-do-not-reply,4/28/05 8:27,2005-04-28 14:17:54 UTC,gerald
137,TShark,RESOLVED,FIXED,Buildbot crash output: editcap.4270f1ad.pcap,4/29/05 15:33,Blocker,2,FreeBSD,wireshark-bugs,buildbot-do-not-reply,4/28/05 9:22,2005-04-29 15:33:38 UTC,gerald
138,TShark,RESOLVED,FIXED,Buildbot crash output: editcap.427101c6.pcap,4/28/05 14:43,Critical,2,FreeBSD,wireshark-bugs,buildbot-do-not-reply,4/28/05 10:31,2005-04-28 14:43:20 UTC,gerald
139,TShark,RESOLVED,DUPLICATE,Buildbot crash output: editcap.427140ed.pcap,4/28/05 15:03,Critical,2,FreeBSD,wireshark-bugs,buildbot-do-not-reply,4/28/05 15:00,2005-04-28 15:03:38 UTC,gerald
140,TShark,RESOLVED,FIXED,Buildbot crash output: editcap.42715780.pcap,4/28/05 17:02,Critical,2,FreeBSD,wireshark-bugs,buildbot-do-not-reply,4/28/05 16:37,2005-04-28 17:02:41 UTC,gerald
141,TShark,RESOLVED,FIXED,Buildbot crash output: editcap.42717e37.pcap,4/28/05 22:36,Critical,2,FreeBSD,wireshark-bugs,buildbot-do-not-reply,4/28/05 19:22,2005-04-28 22:36:11 UTC,gerald
142,TShark,RESOLVED,FIXED,Buildbot crash output: editcap.42719f03.pcap,4/29/05 9:40,Critical,3,FreeBSD,wireshark-bugs,buildbot-do-not-reply,4/28/05 21:42,2005-04-29 09:40:25 UTC,gerald
143,GTK+ UI,RESOLVED,FIXED,Memory exhaustion in NCP,4/29/05 9:25,Blocker,3,Linux (other),wireshark-bugs,gerald,4/28/05 22:57,2005-04-29 09:25:32 UTC,gerald
144,TShark,RESOLVED,FIXED,Buildbot crash output: editcap.4271c84e.pcap,4/29/05 9:53,Critical,3,FreeBSD,wireshark-bugs,buildbot-do-not-reply,4/29/05 0:38,2005-04-29 09:53:25 UTC,gerald
145,TShark,RESOLVED,FIXED,Fuzzed capture (single frame) crashes [t]ethereal (SVN),5/2/05 15:07,Blocker,9,Linux (other),wireshark-bugs,thomas.anders,4/29/05 2:26,2005-05-02 15:07:19 UTC,gerald
146,TShark,RESOLVED,DUPLICATE,Buildbot crash output: editcap.427206b7.pcap,4/29/05 9:53,Critical,2,FreeBSD,wireshark-bugs,buildbot-do-not-reply,4/29/05 5:04,2005-04-29 09:53:59 UTC,gerald
147,TShark,RESOLVED,FIXED,Buildbot crash output: editcap.4272705c.pcap,4/29/05 23:31,Critical,2,FreeBSD,wireshark-bugs,buildbot-do-not-reply,4/29/05 12:35,2005-04-29 23:31:26 UTC,gerald
148,GTK+ UI,RESOLVED,FIXED,Capture Win32: setting capture buffer size has no effect,5/29/05 23:48,Normal,2,Windows XP,wireshark-bugs,ulf.lamping,4/29/05 18:52,2005-05-29 23:48:24 UTC,ulf.lamping
149,TShark,RESOLVED,FIXED,Buildbot crash output: editcap.4273a185.pcap,4/30/05 11:42,Critical,2,FreeBSD,wireshark-bugs,buildbot-do-not-reply,4/30/05 10:17,2005-04-30 11:42:28 UTC,gerald
150,TShark,RESOLVED,FIXED,Buildbot crash output: editcap.4275939e.pcap,5/2/05 19:20,Blocker,4,FreeBSD,wireshark-bugs,buildbot-do-not-reply,5/1/05 21:42,2005-05-02 19:20:56 UTC,lars.roland
151,GTK+ UI,RESOLVED,FIXED,Error messages when starting capture as unprivileged users,5/26/05 15:13,Minor,4,Linux (other),wireshark-bugs,TBoehne,5/2/05 2:59,2005-05-26 15:13:01 UTC,ulf.lamping
152,GTK+ UI,RESOLVED,FIXED,Read filter buttons don't work (with Gtk2.4 and above),2/18/06 15:58,Minor,9,All,wireshark-bugs,TBoehne,5/2/05 3:03,2005-12-31 11:09:57 UTC,jmayer
153,GTK+ UI,RESOLVED,FIXED,crash when dissecting sigtran messages,7/10/08 10:12,Blocker,5,Linux (other),wireshark-bugs,kite,5/2/05 3:59,2005-05-04 16:29:06 UTC,bugzilla-admin
154,TShark,RESOLVED,FIXED,Buildbot crash output: editcap.427687cb.pcap,5/2/05 15:31,Blocker,3,FreeBSD,wireshark-bugs,buildbot-do-not-reply,5/2/05 15:04,2005-05-02 15:31:10 UTC,gerald
155,GTK+ UI,RESOLVED,FIXED,Infinite loop in TCAP,5/3/05 9:36,Blocker,3,Linux (other),wireshark-bugs,gerald,5/2/05 22:09,2005-05-03 09:36:24 UTC,gerald
156,GTK+ UI,RESOLVED,NOTABUG,Fedora Core 3 (Linux) compile (link) fails: undefined reference to `.LC771',5/10/07 8:11,Major,15,Linux (other),wireshark-bugs,jeff.morriss.ws,5/3/05 4:52,2005-05-17 04:08:01 UTC,jeff.morriss.ws
157,GTK+ UI,RESOLVED,FIXED,NTLMSSP causes core dump,5/3/05 14:34,Blocker,4,Windows XP,wireshark-bugs,gerald,5/3/05 11:41,2005-05-03 14:34:10 UTC,gerald
158,TShark,RESOLVED,FIXED,Buildbot crash output: editcap.4277fd69.pcap,5/4/05 12:04,Critical,2,FreeBSD,wireshark-bugs,buildbot-do-not-reply,5/3/05 17:38,2005-05-04 12:04:01 UTC,bugzilla-admin
159,GTK+ UI,RESOLVED,DUPLICATE,"""Display Filter"" dialog cannot receive input when ""Open file dialog"" open",7/10/08 10:13,Normal,3,Linux (other),wireshark-bugs,rvokal,5/4/05 6:01,2005-05-04 14:11:32 UTC,bugzilla-admin
160,TShark,RESOLVED,FIXED,fuzz capture causes infinite loop (eating up all memory),5/5/05 21:08,Blocker,5,Linux (other),gram,thomas.anders,5/4/05 11:04,2005-05-05 20:57:11 UTC,gram
161,TShark,RESOLVED,FIXED,Buildbot crash output: editcap.427ae065.pcap,5/9/05 22:14,Critical,2,FreeBSD,wireshark-bugs,buildbot-do-not-reply,5/5/05 22:11,2005-05-09 22:14:16 UTC,gerald
162,TShark,RESOLVED,FIXED,Buildbot crash output: editcap.427b1dc7.pcap,5/6/05 19:14,Critical,2,FreeBSD,wireshark-bugs,buildbot-do-not-reply,5/6/05 2:33,2005-05-06 19:14:55 UTC,lars.roland
163,TShark,RESOLVED,FIXED,Buildbot crash output: editcap.427bc6fb.pcap,5/14/05 14:13,Critical,4,FreeBSD,wireshark-bugs,buildbot-do-not-reply,5/6/05 14:35,2005-05-14 14:13:22 UTC,gerald
164,TShark,RESOLVED,FIXED,Buildbot crash output: editcap.427c1d18.pcap,5/10/05 18:46,Critical,2,FreeBSD,wireshark-bugs,buildbot-do-not-reply,5/6/05 20:42,2005-05-10 18:46:33 UTC,gerald
165,GTK+ UI,RESOLVED,FIXED,RTP stream analysis doesn't handle timestamps and marker bits for video correctly.,2/16/11 0:16,Normal,13,Windows XP,wireshark-bugs,Peter.Parnes,5/7/05 3:51,2010-10-21 08:14:01 UTC,amos.temp2
166,GTK+ UI,RESOLVED,FIXED,rsync: info - string not readable,5/29/05 7:56,Minor,5,Linux (other),wireshark-bugs,toralf.foerster,5/8/05 12:13,2005-05-29 07:56:54 UTC,toralf.foerster
167,GTK+ UI,RESOLVED,NOTABUG,rsync: packet is not a client query,8/31/05 7:56,Normal,5,Linux (other),wireshark-bugs,toralf.foerster,5/8/05 12:19,2005-08-31 07:56:22 UTC,jeff.morriss.ws
168,GTK+ UI,RESOLVED,FIXED,Unable to capture packets or open .pcap files under OS X 10.3.9,7/10/08 10:13,Blocker,4,Mac OS X 10.3,wireshark-bugs,aturner,5/8/05 22:55,2005-09-20 06:12:08 UTC,bugzilla-admin
169,GTK+ UI,RESOLVED,FIXED,messenger: entries in 'Packet Details' windows not highlighted in 'Packet Bytes' window,5/14/05 17:07,Minor,4,Linux (other),wireshark-bugs,toralf.foerster,5/9/05 2:34,2005-05-14 17:07:28 UTC,ronniesahlberg
170,TShark,RESOLVED,FIXED,Fuzzed ESP capture causes tethereal (SVN) infinite loop (eating up all CPU),5/14/05 16:13,Critical,4,Linux (other),wireshark-bugs,thomas.anders,5/9/05 4:19,2005-05-14 16:13:41 UTC,gerald
171,GTK+ UI,RESOLVED,WONTFIX,Wireshark and Ethreal losing focus/minimizes under Windows XP,7/30/14 19:58,Normal,6,Windows XP,wireshark-bugs,olafvdspek,5/9/05 6:45,2014-07-30 19:58:39 UTC,guy
172,TShark,RESOLVED,FIXED,Buildbot crash output: editcap.427fbe9e.pcap,5/20/05 14:54,Critical,3,FreeBSD,wireshark-bugs,buildbot-do-not-reply,5/9/05 14:48,2005-05-20 14:54:40 UTC,gerald
173,TShark,RESOLVED,FIXED,crash on fuzzed DOCSIS capture,5/30/05 14:38,Critical,4,Linux (other),wireshark-bugs,thomas.anders,5/10/05 9:15,2005-05-30 14:38:05 UTC,thomas.anders
174,TShark,RESOLVED,FIXED,infinite loop on fuzzed DOCSIS capture,5/23/05 16:18,Critical,3,Linux (other),wireshark-bugs,thomas.anders,5/10/05 9:51,2005-05-23 16:18:38 UTC,gerald
175,TShark,RESOLVED,FIXED,Buildbot crash output: editcap.4281200b.pcap,5/24/05 8:51,Critical,2,FreeBSD,wireshark-bugs,buildbot-do-not-reply,5/10/05 15:56,2005-05-24 08:51:12 UTC,gerald
176,TShark,RESOLVED,FIXED,Buildbot crash output: editcap.42813881.pcap,5/11/05 18:50,Critical,7,FreeBSD,wireshark-bugs,buildbot-do-not-reply,5/10/05 17:41,2005-05-11 17:27:08 UTC,gerald
177,TShark,RESOLVED,DUPLICATE,Buildbot crash output: editcap.42815118.pcap,5/11/05 17:27,Critical,2,FreeBSD,wireshark-bugs,buildbot-do-not-reply,5/10/05 19:26,2005-05-11 17:27:23 UTC,gerald
178,TShark,RESOLVED,DUPLICATE,Buildbot crash output: editcap.428169a3.pcap,5/11/05 17:27,Critical,2,FreeBSD,wireshark-bugs,buildbot-do-not-reply,5/10/05 21:10,2005-05-11 17:27:31 UTC,gerald
179,TShark,RESOLVED,DUPLICATE,Buildbot crash output: editcap.428254af.pcap,5/11/05 17:27,Critical,2,FreeBSD,wireshark-bugs,buildbot-do-not-reply,5/11/05 13:53,2005-05-11 17:27:40 UTC,gerald
180,TShark,RESOLVED,DUPLICATE,Buildbot crash output: editcap.42826d20.pcap,5/11/05 17:27,Critical,2,FreeBSD,wireshark-bugs,buildbot-do-not-reply,5/11/05 15:37,2005-05-11 17:27:48 UTC,gerald
181,TShark,RESOLVED,DUPLICATE,Buildbot crash output: editcap.428295ea.pcap,5/11/05 18:50,Critical,2,FreeBSD,wireshark-bugs,buildbot-do-not-reply,5/11/05 18:31,2005-05-11 18:50:12 UTC,gerald
182,TShark,RESOLVED,FIXED,Buildbot crash output: editcap.4283380f.pcap,5/26/05 9:53,Critical,3,FreeBSD,wireshark-bugs,buildbot-do-not-reply,5/12/05 6:03,2005-05-26 09:53:56 UTC,gerald
183,GTK+ UI,RESOLVED,NOTABUG,Ethereal-0.10.11 build fails on HP-UX platforms,7/10/08 10:13,Critical,4,HP-UX,wireshark-bugs,praboos,5/12/05 6:49,2006-01-12 16:12:36 UTC,bugzilla-admin
184,GTK+ UI,RESOLVED,NOTOURBUG,Capture filtering does not work with VLAN tags,1/24/17 21:36,Normal,3,All,wireshark-bugs,andersen7,5/13/05 15:48,2017-01-24 21:36:50 UTC,guy
185,GTK+ UI,RESOLVED,FIXED,HTTP does not dissect bodies of requests if Transfer-Encoding is not given or if the body starts after the packet that ends the header.,1/21/08 0:13,Normal,13,Windows 2000,wireshark-bugs,hnemet,5/15/05 9:16,2008-01-21 00:13:00 UTC,bugzilla
186,GTK+ UI,RESOLVED,FIXED,http: packet classified as dcerpc,7/10/08 10:13,Normal,10,Linux (other),wireshark-bugs,toralf.foerster,5/17/05 7:35,2005-05-30 06:45:33 UTC,bugzilla-admin
187,GTK+ UI,RESOLVED,FIXED,crash of ethereal while 'Expand Subtrees',7/10/08 10:13,Normal,6,Linux (other),wireshark-bugs,toralf.foerster,5/17/05 8:34,2005-05-18 14:47:09 UTC,bugzilla-admin
188,TShark,RESOLVED,FIXED,Dissector bug in mmse/wsp,7/10/08 10:13,Normal,5,Mac OS X 10.3,wireshark-bugs,luis.ontanon,5/17/05 9:49,2005-05-27 01:04:05 UTC,bugzilla-admin
189,GTK+ UI,RESOLVED,FIXED,ldap: wrong identified,6/2/05 12:14,Normal,3,Linux (other),wireshark-bugs,toralf.foerster,5/17/05 10:11,2005-06-02 12:14:00 UTC,toralf.foerster
190,GTK+ UI,RESOLVED,FIXED,WSP paquet incorrectly tagged as malformed,7/10/08 10:14,Minor,4,All,wireshark-bugs,mathieu,5/17/05 10:26,2005-05-28 05:25:08 UTC,bugzilla-admin
191,GTK+ UI,RESOLVED,FIXED,Telnet option negotiation miss-analyzing,6/1/09 17:06,Minor,6,Windows Server 2003,jmayer,yuvalkashtan,5/17/05 11:40,2009-06-01 17:06:36 UTC,balint
193,TShark,RESOLVED,DUPLICATE,Buildbot crash output: editcap.428b5583.pcap,5/28/05 7:35,Critical,2,FreeBSD,wireshark-bugs,buildbot-do-not-reply,5/18/05 9:47,2005-05-28 07:35:58 UTC,ulf.lamping
194,TShark,RESOLVED,NOTABUG,ring buffer mode does not work anymore for my command,7/10/08 10:14,Normal,3,Linux (other),wireshark-bugs,simon.dekerpel,5/19/05 7:17,2005-05-26 17:02:35 UTC,bugzilla-admin
195,GTK+ UI,RESOLVED,FIXED,ethereal crash while displaying html stats,5/20/05 14:43,Normal,3,Linux (other),luis.ontanon,toralf.foerster,5/20/05 4:08,2005-05-20 14:43:51 UTC,luis.ontanon
196,TShark,RESOLVED,FIXED,Fuzzed DHCP capture causes infinite loop (eating up all memory),5/24/05 11:46,Blocker,4,Linux (other),wireshark-bugs,thomas.anders,5/20/05 18:30,2005-05-24 11:46:37 UTC,gerald
197,TShark,RESOLVED,FIXED,Buildbot crash output: editcap.428f7483.pcap,5/28/05 7:51,Critical,2,FreeBSD,wireshark-bugs,buildbot-do-not-reply,5/21/05 12:48,2005-05-28 07:51:06 UTC,ulf.lamping
198,GTK+ UI,RESOLVED,FIXED,if live capture stops  the file name (in the status line) is no longer displayed,5/26/05 16:52,Enhancement,2,Linux (other),wireshark-bugs,toralf.foerster,5/22/05 7:09,2005-05-26 16:52:02 UTC,ulf.lamping
199,GTK+ UI,RESOLVED,FIXED,Capture start: a space in the filename makes trouble,5/25/05 12:47,Major,2,Windows XP,wireshark-bugs,ulf.lamping,5/24/05 2:28,2005-05-25 12:47:54 UTC,ulf.lamping
200,TShark,RESOLVED,FIXED,Buildbot crash output: editcap.4294256e.pcap (crash in GIOP),6/19/05 17:41,Critical,4,FreeBSD,wireshark-bugs,buildbot-do-not-reply,5/25/05 2:12,2005-05-30 11:04:15 UTC,gerald
201,GTK+ UI,RESOLVED,FIXED,dns: Invalid UTF-8 string passed to pango_layout_set_text(),6/27/05 2:54,Minor,17,All,wireshark-bugs,toralf.foerster,5/25/05 4:04,2005-06-27 02:54:50 UTC,guy
202,TShark,RESOLVED,FIXED,Buildbot crash output: editcap.42943fc4.pcap,5/28/05 7:50,Critical,2,FreeBSD,wireshark-bugs,buildbot-do-not-reply,5/25/05 4:05,2005-05-28 07:50:33 UTC,ulf.lamping
203,GTK+ UI,RESOLVED,FIXED,in ethereal 0.10.10 and 0.10.11 the mousewheelup event in the graphic call flow window is mapped to the mousewheeldown event,7/10/08 10:14,Normal,3,Linux (other),wireshark-bugs,dragonheart,5/25/05 7:32,2005-05-26 18:20:30 UTC,bugzilla-admin
204,GTK+ UI,RESOLVED,LATER,initial column size of 'Protocol' in window 'Packet List' ...,5/26/05 2:17,Trivial,3,Linux (other),wireshark-bugs,toralf.foerster,5/25/05 8:14,2005-05-26 02:17:25 UTC,toralf.foerster
205,GTK+ UI,RESOLVED,FIXED,crash when opening existing capture without an extension,7/10/08 10:14,Critical,3,Windows XP,wireshark-bugs,todd_lindberg,5/25/05 17:55,2005-05-26 03:57:04 UTC,bugzilla-admin
206,GTK+ UI,RESOLVED,NOTABUG,irc: Request line contains non-ascii character,3/4/06 8:01,Trivial,8,Linux (other),wireshark-bugs,toralf.foerster,5/26/05 8:46,2005-09-20 07:47:22 UTC,ulf.lamping
207,GTK+ UI,RESOLVED,DUPLICATE,irc: Pango-WARNING **: Invalid UTF-8 string,5/26/05 17:13,Minor,3,Linux (other),wireshark-bugs,toralf.foerster,5/26/05 8:52,2005-05-26 17:13:44 UTC,dgautheron
208,TShark,RESOLVED,FIXED,Buildbot crash output: editcap.4295e76e.pcap,5/28/05 7:49,Critical,3,FreeBSD,wireshark-bugs,buildbot-do-not-reply,5/26/05 10:12,2005-05-28 07:49:52 UTC,ulf.lamping
209,GTK+ UI,RESOLVED,FIXED,too long line in $HOME/.ethereal/recent,5/27/05 13:34,Trivial,6,Linux (other),luis.ontanon,toralf.foerster,5/27/05 3:13,2005-05-27 13:34:43 UTC,luis.ontanon
211,GTK+ UI,RESOLVED,FIXED,rmt dissector: sct flag used for ert check,6/18/05 3:55,Normal,2,All,wireshark-bugs,dkuhlen,5/27/05 6:36,2005-06-18 03:55:20 UTC,jmayer
212,GTK+ UI,RESOLVED,WORKSFORME,"Ethereal crashes after I clicked on ""Edit -> Preferences""",2/11/07 4:35,Major,22,Windows XP,wireshark-bugs,leo.woess,5/27/05 9:05,2007-02-11 04:35:36 UTC,ulf.lamping
213,TShark,RESOLVED,FIXED,Buildbot crash output: editcap.42989f1c.pcap,5/30/05 10:51,Critical,3,FreeBSD,wireshark-bugs,buildbot-do-not-reply,5/28/05 11:41,2005-05-30 10:51:35 UTC,gerald
214,TShark,RESOLVED,DUPLICATE,Buildbot crash output: editcap.429a2625.pcap,5/30/05 10:51,Critical,2,FreeBSD,wireshark-bugs,buildbot-do-not-reply,5/29/05 15:29,2005-05-30 10:51:45 UTC,gerald
215,TShark,RESOLVED,FIXED,"SMB dissector bug: failed assertion ""hfinfo->type == FT_STRING || hfinfo->type == FT_STRINGZ""",5/29/05 22:14,Critical,3,Linux (other),wireshark-bugs,thomas.anders,5/29/05 15:41,2005-05-29 22:14:17 UTC,ulf.lamping
216,TShark,RESOLVED,FIXED,Buildbot crash output: editcap.429a2eee.pcap,5/29/05 21:58,Critical,2,FreeBSD,wireshark-bugs,buildbot-do-not-reply,5/29/05 16:06,2005-05-29 21:58:45 UTC,ulf.lamping
217,GTK+ UI,RESOLVED,FIXED,Ethereal code review,7/10/08 10:14,Major,6,Linux (other),wireshark-bugs,rvokal,5/30/05 1:45,2005-06-14 13:19:52 UTC,bugzilla-admin
218,GTK+ UI,RESOLVED,FIXED,irc response: Pango-WARNING **: Invalid UTF-8 string passed to pango_layout_set_text(),9/23/05 16:34,Minor,3,Linux (other),wireshark-bugs,toralf.foerster,5/30/05 3:37,2005-09-23 16:34:12 UTC,ronniesahlberg
219,TShark,RESOLVED,FIXED,crash on fuzzed DOCSIS capture (proto_item_fill_label?),6/15/05 10:10,Critical,3,Linux (other),wireshark-bugs,thomas.anders,5/30/05 14:53,2005-06-15 10:10:17 UTC,bugzilla-admin
220,GTK+ UI,RESOLVED,FIXED,Vertical Scroll Bar Disappeared after using Display Filter,7/10/08 10:14,Normal,23,Windows Server 2003,wireshark-bugs,jiangjinke,6/1/05 0:48,2006-11-14 06:03:26 UTC,bugzilla-admin
221,Documentation,RESOLVED,FIXED,Tethereal man page is annoyingly outdated,7/10/08 10:14,Normal,3,All,wireshark-bugs,sb,6/1/05 7:44,2005-06-03 20:35:56 UTC,bugzilla-admin
222,GTK+ UI,RESOLVED,NOTABUG,First 50 packets has innacurate timestamp,7/10/08 10:14,Normal,4,Linux (other),wireshark-bugs,smalenfant,6/1/05 13:57,2005-06-01 14:14:02 UTC,bugzilla-admin
223,TShark,RESOLVED,FIXED,Buildbot crash output: editcap.429f5932.pcap,6/2/05 14:31,Critical,2,FreeBSD,wireshark-bugs,buildbot-do-not-reply,6/2/05 14:08,2005-06-02 14:31:34 UTC,ulf.lamping
224,GTK+ UI,RESOLVED,FIXED,ethereal crash: Statistics -> Protocol Hierarchie,6/29/05 7:01,Normal,10,Linux (other),wireshark-bugs,toralf.foerster,6/3/05 8:05,2005-06-29 07:01:51 UTC,ronniesahlberg
225,TShark,RESOLVED,DUPLICATE,Buildbot crash output: editcap.42a0a4c1.pcap,6/4/05 16:41,Critical,2,FreeBSD,wireshark-bugs,buildbot-do-not-reply,6/3/05 13:43,2005-06-04 16:41:17 UTC,ulf.lamping
226,TShark,RESOLVED,DUPLICATE,Buildbot crash output: editcap.42a11df9.pcap,6/4/05 16:41,Critical,2,FreeBSD,wireshark-bugs,buildbot-do-not-reply,6/3/05 22:20,2005-06-04 16:41:31 UTC,ulf.lamping
227,TShark,RESOLVED,DUPLICATE,Buildbot crash output: editcap.42a137ed.pcap,6/4/05 16:41,Critical,2,FreeBSD,wireshark-bugs,buildbot-do-not-reply,6/4/05 0:11,2005-06-04 16:41:41 UTC,ulf.lamping
228,TShark,RESOLVED,DUPLICATE,Buildbot crash output: editcap.42a151f4.pcap,6/4/05 16:41,Critical,2,FreeBSD,wireshark-bugs,buildbot-do-not-reply,6/4/05 2:02,2005-06-04 16:41:51 UTC,ulf.lamping
229,TShark,RESOLVED,DUPLICATE,Buildbot crash output: editcap.42a19bde.pcap,6/4/05 16:42,Critical,2,FreeBSD,wireshark-bugs,buildbot-do-not-reply,6/4/05 7:17,2005-06-04 16:42:01 UTC,ulf.lamping
230,TShark,RESOLVED,DUPLICATE,Buildbot crash output: editcap.42a1b5db.pcap,6/4/05 16:42,Critical,2,FreeBSD,wireshark-bugs,buildbot-do-not-reply,6/4/05 9:08,2005-06-04 16:42:14 UTC,ulf.lamping
231,TShark,RESOLVED,FIXED,Buildbot crash output: editcap.42a219a7.pcap,6/4/05 16:42,Critical,8,FreeBSD,wireshark-bugs,buildbot-do-not-reply,6/4/05 16:14,2005-06-04 16:40:51 UTC,ulf.lamping
232,TShark,RESOLVED,FIXED,Buildbot crash output: editcap.42a3c894.pcap,6/8/05 10:35,Critical,3,FreeBSD,wireshark-bugs,buildbot-do-not-reply,6/5/05 22:52,2005-06-08 10:32:38 UTC,bugzilla-admin
233,TShark,RESOLVED,DUPLICATE,Buildbot crash output: editcap.42a6a3fc.pcap,6/8/05 10:35,Critical,2,FreeBSD,wireshark-bugs,buildbot-do-not-reply,6/8/05 2:53,2005-06-08 10:35:43 UTC,bugzilla-admin
234,TShark,RESOLVED,FIXED,Buildbot crash output: editcap.42a6b08e.pcap,6/15/05 17:56,Critical,2,FreeBSD,wireshark-bugs,buildbot-do-not-reply,6/8/05 3:47,2005-06-15 17:56:47 UTC,gerald
235,TShark,RESOLVED,FIXED,Buildbot crash output: editcap.42a728e5.pcap,6/15/05 16:23,Critical,2,FreeBSD,wireshark-bugs,buildbot-do-not-reply,6/8/05 12:20,2005-06-15 16:23:33 UTC,bugzilla-admin
236,TShark,VERIFIED,FIXED,Buildbot crash output: editcap.42a813fa.pcap,6/15/05 17:09,Critical,3,FreeBSD,wireshark-bugs,buildbot-do-not-reply,6/9/05 5:03,2005-06-15 15:55:41 UTC,bugzilla-admin
237,Qt UI,RESOLVED,FIXED,"UNICODE support in ""follow TCP stream""",6/3/16 16:21,Enhancement,13,All,wireshark-bugs,awebster,6/9/05 14:47,2016-06-03 16:20:59 UTC,gerrit-do-not-reply
238,GTK+ UI,RESOLVED,NOTOURBUG,http: packet classified as dcerpc,9/20/05 7:49,Normal,6,Linux (other),wireshark-bugs,toralf.foerster,6/10/05 10:37,2005-09-20 07:49:03 UTC,ulf.lamping
239,GTK+ UI,RESOLVED,DUPLICATE,expanding subtrees has to be taken twice,7/8/08 11:19,Minor,7,Linux (other),wireshark-bugs,toralf.foerster,6/10/05 14:11,2008-07-08 11:19:15 UTC,toralf.foerster
240,TShark,RESOLVED,FIXED,Buildbot crash output: editcap.42aa53ca.pcap,6/15/05 16:35,Critical,3,FreeBSD,wireshark-bugs,buildbot-do-not-reply,6/10/05 22:00,2005-06-15 16:34:02 UTC,bugzilla-admin
241,TShark,RESOLVED,FIXED,Buildbot crash output: editcap.42ab9ce7.pcap,6/15/05 16:45,Critical,2,FreeBSD,wireshark-bugs,buildbot-do-not-reply,6/11/05 21:24,2005-06-15 16:45:36 UTC,bugzilla-admin
242,GTK+ UI,RESOLVED,FIXED,Improprer ICMP TTL decode value,6/14/05 2:52,Normal,2,Windows XP,wireshark-bugs,sfaber,6/13/05 10:14,2005-06-14 02:52:15 UTC,ulf.lamping
243,GTK+ UI,RESOLVED,NOTABUG,Missing support for floats in tree items,7/10/08 10:10,Normal,4,Linux (other),wireshark-bugs,gjc,6/14/05 7:47,2005-06-14 08:05:02 UTC,bugzilla-admin
244,GTK+ UI,RESOLVED,FIXED,LLC SSAP=0xAB?,7/10/08 9:54,Minor,6,Windows 2000,wireshark-bugs,ro-fisch,6/14/05 11:59,2005-07-20 17:21:35 UTC,bugzilla-admin
245,TShark,RESOLVED,DUPLICATE,Buildbot crash output: editcap.42afe30e.pcap,6/15/05 16:35,Critical,2,FreeBSD,wireshark-bugs,buildbot-do-not-reply,6/15/05 3:13,2005-06-15 16:35:29 UTC,bugzilla-admin
246,TShark,RESOLVED,FIXED,Buildbot crash output: editcap.42b088a5.pcap,6/15/05 17:10,Critical,4,FreeBSD,wireshark-bugs,buildbot-do-not-reply,6/15/05 14:59,2005-06-15 17:10:48 UTC,bugzilla-admin
247,TShark,RESOLVED,FIXED,Buildbot crash output: editcap.42b0cc48.pcap,6/16/05 15:52,Critical,2,FreeBSD,wireshark-bugs,buildbot-do-not-reply,6/15/05 19:48,2005-06-16 15:52:02 UTC,gerald
248,GTK+ UI,RESOLVED,WORKSFORME,some DDns traffic is incorrectly parsed as UDP instead of Dns,7/10/08 10:14,Normal,8,Windows XP,wireshark-bugs,fcnet,6/16/05 11:35,2006-02-24 04:22:52 UTC,bugzilla-admin
249,Build process,RESOLVED,NOTABUG,make seems to ignore environment variable CC,1/26/15 22:31,Trivial,2,Linux (other),wireshark-bugs,toralf.foerster,6/17/05 4:18,2005-06-17 18:52:36 UTC,guy
250,TShark,RESOLVED,DUPLICATE,Buildbot crash output: editcap.42b73c1a.pcap,6/21/05 11:33,Critical,3,FreeBSD,wireshark-bugs,buildbot-do-not-reply,6/20/05 16:58,2005-06-21 11:33:43 UTC,gerald
251,TShark,RESOLVED,FIXED,Buildbot crash output: editcap.42b74e09.pcap,6/21/05 11:35,Critical,5,FreeBSD,wireshark-bugs,buildbot-do-not-reply,6/20/05 18:15,2005-06-21 04:42:52 UTC,ronniesahlberg
252,TShark,RESOLVED,DUPLICATE,Buildbot crash output: editcap.42b7ecb5.pcap,6/21/05 11:34,Critical,2,FreeBSD,wireshark-bugs,buildbot-do-not-reply,6/21/05 5:32,2005-06-21 11:34:41 UTC,gerald
253,TShark,RESOLVED,DUPLICATE,Buildbot crash output: editcap.42b808b6.pcap,6/21/05 11:35,Critical,2,FreeBSD,wireshark-bugs,buildbot-do-not-reply,6/21/05 7:31,2005-06-21 11:35:13 UTC,gerald
254,TShark,RESOLVED,FIXED,Buildbot crash output: editcap.42b8a08d.pcap,6/22/05 10:38,Critical,6,FreeBSD,wireshark-bugs,buildbot-do-not-reply,6/21/05 18:19,2005-06-22 10:38:25 UTC,gerald
255,TShark,RESOLVED,DUPLICATE,Buildbot crash output: editcap.42b8dc6b.pcap,6/22/05 10:38,Critical,2,FreeBSD,wireshark-bugs,buildbot-do-not-reply,6/21/05 22:35,2005-06-22 10:38:34 UTC,gerald
256,TShark,RESOLVED,DUPLICATE,Buildbot crash output: editcap.42b930a6.pcap,6/22/05 10:38,Critical,2,FreeBSD,wireshark-bugs,buildbot-do-not-reply,6/22/05 4:34,2005-06-22 10:38:44 UTC,gerald
257,TShark,RESOLVED,DUPLICATE,Buildbot crash output: editcap.42b94302.pcap,6/22/05 10:38,Critical,2,FreeBSD,wireshark-bugs,buildbot-do-not-reply,6/22/05 5:52,2005-06-22 10:38:51 UTC,gerald
258,TShark,RESOLVED,DUPLICATE,Buildbot crash output: editcap.42b95508.pcap,6/22/05 10:38,Critical,2,FreeBSD,wireshark-bugs,buildbot-do-not-reply,6/22/05 7:09,2005-06-22 10:38:59 UTC,gerald
259,TShark,RESOLVED,FIXED,crash on fuzzed SMB capture,6/23/05 17:18,Critical,4,Linux (other),wireshark-bugs,thomas.anders,6/22/05 13:54,2005-06-23 17:18:50 UTC,thomas.anders
260,GTK+ UI,RESOLVED,FIXED,SMB: QUERY_PATH_INFO / all info broken,7/10/08 10:14,Normal,7,Linux (other),wireshark-bugs,elrond+ethereal.com,6/23/05 18:24,2005-12-11 16:30:34 UTC,bugzilla-admin
261,TShark,RESOLVED,FIXED,Novell-Fileshare // ** ERROR **: file ftypes.c: line 455 (fvalue_get_integer): assertion failed: (fv->ftype->get_value_integer),7/10/08 10:12,Normal,5,Linux (other),wireshark-bugs,norman.zimmer,6/24/05 3:09,2005-06-27 02:46:38 UTC,bugzilla-admin
262,GTK+ UI,RESOLVED,FIXED,Double click on Capture start button asserts in capture.c,7/10/08 10:14,Normal,4,Windows 2000,wireshark-bugs,jaap.keuter,6/24/05 7:52,2005-06-27 07:30:28 UTC,bugzilla-admin
263,GTK+ UI,RESOLVED,NOTABUG,smtp : example response packet from courieresmtpd,11/1/05 3:14,Enhancement,4,Linux (other),wireshark-bugs,toralf.foerster,6/24/05 8:07,2005-11-01 03:14:13 UTC,toralf.foerster
264,GTK+ UI,RESOLVED,FIXED,"Problem: ""Ethereal Capture Options""",6/24/05 21:09,Normal,5,Windows 2000,wireshark-bugs,jpimentel,6/24/05 18:24,2005-06-24 21:09:39 UTC,jpimentel
265,GTK+ UI,RESOLVED,NOTABUG,"cannot use ""-"" as argument of -i option",7/10/08 10:14,Normal,5,Mac OS X 10.3,wireshark-bugs,luis.ontanon,6/25/05 8:13,2007-01-06 01:44:04 UTC,bugzilla-admin
266,TShark,RESOLVED,FIXED,crash on fuzzed RTP capture,7/25/05 14:08,Critical,6,Linux (other),wireshark-bugs,thomas.anders,6/26/05 16:09,2005-07-25 14:05:57 UTC,gerald
267,TShark,RESOLVED,FIXED,inifinite loop (eating up all memory) on fuzzed DOCSIS capture,6/27/05 17:12,Critical,4,Linux (other),wireshark-bugs,thomas.anders,6/27/05 3:54,2005-06-27 17:12:10 UTC,ulf.lamping
268,GTK+ UI,RESOLVED,NOTOURBUG,Problem with HTTP display filter,7/10/08 10:14,Normal,6,Windows 2000,wireshark-bugs,didier.mercadier,6/27/05 7:12,2005-12-30 19:48:31 UTC,bugzilla-admin
269,GTK+ UI,RESOLVED,DUPLICATE,H.263 - Marker Bits shows as 'Incorrect Timestamp' in RTP Stream Analysis,7/2/09 9:05,Normal,7,Windows XP,wireshark-bugs,masanwar,6/28/05 4:43,2009-07-02 09:05:38 UTC,anders.broman
270,GTK+ UI,RESOLVED,WORKSFORME,icmp packets filtered as dns,6/28/05 7:53,Normal,3,Linux (other),wireshark-bugs,toralf.foerster,6/28/05 7:19,2005-06-28 07:53:42 UTC,luis.ontanon
271,GTK+ UI,RESOLVED,FIXED,Crash on failed hex find,7/10/08 10:14,Critical,4,Linux (other),wireshark-bugs,Steven.Schaeffer,6/29/05 14:35,2005-07-01 15:49:39 UTC,bugzilla-admin
272,TShark,RESOLVED,FIXED,Buildbot crash output: editcap.42c8f030.pcap,7/26/05 13:18,Critical,3,FreeBSD,wireshark-bugs,buildbot-do-not-reply,7/4/05 3:15,2005-07-26 13:18:40 UTC,gerald
273,GTK+ UI,RESOLVED,FIXED,SIP domain option encoding is not performed correctly,7/10/08 10:14,Normal,4,Windows 2000,wireshark-bugs,ethereal,7/4/05 13:36,2005-07-20 06:45:29 UTC,bugzilla-admin
274,TShark,RESOLVED,FIXED,Buildbot crash output: editcap.42ca2ecf.pcap,7/5/05 15:31,Critical,6,FreeBSD,wireshark-bugs,buildbot-do-not-reply,7/5/05 1:55,2005-07-05 15:20:50 UTC,gerald
275,GTK+ UI,RESOLVED,NOTABUG,protocoll hierarchie seems to be incomplete,7/5/05 13:58,Trivial,4,Linux (other),wireshark-bugs,toralf.foerster,7/5/05 9:34,2005-07-05 13:58:50 UTC,ulf.lamping
276,TShark,RESOLVED,DUPLICATE,Buildbot crash output: editcap.42cac74b.pcap,7/5/05 15:21,Critical,2,FreeBSD,wireshark-bugs,buildbot-do-not-reply,7/5/05 12:45,2005-07-05 15:21:12 UTC,gerald
277,TShark,RESOLVED,DUPLICATE,Buildbot crash output: editcap.42cacfa0.pcap,7/5/05 15:21,Critical,2,FreeBSD,wireshark-bugs,buildbot-do-not-reply,7/5/05 13:21,2005-07-05 15:21:21 UTC,gerald
278,TShark,RESOLVED,DUPLICATE,Buildbot crash output: editcap.42cae02e.pcap,7/5/05 15:22,Critical,2,FreeBSD,wireshark-bugs,buildbot-do-not-reply,7/5/05 14:31,2005-07-05 15:22:12 UTC,gerald
279,TShark,RESOLVED,DUPLICATE,Buildbot crash output: editcap.42caec21.pcap,7/5/05 15:31,Critical,2,FreeBSD,wireshark-bugs,buildbot-do-not-reply,7/5/05 15:22,2005-07-05 15:31:27 UTC,gerald
280,GTK+ UI,VERIFIED,FIXED,Statistics->SCTP dumps core if duplicate SACK (?),7/12/05 3:05,Major,2,Solaris,wireshark-bugs,jeff.morriss.ws,7/7/05 5:14,2005-07-08 06:48:48 UTC,jeff.morriss.ws
281,GTK+ UI,RESOLVED,FIXED,ISAKMP IKEv2 Certificate Request Payload incorrectly parsed,7/10/08 10:14,Normal,4,Linux (other),wireshark-bugs,efung,7/7/05 12:20,2005-07-14 03:15:00 UTC,bugzilla-admin
282,GTK+ UI,RESOLVED,NOTABUG,cannot use filter to remove packets related to a known IP addr,7/10/08 10:14,Normal,3,Windows XP,wireshark-bugs,guizop,7/10/05 14:34,2005-07-10 14:47:15 UTC,bugzilla-admin
283,GTK+ UI,RESOLVED,FIXED,Default global example files (e.g. colorfilters) are not uninstalled,8/18/05 15:34,Major,4,Windows XP,wireshark-bugs,ulf.lamping,7/11/05 15:21,2005-08-18 15:34:10 UTC,ulf.lamping
284,GTK+ UI,VERIFIED,FIXED,Ethereal doesn't check for program wide cfilter/dfilter,7/10/08 10:14,Normal,6,Windows XP,wireshark-bugs,tbearden,7/15/05 14:37,2005-08-01 12:40:12 UTC,bugzilla-admin
285,GTK+ UI,RESOLVED,FIXED,Cannot dissect NAT Keepalive pkt for IKE,7/10/08 10:14,Normal,4,Linux (other),wireshark-bugs,efung,7/15/05 16:13,2005-07-20 02:51:59 UTC,bugzilla-admin
286,GTK+ UI,RESOLVED,FIXED,"in Flow Graphs the selected packet ""dissappears""",7/19/05 16:41,Major,2,Mac OS X 10.3,wireshark-bugs,luis.ontanon,7/17/05 18:22,2005-07-19 16:41:32 UTC,luis.ontanon
287,TShark,RESOLVED,FIXED,Buildbot crash output: editcap.42dd9d08.pcap,7/20/05 15:58,Critical,2,FreeBSD,wireshark-bugs,buildbot-do-not-reply,7/19/05 19:38,2005-07-20 15:58:03 UTC,gerald
288,TShark,RESOLVED,FIXED,Buildbot crash output: editcap.42def084.pcap,7/21/05 16:41,Critical,2,FreeBSD,wireshark-bugs,buildbot-do-not-reply,7/20/05 19:47,2005-07-21 16:41:18 UTC,gerald
289,GTK+ UI,RESOLVED,NOTABUG,Calls to slow getserv() make reading from capture file very slow,7/10/08 23:09,Normal,10,Mac OS X 10.4,wireshark-bugs,waters,7/20/05 21:05,2007-01-21 00:33:52 UTC,bugzilla-admin
290,GTK+ UI,RESOLVED,FIXED,ISAKMP Exchange Type 37 not being recognized,7/10/08 10:14,Normal,3,Linux (other),wireshark-bugs,efung,7/21/05 14:15,2005-07-21 21:00:50 UTC,bugzilla-admin
291,GTK+ UI,RESOLVED,FIXED,ISAKMP Notify Message types for IKEv1 are incorrect,7/10/08 10:14,Normal,3,Linux (other),wireshark-bugs,efung,7/21/05 15:24,2005-07-21 21:08:35 UTC,bugzilla-admin
292,GTK+ UI,RESOLVED,LATER,radius: Could not find radius directory,7/23/05 22:50,Minor,9,All,wireshark-bugs,toralf.foerster,7/23/05 5:20,2005-07-23 22:50:58 UTC,luis.ontanon
293,TShark,RESOLVED,FIXED,Buildbot crash output: editcap.42e3373e.pcap,7/24/05 16:03,Critical,2,FreeBSD,wireshark-bugs,buildbot-do-not-reply,7/24/05 1:37,2005-07-24 16:03:03 UTC,gerald
294,GTK+ UI,RESOLVED,WORKSFORME,"Removing ""Source"" from the column list crashes Ethereal",7/10/08 10:14,Normal,3,Windows XP,wireshark-bugs,ethereal,7/24/05 3:45,2005-09-20 06:31:47 UTC,bugzilla-admin
295,GTK+ UI,RESOLVED,NOTABUG,minor rounding error for udp statistics,7/24/05 13:33,Trivial,3,Linux (other),wireshark-bugs,toralf.foerster,7/24/05 11:04,2005-07-24 13:33:34 UTC,ulf.lamping
296,TShark,RESOLVED,FIXED,Buildbot crash output: editcap.42e48cc5.pcap,7/25/05 10:44,Critical,3,FreeBSD,wireshark-bugs,buildbot-do-not-reply,7/25/05 1:55,2005-07-25 10:44:13 UTC,gerald
297,TShark,RESOLVED,DUPLICATE,Buildbot crash output: editcap.42e4a863.pcap,7/25/05 10:44,Critical,2,FreeBSD,wireshark-bugs,buildbot-do-not-reply,7/25/05 3:52,2005-07-25 10:44:26 UTC,gerald
298,GTK+ UI,RESOLVED,FIXED,WSP: dissector assert on privately fuzzed capture,9/30/05 14:33,Critical,4,Windows XP,wireshark-bugs,ulf.lamping,7/25/05 11:08,2005-09-28 02:20:50 UTC,ethereal
299,Capture file support (libwiretap),RESOLVED,LATER,Time stamps in some Windows Sniffer files are off by a few hours,12/21/15 0:12,Normal,31,All,wireshark-bugs,elizabeth.m.hendrix,7/25/05 19:57,2015-12-21 00:12:20 UTC,guy
300,Dissection engine (libwireshark),RESOLVED,NOTABUG,DPNSS and DASS decoding,1/24/17 21:53,Normal,3,All,wireshark-bugs,bibhuti.tosh,7/26/05 1:52,2005-08-31 18:21:47 UTC,guy
301,GTK+ UI,RESOLVED,FIXED,Default storage location for traces on Windows is not Windows' encouraged practice,1/14/07 23:45,Normal,7,Windows XP,wireshark-bugs,michael.emmott,7/27/05 5:37,2007-01-14 23:45:11 UTC,ulf.lamping
302,GTK+ UI,RESOLVED,NOTOURBUG,PCAP Load big files,1/24/06 23:54,Major,7,Windows 2000,wireshark-bugs,Felix,7/27/05 5:44,2006-01-24 23:54:52 UTC,jeff.morriss.ws
303,TShark,RESOLVED,FIXED,Buildbot crash output: editcap.42e77a62.pcap,7/27/05 9:21,Critical,2,FreeBSD,wireshark-bugs,buildbot-do-not-reply,7/27/05 7:13,2005-07-27 09:21:28 UTC,jmayer
304,GTK+ UI,RESOLVED,FIXED,Assertion in gdate.c line 850,7/10/08 10:14,Normal,14,Windows XP,wireshark-bugs,shradecky,7/28/05 3:56,2006-02-23 01:17:30 UTC,bugzilla-admin
305,GTK+ UI,RESOLVED,FIXED,File Set: don't get file creation date/time of the file but just use the filename,8/18/05 14:37,Normal,2,Windows XP,wireshark-bugs,ulf.lamping,7/29/05 6:47,2005-08-18 14:37:19 UTC,ulf.lamping
306,GTK+ UI,RESOLVED,FIXED,Incorrect MobileIPv4 router advertisement dissecting.,12/15/05 17:17,Normal,2,Windows 2000,wireshark-bugs,kuikka,7/29/05 18:45,2005-12-15 17:17:52 UTC,ronniesahlberg
307,GTK+ UI,RESOLVED,FIXED,Unable to read pcap capture files on i686 Linux w/ ver. 0.10.12 Ethereal,7/10/08 10:15,Normal,4,Linux (other),wireshark-bugs,jayjwa,7/30/05 1:12,2005-09-21 04:12:47 UTC,bugzilla-admin
308,GTK+ UI,RESOLVED,WORKSFORME,10.12 -TCP Packet Details not showing flags correctly,9/20/05 6:39,Normal,2,Windows XP,wireshark-bugs,roger,8/1/05 16:59,2005-09-20 06:39:23 UTC,ulf.lamping
309,GTK+ UI,RESOLVED,NOTABUG,Registered port 4500 is ipsec-nat-t,7/10/08 10:14,Minor,3,Linux (other),wireshark-bugs,efung,8/2/05 9:33,2005-09-20 06:53:50 UTC,bugzilla-admin
310,GTK+ UI,RESOLVED,FIXED,Packet history list wrong with display filter,5/4/07 11:21,Normal,6,All,wireshark-bugs,Steven.Schaeffer,8/2/05 13:30,2007-05-04 11:21:47 UTC,jaap.keuter
311,TShark,RESOLVED,FIXED,Buildbot crash output: editcap.42f157c8.pcap,8/4/05 12:13,Critical,3,FreeBSD,wireshark-bugs,buildbot-do-not-reply,8/3/05 18:48,2005-08-04 12:13:22 UTC,gerald
312,TShark,RESOLVED,FIXED,Buildbot crash output: editcap.42f1b6f3.pcap,8/4/05 5:28,Critical,2,FreeBSD,wireshark-bugs,buildbot-do-not-reply,8/4/05 1:34,2005-08-04 05:28:20 UTC,guy
313,GTK+ UI,RESOLVED,DUPLICATE,Vertical Scroll Bar not updated after new capture,7/10/08 10:14,Normal,5,Windows XP,wireshark-bugs,eth.bugs.itom,8/4/05 10:16,2005-08-04 11:51:54 UTC,bugzilla-admin
314,TShark,RESOLVED,DUPLICATE,Buildbot crash output: editcap.42f244dc.pcap,8/4/05 12:13,Critical,2,FreeBSD,wireshark-bugs,buildbot-do-not-reply,8/4/05 11:40,2005-08-04 12:13:31 UTC,gerald
315,GTK+ UI,RESOLVED,NOTOURBUG,no capture on Dell Notebook with Intel Wi-Fi Card,8/5/05 1:36,Critical,2,Windows XP,wireshark-bugs,jroy,8/4/05 19:46,2005-08-05 01:36:35 UTC,guy
316,TShark,RESOLVED,FIXED,Buildbot crash output: editcap.42f2ba6d.pcap,8/5/05 22:54,Critical,5,FreeBSD,wireshark-bugs,buildbot-do-not-reply,8/4/05 20:01,2005-08-05 22:54:09 UTC,gerald
317,TShark,RESOLVED,DUPLICATE,Buildbot crash output: editcap.42f30a5e.pcap,8/5/05 22:47,Critical,2,FreeBSD,wireshark-bugs,buildbot-do-not-reply,8/5/05 1:42,2005-08-05 22:47:47 UTC,gerald
318,TShark,RESOLVED,DUPLICATE,Buildbot crash output: editcap.42f375ef.pcap,8/5/05 22:48,Critical,2,FreeBSD,wireshark-bugs,buildbot-do-not-reply,8/5/05 9:21,2005-08-05 22:48:47 UTC,gerald
319,TShark,RESOLVED,DUPLICATE,Buildbot crash output: editcap.42f417fa.pcap,8/5/05 22:49,Critical,2,FreeBSD,wireshark-bugs,buildbot-do-not-reply,8/5/05 20:52,2005-08-05 22:49:25 UTC,gerald
320,TShark,RESOLVED,FIXED,Buildbot crash output: editcap.42f49b03.pcap,8/6/05 14:29,Critical,3,FreeBSD,wireshark-bugs,buildbot-do-not-reply,8/6/05 6:12,2005-08-06 10:19:40 UTC,gerald
321,GTK+ UI,RESOLVED,DUPLICATE,Merge crash something in Ethereal,5/25/12 13:47,Normal,2,Windows XP,wireshark-bugs,wotttt,8/6/05 7:16,2005-08-25 19:31:29 UTC,guy
322,GTK+ UI,RESOLVED,FIXED,packet detail window -> Protocol Preferences: tree not expanded,9/26/05 14:24,Trivial,6,Linux (other),ulf.lamping,toralf.foerster,8/6/05 9:25,2005-09-26 14:24:56 UTC,ulf.lamping
324,GTK+ UI,RESOLVED,FIXED,eDonkey: Unknown Protocol,8/31/05 8:46,Minor,3,Linux (other),wireshark-bugs,toralf.foerster,8/6/05 9:37,2005-08-31 08:46:13 UTC,jeff.morriss.ws
325,Documentation,RESOLVED,NOTOURBUG,"failed to load external entity ""http://www.oasis-open.org/docbook/xml/4.2/docbookx.dtd""",9/15/06 21:19,Minor,12,Linux (other),wireshark-bugs,toralf.foerster,8/6/05 11:22,2006-09-15 21:19:30 UTC,toralf.foerster
326,TShark,RESOLVED,DUPLICATE,Buildbot crash output: editcap.42f501da.pcap,8/6/05 14:29,Critical,2,FreeBSD,wireshark-bugs,buildbot-do-not-reply,8/6/05 13:30,2005-08-06 14:29:13 UTC,gerald
327,GTK+ UI,RESOLVED,WORKSFORME,Slim devices (slimp3) traffic causes Ethereal to segfault,7/10/08 10:14,Critical,7,Linux (other),wireshark-bugs,bminish,8/6/05 16:02,2005-10-12 13:45:07 UTC,bugzilla-admin
328,TShark,RESOLVED,FIXED,Buildbot crash output: editcap.42f56ea9.pcap,8/9/05 9:41,Critical,7,FreeBSD,wireshark-bugs,buildbot-do-not-reply,8/6/05 21:15,2005-08-09 09:38:40 UTC,gerald
329,TShark,RESOLVED,DUPLICATE,Buildbot crash output: editcap.42f5dbca.pcap,8/9/05 9:39,Critical,2,FreeBSD,wireshark-bugs,buildbot-do-not-reply,8/7/05 5:00,2005-08-09 09:39:46 UTC,gerald
330,TShark,RESOLVED,DUPLICATE,Buildbot crash output: editcap.42f6bc05.pcap,8/9/05 9:40,Critical,2,FreeBSD,wireshark-bugs,buildbot-do-not-reply,8/7/05 20:57,2005-08-09 09:40:12 UTC,gerald
331,GTK+ UI,RESOLVED,FIXED,File set dialog: add a vertical scrollbar,8/29/06 21:10,Normal,6,All,cocybombon,ulf.lamping,8/8/05 7:46,2006-08-29 21:10:55 UTC,ulf.lamping
332,GTK+ UI,RESOLVED,FIXED,MTP3 management dissector does not pretty-print PCs,7/10/08 10:14,Normal,8,All,wireshark-bugs,jeff.morriss.ws,8/8/05 8:42,2006-03-22 11:13:25 UTC,bugzilla-admin
333,GTK+ UI,RESOLVED,FIXED,builds on systems with ibiconv fail (can't find libiconv_open()  etc.),7/20/06 12:26,Normal,12,Solaris,jmayer,jeff.morriss.ws,8/8/05 9:31,2006-07-20 02:20:11 UTC,jeff.morriss.ws
334,TShark,RESOLVED,DUPLICATE,Buildbot crash output: editcap.42f77721.pcap,8/9/05 9:41,Critical,2,FreeBSD,wireshark-bugs,buildbot-do-not-reply,8/8/05 10:15,2005-08-09 09:41:02 UTC,gerald
335,TShark,RESOLVED,DUPLICATE,Buildbot crash output: editcap.42f80a24.pcap,8/9/05 9:41,Critical,2,FreeBSD,wireshark-bugs,buildbot-do-not-reply,8/8/05 20:43,2005-08-09 09:41:25 UTC,gerald
336,TShark,RESOLVED,DUPLICATE,Buildbot crash output: editcap.42f8784e.pcap,8/9/05 9:41,Critical,2,FreeBSD,wireshark-bugs,buildbot-do-not-reply,8/9/05 4:33,2005-08-09 09:41:52 UTC,gerald
337,TShark,RESOLVED,FIXED,Buildbot crash output: editcap.42f92d83.pcap,8/10/05 13:59,Critical,2,FreeBSD,wireshark-bugs,buildbot-do-not-reply,8/9/05 17:26,2005-08-10 13:59:41 UTC,gerald
338,GTK+ UI,RESOLVED,FIXED,WTLS dissector display bug: session ids > 4 bytes not displayed,7/10/08 10:14,Minor,10,All,wireshark-bugs,jonas.berlin,8/10/05 5:48,2006-09-02 08:17:48 UTC,bugzilla-admin
339,GTK+ UI,VERIFIED,FIXED,Silent install broken,8/29/05 2:04,Normal,6,Windows XP,wireshark-bugs,cm,8/10/05 6:41,2005-08-25 20:00:09 UTC,cm
340,GTK+ UI,RESOLVED,FIXED,Win32: Make use of Packet32.h from WinpdPack optional,9/19/05 16:03,Normal,2,Windows XP,wireshark-bugs,ulf.lamping,8/10/05 6:57,2005-09-19 16:03:51 UTC,ulf.lamping
341,GTK+ UI,RESOLVED,FIXED,Time Display Problem,7/10/08 10:11,Normal,5,Windows XP,wireshark-bugs,thedilleyo,8/10/05 10:44,2005-09-19 13:57:07 UTC,bugzilla-admin
342,TShark,RESOLVED,FIXED,Buildbot crash output: editcap.42fa735e.pcap,8/11/05 5:12,Critical,2,FreeBSD,wireshark-bugs,buildbot-do-not-reply,8/10/05 16:36,2005-08-11 05:12:15 UTC,ronniesahlberg
343,GTK+ UI,RESOLVED,FIXED,Parsing Problem - TransactionResponseAck (MEGACO),7/10/08 10:15,Normal,4,Windows XP,wireshark-bugs,paulo.borelli,8/11/05 9:52,2005-09-20 15:01:31 UTC,bugzilla-admin
344,GTK+ UI,RESOLVED,DUPLICATE,Packet List pane scrollbar not updated,8/15/05 11:22,Minor,2,Linux (other),wireshark-bugs,Steven.Schaeffer,8/11/05 11:38,2005-08-15 11:22:13 UTC,ulf.lamping
345,Capture file support (libwiretap),RESOLVED,FIXED,Time scale on Windows Sniffer/Netasyst captures is sometimes wrong,12/21/15 0:32,Normal,7,All,wireshark-bugs,dolmant,8/11/05 14:49,2005-09-09 20:09:33 UTC,guy
346,GTK+ UI,RESOLVED,FIXED,Wireshark starts up behind taskbar,11/17/07 4:29,Minor,13,Windows XP,wireshark-bugs,mdill,8/11/05 18:53,2007-11-17 04:29:02 UTC,stephenfisher
347,GTK+ UI,RESOLVED,FIXED,Mouse wheel scrolling doesn't follow system setting,12/1/06 8:24,Minor,7,Windows XP,wireshark-bugs,mdill,8/11/05 18:58,2006-12-01 08:24:21 UTC,anders.broman
348,TShark,RESOLVED,FIXED,Buildbot crash output: editcap.42fbfac9.pcap,8/12/05 10:27,Critical,2,FreeBSD,wireshark-bugs,buildbot-do-not-reply,8/11/05 20:26,2005-08-12 10:27:39 UTC,gerald
349,TShark,RESOLVED,FIXED,Buildbot crash output: editcap.42fc6cf6.pcap,8/12/05 11:33,Critical,3,FreeBSD,wireshark-bugs,buildbot-do-not-reply,8/12/05 4:33,2005-08-12 11:33:11 UTC,gerald
350,GTK+ UI,RESOLVED,FIXED,Display filter: ip.checksum_bad == 0 not working,8/21/05 15:46,Normal,3,Windows XP,wireshark-bugs,thomas.sigrist,8/12/05 8:35,2005-08-21 15:46:42 UTC,ulf.lamping
351,GTK+ UI,RESOLVED,NOTABUG,ethereal-0.10.12 compile error in epan/dissectors/,8/31/05 9:28,Normal,3,Linux (other),wireshark-bugs,vmiklos,8/12/05 10:28,2005-08-31 09:28:33 UTC,vmiklos
352,TShark,RESOLVED,DUPLICATE,Buildbot crash output: editcap.42fcc037.pcap,8/12/05 11:33,Critical,2,FreeBSD,wireshark-bugs,buildbot-do-not-reply,8/12/05 10:29,2005-08-12 11:33:30 UTC,gerald
353,GTK+ UI,RESOLVED,FIXED,ethereal crashes when apply a filter,7/10/08 10:15,Critical,12,Windows 2000,wireshark-bugs,taoismc,8/14/05 4:35,2006-08-01 13:43:13 UTC,bugzilla-admin
354,GTK+ UI,RESOLVED,FIXED,SUM(frame.pkt_len)frame.pkt_len show zero in tethereal statistics,7/10/08 10:15,Normal,3,Linux (other),wireshark-bugs,rvokal,8/15/05 4:37,2005-08-15 05:58:23 UTC,bugzilla-admin
356,TShark,RESOLVED,FIXED,Buildbot crash output: editcap.43015fb4.pcap,8/16/05 11:06,Critical,2,FreeBSD,wireshark-bugs,buildbot-do-not-reply,8/15/05 22:38,2005-08-16 11:06:33 UTC,bugzilla-admin
357,TShark,RESOLVED,FIXED,Tethereal does not increment filename number when in ringbuffer mode.,7/10/08 10:15,Normal,3,Linux (other),wireshark-bugs,sdredge,8/16/05 2:04,2005-08-20 11:08:33 UTC,bugzilla-admin
358,GTK+ UI,VERIFIED,FIXED,Printing in windows not possible for user if \ has ACL,7/10/08 10:15,Normal,4,Windows XP,wireshark-bugs,philipp.marek,8/16/05 2:25,2005-11-25 19:58:28 UTC,bugzilla-admin
360,GTK+ UI,RESOLVED,FIXED,searching through data field doesn't show all entries,7/10/08 10:15,Minor,10,Windows XP,wireshark-bugs,andrew.kendall,8/16/05 5:16,2006-08-23 18:48:33 UTC,bugzilla-admin
361,Capture file support (libwiretap),RESOLVED,DUPLICATE,Timestamps are Off When Compared to Sniffer,12/21/15 0:33,Major,9,All,wireshark-bugs,kporter,8/16/05 15:32,2005-08-16 17:36:52 UTC,guy
362,TShark,RESOLVED,FIXED,Buildbot crash output: editcap.4302c6bb.pcap,8/17/05 10:07,Critical,6,FreeBSD,wireshark-bugs,buildbot-do-not-reply,8/17/05 0:10,2005-08-17 10:05:32 UTC,bugzilla-admin
363,TShark,RESOLVED,DUPLICATE,Buildbot crash output: editcap.430305fe.pcap,8/17/05 10:06,Critical,2,FreeBSD,wireshark-bugs,buildbot-do-not-reply,8/17/05 4:40,2005-08-17 10:06:43 UTC,bugzilla-admin
364,TShark,RESOLVED,DUPLICATE,Buildbot crash output: editcap.430315d8.pcap,8/17/05 10:06,Critical,2,FreeBSD,wireshark-bugs,buildbot-do-not-reply,8/17/05 5:47,2005-08-17 10:06:53 UTC,bugzilla-admin
365,TShark,RESOLVED,DUPLICATE,Buildbot crash output: editcap.4303258e.pcap,8/17/05 10:07,Critical,2,FreeBSD,wireshark-bugs,buildbot-do-not-reply,8/17/05 6:54,2005-08-17 10:07:00 UTC,bugzilla-admin
366,TShark,RESOLVED,DUPLICATE,Buildbot crash output: editcap.43033d52.pcap,8/17/05 10:07,Critical,2,FreeBSD,wireshark-bugs,buildbot-do-not-reply,8/17/05 8:36,2005-08-17 10:07:10 UTC,bugzilla-admin
367,TShark,RESOLVED,FIXED,Buildbot crash output: editcap.430540fe.pcap,8/19/05 13:29,Critical,2,FreeBSD,wireshark-bugs,buildbot-do-not-reply,8/18/05 21:16,2005-08-19 13:29:11 UTC,gerald
368,GTK+ UI,RESOLVED,FIXED,Text in info column is not centered,7/10/08 10:15,Major,8,Windows XP,wireshark-bugs,info,8/19/05 7:20,2005-08-21 14:00:19 UTC,bugzilla-admin
369,GTK+ UI,RESOLVED,FIXED,Ringbuffer: After switching to next capture file  toolbar and menu are disabled to stop capturing,10/5/05 18:58,Critical,3,All,ulf.lamping,ulf.lamping,8/19/05 11:33,2005-10-05 18:58:57 UTC,ulf.lamping
370,GTK+ UI,RESOLVED,NOTABUG,configure doesn't use proper libraries when compiling with SSL,7/10/08 10:15,Minor,9,Solaris,wireshark-bugs,jfrank,8/19/05 12:56,2007-05-07 15:19:15 UTC,bugzilla-admin
371,GTK+ UI,RESOLVED,FIXED,BACNet UnconfirmedServiceNotification format seems wrong,7/10/08 10:14,Normal,4,Linux (other),wireshark-bugs,jredman,8/21/05 11:58,2006-03-19 06:29:32 UTC,bugzilla-admin
372,GTK+ UI,RESOLVED,FIXED,io graph crash on new filter,7/10/08 10:15,Major,5,Windows 2000,wireshark-bugs,musicae,8/22/05 6:53,2005-09-21 05:38:06 UTC,bugzilla-admin
373,GTK+ UI,RESOLVED,FIXED,'Distributed Checksum Clearinghouse Protocol' misinterpretation,7/10/08 10:15,Normal,3,Windows 2000,wireshark-bugs,martin.pala,8/22/05 8:42,2005-12-16 13:51:44 UTC,bugzilla-admin
374,GTK+ UI,RESOLVED,FIXED,Crash on File->Open Recent,8/25/05 8:59,Critical,2,Linux (other),wireshark-bugs,Steven.Schaeffer,8/22/05 9:46,2005-08-25 08:59:22 UTC,Steven.Schaeffer
375,GTK+ UI,RESOLVED,FIXED,Crashes when saving to network share without drive letter mapping,7/10/08 10:15,Minor,6,Windows XP,wireshark-bugs,adaig90,8/22/05 17:46,2005-12-29 18:03:55 UTC,bugzilla-admin
376,GTK+ UI,RESOLVED,FIXED,Ethereal 10.12 does not completely decode H.450 in setup from Cisco Call Manager,7/10/08 10:15,Major,3,Windows XP,wireshark-bugs,agoyal,8/23/05 2:26,2005-08-31 00:57:50 UTC,bugzilla-admin
377,GTK+ UI,RESOLVED,FIXED,Ethereal aborts if invalid filter specified for statistics,7/10/08 10:15,Critical,3,All,wireshark-bugs,ghewson,8/24/05 23:16,2005-08-25 11:02:03 UTC,bugzilla-admin
378,GTK+ UI,RESOLVED,FIXED,ip.checksum_bad  is always true ?,12/23/05 13:14,Minor,4,Linux (other),wireshark-bugs,toralf.foerster,8/25/05 13:04,2005-08-25 19:02:57 UTC,ulf.lamping
379,Extras,RESOLVED,FIXED,Patch to editcap to split output to multiple files,7/10/08 10:15,Enhancement,4,All,wireshark-bugs,mikko.tiihonen,8/26/05 5:20,2005-12-16 13:50:30 UTC,bugzilla-admin
380,GTK+ UI,RESOLVED,NOTOURBUG,"""wireshark -R"" doesn't support 'frame.number' as a read filter",3/17/07 6:36,Normal,6,Linux (other),wireshark-bugs,steveg,8/26/05 17:05,2007-03-17 06:36:20 UTC,jeff.morriss.ws
381,TShark,RESOLVED,FIXED,Buildbot crash output: editcap.430fe056.pcap,8/28/05 19:44,Critical,5,FreeBSD,wireshark-bugs,buildbot-do-not-reply,8/26/05 22:39,2005-08-28 15:00:08 UTC,gerald
382,TShark,RESOLVED,FIXED,Buildbot crash output: editcap.43103af8.pcap,8/28/05 15:15,Critical,2,FreeBSD,wireshark-bugs,buildbot-do-not-reply,8/27/05 5:05,2005-08-28 15:15:28 UTC,gerald
383,GTK+ UI,RESOLVED,FIXED,HTTP doesn't show multiple packets in the Info column,7/10/08 10:15,Normal,8,Windows XP,wireshark-bugs,iandol,8/27/05 7:50,2008-03-08 21:23:40 UTC,bugzilla-admin
384,TShark,RESOLVED,DUPLICATE,Buildbot crash output: editcap.431107a7.pcap,8/28/05 15:00,Critical,2,FreeBSD,wireshark-bugs,buildbot-do-not-reply,8/27/05 19:39,2005-08-28 15:00:28 UTC,gerald
385,GTK+ UI,RESOLVED,FIXED,E/IP packet misinterpreted,6/9/12 11:20,Enhancement,6,Windows Server 2003,wireshark-bugs,ron,8/27/05 20:06,2012-06-09 11:20:33 UTC,mmann78
386,TShark,RESOLVED,DUPLICATE,Buildbot crash output: editcap.4311ade4.pcap,8/28/05 15:00,Critical,2,FreeBSD,wireshark-bugs,buildbot-do-not-reply,8/28/05 7:28,2005-08-28 15:00:45 UTC,gerald
387,TShark,RESOLVED,DUPLICATE,Buildbot crash output: editcap.43125439.pcap,8/28/05 19:44,Critical,2,FreeBSD,wireshark-bugs,buildbot-do-not-reply,8/28/05 19:18,2005-08-28 19:44:58 UTC,gerald
388,GTK+ UI,RESOLVED,FIXED,Windows installar command-line-switch for icon,9/14/05 1:22,Enhancement,3,Windows 2000,wireshark-bugs,cm,8/29/05 2:06,2005-09-14 01:22:08 UTC,cm
389,TShark,RESOLVED,FIXED,"After recent 'nanosec time precision change' Tethereal dies (""...should not be reached"") reading a capture file",8/29/05 16:27,Major,3,Windows XP,wireshark-bugs,wmeier,8/29/05 9:42,2005-08-29 16:26:01 UTC,wmeier
390,GTK+ UI,RESOLVED,NOTOURBUG,Loading large capture file -  ethereal crashes,7/10/08 10:15,Normal,3,Windows XP,wireshark-bugs,rimanriman,8/29/05 13:41,2005-09-20 07:24:15 UTC,bugzilla-admin
391,GTK+ UI,RESOLVED,NOTABUG,Capture filter does not work when capturing on PPPoE interface,7/10/08 10:15,Normal,5,Windows XP,wireshark-bugs,wireshark-bugs,8/29/05 21:18,2005-08-29 22:04:57 UTC,bugzilla-admin
392,TShark,RESOLVED,FIXED,Buildbot crash output: editcap.4313c246.pcap,8/30/05 15:55,Critical,6,FreeBSD,wireshark-bugs,buildbot-do-not-reply,8/29/05 21:19,2005-08-30 14:44:17 UTC,gerald
393,TShark,RESOLVED,DUPLICATE,Buildbot crash output: editcap.43142057.pcap,8/30/05 14:44,Critical,2,FreeBSD,wireshark-bugs,buildbot-do-not-reply,8/30/05 4:01,2005-08-30 14:44:27 UTC,gerald
394,TShark,RESOLVED,DUPLICATE,Buildbot crash output: editcap.43142f4b.pcap,8/30/05 14:44,Critical,2,FreeBSD,wireshark-bugs,buildbot-do-not-reply,8/30/05 5:05,2005-08-30 14:44:38 UTC,gerald
395,TShark,RESOLVED,DUPLICATE,Buildbot crash output: editcap.43143e1c.pcap,8/30/05 14:44,Critical,2,FreeBSD,wireshark-bugs,buildbot-do-not-reply,8/30/05 6:08,2005-08-30 14:44:50 UTC,gerald
396,GTK+ UI,RESOLVED,FIXED,Saving flow data crashes Ethereal,2/23/07 15:06,Blocker,21,Windows XP,wireshark-bugs,gerald,8/30/05 9:55,2006-10-11 23:28:20 UTC,jeff.morriss.ws
397,GTK+ UI,VERIFIED,NOTABUG,"""unknown error"" prevents load in kde with pppoe on nic",8/7/06 3:56,Major,14,Linux (other),wireshark-bugs,johann,8/30/05 13:21,2006-08-07 03:22:37 UTC,seitz
398,TShark,RESOLVED,DUPLICATE,Buildbot crash output: editcap.4314c3ff.pcap,8/30/05 15:55,Critical,2,FreeBSD,wireshark-bugs,buildbot-do-not-reply,8/30/05 15:39,2005-08-30 15:55:38 UTC,gerald
399,TShark,RESOLVED,FIXED,Buildbot crash output: editcap.4315660b.pcap,9/1/05 14:36,Critical,3,FreeBSD,wireshark-bugs,buildbot-do-not-reply,8/31/05 3:10,2005-09-01 14:36:22 UTC,gerald
400,GTK+ UI,RESOLVED,FIXED,Add dissection of OID 1.0.9506.1.1,2/7/06 19:06,Enhancement,5,All,wireshark-bugs,Steven.Schaeffer,8/31/05 8:57,2006-02-07 19:06:41 UTC,ronniesahlberg
401,TShark,RESOLVED,DUPLICATE,Buildbot crash output: editcap.43160903.pcap,9/1/05 14:36,Critical,2,FreeBSD,wireshark-bugs,buildbot-do-not-reply,8/31/05 14:46,2005-09-01 14:36:43 UTC,gerald
402,GTK+ UI,RESOLVED,NOTABUG,'ip.addr != IP_ADDRESS' does not work,9/1/05 14:59,Normal,2,Windows XP,wireshark-bugs,jsassojr,9/1/05 14:04,2005-09-01 14:59:51 UTC,ulf.lamping
403,GTK+ UI,RESOLVED,FIXED,NT build fails because NT xcopy does not accept /Y argument,7/10/08 10:15,Normal,11,Windows NT,wireshark-bugs,david.avery,9/1/05 20:55,2005-09-08 15:45:09 UTC,bugzilla-admin
404,GTK+ UI,RESOLVED,FIXED,Decoding of MSISDN on GSM is incomplete.,7/10/08 10:15,Normal,3,Windows XP,wireshark-bugs,delz_a,9/1/05 21:23,2005-09-20 15:04:46 UTC,bugzilla-admin
405,GTK+ UI,RESOLVED,DUPLICATE,Vertical scrollbar disabled in Packet Details pane,7/10/08 10:15,Normal,3,Windows 2000,wireshark-bugs,coder9341,9/2/05 10:41,2005-09-02 13:03:28 UTC,bugzilla-admin
406,TShark,RESOLVED,FIXED,crash on fuzzed SNMP capture,9/5/05 16:40,Critical,3,Linux (other),wireshark-bugs,thomas.anders,9/2/05 16:21,2005-09-05 16:40:20 UTC,gerald
407,TShark,RESOLVED,FIXED,crash on fuzzed H323/SIP/syslog/... capture,3/13/06 16:11,Critical,7,Linux (other),wireshark-bugs,thomas.anders,9/2/05 16:55,2006-03-13 16:11:05 UTC,jaap.keuter
408,GTK+ UI,RESOLVED,FIXED,"""./ethereal -v"" gives less information about current version than ""tethereal -v""",9/3/05 13:23,Enhancement,2,All,wireshark-bugs,toralf.foerster,9/3/05 10:44,2005-09-03 13:23:42 UTC,guy
410,TShark,RESOLVED,FIXED,Buildbot crash output: editcap.431c6389.pcap,9/6/05 11:38,Critical,2,FreeBSD,wireshark-bugs,buildbot-do-not-reply,9/5/05 10:26,2005-09-06 11:38:39 UTC,gerald
411,TShark,RESOLVED,FIXED,Buildbot crash output: editcap.431e131e.pcap,9/8/05 8:20,Critical,6,FreeBSD,wireshark-bugs,buildbot-do-not-reply,9/6/05 17:07,2005-09-07 10:41:32 UTC,thomas.anders
412,TShark,RESOLVED,DUPLICATE,Buildbot crash output: editcap.431ec30f.pcap,9/7/05 10:41,Critical,2,FreeBSD,wireshark-bugs,buildbot-do-not-reply,9/7/05 5:38,2005-09-07 10:41:42 UTC,gerald
413,TShark,RESOLVED,DUPLICATE,Buildbot crash output: editcap.431ed7e6.pcap,9/7/05 10:41,Critical,2,FreeBSD,wireshark-bugs,buildbot-do-not-reply,9/7/05 7:07,2005-09-07 10:41:52 UTC,gerald
414,TShark,RESOLVED,DUPLICATE,crash on fuzzed KRB5 capture,9/7/05 11:07,Critical,4,Linux (other),wireshark-bugs,thomas.anders,9/7/05 10:44,2005-09-07 11:07:30 UTC,thomas.anders
415,Dissection engine (libwireshark),RESOLVED,FIXED,YMSG: 0-len packets shown unreassembled,1/27/15 0:12,Trivial,4,Linux (other),wireshark-bugs,jkohen,9/7/05 12:34,2005-12-20 11:18:14 UTC,guy
416,TShark,RESOLVED,DUPLICATE,Buildbot crash output: editcap.431f7430.pcap,9/8/05 8:20,Critical,2,FreeBSD,wireshark-bugs,buildbot-do-not-reply,9/7/05 18:13,2005-09-08 08:20:56 UTC,gerald
417,TShark,RESOLVED,FIXED,Buildbot crash output: editcap.431f8b79.pcap,9/8/05 7:42,Critical,2,FreeBSD,wireshark-bugs,buildbot-do-not-reply,9/7/05 19:53,2005-09-08 07:42:35 UTC,ronniesahlberg
418,TShark,RESOLVED,FIXED,Buildbot crash output: editcap.432019aa.pcap,9/8/05 7:43,Critical,2,FreeBSD,wireshark-bugs,buildbot-do-not-reply,9/8/05 5:59,2005-09-08 07:43:05 UTC,ronniesahlberg
419,TShark,RESOLVED,FIXED,Buildbot crash output: editcap.432030d6.pcap,9/8/05 7:43,Critical,2,FreeBSD,wireshark-bugs,buildbot-do-not-reply,9/8/05 7:38,2005-09-08 07:43:51 UTC,ronniesahlberg
420,GTK+ UI,RESOLVED,FIXED,"Err  Duplicate protocol name ""eXtensible Markup Language""!",10/30/05 8:04,Normal,4,Linux (other),wireshark-bugs,toralf.foerster,9/9/05 13:49,2005-10-30 08:04:42 UTC,ulf.lamping
421,TShark,RESOLVED,FIXED,fuzzed SMB capture causes tethereal to abort (memory allocation failed),9/21/05 16:50,Critical,4,Linux (other),wireshark-bugs,thomas.anders,9/9/05 17:30,2005-09-21 16:50:44 UTC,thomas.anders
422,GTK+ UI,RESOLVED,FIXED,"XML: [ Error: Unrecognized Text ] with valid RSS/XML ""file""",9/10/05 12:29,Normal,4,Windows XP,wireshark-bugs,ulf.lamping,9/10/05 10:56,2005-09-10 12:29:49 UTC,luis.ontanon
423,GTK+ UI,VERIFIED,FIXED,Capture Filter for host and TCP Port 80 does not work correctly,7/10/08 10:15,Normal,4,Windows XP,wireshark-bugs,reinhard.guelker,9/11/05 2:37,2005-09-12 05:58:07 UTC,bugzilla-admin
424,TShark,RESOLVED,DUPLICATE,Buildbot crash output: editcap.4324999f.pcap,9/12/05 21:47,Critical,2,FreeBSD,wireshark-bugs,buildbot-do-not-reply,9/11/05 15:54,2005-09-12 21:47:03 UTC,guy
425,TShark,RESOLVED,DUPLICATE,Buildbot crash output: editcap.4324b80f.pcap,9/12/05 21:46,Critical,2,FreeBSD,wireshark-bugs,buildbot-do-not-reply,9/11/05 18:04,2005-09-12 21:46:28 UTC,guy
426,TShark,RESOLVED,DUPLICATE,Buildbot crash output: editcap.4324d218.pcap,9/12/05 21:45,Critical,2,FreeBSD,wireshark-bugs,buildbot-do-not-reply,9/11/05 19:55,2005-09-12 21:45:58 UTC,guy
427,TShark,RESOLVED,FIXED,Buildbot crash output: editcap.4324ea9b.pcap,9/13/05 15:18,Critical,4,FreeBSD,wireshark-bugs,buildbot-do-not-reply,9/11/05 21:40,2005-09-13 15:14:27 UTC,gerald
428,TShark,RESOLVED,DUPLICATE,Buildbot crash output: editcap.4325397c.pcap,9/12/05 21:44,Critical,2,FreeBSD,wireshark-bugs,buildbot-do-not-reply,9/12/05 3:17,2005-09-12 21:44:38 UTC,guy
429,TShark,RESOLVED,DUPLICATE,Buildbot crash output: editcap.43255213.pcap,9/13/05 15:17,Critical,2,FreeBSD,wireshark-bugs,buildbot-do-not-reply,9/12/05 5:02,2005-09-13 15:17:16 UTC,gerald
430,TShark,RESOLVED,WORKSFORME,tethereal ignores 802.11 FCS  incorrectly tags packet malformed,7/10/08 10:15,Normal,5,Linux (other),wireshark-bugs,techie,9/12/05 6:27,2005-10-10 13:26:57 UTC,bugzilla-admin
431,GTK+ UI,RESOLVED,FIXED,Ethereal crashes when saving captured data,7/10/08 10:15,Normal,9,Windows 2000,wireshark-bugs,James.Conners,9/12/05 10:48,2005-12-19 13:40:17 UTC,bugzilla-admin
432,TShark,RESOLVED,DUPLICATE,Buildbot crash output: editcap.4325bf1c.pcap,9/12/05 21:43,Critical,2,FreeBSD,wireshark-bugs,buildbot-do-not-reply,9/12/05 12:47,2005-09-12 21:43:33 UTC,guy
433,TShark,RESOLVED,DUPLICATE,Buildbot crash output: editcap.4325f29a.pcap,9/12/05 21:42,Critical,2,FreeBSD,wireshark-bugs,buildbot-do-not-reply,9/12/05 16:26,2005-09-12 21:42:57 UTC,guy
434,TShark,RESOLVED,FIXED,Buildbot crash output: editcap.43260c71.pcap,9/12/05 21:47,Critical,8,FreeBSD,wireshark-bugs,buildbot-do-not-reply,9/12/05 18:17,2005-09-12 21:40:40 UTC,guy
435,TShark,RESOLVED,DUPLICATE,Buildbot crash output: editcap.43263afd.pcap,9/13/05 15:18,Critical,2,FreeBSD,wireshark-bugs,buildbot-do-not-reply,9/12/05 21:35,2005-09-13 15:18:18 UTC,gerald
436,GTK+ UI,RESOLVED,WORKSFORME,"""File -> Save As"" crashes Ethereal",7/10/08 10:15,Major,6,Windows XP,wireshark-bugs,pzafiris,9/13/05 5:55,2006-03-06 15:37:13 UTC,bugzilla-admin
437,GTK+ UI,RESOLVED,FIXED,Invalid ISUP Message Status Filter Crash,7/10/08 10:15,Minor,3,Windows XP,wireshark-bugs,nglass,9/14/05 12:18,2005-09-15 04:52:01 UTC,bugzilla-admin
438,GTK+ UI,RESOLVED,FIXED,0.0.12 Ethereal Radius Message did not parse 3GPP Vendor Attribute Correctly,7/10/08 10:15,Normal,5,Linux (other),luis.ontanon,weiqiang.wu,9/14/05 13:14,2005-09-19 12:43:30 UTC,bugzilla-admin
439,GTK+ UI,RESOLVED,FIXED,Exported PDML: Incomplete HTTP Packets Data,7/10/08 10:15,Major,10,Windows XP,wireshark-bugs,jonathan.carse,9/14/05 16:21,2006-04-21 10:11:19 UTC,bugzilla-admin
440,TShark,RESOLVED,FIXED,Buildbot crash output: editcap.432948c3.pcap,9/15/05 13:47,Critical,6,FreeBSD,wireshark-bugs,buildbot-do-not-reply,9/15/05 5:11,2005-09-15 13:42:56 UTC,gerald
441,GTK+ UI,RESOLVED,WORKSFORME,Colorizing does not work sometimes.,3/11/06 11:20,Normal,3,Mac OS X 10.3,wireshark-bugs,tuexen,9/15/05 5:30,2006-03-11 11:20:05 UTC,ulf.lamping
442,TShark,RESOLVED,DUPLICATE,Buildbot crash output: editcap.43295ba2.pcap,9/15/05 13:43,Critical,2,FreeBSD,wireshark-bugs,buildbot-do-not-reply,9/15/05 6:31,2005-09-15 13:43:27 UTC,gerald
443,GTK+ UI,VERIFIED,FIXED,M2PA decoding doesn't work on Solaris but works on Win,7/10/08 10:09,Normal,9,Solaris,wireshark-bugs,sseregin,9/15/05 7:30,2005-09-15 08:20:57 UTC,bugzilla-admin
444,TShark,RESOLVED,DUPLICATE,Buildbot crash output: editcap.43296e38.pcap,9/15/05 13:47,Critical,2,FreeBSD,wireshark-bugs,buildbot-do-not-reply,9/15/05 7:51,2005-09-15 13:47:35 UTC,gerald
445,TShark,RESOLVED,DUPLICATE,Buildbot crash output: editcap.4329905c.pcap,9/15/05 13:44,Critical,2,FreeBSD,wireshark-bugs,buildbot-do-not-reply,9/15/05 10:16,2005-09-15 13:44:20 UTC,gerald
446,TShark,RESOLVED,DUPLICATE,Buildbot crash output: editcap.4329a4ba.pcap,9/15/05 13:44,Critical,2,FreeBSD,wireshark-bugs,buildbot-do-not-reply,9/15/05 11:43,2005-09-15 13:44:30 UTC,gerald
447,TShark,VERIFIED,FIXED,semi-random FC packet causes tethereal to abort (memory allocation failed),9/16/05 5:16,Critical,4,Linux (other),wireshark-bugs,thomas.anders,9/15/05 15:28,2005-09-16 05:15:02 UTC,thomas.anders
448,TShark,RESOLVED,FIXED,Buildbot crash output: editcap.432a1cd6.pcap,9/19/05 16:28,Critical,9,FreeBSD,wireshark-bugs,buildbot-do-not-reply,9/15/05 20:16,2005-09-19 11:23:29 UTC,gerald
449,TShark,RESOLVED,DUPLICATE,Buildbot crash output: editcap.432a780a.pcap,9/19/05 11:23,Critical,2,FreeBSD,wireshark-bugs,buildbot-do-not-reply,9/16/05 2:45,2005-09-19 11:23:42 UTC,gerald
450,GTK+ UI,RESOLVED,FIXED,Date/Time stamp issue with Ethereal 0.10.12,7/10/08 10:15,Normal,4,Windows XP,wireshark-bugs,eric.walters,9/16/05 9:07,2006-01-12 21:51:55 UTC,bugzilla-admin
451,TShark,RESOLVED,DUPLICATE,Buildbot crash output: editcap.432ad328.pcap,9/19/05 11:23,Critical,2,FreeBSD,wireshark-bugs,buildbot-do-not-reply,9/16/05 9:14,2005-09-19 11:23:59 UTC,gerald
452,TShark,RESOLVED,DUPLICATE,Buildbot crash output: editcap.432b00a7.pcap,9/19/05 11:24,Critical,2,FreeBSD,wireshark-bugs,buildbot-do-not-reply,9/16/05 12:28,2005-09-19 11:24:12 UTC,gerald
453,TShark,RESOLVED,FIXED,Buildbot crash output: editcap.432b1548.pcap,9/19/05 12:50,Critical,2,FreeBSD,wireshark-bugs,buildbot-do-not-reply,9/16/05 13:56,2005-09-19 12:50:51 UTC,gerald
454,TShark,RESOLVED,DUPLICATE,Buildbot crash output: editcap.432b9ca9.pcap,9/19/05 11:24,Critical,2,FreeBSD,wireshark-bugs,buildbot-do-not-reply,9/16/05 23:33,2005-09-19 11:24:27 UTC,gerald
455,TShark,RESOLVED,FIXED,Buildbot crash output: editcap.432c41f8.pcap,9/19/05 15:51,Critical,2,FreeBSD,wireshark-bugs,buildbot-do-not-reply,9/17/05 11:19,2005-09-19 15:51:03 UTC,gerald
456,TShark,RESOLVED,DUPLICATE,Buildbot crash output: editcap.432ca841.pcap,9/19/05 11:24,Critical,2,FreeBSD,wireshark-bugs,buildbot-do-not-reply,9/17/05 18:35,2005-09-19 11:24:54 UTC,gerald
457,TShark,RESOLVED,FIXED,Buildbot crash output: editcap.432d04de.pcap,9/19/05 15:31,Critical,4,FreeBSD,wireshark-bugs,buildbot-do-not-reply,9/18/05 1:10,2005-09-19 15:31:24 UTC,gerald
458,TShark,RESOLVED,DUPLICATE,Buildbot crash output: editcap.432d8b4c.pcap,9/19/05 15:31,Critical,2,FreeBSD,wireshark-bugs,buildbot-do-not-reply,9/18/05 10:44,2005-09-19 15:31:41 UTC,gerald
459,TShark,RESOLVED,DUPLICATE,Buildbot crash output: editcap.432de7d2.pcap,9/19/05 15:31,Critical,2,FreeBSD,wireshark-bugs,buildbot-do-not-reply,9/18/05 17:18,2005-09-19 15:31:52 UTC,gerald
460,TShark,RESOLVED,FIXED,Buildbot crash output: editcap.432e6816.pcap,9/19/05 14:46,Critical,2,FreeBSD,wireshark-bugs,buildbot-do-not-reply,9/19/05 2:26,2005-09-19 14:46:49 UTC,gerald
461,TShark,RESOLVED,DUPLICATE,Buildbot crash output: editcap.432ec752.pcap,9/19/05 11:25,Critical,2,FreeBSD,wireshark-bugs,buildbot-do-not-reply,9/19/05 9:12,2005-09-19 11:25:31 UTC,gerald
462,TShark,RESOLVED,DUPLICATE,Buildbot crash output: editcap.432f2c04.pcap,9/19/05 16:28,Critical,2,FreeBSD,wireshark-bugs,buildbot-do-not-reply,9/19/05 16:22,2005-09-19 16:28:31 UTC,gerald
463,TShark,RESOLVED,FIXED,Buildbot crash output: editcap.432f7969.pcap,9/20/05 12:23,Critical,2,FreeBSD,wireshark-bugs,buildbot-do-not-reply,9/19/05 21:52,2005-09-20 12:23:33 UTC,gerald
464,GTK+ UI,RESOLVED,WORKSFORME,RCF 3057 IUA failure to decode MGMT message TEI Query Request,7/10/08 10:15,Trivial,7,Linux (other),wireshark-bugs,Richard.Carslake,9/20/05 4:22,2005-09-20 08:36:53 UTC,bugzilla-admin
465,GTK+ UI,RESOLVED,FIXED,Win32: command line errors not shown  as console is not open,9/21/05 15:30,Normal,2,Windows XP,ulf.lamping,ulf.lamping,9/21/05 10:00,2005-09-21 15:30:20 UTC,ulf.lamping
466,GTK+ UI,VERIFIED,FIXED,Win32: command line errors not shown  as console is not open,9/21/05 10:14,Normal,2,Windows XP,ulf.lamping,ulf.lamping,9/21/05 10:12,2005-09-21 10:13:41 UTC,ulf.lamping
467,GTK+ UI,RESOLVED,FIXED,Win32: command line option -k (without -i) doesn't work,9/21/05 15:35,Normal,2,Windows XP,ulf.lamping,ulf.lamping,9/21/05 10:23,2005-09-21 15:35:13 UTC,ulf.lamping
468,TShark,RESOLVED,FIXED,Buildbot crash output: editcap.43318500.pcap,9/21/05 12:48,Critical,3,FreeBSD,wireshark-bugs,buildbot-do-not-reply,9/21/05 11:06,2005-09-21 11:19:21 UTC,gerald
469,TShark,RESOLVED,DUPLICATE,Buildbot crash output: editcap.4331970a.pcap,9/21/05 12:48,Critical,2,FreeBSD,wireshark-bugs,buildbot-do-not-reply,9/21/05 12:23,2005-09-21 12:48:58 UTC,gerald
470,TShark,RESOLVED,FIXED,Buildbot crash output: editcap.4331ae7a.pcap,9/21/05 18:08,Critical,2,FreeBSD,wireshark-bugs,buildbot-do-not-reply,9/21/05 14:03,2005-09-21 18:08:09 UTC,guy
471,GTK+ UI,RESOLVED,DUPLICATE,fuzzed SMB capture crashes [t]ethereal,9/21/05 18:25,Critical,3,Linux (other),wireshark-bugs,thomas.anders,9/21/05 16:47,2005-09-21 18:25:50 UTC,guy
472,TShark,RESOLVED,FIXED,Buildbot crash output: editcap.4331dd15.pcap,9/22/05 3:01,Critical,4,FreeBSD,wireshark-bugs,buildbot-do-not-reply,9/21/05 17:22,2005-09-21 18:24:34 UTC,guy
473,TShark,RESOLVED,DUPLICATE,Buildbot crash output: editcap.433239d5.pcap,9/22/05 3:01,Critical,2,FreeBSD,wireshark-bugs,buildbot-do-not-reply,9/21/05 23:58,2005-09-22 03:01:47 UTC,guy
474,GTK+ UI,RESOLVED,FIXED,Stats tree code can't handle more than one higher-level packet in the same link-layer packet,9/22/05 12:01,Normal,7,All,luis.ontanon,guy,9/22/05 3:31,2005-09-22 11:55:26 UTC,luis.ontanon
475,GTK+ UI,RESOLVED,FIXED,Add Buffer Size to Capture Preferences window,5/10/10 15:03,Enhancement,15,All,wireshark-bugs,olafvdspek,9/22/05 5:42,2010-05-10 15:03:50 UTC,jeff.morriss.ws
476,GTK+ UI,RESOLVED,FIXED,[PATCH] parsing of 802.11 Qos data broken,12/16/05 16:44,Normal,3,Linux (other),wireshark-bugs,rvokal,9/23/05 3:33,2005-12-16 16:44:07 UTC,jaap.keuter
477,GTK+ UI,RESOLVED,WORKSFORME,Can only print once during Ethereal 'session',7/10/08 10:15,Normal,5,Windows 2000,wireshark-bugs,olafvdspek,9/23/05 4:57,2006-03-14 17:53:59 UTC,bugzilla-admin
478,GTK+ UI,RESOLVED,FIXED,Segmentation fault in ep_strndup(),7/10/08 10:15,Blocker,10,FreeBSD,luis.ontanon,jb.quenot,9/23/05 8:57,2005-10-12 13:19:02 UTC,bugzilla-admin
479,TShark,RESOLVED,FIXED,Buildbot crash output: editcap.433461d7.pcap,9/23/05 15:52,Critical,2,FreeBSD,wireshark-bugs,buildbot-do-not-reply,9/23/05 15:13,2005-09-23 15:52:37 UTC,ronniesahlberg
480,GTK+ UI,RESOLVED,FIXED,Change defaults for all reassembling settings to ON,9/28/05 17:16,Enhancement,2,All,ulf.lamping,ulf.lamping,9/24/05 12:54,2005-09-28 17:16:50 UTC,ulf.lamping
481,GTK+ UI,RESOLVED,WORKSFORME,CPU performance pegs near 100% for v 0.10.12 but 0.10.11 ok,10/26/08 9:38,Critical,17,Windows XP,wireshark-bugs,wireshark,9/24/05 15:01,2008-10-26 09:38:43 UTC,sake
482,TShark,RESOLVED,FIXED,Buildbot crash output: editcap.43360222.pcap,9/25/05 5:05,Critical,3,FreeBSD,wireshark-bugs,buildbot-do-not-reply,9/24/05 20:49,2005-09-24 21:58:18 UTC,luis.ontanon
483,TShark,RESOLVED,DUPLICATE,Buildbot crash output: editcap.43362eae.pcap,9/25/05 5:05,Critical,2,FreeBSD,wireshark-bugs,buildbot-do-not-reply,9/24/05 23:59,2005-09-25 05:05:29 UTC,luis.ontanon
484,GTK+ UI,RESOLVED,NOTOURBUG,"no packet in window ""Packet List' but in ""Packet Detail"" and in ""Pa cket Bytes""",11/1/06 16:11,Minor,5,Linux (other),wireshark-bugs,toralf.foerster,9/25/05 9:23,2006-11-01 16:11:09 UTC,toralf.foerster
485,TShark,RESOLVED,FIXED,Buildbot crash output: editcap.43386794.pcap,9/26/05 19:04,Critical,2,FreeBSD,wireshark-bugs,buildbot-do-not-reply,9/26/05 16:26,2005-09-26 19:04:19 UTC,guy
486,GTK+ UI,RESOLVED,WORKSFORME,Memory leak in 0.10.12,7/10/08 10:15,Normal,9,Windows 2000,wireshark-bugs,tomroholm,9/27/05 3:28,2006-08-04 10:12:15 UTC,bugzilla-admin
487,GTK+ UI,RESOLVED,FIXED,fail to decode h323 optional field for h450.7,7/10/08 10:15,Normal,7,Linux (other),wireshark-bugs,frederic.heem,9/27/05 4:42,2005-11-11 07:53:19 UTC,bugzilla-admin
488,TShark,RESOLVED,FIXED,Buildbot crash output: editcap.433a202e.pcap,10/1/05 6:17,Critical,4,FreeBSD,luis.ontanon,buildbot-do-not-reply,9/27/05 23:46,2005-10-01 06:17:37 UTC,luis.ontanon
489,TShark,RESOLVED,FIXED,Buildbot crash output: editcap.433a4ec2.pcap,9/28/05 4:31,Critical,2,FreeBSD,wireshark-bugs,buildbot-do-not-reply,9/28/05 3:05,2005-09-28 04:31:58 UTC,guy
490,GTK+ UI,RESOLVED,FIXED,"option ""-w savefile"" not working  ""-a filesize"" not working properly",7/10/08 10:15,Normal,6,Linux (other),ulf.lamping,will.cai,9/28/05 20:08,2005-10-30 08:14:37 UTC,bugzilla-admin
491,GTK+ UI,RESOLVED,FIXED,Unexpected frame.time_delta behavior,7/17/07 18:32,Minor,7,All,wireshark-bugs,gerald,9/29/05 15:11,2007-03-23 18:10:42 UTC,guy
492,GTK+ UI,RESOLVED,DUPLICATE,When decoding a WSP packet a failed assertion is reported.,7/10/08 10:15,Normal,4,Windows 2000,wireshark-bugs,simon.callan,9/30/05 6:01,2005-09-30 14:33:23 UTC,bugzilla-admin
493,GTK+ UI,RESOLVED,DUPLICATE,Scroll Bars not visible,7/10/08 10:15,Normal,4,Windows XP,wireshark-bugs,laarijo,10/1/05 4:44,2005-10-01 05:29:43 UTC,bugzilla-admin
494,TShark,RESOLVED,LATER,partial load of radius dictionary  on errors,1/22/11 3:40,Minor,8,All,luis.ontanon,luis.ontanon,10/1/05 6:21,2011-01-22 03:40:36 UTC,sake
495,GTK+ UI,RESOLVED,FIXED,RTSE packet dissector failed to compile,10/3/05 8:13,Normal,3,All,wireshark-bugs,peter.kovar,10/3/05 8:01,2005-10-03 08:13:11 UTC,luis.ontanon
496,GTK+ UI,RESOLVED,FIXED,Win32: passing %I64 to g_s... functions crash Ethereal,3/14/06 18:02,Critical,2,Windows XP,wireshark-bugs,ulf.lamping,10/3/05 10:01,2006-03-14 18:02:57 UTC,ulf.lamping
497,GTK+ UI,RESOLVED,FIXED,crash on fuzzed IAX2 packet,10/3/05 20:17,Critical,3,Linux (other),wireshark-bugs,thomas.anders,10/3/05 16:31,2005-10-03 20:17:20 UTC,guy
498,TShark,RESOLVED,FIXED,Buildbot crash output: editcap.43420af2.pcap,10/4/05 9:43,Critical,2,FreeBSD,wireshark-bugs,buildbot-do-not-reply,10/3/05 23:54,2005-10-04 09:43:17 UTC,ronniesahlberg
499,GTK+ UI,RESOLVED,FIXED,File->Open Recent: bad file list with non-ASCII names,7/10/08 10:15,Normal,7,Windows 2000,wireshark-bugs,igtorque,10/4/05 3:30,2005-12-19 01:54:24 UTC,bugzilla-admin
500,TShark,RESOLVED,FIXED,Buildbot crash output: editcap.43423e7b.pcap,10/4/05 9:47,Critical,2,FreeBSD,wireshark-bugs,buildbot-do-not-reply,10/4/05 3:34,2005-10-04 09:47:15 UTC,ronniesahlberg
501,TShark,RESOLVED,FIXED,Buildbot crash output: editcap.4342739a.pcap,10/4/05 9:44,Critical,2,FreeBSD,wireshark-bugs,buildbot-do-not-reply,10/4/05 7:20,2005-10-04 09:44:15 UTC,ronniesahlberg
502,GTK+ UI,RESOLVED,DUPLICATE,Ethereal crashes on fuzzed COPS capture,10/6/05 9:15,Blocker,4,Linux (other),wireshark-bugs,gerald,10/5/05 9:43,2005-10-06 09:15:31 UTC,gerald
503,TShark,RESOLVED,FIXED,Buildbot crash output: editcap.43443c54.pcap,10/6/05 9:15,Critical,3,FreeBSD,wireshark-bugs,buildbot-do-not-reply,10/5/05 15:49,2005-10-05 16:42:07 UTC,gerald
504,TShark,RESOLVED,FIXED,Valgrind errors from XML dissector and DTD-reading code,3/11/06 11:35,Normal,6,Linux (other),wireshark-bugs,guy,10/6/05 14:06,2006-03-11 11:35:00 UTC,luis.ontanon
505,TShark,RESOLVED,FIXED,Valgrind errors from COPS dissector and net-snmp,1/11/07 21:02,Critical,5,Linux (other),wireshark-bugs,guy,10/6/05 14:09,2007-01-11 21:02:00 UTC,jaap.keuter
506,GTK+ UI,RESOLVED,FIXED,ethereal crashes when parsing EAP packets,10/10/05 3:29,Major,8,Linux (other),wireshark-bugs,pp,10/6/05 14:40,2005-10-10 03:29:21 UTC,guy
507,GTK+ UI,VERIFIED,FIXED,ranap bugs,7/10/08 10:15,Minor,2,Windows XP,wireshark-bugs,palos,10/7/05 1:25,2005-10-07 01:27:30 UTC,bugzilla-admin
508,TShark,RESOLVED,FIXED,Assertion failure in H.223 dissector,10/10/05 2:26,Major,6,All,wireshark-bugs,guy,10/7/05 2:47,2005-10-10 02:25:14 UTC,guy
509,TShark,RESOLVED,DUPLICATE,Buildbot crash output: editcap.43464f60.pcap,10/10/05 2:25,Critical,2,FreeBSD,wireshark-bugs,buildbot-do-not-reply,10/7/05 5:35,2005-10-10 02:25:30 UTC,guy
510,TShark,RESOLVED,DUPLICATE,Buildbot crash output: editcap.43467894.pcap,10/10/05 2:25,Critical,2,FreeBSD,wireshark-bugs,buildbot-do-not-reply,10/7/05 8:31,2005-10-10 02:25:46 UTC,guy
511,Documentation,RESOLVED,FIXED,There's no emem documentation whatsoever,12/21/05 3:24,Minor,3,All,wireshark-bugs,luis.ontanon,10/7/05 10:05,2005-12-21 03:24:30 UTC,ronniesahlberg
512,GTK+ UI,RESOLVED,FIXED,Gtk-ERROR **: file gtktextbtree.c: line 1883: assertion failed,7/10/08 10:15,Critical,5,Solaris,wireshark-bugs,william.fiveash,10/7/05 11:23,2005-10-12 02:11:50 UTC,bugzilla-admin
513,GTK+ UI,RESOLVED,FIXED,ISAKMP Vendor ID for RFC 3947,7/10/08 10:15,Enhancement,10,other,wireshark-bugs,kenny,10/7/05 18:18,2005-12-22 15:32:28 UTC,bugzilla-admin
514,TShark,RESOLVED,DUPLICATE,Buildbot crash output: editcap.43471003.pcap,10/10/05 2:26,Critical,2,FreeBSD,wireshark-bugs,buildbot-do-not-reply,10/7/05 19:17,2005-10-10 02:26:39 UTC,guy
515,TShark,RESOLVED,FIXED,Buildbot crash output: editcap.4347899f.pcap,10/11/05 23:11,Critical,13,FreeBSD,bugzilla,buildbot-do-not-reply,10/8/05 3:56,2005-10-11 23:08:23 UTC,guy
516,TShark,RESOLVED,DUPLICATE,Buildbot crash output: editcap.4348030a.pcap,10/11/05 5:16,Critical,2,FreeBSD,wireshark-bugs,buildbot-do-not-reply,10/8/05 12:34,2005-10-11 05:16:24 UTC,bugzilla
517,TShark,RESOLVED,DUPLICATE,Buildbot crash output: editcap.43487c8d.pcap,10/11/05 5:16,Critical,2,FreeBSD,wireshark-bugs,buildbot-do-not-reply,10/8/05 21:12,2005-10-11 05:16:44 UTC,bugzilla
518,TShark,RESOLVED,DUPLICATE,Buildbot crash output: editcap.4348f64e.pcap,10/11/05 5:17,Critical,2,FreeBSD,wireshark-bugs,buildbot-do-not-reply,10/9/05 5:52,2005-10-11 05:17:24 UTC,bugzilla
519,TShark,RESOLVED,DUPLICATE,Buildbot crash output: editcap.43497012.pcap,10/11/05 5:17,Critical,2,FreeBSD,wireshark-bugs,buildbot-do-not-reply,10/9/05 14:31,2005-10-11 05:17:55 UTC,bugzilla
520,GTK+ UI,RESOLVED,WORKSFORME,"Decoding of BACnet-Service ""SubscribeCOV"" apdu is wrong",7/10/08 10:15,Normal,5,Windows XP,wireshark-bugs,bernd.timmermann,10/10/05 5:01,2005-12-13 01:11:13 UTC,bugzilla-admin
521,GTK+ UI,RESOLVED,FIXED,spurious  [TCP Window Full],1/26/06 17:10,Normal,2,Linux (other),wireshark-bugs,dgautheron,10/10/05 9:50,2006-01-26 17:10:39 UTC,ronniesahlberg
522,TShark,RESOLVED,DUPLICATE,Buildbot crash output: editcap.434aa010.pcap,10/11/05 5:18,Critical,2,FreeBSD,wireshark-bugs,buildbot-do-not-reply,10/10/05 12:08,2005-10-11 05:18:32 UTC,bugzilla
523,GTK+ UI,RESOLVED,FIXED,inet_aton and gethostbyname problems under Windows,1/19/06 17:02,Major,3,Windows XP,wireshark-bugs,gerald,10/10/05 16:01,2006-01-19 17:02:41 UTC,gerald
524,TShark,RESOLVED,DUPLICATE,Buildbot crash output: editcap.434b19ec.pcap,10/11/05 5:18,Critical,2,FreeBSD,wireshark-bugs,buildbot-do-not-reply,10/10/05 20:48,2005-10-11 05:18:59 UTC,bugzilla
525,TShark,RESOLVED,DUPLICATE,Buildbot crash output: editcap.434b942a.pcap,10/11/05 6:42,Critical,2,FreeBSD,wireshark-bugs,buildbot-do-not-reply,10/11/05 5:30,2005-10-11 06:42:48 UTC,bugzilla
526,TShark,RESOLVED,DUPLICATE,Buildbot crash output: editcap.434c0dee.pcap,10/11/05 23:10,Critical,2,FreeBSD,wireshark-bugs,buildbot-do-not-reply,10/11/05 14:09,2005-10-11 23:10:19 UTC,guy
527,TShark,RESOLVED,DUPLICATE,Buildbot crash output: editcap.434c8846.pcap,10/11/05 23:11,Critical,2,FreeBSD,wireshark-bugs,buildbot-do-not-reply,10/11/05 22:51,2005-10-11 23:11:40 UTC,guy
528,GTK+ UI,RESOLVED,NOTOURBUG,link build step is not including epan/dissectors/.libs/libdissectors.a,11/12/07 18:26,Normal,7,Solaris,wireshark-bugs,william.fiveash,10/12/05 15:11,2007-11-12 18:26:33 UTC,stephenfisher
529,TShark,RESOLVED,FIXED,Buildbot crash output: editcap.434d6f3a.pcap,10/12/05 20:47,Critical,2,FreeBSD,wireshark-bugs,buildbot-do-not-reply,10/12/05 15:17,2005-10-12 20:47:13 UTC,ronniesahlberg
530,GTK+ UI,RESOLVED,NOTOURBUG,Ethereal detects Linksys WUSB54 wireless network adapter as Ralink Tech Inc  and fails to capture network packets,7/10/08 10:14,Blocker,7,Windows XP,wireshark-bugs,rctablada,10/12/05 23:25,2005-10-13 02:20:54 UTC,bugzilla-admin
532,TShark,RESOLVED,FIXED,wiretap's K12 module fails to open legitimate .fr5 file created with k15,3/17/07 14:57,Normal,3,All,luis.ontanon,luis.ontanon,10/14/05 8:39,2007-03-17 14:57:23 UTC,luis.ontanon
533,TShark,RESOLVED,FIXED,MATE crashes when an Export statement contains an unexistent field.,12/11/05 19:33,Normal,2,All,luis.ontanon,luis.ontanon,10/14/05 8:41,2005-12-11 19:33:43 UTC,luis.ontanon
534,TShark,RESOLVED,FIXED,wrong timestamps in some .rf5 files generated with a k15,10/24/05 16:57,Normal,3,All,luis.ontanon,luis.ontanon,10/14/05 8:44,2005-10-24 16:57:31 UTC,luis.ontanon
535,TShark,RESOLVED,FIXED,Buildbot crash output: editcap.435239dc.pcap,10/16/05 15:58,Critical,2,FreeBSD,wireshark-bugs,buildbot-do-not-reply,10/16/05 6:30,2005-10-16 15:58:49 UTC,gerald
536,GTK+ UI,RESOLVED,FIXED,Random crash in packet-dcerpc-nt.c,10/20/05 8:02,Blocker,5,Windows XP,wireshark-bugs,Greg.Morris,10/17/05 6:52,2005-10-20 08:02:39 UTC,Greg.Morris
537,TShark,RESOLVED,FIXED,Buildbot crash output: editcap.4353faca.pcap,10/17/05 15:33,Blocker,3,FreeBSD,wireshark-bugs,buildbot-do-not-reply,10/17/05 14:26,2005-10-17 15:33:33 UTC,gerald
538,GTK+ UI,RESOLVED,NOTABUG,Filtering a specific IP Address under one Network,10/17/05 22:49,Trivial,2,Windows XP,wireshark-bugs,shihboy,10/17/05 22:06,2005-10-17 22:49:45 UTC,guy
539,TShark,RESOLVED,WORKSFORME,Tethereal -z funcion not work,8/20/08 7:29,Normal,7,Solaris,wireshark-bugs,chi_keung_wong,10/17/05 23:32,2008-08-20 07:29:52 UTC,sake
540,TShark,RESOLVED,FIXED,Buildbot crash output: editcap.4354e421.pcap,10/18/05 8:36,Critical,2,FreeBSD,wireshark-bugs,buildbot-do-not-reply,10/18/05 7:01,2005-10-18 08:36:50 UTC,gerald
542,TShark,RESOLVED,FIXED,Buildbot crash output: editcap.4355cf7d.pcap,10/19/05 10:37,Critical,2,FreeBSD,wireshark-bugs,buildbot-do-not-reply,10/18/05 23:45,2005-10-19 10:37:15 UTC,gerald
545,GTK+ UI,RESOLVED,FIXED,Memory reference error.,9/30/08 0:44,Normal,13,Windows XP,wireshark-bugs,thegeekster,10/20/05 16:34,2008-09-30 00:44:31 UTC,anders.broman
547,GTK+ UI,RESOLVED,FIXED,decode of radius  packetcable VSAs not working anymore,7/10/08 10:15,Major,8,Windows XP,luis.ontanon,jim_pilium,10/22/05 4:53,2006-08-01 14:08:04 UTC,bugzilla-admin
548,TShark,RESOLVED,FIXED,Buildbot crash output: editcap.435c1eab.pcap,10/23/05 21:36,Critical,2,FreeBSD,wireshark-bugs,buildbot-do-not-reply,10/23/05 18:37,2005-10-23 21:36:13 UTC,guy
549,TShark,RESOLVED,FIXED,Buildbot crash output: editcap.435cafa5.pcap,10/24/05 23:21,Critical,2,FreeBSD,wireshark-bugs,buildbot-do-not-reply,10/24/05 4:55,2005-10-24 23:21:58 UTC,guy
550,TShark,RESOLVED,FIXED,k12 does not dup VP/VC/CID data into packet record,3/9/07 1:28,Minor,2,All,luis.ontanon,luis.ontanon,10/24/05 17:07,2007-03-09 01:28:09 UTC,luis.ontanon
551,GTK+ UI,RESOLVED,FIXED,SS7  ISUP  IAM-signal  malformed packet (not),7/10/08 10:16,Normal,8,Windows XP,wireshark-bugs,kenneth.pettersson,10/25/05 3:46,2005-11-30 02:22:28 UTC,bugzilla-admin
552,GTK+ UI,RESOLVED,FIXED,Problems with display filters,7/10/08 10:16,Normal,7,Windows XP,wireshark-bugs,claude.lavanchy,10/25/05 4:09,2007-03-11 06:17:52 UTC,bugzilla-admin
553,GTK+ UI,RESOLVED,FIXED,Menu and Title bars inaccessible using GTK2 (non-legacy) with two monitors,10/8/12 8:54,Normal,58,Windows XP,wireshark-bugs,kproth,10/25/05 9:42,2012-10-07 09:53:56 UTC,Christopher.Maynard
554,GTK+ UI,RESOLVED,FIXED,ETSI codec dissection error in BICC,7/10/08 10:16,Minor,4,Windows XP,wireshark-bugs,palos,10/25/05 21:46,2005-11-11 16:09:25 UTC,bugzilla-admin
555,GTK+ UI,RESOLVED,DUPLICATE,File open/save dialogs lack support for UNC paths,7/10/08 10:16,Enhancement,4,Windows XP,wireshark-bugs,m-starostik,10/25/05 21:53,2005-10-26 14:20:52 UTC,bugzilla-admin
557,GTK+ UI,RESOLVED,DUPLICATE,URR REGISTER ACCEPT  is decoded incorrectly,7/10/08 10:16,Normal,3,Windows XP,wireshark-bugs,peregodia,10/26/05 7:04,2005-10-26 07:10:57 UTC,bugzilla-admin
558,GTK+ UI,RESOLVED,FIXED,URR REGISTER ACCEPT  is decoded incorrectly,7/10/08 10:16,Normal,5,Windows XP,wireshark-bugs,peregodia,10/26/05 7:10,2005-11-11 07:49:18 UTC,bugzilla-admin
559,TShark,RESOLVED,NOTABUG,Command line not parsed proper;y,7/10/08 10:12,Normal,3,FreeBSD,wireshark-bugs,asimex,10/26/05 8:35,2005-10-26 11:45:24 UTC,bugzilla-admin
560,TShark,RESOLVED,FIXED,Buildbot crash output: editcap.43618bc1.pcap,10/28/05 10:08,Critical,2,FreeBSD,wireshark-bugs,buildbot-do-not-reply,10/27/05 21:24,2005-10-28 10:08:32 UTC,gerald
561,GTK+ UI,RESOLVED,NOTABUG,cannot sniff ipsec nat-t traffic,7/10/08 10:16,Normal,5,Windows XP,wireshark-bugs,fuko135,10/28/05 4:03,2005-11-02 01:53:13 UTC,bugzilla-admin
562,GTK+ UI,RESOLVED,WORKSFORME,"Display filter crashes when using ""matches"" keyword",7/10/08 10:16,Critical,3,Linux (other),wireshark-bugs,cjorsinger,10/28/05 13:35,2005-10-28 13:55:03 UTC,bugzilla-admin
563,GTK+ UI,RESOLVED,FIXED,crash on low monitor resolution,7/10/08 10:16,Normal,4,Windows XP,wireshark-bugs,esli,10/28/05 17:10,2005-11-11 16:10:26 UTC,bugzilla-admin
564,GTK+ UI,RESOLVED,FIXED,Error message HTML formatting bug when displaying &&,7/10/08 10:16,Minor,4,All,wireshark-bugs,spamgohere,10/30/05 13:35,2005-10-30 14:18:23 UTC,bugzilla-admin
565,GTK+ UI,RESOLVED,FIXED,copy causes crashes ?,7/10/08 10:16,Major,6,Windows XP,wireshark-bugs,ethereal,10/30/05 14:13,2006-01-21 16:57:33 UTC,bugzilla-admin
566,GTK+ UI,RESOLVED,FIXED,H.263: in display filters  ftype bit masked by sbit,7/10/08 10:16,Trivial,4,All,wireshark-bugs,clepple,10/31/05 13:15,2005-11-13 14:54:01 UTC,bugzilla-admin
567,GTK+ UI,RESOLVED,DUPLICATE,Cancelling Statistics -> IP Address dialog doesn't give focus back to Ethereal,11/1/05 4:05,Minor,4,Windows XP,wireshark-bugs,ethereal,10/31/05 14:16,2005-11-01 03:09:43 UTC,ulf.lamping
568,GTK+ UI,RESOLVED,FIXED,Windows XP -> Save As with Packet Range Crashes on hitting Enter,7/10/08 10:16,Normal,3,Windows XP,wireshark-bugs,jonathan.glass,11/2/05 15:06,2005-11-26 06:04:04 UTC,bugzilla-admin
569,GTK+ UI,RESOLVED,FIXED,File->Open and File->Save File Browser Dialog takes 15 minutes to appear,4/14/06 1:49,Normal,8,Windows XP,wireshark-bugs,jukn-skh8,11/2/05 21:19,2006-04-14 01:49:47 UTC,ulf.lamping
570,GTK+ UI,RESOLVED,FIXED,SMB: SessionSetupAndX field not recognized (only as extra byte parameters),7/10/08 10:15,Minor,6,Linux (other),wireshark-bugs,bihrm,11/3/05 4:17,2005-11-19 04:27:50 UTC,bugzilla-admin
571,GTK+ UI,RESOLVED,NOTABUG,HTTP Decoding,7/10/08 10:16,Normal,6,Windows XP,wireshark-bugs,stephane.grosjean,11/3/05 14:13,2005-11-04 15:48:19 UTC,bugzilla-admin
572,TShark,RESOLVED,FIXED,Buildbot crash output: editcap.436b1c6a.pcap,12/6/05 12:54,Critical,5,FreeBSD,luis.ontanon,buildbot-do-not-reply,11/4/05 2:31,2005-12-06 12:54:49 UTC,luis.ontanon
574,GTK+ UI,RESOLVED,NOTOURBUG,wtp+wsp over eth0,11/4/05 15:04,Minor,3,Linux (other),wireshark-bugs,toralf.foerster,11/4/05 11:48,2005-11-04 15:04:32 UTC,ethereal
575,TShark,RESOLVED,FIXED,Buildbot crash output: editcap.436e1b0c.pcap,11/7/05 15:54,Critical,2,FreeBSD,wireshark-bugs,buildbot-do-not-reply,11/6/05 9:02,2005-11-07 15:54:49 UTC,gerald
576,TShark,RESOLVED,FIXED,Buildbot crash output: editcap.436f6af2.pcap,11/8/05 9:25,Critical,2,FreeBSD,wireshark-bugs,buildbot-do-not-reply,11/7/05 8:55,2005-11-08 09:25:52 UTC,gerald
577,GTK+ UI,RESOLVED,FIXED,Typo in GTP packet dissector,11/8/05 9:28,Trivial,3,All,wireshark-bugs,peter.kovar,11/8/05 2:16,2005-11-08 09:28:34 UTC,gerald
578,GTK+ UI,RESOLVED,REMIND,Add functionality to assign friendly name to source and destination addresses,7/10/08 10:16,Enhancement,7,Windows XP,wireshark-bugs,johngil1,11/9/05 8:20,2005-12-16 10:10:42 UTC,bugzilla-admin
579,GTK+ UI,RESOLVED,FIXED,DNP3 Control Codes Reversed,7/10/08 10:16,Minor,3,Windows XP,wireshark-bugs,keith.kantola,11/9/05 11:56,2005-12-13 00:37:30 UTC,bugzilla-admin
580,GTK+ UI,RESOLVED,FIXED,"Error ""Arg list too long"" when saving trace file > 2GB",4/10/11 14:11,Normal,16,Windows XP,wireshark-bugs,gtamisier,11/9/05 12:23,2011-04-10 14:11:29 UTC,guy
581,TShark,RESOLVED,FIXED,Buildbot crash output: editcap.43744a36.pcap,11/19/05 20:58,Critical,3,FreeBSD,ronniesahlberg,buildbot-do-not-reply,11/11/05 1:37,2005-11-19 20:58:53 UTC,ronniesahlberg
582,TShark,RESOLVED,FIXED,Buildbot crash output: editcap.4374a26c.pcap,11/25/05 19:59,Critical,2,FreeBSD,wireshark-bugs,buildbot-do-not-reply,11/11/05 7:53,2005-11-25 19:59:25 UTC,ronniesahlberg
583,GTK+ UI,RESOLVED,FIXED,SIP continuation packets don't show message body,7/10/08 10:16,Normal,4,Windows 2000,wireshark-bugs,akhedr,11/11/05 11:41,2005-11-14 08:28:48 UTC,bugzilla-admin
584,GTK+ UI,RESOLVED,FIXED,SVN's - Capturing does NOT start at all,7/10/08 10:16,Major,4,Windows 2000,wireshark-bugs,akhedr,11/14/05 11:56,2005-11-16 15:59:11 UTC,bugzilla-admin
585,TShark,RESOLVED,FIXED,NCP: Buildbot crash output: editcap.437dbf13.pcap,12/13/05 11:00,Critical,3,FreeBSD,wireshark-bugs,buildbot-do-not-reply,11/18/05 5:46,2005-12-13 11:00:40 UTC,gerald
586,TShark,RESOLVED,FIXED,Buildbot crash output: editcap.437e6b5f.pcap,11/19/05 4:08,Critical,2,FreeBSD,wireshark-bugs,buildbot-do-not-reply,11/18/05 18:01,2005-11-19 04:08:44 UTC,ronniesahlberg
587,TShark,RESOLVED,FIXED,Buildbot crash output: editcap.437ea99b.pcap,11/19/05 4:07,Critical,2,FreeBSD,wireshark-bugs,buildbot-do-not-reply,11/18/05 22:27,2005-11-19 04:07:03 UTC,ronniesahlberg
588,TShark,RESOLVED,FIXED,Buildbot crash output: editcap.437ec57f.pcap,11/19/05 4:04,Critical,2,FreeBSD,wireshark-bugs,buildbot-do-not-reply,11/19/05 0:26,2005-11-19 04:04:39 UTC,ronniesahlberg
589,TShark,RESOLVED,FIXED,Buildbot crash output: editcap.437f4b84.pcap,11/20/05 3:19,Critical,4,FreeBSD,wireshark-bugs,buildbot-do-not-reply,11/19/05 9:58,2005-11-19 20:52:57 UTC,ronniesahlberg
590,TShark,RESOLVED,FIXED,Buildbot crash output: editcap.437fbc98.pcap,11/19/05 20:51,Critical,2,FreeBSD,wireshark-bugs,buildbot-do-not-reply,11/19/05 18:00,2005-11-19 20:51:06 UTC,ronniesahlberg
591,TShark,RESOLVED,DUPLICATE,Buildbot crash output: editcap.43802d62.pcap,11/20/05 3:19,Critical,2,FreeBSD,wireshark-bugs,buildbot-do-not-reply,11/20/05 2:01,2005-11-20 03:19:50 UTC,guy
592,GTK+ UI,RESOLVED,FIXED,"""Follow TCP Stream"" (silently) fails to show a connection's conversation correctly (capture attached)",7/10/08 10:16,Normal,13,Linux (other),wireshark-bugs,s,11/20/05 9:57,2007-12-15 23:26:38 UTC,bugzilla-admin
594,GTK+ UI,RESOLVED,FIXED,use port names instead of port numbers in filter expressions,6/10/15 14:52,Enhancement,12,Linux (other),wireshark-bugs,toralf.foerster,11/27/05 4:04,2015-06-10 14:52:28 UTC,gerrit-do-not-reply
595,GTK+ UI,RESOLVED,FIXED,ICMP Unreachable TCP payload not completely parsed,7/10/08 10:16,Normal,7,All,wireshark-bugs,mikko.rantanen,11/28/05 15:14,2006-12-16 15:19:55 UTC,bugzilla-admin
596,GTK+ UI,RESOLVED,FIXED,LLDP TIA  Network Policy Decode is not correct,7/10/08 10:16,Normal,5,Windows XP,wireshark-bugs,echaudron,11/30/05 8:22,2005-12-16 10:37:58 UTC,bugzilla-admin
597,GTK+ UI,RESOLVED,FIXED,Ethereal crashes when using Decode As ... for UCP,7/10/08 10:16,Critical,7,Windows XP,wireshark-bugs,glm_mbx-usr,11/30/05 11:13,2006-04-08 08:05:26 UTC,bugzilla-admin
598,GTK+ UI,RESOLVED,FIXED,Follow TCP Stream window replaces: \r\n -> \r\r\n,7/10/08 10:16,Normal,6,Windows XP,wireshark-bugs,olafvdspek,11/30/05 16:16,2007-03-30 00:25:39 UTC,bugzilla-admin
599,GTK+ UI,RESOLVED,NOTABUG,Negative relative time.,7/10/08 10:16,Minor,3,Windows XP,wireshark-bugs,jona_pel,12/1/05 11:11,2005-12-01 13:32:00 UTC,bugzilla-admin
600,TShark,RESOLVED,DUPLICATE,Buildbot crash output: editcap.43952da3.pcap,12/6/05 19:47,Critical,3,FreeBSD,wireshark-bugs,buildbot-do-not-reply,12/6/05 0:20,2005-12-06 19:47:17 UTC,guy
601,TShark,RESOLVED,DUPLICATE,Buildbot crash output: editcap.4395460c.pcap,12/6/05 6:02,Critical,2,FreeBSD,wireshark-bugs,buildbot-do-not-reply,12/6/05 2:04,2005-12-06 06:02:38 UTC,luis.ontanon
602,TShark,RESOLVED,DUPLICATE,Buildbot crash output: editcap.43959172.pcap,12/6/05 19:35,Critical,3,FreeBSD,wireshark-bugs,buildbot-do-not-reply,12/6/05 7:26,2005-12-06 19:35:42 UTC,guy
603,TShark,RESOLVED,FIXED,Buildbot crash output: editcap.4395a01f.pcap,12/6/05 21:04,Critical,2,FreeBSD,wireshark-bugs,buildbot-do-not-reply,12/6/05 8:28,2005-12-06 21:04:15 UTC,guy
604,GTK+ UI,RESOLVED,FIXED,NFSv4: garbage appended to displayed variable-length strings,7/10/08 10:15,Normal,5,Linux (other),wireshark-bugs,bfields,12/6/05 13:18,2005-12-13 22:25:30 UTC,bugzilla-admin
605,TShark,RESOLVED,FIXED,Buildbot crash output: editcap.43961362.pcap,12/6/05 19:47,Critical,4,FreeBSD,wireshark-bugs,buildbot-do-not-reply,12/6/05 16:40,2005-12-06 19:33:49 UTC,guy
606,TShark,RESOLVED,FIXED,Buildbot crash output: editcap.43962b94.pcap,12/12/05 21:50,Critical,4,FreeBSD,wireshark-bugs,buildbot-do-not-reply,12/6/05 18:23,2005-12-12 21:50:13 UTC,gerald
607,TShark,RESOLVED,DUPLICATE,Buildbot crash output: editcap.4396443a.pcap,12/12/05 21:50,Critical,2,FreeBSD,wireshark-bugs,buildbot-do-not-reply,12/6/05 20:09,2005-12-12 21:50:28 UTC,gerald
608,TShark,RESOLVED,DUPLICATE,Buildbot crash output: editcap.43966265.pcap,12/12/05 21:50,Critical,2,FreeBSD,wireshark-bugs,buildbot-do-not-reply,12/6/05 22:17,2005-12-12 21:50:52 UTC,gerald
609,TShark,RESOLVED,FIXED,Buildbot crash output: editcap.4396a50b.pcap,12/7/05 4:45,Critical,2,FreeBSD,wireshark-bugs,buildbot-do-not-reply,12/7/05 3:02,2005-12-07 04:45:16 UTC,guy
610,TShark,RESOLVED,DUPLICATE,Buildbot crash output: editcap.4396c707.pcap,12/7/05 8:22,Critical,2,FreeBSD,wireshark-bugs,buildbot-do-not-reply,12/7/05 5:27,2005-12-07 08:22:33 UTC,luis.ontanon
611,TShark,RESOLVED,FIXED,Buildbot crash output: editcap.4396e003.pcap,12/7/05 15:15,Critical,6,FreeBSD,luis.ontanon,buildbot-do-not-reply,12/7/05 7:13,2005-12-07 15:15:48 UTC,luis.ontanon
612,TShark,RESOLVED,DUPLICATE,Buildbot crash output: editcap.4396f8d3.pcap,12/7/05 11:59,Critical,2,FreeBSD,wireshark-bugs,buildbot-do-not-reply,12/7/05 8:59,2005-12-07 11:59:23 UTC,luis.ontanon
613,TShark,RESOLVED,DUPLICATE,Buildbot crash output: editcap.43971157.pcap,12/7/05 11:58,Critical,2,FreeBSD,wireshark-bugs,buildbot-do-not-reply,12/7/05 10:44,2005-12-07 11:58:39 UTC,luis.ontanon
614,TShark,RESOLVED,FIXED,Buildbot crash output: editcap.43979829.pcap,12/9/05 16:10,Critical,7,FreeBSD,wireshark-bugs,buildbot-do-not-reply,12/7/05 20:19,2005-12-09 16:08:52 UTC,ronniesahlberg
615,TShark,RESOLVED,DUPLICATE,Buildbot crash output: editcap.4397eeaf.pcap,12/9/05 16:09,Critical,2,FreeBSD,wireshark-bugs,buildbot-do-not-reply,12/8/05 2:28,2005-12-09 16:09:13 UTC,ronniesahlberg
616,GTK+ UI,VERIFIED,FIXED,HTTP/1.1 100 Continue wrong order stream content,7/10/08 10:16,Normal,4,Windows XP,wireshark-bugs,e_wiel_e,12/8/05 3:14,2005-12-20 04:28:22 UTC,bugzilla-admin
617,TShark,RESOLVED,DUPLICATE,Buildbot crash output: editcap.439844df.pcap,12/9/05 16:09,Critical,2,FreeBSD,wireshark-bugs,buildbot-do-not-reply,12/8/05 8:36,2005-12-09 16:09:43 UTC,ronniesahlberg
618,GTK+ UI,RESOLVED,FIXED,SMB dissector: some unknown data is the inode number,7/10/08 10:15,Enhancement,6,Linux (other),wireshark-bugs,mkoeppe,12/8/05 10:35,2005-12-11 15:22:17 UTC,bugzilla-admin
619,GTK+ UI,RESOLVED,DUPLICATE,Add support for RFC 3947 to ISAKMP dissector,7/10/08 10:15,Enhancement,4,Linux (other),wireshark-bugs,efung,12/8/05 14:10,2005-12-16 11:18:57 UTC,bugzilla-admin
620,TShark,RESOLVED,DUPLICATE,Buildbot crash output: editcap.43989aee.pcap,12/9/05 16:10,Critical,3,FreeBSD,wireshark-bugs,buildbot-do-not-reply,12/8/05 14:43,2005-12-09 16:10:24 UTC,ronniesahlberg
621,TShark,RESOLVED,DUPLICATE,Buildbot crash output: editcap.439915ff.pcap,12/9/05 16:10,Critical,2,FreeBSD,wireshark-bugs,buildbot-do-not-reply,12/8/05 23:28,2005-12-09 16:10:42 UTC,ronniesahlberg
622,GTK+ UI,RESOLVED,NOTABUG,One of two SIP calls not shown,7/10/08 10:16,Normal,4,Windows XP,wireshark-bugs,radudumi,12/9/05 4:22,2005-12-09 09:50:58 UTC,bugzilla-admin
623,TShark,RESOLVED,DUPLICATE,Buildbot crash output: editcap.43996cd7.pcap,12/9/05 16:10,Critical,2,FreeBSD,wireshark-bugs,buildbot-do-not-reply,12/9/05 5:39,2005-12-09 16:10:57 UTC,ronniesahlberg
624,GTK+ UI,RESOLVED,NOTABUG,recognition of rtsp frames,7/10/08 10:16,Normal,5,Windows XP,wireshark-bugs,gewuerz,12/9/05 7:11,2005-12-09 12:32:26 UTC,bugzilla-admin
625,GTK+ UI,RESOLVED,DUPLICATE,packet list remains empty after filter with no output,7/10/08 10:18,Normal,7,Windows 2000,wireshark-bugs,ext-henning.treu,12/9/05 8:25,2006-10-25 05:20:57 UTC,bugzilla-admin
626,TShark,RESOLVED,FIXED,Buildbot crash output: editcap.4399c04d.pcap,12/12/05 21:49,Critical,2,FreeBSD,wireshark-bugs,buildbot-do-not-reply,12/9/05 11:35,2005-12-12 21:49:00 UTC,gerald
627,TShark,RESOLVED,FIXED,Buildbot crash output: editcap.439a1692.pcap,12/13/05 1:15,Critical,2,FreeBSD,wireshark-bugs,buildbot-do-not-reply,12/9/05 17:43,2005-12-13 01:15:26 UTC,ronniesahlberg
628,GTK+ UI,RESOLVED,FIXED,CAMEL - Connect decoding error,7/10/08 10:16,Major,4,Windows XP,wireshark-bugs,delz_a,12/12/05 22:08,2005-12-16 10:38:51 UTC,bugzilla-admin
629,GTK+ UI,RESOLVED,DUPLICATE,CAMEL - Connect decoding error,7/10/08 10:16,Major,3,Windows XP,wireshark-bugs,delz_a,12/12/05 22:08,2005-12-13 04:58:19 UTC,bugzilla-admin
630,GTK+ UI,RESOLVED,FIXED,ethereal's radius dictionary parser leaks file descriptors,7/10/08 10:16,Major,4,NetBSD,luis.ontanon,tron,12/14/05 3:16,2005-12-14 03:51:22 UTC,bugzilla-admin
631,GTK+ UI,RESOLVED,NOTOURBUG,Panda AV removes Ethereal and winPcap files as Hacker Tools,12/16/05 11:22,Major,2,Windows XP,wireshark-bugs,cjonetsec,12/14/05 6:56,2005-12-16 11:22:15 UTC,jaap.keuter
632,GTK+ UI,RESOLVED,FIXED,Packets buffered without being processed/displayed.,7/10/08 10:15,Normal,4,FreeBSD,wireshark-bugs,crsacer,12/16/05 7:04,2006-08-22 16:51:13 UTC,bugzilla-admin
633,GTK+ UI,RESOLVED,WORKSFORME,"Crash after start  then stop: Application Error : The instruction at ""0x780109b3""",7/10/08 10:16,Major,5,Windows 2000,wireshark-bugs,musicman,12/16/05 8:59,2006-02-25 13:32:03 UTC,bugzilla-admin
634,GTK+ UI,RESOLVED,WORKSFORME,GLib-CRITICAL **: g_hash_table_lookup: assertion `hash_table != NULL' failed,1/13/06 3:11,Minor,4,Linux (other),wireshark-bugs,toralf.foerster,12/16/05 14:20,2006-01-13 03:11:51 UTC,ulf.lamping
635,GTK+ UI,RESOLVED,NOTABUG,Cannot build Ethereal 10.13 on Mandrake 10.1,7/10/08 10:16,Blocker,4,Linux (other),wireshark-bugs,ethereal,12/17/05 6:30,2005-12-17 12:21:56 UTC,bugzilla-admin
636,TShark,RESOLVED,DUPLICATE,Buildbot crash output: editcap.43a510aa.pcap,12/18/05 5:32,Critical,2,FreeBSD,wireshark-bugs,buildbot-do-not-reply,12/18/05 1:33,2005-12-18 05:32:08 UTC,guy
637,TShark,RESOLVED,FIXED,Buildbot crash output: editcap.43a531e5.pcap,12/18/05 7:19,Critical,4,FreeBSD,wireshark-bugs,buildbot-do-not-reply,12/18/05 3:54,2005-12-18 05:20:29 UTC,guy
638,TShark,RESOLVED,DUPLICATE,Buildbot crash output: editcap.43a54fd6.pcap,12/18/05 7:19,Critical,2,FreeBSD,wireshark-bugs,buildbot-do-not-reply,12/18/05 6:02,2005-12-18 07:19:11 UTC,guy
639,GTK+ UI,RESOLVED,NOTOURBUG,last windows size not saved,4/28/08 7:23,Trivial,9,Linux (other),wireshark-bugs,toralf.foerster,12/19/05 8:14,2006-08-22 16:54:53 UTC,ulf.lamping
640,GTK+ UI,RESOLVED,FIXED,Ethereal/tethereal really slow to start up,7/10/08 10:15,Normal,19,Mac OS X 10.3,wireshark-bugs,david.ponzone,12/19/05 13:57,2006-01-13 07:15:29 UTC,bugzilla-admin
641,TShark,RESOLVED,FIXED,radius_dict.l crashes on 64 bit platforms,12/20/05 8:41,Major,3,All,luis.ontanon,luis.ontanon,12/19/05 16:42,2005-12-20 08:41:38 UTC,Steven.Schaeffer
642,GTK+ UI,RESOLVED,FIXED,"Packet Info incorrect for Skinny message ""SoftKeySetResMessage""",7/10/08 10:15,Minor,5,Linux (other),wireshark-bugs,druid,12/20/05 15:35,2005-12-22 01:12:48 UTC,bugzilla-admin
643,GTK+ UI,RESOLVED,WONTFIX,Follow TCP Stream could filter more efficiently,7/30/14 20:02,Enhancement,4,All,wireshark-bugs,lydickaw,12/22/05 3:17,2014-07-30 20:02:41 UTC,guy
644,GTK+ UI,RESOLVED,FIXED,Enhancement: Provide a way to view UDP packet data in a window,7/10/08 10:15,Enhancement,3,Linux (other),wireshark-bugs,lydickaw,12/22/05 3:22,2007-11-03 04:51:12 UTC,bugzilla-admin
645,GTK+ UI,CONFIRMED, ---,Safe save isn't,8/29/16 11:04,Normal,7,All,wireshark-bugs,guy,12/22/05 3:52,,Echo77echo
646,GTK+ UI,RESOLVED,FIXED,HTTP dissector is not showing the (last chunk) of HTTP chunked response message,11/24/06 3:01,Normal,4,All,wireshark-bugs,jamerine,12/23/05 4:33,2006-11-24 03:01:35 UTC,stephenfisher
647,GTK+ UI,RESOLVED,FIXED,rsync: typo in info string,12/27/05 17:12,Trivial,3,Linux (other),wireshark-bugs,toralf.foerster,12/27/05 13:01,2005-12-27 17:12:16 UTC,jmayer
648,GTK+ UI,RESOLVED,FIXED,"Start ethereal : ""Could not open filter file colorfilters  disabled_protos  dfilters  cfilters  preferences  hosts""",7/10/08 10:18,Critical,27,Windows XP,wireshark-bugs,didier.mercadier,12/28/05 8:52,2006-01-12 16:59:11 UTC,bugzilla-admin
649,GTK+ UI,VERIFIED,FIXED,Convert from libpcap to snoop format invalidates time stamps,7/10/08 10:18,Normal,7,Windows Server 2003,ulf.lamping,Arkady_Tunik,12/28/05 10:20,2005-12-31 05:55:35 UTC,bugzilla-admin
650,GTK+ UI,RESOLVED,NOTABUG,compatibility issues with a wifi card,7/11/08 8:41,Critical,5,Windows 95/98/ME,wireshark-bugs,zitstif,12/30/05 20:04,2005-12-30 21:38:46 UTC,bugzilla-admin
651,TShark,RESOLVED,FIXED,Buildbot crash output: editcap.43b729fe.pcap,1/11/06 20:07,Critical,3,FreeBSD,wireshark-bugs,buildbot-do-not-reply,12/31/05 19:01,2006-01-06 14:04:38 UTC,gerald
652,GTK+ UI,RESOLVED,FIXED,"""-w -"" broken in 0.10.14",7/10/08 10:18,Major,4,Linux (other),wireshark-bugs,kaiowas,1/3/06 1:53,2006-01-03 20:52:25 UTC,bugzilla-admin
653,GTK+ UI,RESOLVED,FIXED,The string of the CheckSum Error is incorrect in Coloring Rules,7/10/08 10:18,Normal,6,Windows 2000,wireshark-bugs,ivan.cheng,1/3/06 3:48,2006-01-08 20:00:06 UTC,bugzilla-admin
654,Documentation,RESOLVED,FIXED,capture filter syntax external reference is bad,7/10/08 10:15,Normal,3,Linux (other),wireshark-bugs,clock,1/3/06 9:13,2006-01-07 05:33:56 UTC,bugzilla-admin
655,TShark,RESOLVED,FIXED,Service parameter to ignore Windows logoff events,12/29/09 13:48,Enhancement,8,Windows XP,wireshark-bugs,rogerreed,1/3/06 15:51,2009-12-29 13:48:57 UTC,stephenfisher
656,GTK+ UI,RESOLVED,FIXED,Incorrect decoding of IPMI System Software IDs,7/10/08 10:18,Minor,3,Windows 2000,wireshark-bugs,mthompson,1/4/06 13:43,2006-01-05 02:54:33 UTC,bugzilla-admin
657,GTK+ UI,RESOLVED,FIXED,Too many buttons in preferences dialog,7/10/08 10:16,Enhancement,6,All,wireshark-bugs,jkohen,1/5/06 13:54,2007-01-11 21:09:25 UTC,bugzilla-admin
658,GTK+ UI,RESOLVED,FIXED,"Display filter ""ip.dst == 1"" (or alike) hangs Wireshark",2/12/10 14:55,Minor,23,Ubuntu,wireshark-bugs,alexandre.g.cardoso,1/6/06 5:46,2010-02-12 14:55:12 UTC,gerald
659,GTK+ UI,RESOLVED,FIXED,memory leak while uncompressing zip data,7/10/08 10:15,Critical,3,All,wireshark-bugs,ce_kashyap,1/6/06 7:29,2006-01-06 21:37:53 UTC,bugzilla-admin
660,GTK+ UI,RESOLVED,FIXED,Endpoints report doesn't sort correctly in Packets column.,7/10/08 10:18,Minor,4,Windows XP,wireshark-bugs,david.hingst,1/6/06 14:32,2006-01-07 05:12:18 UTC,bugzilla-admin
661,GTK+ UI,RESOLVED,FIXED,If there is a pcap file in unicode path directory then cannot be opened!!,7/10/08 10:18,Critical,11,Windows XP,ulf.lamping,aquicker,1/9/06 18:22,2006-01-12 17:05:38 UTC,bugzilla-admin
662,GTK+ UI,RESOLVED,FIXED,Err  file emem.c: line 506 (ep_free_all) after updating to revision 16985:,1/10/06 15:14,Normal,2,Linux (other),wireshark-bugs,toralf.foerster,1/10/06 6:58,2006-01-10 15:14:31 UTC,gerald
663,Capture file support (libwiretap),RESOLVED,FIXED,Windows Sniffer Ethernet captures with type 5 aren't handled,12/21/15 0:17,Normal,19,All,wireshark-bugs,kosburn,1/10/06 10:35,2006-01-24 20:00:29 UTC,guy
664,GTK+ UI,RESOLVED,NOTOURBUG,SNMP dissector shows a wrong Timestamp when the value is negative,7/10/08 10:09,Normal,9,Linux (other),wireshark-bugs,chris-bugzilla01,1/10/06 11:41,2007-08-28 19:27:25 UTC,bugzilla-admin
665,TShark,RESOLVED,FIXED,Buildbot crash output: editcap.43c46ef3.pcap,1/11/06 9:47,Critical,3,FreeBSD,wireshark-bugs,buildbot-do-not-reply,1/10/06 20:35,2006-01-11 09:40:42 UTC,gerald
666,TShark,RESOLVED,DUPLICATE,Buildbot crash output: editcap.43c49871.pcap,1/11/06 9:47,Critical,2,FreeBSD,wireshark-bugs,buildbot-do-not-reply,1/10/06 23:32,2006-01-11 09:47:23 UTC,gerald
667,TShark,RESOLVED,FIXED,Buildbot crash output: editcap.43c4fbe2.pcap,1/12/06 15:54,Critical,4,FreeBSD,wireshark-bugs,buildbot-do-not-reply,1/11/06 6:36,2006-01-12 15:54:02 UTC,gerald
668,GTK+ UI,RESOLVED,DUPLICATE,Sorting by packets under Endpoint analysis,7/10/08 10:16,Minor,3,Windows XP,wireshark-bugs,jvincent,1/11/06 8:38,2006-01-11 14:48:08 UTC,bugzilla-admin
669,TShark,RESOLVED,FIXED,Buildbot crash output: editcap.43c51fa3.pcap,1/12/06 12:47,Critical,7,FreeBSD,wireshark-bugs,buildbot-do-not-reply,1/11/06 9:09,2006-01-12 03:35:52 UTC,tomas.kukosa
670,TShark,RESOLVED,FIXED,Buildbot crash output: editcap.43c5531e.pcap,1/12/06 16:03,Critical,2,FreeBSD,wireshark-bugs,buildbot-do-not-reply,1/11/06 12:49,2006-01-12 16:03:52 UTC,gerald
671,GTK+ UI,RESOLVED,NOTABUG,For certain traces  conversation output is not reliable.,7/10/08 10:16,Normal,8,Windows XP,wireshark-bugs,paulwltr,1/11/06 12:53,2007-08-09 20:21:33 UTC,bugzilla-admin
672,TShark,RESOLVED,FIXED,tshark -i - broken under win32,5/31/07 0:01,Normal,3,Windows 2000,wireshark-bugs,matthew,1/11/06 12:56,2007-05-31 00:01:47 UTC,gerald
673,TShark,RESOLVED,FIXED,Buildbot crash output: editcap.43c57f67.pcap,1/12/06 16:04,Critical,2,FreeBSD,wireshark-bugs,buildbot-do-not-reply,1/11/06 15:58,2006-01-12 16:04:44 UTC,gerald
674,TShark,RESOLVED,FIXED,Buildbot crash output: editcap.43c5abc2.pcap,1/12/06 16:10,Critical,2,FreeBSD,wireshark-bugs,buildbot-do-not-reply,1/11/06 19:07,2006-01-12 16:10:39 UTC,gerald
675,TShark,RESOLVED,DUPLICATE,Buildbot crash output: editcap.43c5cf7f.pcap,1/12/06 12:45,Critical,2,FreeBSD,wireshark-bugs,buildbot-do-not-reply,1/11/06 21:39,2006-01-12 12:45:45 UTC,gerald
676,TShark,RESOLVED,DUPLICATE,Buildbot crash output: editcap.43c5f2cf.pcap,1/12/06 12:42,Critical,2,FreeBSD,wireshark-bugs,buildbot-do-not-reply,1/12/06 0:10,2006-01-12 12:42:43 UTC,gerald
677,GTK+ UI,RESOLVED,FIXED,megaco.dll can not handle lowcase descriptor,7/10/08 10:18,Major,4,Windows 2000,wireshark-bugs,lu.gan,1/12/06 2:01,2006-04-18 16:09:12 UTC,bugzilla-admin
678,TShark,RESOLVED,DUPLICATE,Buildbot crash output: editcap.43c616cc.pcap,1/12/06 12:47,Critical,2,FreeBSD,wireshark-bugs,buildbot-do-not-reply,1/12/06 2:44,2006-01-12 12:47:57 UTC,gerald
679,GTK+ UI,RESOLVED,FIXED,Incorrect decode of multiple SNMP packets within a single TCP packet,1/12/06 10:19,Normal,3,Windows XP,wireshark-bugs,Brian.Blackmore,1/12/06 5:09,2006-01-12 10:19:24 UTC,jaap.keuter
680,GTK+ UI,RESOLVED,NOTABUG,My network Place properties,7/10/08 10:16,Major,11,Windows XP,wireshark-bugs,satishkapoor,1/12/06 7:01,2006-02-24 15:09:29 UTC,bugzilla-admin
681,GTK+ UI,RESOLVED,WORKSFORME,Include missing,7/10/08 10:18,Normal,8,AIX,wireshark-bugs,tony.reix,1/12/06 11:32,2006-08-02 07:06:26 UTC,bugzilla-admin
682,GTK+ UI,RESOLVED,NOTOURBUG,Line-based text data truncated when exported,7/10/08 10:18,Minor,4,Windows XP,wireshark-bugs,p3wner,1/12/06 12:30,2006-01-12 18:45:55 UTC,bugzilla-admin
683,TShark,RESOLVED,FIXED,Buildbot crash output: editcap.43c6d070.pcap,1/12/06 16:11,Critical,2,FreeBSD,wireshark-bugs,buildbot-do-not-reply,1/12/06 15:56,2006-01-12 16:11:28 UTC,gerald
684,TShark,RESOLVED,FIXED,Incorrect decoding of several fields in the Mobile Station Classmark 2 IE in packet-gsm.c,7/10/08 10:18,Major,4,Windows XP,wireshark-bugs,patrik.olsson,1/12/06 17:07,2006-01-13 09:19:49 UTC,bugzilla-admin
685,GTK+ UI,RESOLVED,FIXED,Win32: Ethereal window title fails to display unicode chars correctly,7/10/08 10:18,Minor,4,Windows XP,wireshark-bugs,ulf.lamping,1/12/06 17:16,2007-01-06 03:59:59 UTC,bugzilla-admin
686,TShark,RESOLVED,FIXED,Buildbot crash output: editcap.43c75a40.pcap,1/14/06 5:32,Critical,5,FreeBSD,wireshark-bugs,buildbot-do-not-reply,1/13/06 1:44,2006-01-14 05:32:38 UTC,jmayer
687,TShark,RESOLVED,FIXED,Incorrect decoding of Additional Access Technologies in IE MS Radio Access Capability in packet-gsm_a.c,7/10/08 10:18,Major,4,Windows XP,wireshark-bugs,patrik.olsson,1/13/06 3:14,2006-01-13 09:20:15 UTC,bugzilla-admin
688,TShark,RESOLVED,FIXED,Buildbot crash output: editcap.43c7b477.pcap,1/17/06 16:10,Critical,2,FreeBSD,wireshark-bugs,buildbot-do-not-reply,1/13/06 8:09,2006-01-17 16:10:03 UTC,gerald
689,TShark,RESOLVED,FIXED,Buildbot crash output: editcap.43c82105.pcap,1/17/06 16:12,Critical,2,FreeBSD,wireshark-bugs,buildbot-do-not-reply,1/13/06 15:52,2006-01-17 16:12:04 UTC,gerald
690,TShark,RESOLVED,FIXED,Buildbot crash output: editcap.43c8aa47.pcap,1/17/06 16:30,Critical,2,FreeBSD,wireshark-bugs,buildbot-do-not-reply,1/14/06 1:37,2006-01-17 16:30:57 UTC,gerald
691,TShark,RESOLVED,FIXED,Buildbot crash output: editcap.43c9232b.pcap,1/17/06 16:33,Critical,2,FreeBSD,wireshark-bugs,buildbot-do-not-reply,1/14/06 10:13,2006-01-17 16:33:10 UTC,gerald
692,TShark,RESOLVED,DUPLICATE,Buildbot crash output: editcap.43cbda8a.pcap,1/17/06 0:46,Critical,2,FreeBSD,wireshark-bugs,buildbot-do-not-reply,1/16/06 11:40,2006-01-17 00:46:18 UTC,jaap.keuter
693,TShark,RESOLVED,FIXED,Buildbot crash output: editcap.43cc2fce.pcap,1/17/06 0:46,Critical,4,FreeBSD,wireshark-bugs,buildbot-do-not-reply,1/16/06 17:44,2006-01-17 00:41:26 UTC,jaap.keuter
694,TShark,RESOLVED,DUPLICATE,Buildbot crash output: editcap.43cc8581.pcap,1/17/06 0:46,Critical,2,FreeBSD,wireshark-bugs,buildbot-do-not-reply,1/16/06 23:49,2006-01-17 00:46:55 UTC,jaap.keuter
695,TShark,RESOLVED,FIXED,Buildbot crash output: editcap.43cca127.pcap,1/21/06 19:29,Critical,7,FreeBSD,alejandrovaquero,buildbot-do-not-reply,1/17/06 1:47,2006-01-21 19:29:38 UTC,alejandrovaquero
696,GTK+ UI,RESOLVED,NOTOURBUG,Ethereal's main windows disappeared after being minimized.,7/10/08 10:18,Normal,4,Windows Server 2003,wireshark-bugs,jiangjinke,1/17/06 3:11,2006-08-22 18:07:32 UTC,bugzilla-admin
697,GTK+ UI,RESOLVED,FIXED,COTP dissector displays class option incorrectly,7/10/08 10:18,Normal,4,Windows 2000,wireshark-bugs,geoff.oakes,1/17/06 6:58,2006-01-18 15:43:13 UTC,bugzilla-admin
698,TShark,RESOLVED,FIXED,Buildbot crash output: editcap.43ccfbc9.pcap,1/17/06 12:50,Critical,2,FreeBSD,wireshark-bugs,buildbot-do-not-reply,1/17/06 8:14,2006-01-17 12:50:31 UTC,gerald
699,GTK+ UI,RESOLVED,FIXED,"""Order"" buttons not working properly in Coloring Rules window",7/10/08 10:18,Blocker,11,Windows XP,wireshark-bugs,adaig90,1/18/06 10:01,2006-08-25 14:35:24 UTC,bugzilla-admin
700,GTK+ UI,RESOLVED,NOTABUG,RTP Payload incorrectly Interpreted as RTP Event (RFC 2833),7/10/08 10:18,Normal,5,Windows XP,wireshark-bugs,58renjk02,1/18/06 14:43,2006-01-18 15:00:54 UTC,bugzilla-admin
701,TShark,RESOLVED,DUPLICATE,Buildbot crash output: editcap.43cf0761.pcap,1/19/06 1:08,Critical,2,FreeBSD,wireshark-bugs,buildbot-do-not-reply,1/18/06 21:28,2006-01-19 01:08:06 UTC,jaap.keuter
702,GTK+ UI,RESOLVED,DUPLICATE,entry of filters causes ethereal to slow down.,7/10/08 10:18,Critical,5,Windows XP,wireshark-bugs,yohan.arellano,1/19/06 2:14,2006-02-05 04:02:10 UTC,bugzilla-admin
703,GTK+ UI,RESOLVED,FIXED,Can't decode GSM A-I/F DTAP - Service Request in RANAP (GPRS Domain),7/10/08 10:18,Normal,4,Windows XP,wireshark-bugs,pichetr,1/19/06 5:07,2006-01-27 04:11:09 UTC,bugzilla-admin
704,TShark,RESOLVED,DUPLICATE,Buildbot crash output: editcap.43cf9e0f.pcap,1/19/06 8:29,Critical,2,FreeBSD,wireshark-bugs,buildbot-do-not-reply,1/19/06 8:11,2006-01-19 08:29:02 UTC,jaap.keuter
705,TShark,RESOLVED,DUPLICATE,Buildbot crash output: editcap.43d03542.pcap,1/20/06 3:41,Critical,2,FreeBSD,wireshark-bugs,buildbot-do-not-reply,1/19/06 18:56,2006-01-20 03:41:43 UTC,jaap.keuter
706,TShark,RESOLVED,DUPLICATE,Buildbot crash output: editcap.43d0510a.pcap,1/20/06 3:42,Critical,2,FreeBSD,wireshark-bugs,buildbot-do-not-reply,1/19/06 20:55,2006-01-20 03:42:06 UTC,jaap.keuter
707,GTK+ UI,RESOLVED,FIXED,It's not possible to print each packet  on a new pager,7/10/08 10:18,Normal,6,Windows XP,wireshark-bugs,kontakt,1/20/06 2:50,2006-08-27 12:36:34 UTC,bugzilla-admin
708,GTK+ UI,RESOLVED,NOTABUG,trouble capturing outgoing traffic on PCMCIA WiFi card,7/10/08 10:18,Normal,5,Windows XP,wireshark-bugs,pluto677,1/20/06 7:22,2006-08-22 18:12:05 UTC,bugzilla-admin
709,GTK+ UI,RESOLVED,FIXED,Error when view details of interface,7/10/08 10:16,Normal,5,Windows XP,wireshark-bugs,assm2,1/21/06 5:38,2006-01-21 09:08:31 UTC,bugzilla-admin
710,GTK+ UI,RESOLVED,FIXED,Segmentation fault while showing http stats,3/17/06 14:32,Critical,17,Linux (other),wireshark-bugs,toralf.foerster,1/21/06 9:08,2006-03-14 19:45:45 UTC,luis.ontanon
711,GTK+ UI,RESOLVED,FIXED,fuzzed mms.pcap.gz triggers stack overflow,3/14/06 18:24,Blocker,8,Windows XP,wireshark-bugs,ulf.lamping,1/21/06 19:52,2006-03-14 18:24:16 UTC,ulf.lamping
712,GTK+ UI,RESOLVED,FIXED,Date time stamps are fast by approx 11 seconds,7/10/08 10:18,Normal,4,Windows Server 2003,wireshark-bugs,leigh,1/22/06 21:24,2006-01-22 22:17:03 UTC,bugzilla-admin
713,GTK+ UI,RESOLVED,FIXED,nfs stream not fully analyzed,2/1/06 2:26,Enhancement,7,Linux (other),wireshark-bugs,toralf.foerster,1/27/06 4:25,2006-02-01 02:26:18 UTC,toralf.foerster
714,GTK+ UI,RESOLVED,FIXED,Impulse graphs won't show at all values above scale,7/10/08 10:16,Normal,4,Windows 2000,wireshark-bugs,haziza,1/27/06 6:37,2006-02-01 03:01:06 UTC,bugzilla-admin
715,TShark,RESOLVED,DUPLICATE, -w - write binary to standard output not working in 0.10.14,7/10/08 10:18,Normal,3,All,wireshark-bugs,ethereal,1/28/06 17:50,2006-01-28 19:06:52 UTC,bugzilla-admin
716,GTK+ UI,VERIFIED,FIXED,Ethereal > 0.10.11 crashes on UMA URR HANDOVER REQUIRED,7/10/08 10:18,Critical,7,All,wireshark-bugs,ilja.maslov,1/29/06 1:29,2006-01-29 09:59:47 UTC,bugzilla-admin
717,GTK+ UI,RESOLVED,FIXED,[ ERROR: Unrecognized Text ] XML tags with digits,7/10/08 10:18,Normal,3,Linux (other),wireshark-bugs,lars.dieckow,1/30/06 12:33,2006-01-30 16:44:59 UTC,bugzilla-admin
718,GTK+ UI,VERIFIED,FIXED,saved preference of 'treat all frames as docsis' requires ethereal exit for proper non-docsis operation,7/10/08 10:18,Normal,7,Windows 2000,wireshark-bugs,dale_schaafsma,1/30/06 16:12,2006-02-23 03:11:37 UTC,bugzilla-admin
719,TShark,RESOLVED,FIXED,Buildbot crash output: editcap.43deb15d.pcap,1/31/06 4:28,Critical,2,FreeBSD,wireshark-bugs,buildbot-do-not-reply,1/30/06 18:37,2006-01-31 04:28:47 UTC,ronniesahlberg
720,TShark,RESOLVED,FIXED,Buildbot crash output: editcap.43ded7d7.pcap,1/31/06 4:29,Critical,2,FreeBSD,wireshark-bugs,buildbot-do-not-reply,1/30/06 21:22,2006-01-31 04:29:53 UTC,ronniesahlberg
721,TShark,RESOLVED,FIXED,Buildbot crash output: editcap.43df04ba.pcap,1/31/06 4:31,Critical,2,FreeBSD,wireshark-bugs,buildbot-do-not-reply,1/31/06 0:33,2006-01-31 04:31:33 UTC,ronniesahlberg
722,TShark,RESOLVED,FIXED,Buildbot crash output: editcap.43df107a.pcap,1/31/06 4:33,Critical,2,FreeBSD,wireshark-bugs,buildbot-do-not-reply,1/31/06 1:23,2006-01-31 04:33:09 UTC,ronniesahlberg
723,GTK+ UI,RESOLVED,FIXED,SNMP COUNTER64,7/10/08 10:15,Normal,4,Windows 2000,wireshark-bugs,ofritz,1/31/06 8:00,2006-02-22 04:45:55 UTC,bugzilla-admin
724,GTK+ UI,RESOLVED,FIXED,DNS dissector fails in handling the sign of Altitude in LOC type response (RFC1867),7/10/08 10:18,Normal,5,Windows XP,wireshark-bugs,habanero,2/1/06 15:19,2006-02-21 02:14:57 UTC,bugzilla-admin
725,GTK+ UI,RESOLVED,FIXED,"0.10.14 shows ""malformed packet"" when showing H323 CS: FACILITY message with opcode ""Calltransfer initiate""",7/10/08 10:18,Normal,4,Windows XP,wireshark-bugs,epancacahya,2/2/06 18:56,2006-03-09 00:03:26 UTC,bugzilla-admin
726,GTK+ UI,RESOLVED,WONTFIX,Impulse values in IO Graph should be stacked up,6/23/15 23:30,Enhancement,5,Windows 2000,wireshark-bugs,haziza,2/3/06 3:43,2015-06-23 23:30:47 UTC,anders.broman
727,GTK+ UI,RESOLVED,REMIND,analyzing udp packet for KLive,2/22/06 9:07,Enhancement,3,Linux (other),wireshark-bugs,toralf.foerster,2/4/06 6:50,2006-02-22 09:07:31 UTC,toralf.foerster
728,GTK+ UI,RESOLVED,FIXED,Autoscroll causes packet list to jump when filtered packets arrive,11/5/06 13:52,Normal,2,Linux (other),wireshark-bugs,codemonkey49,2/7/06 13:33,2006-11-05 13:52:12 UTC,ulf.lamping
729,GTK+ UI,RESOLVED,NOTOURBUG,ICMP (unreacheable) not filtered,7/10/08 10:18,Minor,4,Windows XP,wireshark-bugs,roenick,2/8/06 8:24,2006-02-08 09:08:01 UTC,bugzilla-admin
730,TShark,RESOLVED,FIXED,tshark behaves differently than Wireshark with '-a files:x' (autostop) option,9/28/07 14:25,Normal,7,All,wireshark-bugs,patrick.sullivan,2/8/06 8:25,2007-09-28 14:25:40 UTC,jeff.morriss.ws
731,GTK+ UI,RESOLVED,DUPLICATE,Annoying messageboxes,7/10/08 10:18,Major,3,Windows XP,wireshark-bugs,kolar,2/8/06 13:20,2006-02-08 15:27:14 UTC,bugzilla-admin
732,GTK+ UI,VERIFIED,FIXED,SSL Decrypt not reading private key file,2/14/06 2:37,Normal,4,All,wireshark-bugs,Greg.Morris,2/9/06 10:41,2006-02-13 12:22:45 UTC,paolo.abeni
733,GTK+ UI,RESOLVED,FIXED,Ethereal crashes when capture complete during load of capture,7/10/08 10:18,Major,7,Windows XP,wireshark-bugs,chrisaudley,2/9/06 14:27,2006-02-09 15:05:24 UTC,bugzilla-admin
734,Documentation,RESOLVED,FIXED,docbook/Readme.txt : described make targets does not exist,1/26/15 22:32,Minor,5,Windows XP,wireshark-bugs,toralf.foerster,2/10/06 3:05,2006-06-15 09:22:12 UTC,guy
735,GTK+ UI,RESOLVED,NOTABUG,"The file ""C:\Program Files\Ethereal\asn1/default.tt"" could not be opened: No error.",7/10/08 10:18,Normal,5,Windows XP,wireshark-bugs,ethereal,2/10/06 22:01,2006-02-12 07:10:02 UTC,bugzilla-admin
736,GTK+ UI,RESOLVED,DUPLICATE,Ethereal don't like pathes with specialchars like ,7/10/08 10:18,Normal,3,Windows XP,wireshark-bugs,ethereal,2/11/06 2:26,2006-02-11 04:20:17 UTC,bugzilla-admin
737,TShark,RESOLVED,FIXED,Buildbot crash output: editcap.43ee6a21.pcap,3/14/06 22:35,Critical,2,FreeBSD,wireshark-bugs,buildbot-do-not-reply,2/11/06 16:50,2006-03-14 22:35:21 UTC,lars.roland
738,TShark,RESOLVED,FIXED,Buildbot crash output: editcap.43ee95ac.pcap,2/12/06 8:31,Critical,2,FreeBSD,wireshark-bugs,buildbot-do-not-reply,2/11/06 19:56,2006-02-12 08:31:46 UTC,lars.roland
739,GTK+ UI,RESOLVED,NOTABUG,memory leak in conversation.c,7/10/08 10:12,Normal,3,Linux (other),wireshark-bugs,ce_kashyap,2/12/06 5:18,2006-02-12 05:43:34 UTC,bugzilla-admin
740,GTK+ UI,RESOLVED,NOTABUG,Windows 2000 crashes on capture,7/10/08 10:18,Normal,6,Windows 2000,wireshark-bugs,slutslot,2/12/06 23:50,2006-02-13 02:50:28 UTC,bugzilla-admin
741,GTK+ UI,RESOLVED,FIXED,Problem with the autoscroll button,2/23/06 14:54,Normal,2,Windows XP,wireshark-bugs,johannes.obermaier,2/13/06 14:10,2006-02-23 14:54:09 UTC,jaap.keuter
742,GTK+ UI,VERIFIED,FIXED,SSL Certificate packet causes crash on Win32,2/17/06 3:15,Critical,7,Windows XP,wireshark-bugs,Greg.Morris,2/14/06 8:42,2006-02-17 03:14:34 UTC,paolo.abeni
743,GTK+ UI,RESOLVED,NOTABUG,Bad decoding of H.225 messages sent by Netmeeting.,7/10/08 10:18,Normal,10,Windows 2000,wireshark-bugs,mantovani,2/15/06 7:53,2006-02-16 07:45:58 UTC,bugzilla-admin
744,GTK+ UI,RESOLVED,FIXED,can't load private key from /home/tfoerste/my-server.key,3/16/06 14:57,Normal,10,Linux (other),wireshark-bugs,toralf.foerster,2/15/06 8:08,2006-03-16 14:57:00 UTC,toralf.foerster
745,GTK+ UI,RESOLVED,NOTABUG,Capture file changes IP address info on loading,7/10/08 10:18,Normal,15,Windows XP,wireshark-bugs,alan.h.harper,2/15/06 12:19,2006-02-20 05:54:15 UTC,bugzilla-admin
746,GTK+ UI,RESOLVED,WORKSFORME,Ethereal doesn't show the correct packet information with AIX Large_send,7/10/08 10:18,Normal,5,Windows XP,wireshark-bugs,hamel74,2/15/06 22:14,2006-08-02 06:45:27 UTC,bugzilla-admin
747,GTK+ UI,RESOLVED,DUPLICATE,Read Filter dialog box non-operational,7/10/08 10:18,Normal,9,Windows XP,wireshark-bugs,alan.h.harper,2/16/06 7:49,2006-02-18 15:58:52 UTC,bugzilla-admin
748,GTK+ UI,RESOLVED,DUPLICATE,Localized personal configuration,7/10/08 10:18,Major,4,Windows XP,wireshark-bugs,albert.sputa,2/16/06 7:57,2006-02-16 12:44:55 UTC,bugzilla-admin
749,GTK+ UI,RESOLVED,DUPLICATE,Problem with Ethereal on Czech Windows 2000,7/10/08 10:18,Normal,4,Windows 2000,wireshark-bugs,p.klinkovsky,2/16/06 9:07,2006-02-16 12:44:10 UTC,bugzilla-admin
750,GTK+ UI,RESOLVED,DUPLICATE,Packet list pane shows incorrect number of packets,2/21/06 9:06,Normal,4,Linux (other),wireshark-bugs,mlynch,2/16/06 10:13,2006-02-21 09:06:07 UTC,mlynch
751,GTK+ UI,RESOLVED,DUPLICATE,Ethereal doesn't support special characters in folders names when loading user settings,7/10/08 10:18,Minor,5,Windows XP,wireshark-bugs,gfr2875zks9rj40,2/16/06 11:08,2006-02-16 12:46:05 UTC,bugzilla-admin
752,GTK+ UI,RESOLVED,FIXED,IEEE802.3ah-2004 OAM Errored Frame Seconds Summary Event TLV not decoding properly.,7/10/08 10:18,Normal,3,Windows XP,wireshark-bugs,mrglee,2/16/06 11:29,2006-02-19 03:56:16 UTC,bugzilla-admin
753,GTK+ UI,RESOLVED,FIXED,In NFS calls  the Name shows garbage,7/10/08 10:15,Normal,4,Windows XP,wireshark-bugs,ric_mackie,2/17/06 17:25,2006-02-22 03:04:11 UTC,bugzilla-admin
755,GTK+ UI,RESOLVED,FIXED,ipp response packet : print human readable time stamps,2/22/06 4:39,Enhancement,6,Linux (other),wireshark-bugs,toralf.foerster,2/20/06 3:35,2006-02-22 03:55:13 UTC,ronniesahlberg
756,GTK+ UI,RESOLVED,FIXED,Megaco doesn't handle CR as whitespace,7/10/08 10:18,Normal,3,Windows XP,wireshark-bugs,leigh.fiddes,2/20/06 23:57,2006-02-21 05:50:30 UTC,bugzilla-admin
757,GTK+ UI,RESOLVED,WORKSFORME,Crashes when multiple tap interfaces exist,7/10/08 10:18,Blocker,10,FreeBSD,wireshark-bugs,jmpareja,2/21/06 5:21,2006-07-06 20:43:26 UTC,bugzilla-admin
758,GTK+ UI,RESOLVED,FIXED,Syslog does not recognize Facility codes 12-15 as defined in RFC3164,7/10/08 10:18,Normal,3,Windows XP,wireshark-bugs,mrglee,2/21/06 11:44,2006-02-21 15:31:11 UTC,bugzilla-admin
759,TShark,RESOLVED,NOTABUG,Bug/Feature Request: Capture Filter breaks when packets include PRISM header,7/10/08 10:18,Normal,6,Linux (other),wireshark-bugs,donmorrison,2/21/06 18:55,2006-02-21 21:05:06 UTC,bugzilla-admin
760,Capture file support (libwiretap),RESOLVED,DUPLICATE,Wrong timestamps for sniffer Cap file,12/21/15 0:23,Normal,5,Windows XP,wireshark-bugs,gitapv,2/22/06 4:35,2015-12-21 00:23:08 UTC,guy
762,GTK+ UI,RESOLVED,FIXED,Incorrect Decoding of PICMG Get FRU LED State Response,7/10/08 10:18,Normal,7,Windows 2000,jaap.keuter,mthompson,2/22/06 16:52,2006-02-28 12:23:48 UTC,bugzilla-admin
763,TShark,RESOLVED,NOTOURBUG,tethereal has a memory leak,7/10/08 10:18,Normal,8,Linux (other),wireshark-bugs,rvokal,2/23/06 1:47,2006-08-22 18:18:16 UTC,bugzilla-admin
764,GTK+ UI,RESOLVED,FIXED,crash when escaping a slash in a regular expression using matches operator,7/10/08 10:15,Critical,4,Linux (other),wireshark-bugs,mike,2/23/06 12:37,2006-02-23 15:23:27 UTC,bugzilla-admin
765,GTK+ UI,RESOLVED,FIXED,Typographical Error In IPMI Dissector,7/10/08 10:18,Trivial,3,Windows 2000,wireshark-bugs,mthompson,2/23/06 15:25,2006-02-23 16:10:29 UTC,bugzilla-admin
766,GTK+ UI,RESOLVED,FIXED,Incorrect Decoding of IPMI packet,7/10/08 10:18,Normal,3,Windows 2000,wireshark-bugs,mthompson,2/23/06 16:15,2006-06-09 22:56:00 UTC,bugzilla-admin
767,GTK+ UI,RESOLVED,FIXED,Error message when opening Observer (bfr) trace files,7/10/08 10:18,Normal,8,Windows XP,guy,duncanh,2/24/06 2:01,2006-04-15 19:56:19 UTC,bugzilla-admin
768,GTK+ UI,RESOLVED,DUPLICATE,Error message when opening Observer (bfr) trace files,7/10/08 10:18,Normal,3,Windows XP,wireshark-bugs,duncanh,2/24/06 2:34,2006-02-24 03:21:02 UTC,bugzilla-admin
769,GTK+ UI,RESOLVED,FIXED,TCP Flow sequence number problem,7/10/08 10:18,Normal,4,Windows XP,wireshark-bugs,mamotta,2/24/06 10:58,2006-02-24 14:47:32 UTC,bugzilla-admin
770,GTK+ UI,RESOLVED,DUPLICATE,WinXP Login Name Error,7/10/08 10:18,Normal,3,Windows Server 2003,wireshark-bugs,death_knight,2/26/06 9:58,2006-02-26 19:18:11 UTC,bugzilla-admin
771,GTK+ UI,RESOLVED,FIXED,Capture -> Options -> Link-Layer Header Type : nothing can be choosed,12/26/06 14:34,Minor,11,Linux (other),wireshark-bugs,toralf.foerster,2/27/06 4:44,2006-12-26 14:34:32 UTC,jeff.morriss.ws
772,GTK+ UI,RESOLVED,FIXED,STATUS_ACCESS_VIOLATION,3/8/06 15:40,Critical,6,Windows Server 2003,wireshark-bugs,death_knight,2/27/06 13:51,2006-03-08 15:40:33 UTC,ulf.lamping
773,GTK+ UI,RESOLVED,DUPLICATE,Ethereal on Win32 broken when username contains non-ascii characters,7/10/08 10:18,Normal,4,Windows Server 2003,wireshark-bugs,bjoern,2/27/06 14:03,2006-02-27 14:38:26 UTC,bugzilla-admin
774,GTK+ UI,RESOLVED,DUPLICATE,"""Invalid argument"" errors",7/10/08 10:18,Normal,4,Windows XP,wireshark-bugs,michael.holtzer,2/27/06 15:00,2006-02-27 16:17:41 UTC,bugzilla-admin
775,GTK+ UI,RESOLVED,NOTABUG,Wireless and wired networking do not work after install and reboot on Dell Latitude D510,7/10/08 10:18,Normal,3,Windows XP,wireshark-bugs,wvpowell,2/27/06 23:54,2006-02-28 04:51:05 UTC,bugzilla-admin
776,GTK+ UI,RESOLVED,FIXED,"""Find Packet"" should select found item",7/10/08 10:18,Enhancement,4,All,stephenfisher,ulf.lamping,2/28/06 9:10,2006-11-14 22:36:16 UTC,bugzilla-admin
777,GTK+ UI,RESOLVED,FIXED,Parsing of EAP and EAP-SIM messages,7/10/08 10:18,Normal,6,Linux (other),wireshark-bugs,thodime_guru,2/28/06 16:46,2006-12-06 22:09:30 UTC,bugzilla-admin
778,TShark,RESOLVED,FIXED,Buildbot crash output: editcap.4404f1cb.pcap,3/6/06 13:50,Critical,3,FreeBSD,wireshark-bugs,buildbot-do-not-reply,2/28/06 18:58,2006-03-06 13:50:25 UTC,gerald
779,GTK+ UI,RESOLVED,FIXED,questionable identification of TCP window probe as keep-alive,3/2/06 2:42,Minor,3,Windows XP,wireshark-bugs,kfall,2/28/06 19:42,2006-03-02 02:42:59 UTC,ronniesahlberg
780,GTK+ UI,RESOLVED,FIXED,TCP 1-byte window probes labeled as malformed SIGCOMP packets,7/10/08 10:18,Normal,4,Windows XP,wireshark-bugs,kfall,2/28/06 19:50,2006-03-02 03:45:32 UTC,bugzilla-admin
781,Dissection engine (libwireshark),RESOLVED,NOTABUG,DUA version not shown in in Edit->Preferences,1/24/17 21:52,Normal,3,All,wireshark-bugs,tripaam,3/1/06 0:02,2006-03-01 01:26:34 UTC,guy
782,GTK+ UI,RESOLVED,WORKSFORME,0.10.14 user interface non-responsive after capture,7/10/08 10:18,Critical,5,Windows XP,wireshark-bugs,mbergamo,3/1/06 15:27,2006-08-02 06:43:46 UTC,bugzilla-admin
783,GTK+ UI,RESOLVED,FIXED,"crash when use display filter ""iscsi contains W""",3/2/06 14:44,Normal,3,Linux (other),wireshark-bugs,mingz,3/2/06 11:20,2006-03-02 14:44:38 UTC,jaap.keuter
784,GTK+ UI,RESOLVED,FIXED,Failed assertion in emem.c,3/6/06 8:47,Critical,6,Linux (other),wireshark-bugs,Steven.Schaeffer,3/2/06 12:38,2006-03-06 08:47:24 UTC,Steven.Schaeffer
785,GTK+ UI,RESOLVED,FIXED,Correct RPCSEC_GSS_INIT error reply is erroneously labeled 'malformed packet',7/10/08 10:18,Normal,5,All,wireshark-bugs,iisaman,3/2/06 14:49,2006-08-25 08:15:51 UTC,bugzilla-admin
786,GTK+ UI,RESOLVED,FIXED,AMR codec dissection error in BICC,3/4/06 4:17,Minor,2,Windows XP,wireshark-bugs,palos,3/2/06 23:26,2006-03-04 04:17:02 UTC,a.broman
787,TShark,RESOLVED,DUPLICATE,Buildbot crash output: editcap.44084052.pcap,3/6/06 13:50,Critical,2,FreeBSD,wireshark-bugs,buildbot-do-not-reply,3/3/06 7:10,2006-03-06 13:50:53 UTC,gerald
788,Capture file support (libwiretap),RESOLVED,DUPLICATE,Ethereal won't load Sniffer Distributed 4.50.084 capture,12/21/15 0:17,Normal,4,All,wireshark-bugs,clinton,3/3/06 16:38,2006-03-03 21:50:34 UTC,guy
789,GTK+ UI,RESOLVED,DUPLICATE,Preferences can't be loaded/saved with certain APPDATA path's,7/10/08 10:18,Normal,3,Windows XP,wireshark-bugs,gola,3/4/06 2:38,2006-03-04 02:51:59 UTC,bugzilla-admin
790,GTK+ UI,RESOLVED,FIXED,Addition of script or macro engine to automate file analysis,7/10/08 10:17,Enhancement,4,All,wireshark-bugs,ricotero,3/5/06 7:16,2006-08-02 07:08:18 UTC,bugzilla-admin
791,GTK+ UI,RESOLVED,WONTFIX,messenger: packet detail window lost information about wanted detail information,7/30/14 20:03,Minor,5,All,wireshark-bugs,toralf.foerster,3/5/06 8:55,2014-07-30 20:03:32 UTC,guy
792,GTK+ UI,RESOLVED,FIXED,BACnet ConfirmedCOVNotification is wrong,7/10/08 10:18,Normal,4,Windows XP,wireshark-bugs,adorerofwitches,3/6/06 2:44,2006-03-19 06:30:20 UTC,bugzilla-admin
793,GTK+ UI,RESOLVED,FIXED,BACnet acknowledgeAlarm TimeStamp is wron,7/10/08 10:18,Normal,3,Windows XP,wireshark-bugs,adorerofwitches,3/6/06 2:58,2006-03-19 06:31:10 UTC,bugzilla-admin
794,GTK+ UI,RESOLVED,FIXED,canary error in ALCAP: dissect_fields_desea()  we write 1 too many bytes,3/7/06 8:02,Major,4,Linux (other),wireshark-bugs,jeff.morriss.ws,3/7/06 2:56,2006-03-07 08:02:57 UTC,luis.ontanon
795,GTK+ UI,RESOLVED,FIXED,Private hosts entries display incorrectly on Linux,7/10/08 10:18,Normal,10,Linux (other),wireshark-bugs,Steven.Schaeffer,3/7/06 11:49,2006-08-29 16:55:05 UTC,bugzilla-admin
796,GTK+ UI,RESOLVED,FIXED,Ethereal does not decode Radius attr. MS-MPPE Keys,7/10/08 10:19,Normal,5,Windows XP,wireshark-bugs,mathias.beilstein,3/8/06 6:59,2006-03-22 19:01:18 UTC,bugzilla-admin
797,TShark,RESOLVED,FIXED,Buildbot crash output: editcap.440f9726.pcap,3/11/06 5:20,Critical,2,FreeBSD,wireshark-bugs,buildbot-do-not-reply,3/8/06 20:47,2006-03-11 05:20:28 UTC,ronniesahlberg
798,GTK+ UI,RESOLVED,FIXED,Couldn't create child process: Bad file descriptor,3/9/06 8:42,Blocker,3,Windows Server 2003,wireshark-bugs,death_knight,3/8/06 23:27,2006-03-09 08:42:14 UTC,gerald
799,GTK+ UI,RESOLVED,FIXED,error message after updating from 0.10.13 to 0.10.14,7/10/08 10:19,Major,4,Windows XP,wireshark-bugs,roland.test,3/9/06 3:42,2006-05-17 08:44:42 UTC,bugzilla-admin
800,GTK+ UI,RESOLVED,FIXED,can't open .cap  traces,7/10/08 10:19,Normal,4,Windows XP,wireshark-bugs,jlou,3/9/06 10:04,2006-04-15 20:03:41 UTC,bugzilla-admin
801,GTK+ UI,RESOLVED,DUPLICATE,Could not open files,7/10/08 10:19,Critical,3,Windows 2000,wireshark-bugs,lmstudio,3/9/06 14:49,2006-03-09 19:28:00 UTC,bugzilla-admin
802,TShark,RESOLVED,FIXED,Buildbot crash output: editcap.441096b6.pcap,3/11/06 5:21,Critical,2,FreeBSD,wireshark-bugs,buildbot-do-not-reply,3/9/06 14:57,2006-03-11 05:21:31 UTC,ronniesahlberg
803,GTK+ UI,RESOLVED,FIXED,passing errors from Dumpcap to Ethereal doesn't work any longer,3/12/06 18:34,Normal,2,Windows XP,wireshark-bugs,ulf.lamping,3/10/06 3:12,2006-03-12 18:34:31 UTC,ulf.lamping
804,GTK+ UI,RESOLVED,NOTABUG,H323 application data is not displayed,7/10/08 10:19,Major,9,Windows XP,wireshark-bugs,cjrijnders,3/10/06 8:47,2006-03-10 09:16:39 UTC,bugzilla-admin
805,TShark,RESOLVED,FIXED,Buildbot crash output: editcap.4411942e.pcap,3/11/06 5:21,Critical,2,FreeBSD,wireshark-bugs,buildbot-do-not-reply,3/10/06 8:58,2006-03-11 05:21:55 UTC,ronniesahlberg
806,TShark,RESOLVED,FIXED,Buildbot crash output: editcap.44129164.pcap,3/13/06 8:36,Critical,3,FreeBSD,wireshark-bugs,buildbot-do-not-reply,3/11/06 2:59,2006-03-11 05:22:17 UTC,ronniesahlberg
807,GTK+ UI,RESOLVED,NOTABUG,Display filter ip.addr for 802.11 LLC packets does not work,7/10/08 10:15,Normal,3,Linux (other),wireshark-bugs,Beat.Meier,3/11/06 12:52,2006-03-11 13:01:16 UTC,bugzilla-admin
808,TShark,RESOLVED,DUPLICATE,Buildbot crash output: editcap.44134095.pcap,3/13/06 8:36,Critical,2,FreeBSD,wireshark-bugs,buildbot-do-not-reply,3/11/06 15:26,2006-03-13 08:36:45 UTC,gerald
809,GTK+ UI,RESOLVED,DUPLICATE,Odd but valid characters in windows profile name,7/10/08 10:19,Major,3,Windows XP,wireshark-bugs,choogendijk,3/12/06 13:51,2006-03-12 14:01:51 UTC,bugzilla-admin
810,GTK+ UI,RESOLVED,FIXED,can't run ethereal,7/10/08 10:19,Minor,5,Linux (other),wireshark-bugs,am,3/13/06 6:44,2006-03-13 08:41:14 UTC,bugzilla-admin
811,GTK+ UI,RESOLVED,FIXED,Ethernet Configuration Test Protocol (ethertype 9000) parsing inconsistency,12/22/12 5:44,Normal,7,Linux (other),wmeier,koolniczka,3/13/06 9:18,2006-03-16 11:51:02 UTC,wireshark
812,GTK+ UI,RESOLVED,FIXED,"SIP ""Authorization"" header field is missing info",7/10/08 10:19,Enhancement,6,Windows XP,lars.roland,kcoombes,3/13/06 15:09,2006-03-17 21:27:57 UTC,bugzilla-admin
813,GTK+ UI,RESOLVED,FIXED,Frame length improperly labeled as Packet Length in frame summary header,7/10/08 10:19,Trivial,5,Windows XP,wireshark-bugs,ashley.hatch,3/13/06 21:33,2007-01-21 23:05:10 UTC,bugzilla-admin
814,GTK+ UI,RESOLVED,FIXED,"Display filter for ""is present"" doesn't work for different header fields with the same abbreviation",7/10/08 10:19,Minor,4,Windows XP,wireshark-bugs,ethereal,3/13/06 22:26,2007-11-12 20:52:48 UTC,bugzilla-admin
815,GTK+ UI,RESOLVED,DUPLICATE,Associations with non-ASCII chars in path do not work,7/10/08 10:19,Minor,5,Windows 2000,wireshark-bugs,igtorque,3/14/06 10:49,2006-03-29 00:26:54 UTC,bugzilla-admin
816,GTK+ UI,RESOLVED,FIXED,"Ethereal 0.10.14 IEEE 802.11 ""malformed packet"" error message",7/10/08 10:19,Normal,7,Linux (other),wireshark-bugs,raul.siles,3/14/06 12:02,2006-03-24 05:58:12 UTC,bugzilla-admin
817,GTK+ UI,RESOLVED,FIXED,JXTA is displayed twice,3/23/06 15:40,Minor,6,Linux (other),wireshark-bugs,toralf.foerster,3/15/06 7:58,2006-03-23 15:40:11 UTC,a.broman
819,TShark,RESOLVED,FIXED,Buildbot crash output: editcap.441a9130.pcap,3/17/06 5:46,Critical,2,FreeBSD,wireshark-bugs,buildbot-do-not-reply,3/17/06 4:36,2006-03-17 05:46:45 UTC,jaap.keuter
820,GTK+ UI,RESOLVED,FIXED,gsm-map checkIMEI decoding error,3/23/06 11:02,Normal,5,Windows XP,wireshark-bugs,palos,3/21/06 23:55,2006-03-23 11:02:40 UTC,a.broman
821,GTK+ UI,RESOLVED,FIXED,gsm-map sendIMSI decoding error,3/23/06 11:03,Normal,4,Windows XP,wireshark-bugs,palos,3/22/06 2:26,2006-03-23 11:03:01 UTC,a.broman
822,GTK+ UI,RESOLVED,WORKSFORME,on win98 SE : installer corrupted,7/10/08 10:19,Normal,7,Windows 95/98/ME,wireshark-bugs,kd,3/22/06 5:05,2006-03-25 19:17:35 UTC,bugzilla-admin
823,GTK+ UI,RESOLVED,DUPLICATE,Interface freezes when entering an address in the filter box,7/10/08 10:19,Normal,3,Windows XP,wireshark-bugs,iridium,3/22/06 10:26,2006-03-22 14:51:58 UTC,bugzilla-admin
824,GTK+ UI,RESOLVED,DUPLICATE,Segfault on frame matches display filter.,7/10/08 10:19,Normal,3,Linux (other),wireshark-bugs,nick.george,3/22/06 12:38,2006-03-22 14:45:28 UTC,bugzilla-admin
825,GTK+ UI,RESOLVED,FIXED,setup message has an error in gsm-a-dtap,3/23/06 11:04,Normal,3,Windows XP,wireshark-bugs,palos,3/22/06 20:02,2006-03-23 11:04:04 UTC,a.broman
826,GTK+ UI,RESOLVED,FIXED,Coverity CID 42: NULL pointer dereference in packet-asn1.c,3/27/06 13:43,Blocker,4,All,wireshark-bugs,gerald,3/23/06 14:23,2006-03-27 13:43:45 UTC,gerald
827,GTK+ UI,RESOLVED,FIXED,Coverity CID 145: NULL pointer dereference in iseries.c,3/27/06 11:20,Blocker,2,All,wireshark-bugs,gerald,3/23/06 14:30,2006-03-27 11:20:04 UTC,gerald
828,GTK+ UI,RESOLVED,FIXED,Coverity CID 144: lemon.c resource leak,6/26/06 9:03,Normal,2,All,wireshark-bugs,gerald,3/23/06 14:33,2006-06-26 09:03:20 UTC,ronniesahlberg
829,GTK+ UI,RESOLVED,FIXED,Coverity CID 22: Dead code in packet-cops.c,3/23/06 15:38,Minor,2,All,wireshark-bugs,gerald,3/23/06 14:37,2006-03-23 15:38:43 UTC,a.broman
830,GTK+ UI,RESOLVED,FIXED,Coverity CID 18: Dead code in packet-ncp2222.inc,4/4/06 0:15,Minor,2,All,wireshark-bugs,gerald,3/23/06 14:39,2006-04-04 00:15:11 UTC,a.broman
831,GTK+ UI,RESOLVED,FIXED,Coverity CID 138: Dead code in packet-nfs.c,4/27/06 11:19,Minor,2,All,wireshark-bugs,gerald,3/23/06 14:41,2006-04-27 11:19:32 UTC,gerald
832,GTK+ UI,RESOLVED,FIXED,Coverity CID 24: Dead code in packet-giop.c,3/28/06 0:18,Minor,2,All,wireshark-bugs,gerald,3/23/06 14:43,2006-03-28 00:18:03 UTC,anders.broman
833,Dissection engine (libwireshark),RESOLVED,FIXED,Coverity CID 21: Dead code in packet-tds.c,12/4/15 0:22,Minor,2,All,wireshark-bugs,gerald,3/23/06 14:45,2006-05-07 15:41:41 UTC,guy
834,GTK+ UI,RESOLVED,FIXED,Coverity CID 17: Dead code in packet-http.c,6/26/06 9:03,Minor,2,All,wireshark-bugs,gerald,3/23/06 14:46,2006-06-26 09:03:58 UTC,ronniesahlberg
835,GTK+ UI,RESOLVED,FIXED,Coverity CID 12: Dead code in packet-fc.c,4/27/06 11:13,Minor,2,All,wireshark-bugs,gerald,3/23/06 14:48,2006-04-27 11:13:24 UTC,gerald
836,GTK+ UI,RESOLVED,FIXED,Win32: Export dialogs much too small,3/28/06 17:07,Major,2,Windows XP,wireshark-bugs,ulf.lamping,3/23/06 18:22,2006-03-28 17:07:05 UTC,gerald
837,GTK+ UI,RESOLVED,FIXED,Ethereal crashes during startup,7/10/08 10:19,Minor,7,Windows XP,wireshark-bugs,urkens_jp,3/24/06 5:37,2006-03-25 05:39:23 UTC,bugzilla-admin
838,GTK+ UI,RESOLVED,NOTABUG,SNMP filter shows ICMP packets too,3/24/06 16:25,Minor,3,Linux (other),wireshark-bugs,toralf.foerster,3/24/06 6:04,2006-03-24 16:25:32 UTC,jaap.keuter
839,GTK+ UI,RESOLVED,FIXED,Inconsistent inclusion of CRLF/0d0a in SIP fields,7/10/08 10:19,Minor,8,Windows 2000,wireshark-bugs,Dan.Diolosa,3/24/06 10:14,2008-03-15 18:41:09 UTC,bugzilla-admin
840,GTK+ UI,RESOLVED,FIXED,Wrong offset for de_gmm_drx_param in packet-gtp.c,7/10/08 10:19,Normal,4,All,wireshark-bugs,khaithye,3/25/06 2:00,2006-03-26 02:09:33 UTC,bugzilla-admin
841,GTK+ UI,RESOLVED,DUPLICATE,Error when config file path include Chinese,7/10/08 10:10,Normal,3,Windows XP,wireshark-bugs,jiangjinhai,3/25/06 19:28,2006-03-25 19:40:02 UTC,bugzilla-admin
842,Build process,RESOLVED,FIXED,make in ./docbooks builds the doc every time,1/26/15 22:32,Trivial,2,Linux (other),wireshark-bugs,toralf.foerster,3/27/06 6:28,2006-09-07 20:02:10 UTC,guy
843,TShark,RESOLVED,FIXED,"tethereal shouldn't create a temporary capture file when run without ""-w""",7/10/08 10:19,Normal,4,Linux (other),wireshark-bugs,rvokal,3/27/06 7:09,2006-04-02 19:54:19 UTC,bugzilla-admin
844,GTK+ UI,RESOLVED,NOTABUG,Minimizing the main window makes it impossible to get it restored  as the icon in the taskbar now controls the info window,7/10/08 10:19,Normal,4,Windows XP,wireshark-bugs,aoeuid,3/27/06 16:53,2006-05-17 08:46:54 UTC,bugzilla-admin
845,GTK+ UI,RESOLVED,NOTOURBUG,installer hangs when winpcap  pops up to install. cancel button disabled.,7/10/08 10:19,Minor,6,Windows XP,wireshark-bugs,jmichae3,3/28/06 16:41,2006-03-29 12:26:54 UTC,bugzilla-admin
846,TShark,RESOLVED,NOTOURBUG,ssdp cannot be used a filter expression,3/19/07 9:51,Enhancement,5,Linux (other),wireshark-bugs,toralf.foerster,3/29/06 8:11,2007-03-19 09:51:51 UTC,toralf.foerster
847,GTK+ UI,RESOLVED,DUPLICATE,"Filter window ""locks up"" and freezes ethereal then returns",7/10/08 10:19,Normal,3,Windows XP,wireshark-bugs,ahalper,3/29/06 11:15,2006-03-29 12:46:42 UTC,bugzilla-admin
848,GTK+ UI,RESOLVED,FIXED,A high number of interfaces can not be displayed,7/10/08 10:19,Normal,3,Windows 2000,wireshark-bugs,magne.nybraten,3/30/06 7:42,2006-04-08 15:19:58 UTC,bugzilla-admin
849,GTK+ UI,RESOLVED,FIXED,Gtk-CRITICAL **: gtk_tree_store_set: assertion `VALID_ITER (iter  tree_store)' failed,3/30/06 14:29,Minor,4,Linux (other),wireshark-bugs,toralf.foerster,3/30/06 14:15,2006-03-30 14:29:56 UTC,luis.ontanon
850,GTK+ UI,RESOLVED,FIXED,FTAM disector get malformed packet on packets that were good in 0.10.12,7/10/08 10:19,Normal,5,Windows XP,wireshark-bugs,John,3/30/06 14:57,2006-04-03 14:08:38 UTC,bugzilla-admin
851,GTK+ UI,RESOLVED,FIXED,sccp cannot dissect RANAP message in DT1 format.,4/6/06 20:00,Normal,9,Windows XP,wireshark-bugs,palos,3/30/06 20:24,2006-04-06 20:00:48 UTC,palos
852,GTK+ UI,RESOLVED,FIXED,Follow TCP stream crashes on particular data with X Window System error,7/10/08 10:19,Critical,6,Linux (other),wireshark-bugs,clock,3/31/06 4:52,2006-04-26 01:40:13 UTC,bugzilla-admin
853,GTK+ UI,RESOLVED,NOTOURBUG,bittorent dissected as RX/IPVS/ENIP/SNIP/QUAKE/DNP,3/19/07 9:50,Minor,9,Linux (other),wireshark-bugs,toralf.foerster,3/31/06 13:47,2007-03-19 09:50:55 UTC,toralf.foerster
854,GTK+ UI,RESOLVED,FIXED,[packet-per.c 1092] Not decoded yet in packet : 1016  [unknown extension root index in choice],3/18/07 10:10,Trivial,3,Linux (other),wireshark-bugs,toralf.foerster,3/31/06 14:00,2007-03-18 10:10:43 UTC,toralf.foerster
855,GTK+ UI,RESOLVED,FIXED,messenger dissected as BVLC,4/29/06 13:56,Minor,3,All,wireshark-bugs,toralf.foerster,4/2/06 5:23,2006-04-29 13:55:53 UTC,guy
856,TShark,RESOLVED,FIXED,Buildbot crash output: editcap.4431bf04.pcap,4/4/06 2:55,Critical,2,FreeBSD,wireshark-bugs,buildbot-do-not-reply,4/3/06 19:34,2006-04-04 02:55:10 UTC,ronniesahlberg
857,GTK+ UI,VERIFIED,FIXED,MGCP decode issues,7/10/08 10:19,Normal,8,Windows XP,wireshark-bugs,mike.oliveras,4/4/06 23:21,2006-04-11 06:35:39 UTC,bugzilla-admin
858,GTK+ UI,RESOLVED,NOTABUG,error while capturing packet : recvfrom: Network is down,4/6/06 18:34,Minor,5,Linux (other),wireshark-bugs,toralf.foerster,4/5/06 4:46,2006-04-06 18:34:13 UTC,guy
859,GTK+ UI,RESOLVED,WORKSFORME,"""ip.dst == 9.155.138.29 $&& udp"" is a valid filter string",4/5/07 19:21,Minor,7,Linux (other),wireshark-bugs,toralf.foerster,4/5/06 6:07,2007-04-05 19:21:53 UTC,luis.ontanon
860,GTK+ UI,RESOLVED,NOTABUG,SDP dissector always requires IPv6,7/31/08 3:33,Normal,9,Windows XP,wireshark-bugs,daniel,4/5/06 8:31,2008-07-31 03:33:03 UTC,anders.broman
862,GTK+ UI,RESOLVED,DUPLICATE,Display filter for IP address input problem in v0.10.14,7/10/08 10:19,Normal,3,Windows XP,wireshark-bugs,sunny_xie,4/5/06 21:54,2006-04-05 22:39:46 UTC,bugzilla-admin
863,GTK+ UI,RESOLVED,FIXED,RTCP sender report's NTP time display incorrect,7/10/08 10:19,Normal,3,Windows XP,wireshark-bugs,vesa.01,4/6/06 2:29,2006-04-06 08:32:55 UTC,bugzilla-admin
864,GTK+ UI,RESOLVED,NOTOURBUG,IEEE802.11 Frame Control,7/10/08 10:19,Trivial,5,Linux (other),wireshark-bugs,Peter.Toman,4/6/06 2:49,2006-10-07 20:40:09 UTC,bugzilla-admin
865,GTK+ UI,RESOLVED,FIXED,Timestamp decodes usec value incorrectly,7/10/08 10:19,Normal,9,Windows XP,wireshark-bugs,mark,4/6/06 13:27,2006-04-14 08:36:45 UTC,bugzilla-admin
867,Documentation,RESOLVED,FIXED,changing column size (eg of Source) takes only affects after resizing Packet List window,4/10/07 19:36,Minor,4,Linux (other),wireshark-bugs,toralf.foerster,4/7/06 9:42,2007-04-10 13:39:29 UTC,toralf.foerster
868,GTK+ UI,RESOLVED,FIXED,Ethereal aborts on viewing interface details,7/10/08 10:19,Normal,4,Windows XP,wireshark-bugs,sterling.tabor,4/9/06 20:13,2006-04-09 20:38:12 UTC,bugzilla-admin
869,GTK+ UI,RESOLVED,FIXED,Capture Interfaces dialod shows scrollbar always,4/10/06 15:28,Normal,4,Windows XP,jaap.keuter,ulf.lamping,4/9/06 20:47,2006-04-10 15:28:49 UTC,ulf.lamping
870,GTK+ UI,RESOLVED,NOTABUG,tcp checksum errors,7/10/08 10:19,Normal,4,Windows XP,wireshark-bugs,network27,4/10/06 5:37,2006-04-10 06:14:37 UTC,bugzilla-admin
871,GTK+ UI,RESOLVED,FIXED,Ethereal: Interface Details dialog too high,4/12/06 15:59,Minor,3,Windows XP,wireshark-bugs,jaap.keuter,4/10/06 11:26,2006-04-12 15:59:03 UTC,ulf.lamping
872,GTK+ UI,RESOLVED,FIXED,"display filters broken with ""treat all frames as DOCSIS frames"" in current SVN",7/10/08 10:19,Major,7,Windows XP,wireshark-bugs,mike.oliveras,4/11/06 6:40,2006-04-13 14:10:24 UTC,bugzilla-admin
873,GTK+ UI,RESOLVED,FIXED,Coverity CID 26: Dead code in packet-nfs.c,6/26/06 9:02,Minor,2,All,wireshark-bugs,gerald,4/12/06 14:57,2006-06-26 09:02:35 UTC,ronniesahlberg
874,GTK+ UI,RESOLVED,FIXED,Coverity CID 149: Dead code in packet-fc.c,6/26/06 9:04,Minor,2,All,wireshark-bugs,gerald,4/12/06 14:58,2006-06-26 09:04:39 UTC,ronniesahlberg
875,GTK+ UI,RESOLVED,FIXED,Additional ECC group identifiers for ISAKMP Transform payloads,7/10/08 10:19,Enhancement,5,Windows XP,wireshark-bugs,efung,4/12/06 15:02,2006-04-18 06:53:15 UTC,bugzilla-admin
876,GTK+ UI,RESOLVED,FIXED,Time Zone is not consistent between gsm_a_dtap CC and gsm_a_sms,4/16/06 17:49,Minor,4,Windows XP,wireshark-bugs,palos,4/13/06 20:41,2006-04-16 17:49:35 UTC,a.broman
877,GTK+ UI,RESOLVED,FIXED,Win32 file open dialog too small to show preview info,1/26/07 6:13,Normal,3,Windows XP,wireshark-bugs,ulf.lamping,4/14/06 4:41,2007-01-26 06:13:44 UTC,ulf.lamping
878,GTK+ UI,RESOLVED,FIXED,[PATCH] Complete linking libethereal against adns and other libs,4/27/06 14:13,Normal,8,Linux (other),wireshark-bugs,flameeyes,4/15/06 14:26,2006-04-27 14:13:11 UTC,guy
879,GTK+ UI,RESOLVED,FIXED,Coverity CID 150: Buffer overrun in DCT2000 file support,4/25/06 6:52,Critical,4,All,wireshark-bugs,gerald,4/17/06 9:57,2006-04-25 06:52:42 UTC,martin.mathieson
880,GTK+ UI,RESOLVED,DUPLICATE,Flow Graph Crash,7/10/08 10:19,Critical,4,Windows XP,wireshark-bugs,ehoran,4/17/06 15:21,2006-04-24 10:14:04 UTC,bugzilla-admin
881,GTK+ UI,RESOLVED,FIXED,mysql packet malformed,4/30/06 6:30,Minor,5,Linux (other),wireshark-bugs,toralf.foerster,4/18/06 7:27,2006-04-30 05:38:54 UTC,jaap.keuter
882,GTK+ UI,RESOLVED,FIXED,Incorrect parsing of RTCP (POC1 application specific data),7/10/08 10:19,Minor,6,Windows XP,wireshark-bugs,henrik.nilzon,4/19/06 11:12,2006-04-20 02:40:15 UTC,bugzilla-admin
883,GTK+ UI,RESOLVED,FIXED,Ethereal incorrectly displays internal root path cost for IEEE 802.1s,7/10/08 10:19,Normal,8,Windows 2000,wireshark-bugs,ttai,4/19/06 19:00,2006-04-23 16:24:01 UTC,bugzilla-admin
884,GTK+ UI,RESOLVED,FIXED,checkIMEIres dissection Error in GSM MAP,4/20/06 10:25,Minor,3,Windows XP,wireshark-bugs,palos,4/20/06 1:55,2006-04-20 10:25:50 UTC,a.broman
885,GTK+ UI,RESOLVED,FIXED,"The ""absentSubscriberParam"" can not be dissected in gsm-map.",4/20/06 10:27,Minor,3,Windows XP,wireshark-bugs,palos,4/20/06 2:06,2006-04-20 10:27:35 UTC,a.broman
886,GTK+ UI,RESOLVED,FIXED,Ethereal crashes whenever user tries to rearrange columns,4/24/06 16:29,Normal,7,Linux (other),wireshark-bugs,rvokal,4/20/06 2:24,2006-04-24 16:29:36 UTC,jaap.keuter
887,GTK+ UI,RESOLVED,FIXED,Ethereal always starts on the leftmost monitor,7/10/08 10:19,Normal,4,Windows XP,wireshark-bugs,bmathis-ethereal,4/20/06 23:34,2006-05-01 06:08:08 UTC,bugzilla-admin
888,GTK+ UI,RESOLVED,NOTOURBUG,Win32 file dialog not implemented everywhere,7/2/09 9:15,Trivial,2,Windows XP,wireshark-bugs,olivier.jacques,4/21/06 3:19,2009-07-02 09:15:54 UTC,anders.broman
889,GTK+ UI,RESOLVED,NOTABUG,GLib-ERROR: failed to allocate memory,9/14/06 9:22,Normal,6,Windows XP,wireshark-bugs,michael.stewart,4/21/06 3:53,2006-09-14 09:22:16 UTC,jeff.morriss.ws
890,Extras,RESOLVED,FIXED,eth2asn crashes during eth_prepare due to name used iso nm,4/28/06 1:50,Normal,5,Windows XP,wireshark-bugs,graham,4/21/06 8:59,2006-04-28 01:50:59 UTC,tomas.kukosa
891,GTK+ UI,RESOLVED,FIXED,Can't perform case-insenstive string comparisons,8/1/06 15:44,Normal,2,Linux (other),gram,gram,4/21/06 13:37,2006-08-01 15:44:40 UTC,gram
892,GTK+ UI,RESOLVED,FIXED,VoIP call Analysis issues with MGCP call,10/8/07 11:49,Normal,7,Windows XP,wireshark-bugs,mike.oliveras,4/22/06 15:43,2007-10-08 11:49:45 UTC,anders.broman
893,GTK+ UI,RESOLVED,FIXED,epan/libethereal.def is missing the export for tvb_uncompress,7/10/08 10:19,Normal,3,Windows 2000,wireshark-bugs,cj12345,4/22/06 23:07,2006-04-23 14:14:04 UTC,bugzilla-admin
894,GTK+ UI,RESOLVED,FIXED,File/Export fails with 'path doesn't exist' error message,9/1/06 20:33,Blocker,12,Windows XP,wireshark-bugs,gejmis,4/25/06 13:14,2006-05-01 01:56:00 UTC,guy
895,TShark,VERIFIED,FIXED,Ring buffer problem in tethereal 0.99 (files after 1st are tiny),5/16/06 20:08,Normal,6,All,wireshark-bugs,micah,4/26/06 13:17,2006-04-29 12:56:07 UTC,jeff.morriss.ws
896,GTK+ UI,RESOLVED,FIXED,Multiple UMA messages in single TCP segment aren't shown correctly,7/10/08 10:15,Normal,10,All,wireshark-bugs,iao,4/27/06 8:17,2006-04-28 16:43:07 UTC,bugzilla-admin
897,GTK+ UI,RESOLVED,NOTABUG,Coverity CID 151: Null pointer dereference in packet-scsi.c,5/1/06 2:37,Critical,3,All,wireshark-bugs,gerald,4/27/06 11:25,2006-05-01 02:37:05 UTC,ronniesahlberg
898,GTK+ UI,RESOLVED,FIXED,Coverity CID 152: Dead code in file.c,6/26/06 9:01,Minor,2,All,wireshark-bugs,gerald,4/27/06 13:07,2006-06-26 09:01:36 UTC,ronniesahlberg
899,GTK+ UI,RESOLVED,FIXED,Coverity CID 155: Null dereference in tap-httpstat.c,5/1/06 2:45,Critical,2,All,wireshark-bugs,gerald,4/27/06 13:53,2006-05-01 02:45:55 UTC,ronniesahlberg
900,GTK+ UI,RESOLVED,FIXED,Coverity CID 156: Null dereference in tap-stats_tree.c,5/6/06 17:01,Major,2,All,wireshark-bugs,gerald,4/27/06 14:05,2006-05-06 17:01:13 UTC,ronniesahlberg
901,GTK+ UI,RESOLVED,FIXED,Print and Export packet format not respected,4/28/06 13:46,Normal,2,Windows XP,wireshark-bugs,jaap.keuter,4/27/06 14:52,2006-04-28 13:46:43 UTC,gerald
902,GTK+ UI,RESOLVED,FIXED,TCP-dissector calls tcp_payload with wrong length,5/8/06 8:25,Normal,2,All,wireshark-bugs,markus.meier,4/28/06 5:12,2006-05-08 08:25:59 UTC,markus.meier
903,GTK+ UI,RESOLVED,FIXED,Crash when starting capture with various filters,8/29/06 8:51,Critical,8,Windows XP,wireshark-bugs,tim.court,4/28/06 15:58,2006-08-29 08:51:47 UTC,GaryChaulklin
904,GTK+ UI,RESOLVED,FIXED,FIX protocol dissector missing some message types,4/29/06 10:35,Normal,3,All,wireshark-bugs,chrisaudley,4/29/06 9:35,2006-04-29 10:35:53 UTC,jmayer
905,TShark,RESOLVED,FIXED,Buildbot crash output: editcap.44538b12.pcap,4/29/06 12:32,Critical,3,All,wireshark-bugs,buildbot-do-not-reply,4/29/06 10:49,2006-04-29 12:32:43 UTC,guy
906,TShark,RESOLVED,DUPLICATE,Buildbot crash output: editcap.44539877.pcap,4/29/06 12:31,Critical,2,FreeBSD,wireshark-bugs,buildbot-do-not-reply,4/29/06 11:46,2006-04-29 12:31:26 UTC,guy
907,GTK+ UI,RESOLVED,FIXED,"When starting to capture ""Couldn't run (null)/dumpcap in child process"" dialog is presented",6/15/06 17:45,Major,17,Mac OS X 10.4,wireshark-bugs,peter.karlsson,4/30/06 2:59,2006-06-15 17:45:25 UTC,guy
908,GTK+ UI,RESOLVED,DUPLICATE,File Export appears to be broke in 0.99,5/1/06 1:57,Normal,3,Windows XP,wireshark-bugs,larryschneider,4/30/06 12:33,2006-05-01 01:57:02 UTC,guy
909,GTK+ UI,RESOLVED,FIXED,FIX dissector doesn't handle multiple FIX messages in packet,5/6/06 16:52,Normal,3,Windows XP,wireshark-bugs,chrisaudley,5/1/06 12:30,2006-05-06 16:52:56 UTC,ronniesahlberg
910,GTK+ UI,RESOLVED,FIXED,Win32: file save dialog complicates type/format selection,7/24/06 17:15,Major,2,Windows XP,wireshark-bugs,ulf.lamping,5/1/06 14:45,2006-07-24 17:15:05 UTC,ulf.lamping
911,GTK+ UI,RESOLVED,FIXED,Win32 file save dialog should automatically add file name extension based on format selected,8/12/06 23:21,Major,2,Windows XP,wireshark-bugs,ulf.lamping,5/1/06 14:53,2006-08-12 23:21:48 UTC,ulf.lamping
912,GTK+ UI,RESOLVED,DUPLICATE,Unable to export marked packets to text  XML  or PS.,5/1/06 22:07,Major,2,Windows XP,wireshark-bugs,lrlinares,5/1/06 21:14,2006-05-01 22:07:48 UTC,guy
913,GTK+ UI,RESOLVED,FIXED,DateAndTime dissection error in CAMEL CallInfoReportArg,5/2/06 15:27,Minor,3,Windows XP,wireshark-bugs,palos,5/1/06 22:21,2006-05-02 15:27:41 UTC,a.broman
914,GTK+ UI,RESOLVED,DUPLICATE,Impossible to text export,5/2/06 2:55,Normal,2,Windows 2000,wireshark-bugs,hansthulin,5/2/06 1:47,2006-05-02 02:55:07 UTC,jeff.morriss.ws
915,GTK+ UI,RESOLVED,FIXED,crashes on launch: emem.c line 271 assertion failed (win98),5/18/06 11:56,Normal,21,Windows 95/98/ME,wireshark-bugs,duncan-tech-ethereal,5/2/06 17:57,2006-05-17 19:31:05 UTC,lars.roland
916,GTK+ UI,RESOLVED,FIXED,PurgeMS decoding error in GSM MAP,5/3/06 13:50,Minor,3,Windows XP,wireshark-bugs,palos,5/2/06 21:15,2006-05-03 13:50:27 UTC,a.broman
917,GTK+ UI,RESOLVED,FIXED,gui interface crashes when closing capture dialog [PATCH],6/8/06 15:22,Major,5,Linux (other),wireshark-bugs,rvokal,5/3/06 3:43,2006-06-08 15:22:39 UTC,jmayer
918,GTK+ UI,RESOLVED,DUPLICATE,Problem with export,5/4/06 6:25,Normal,2,Windows XP,wireshark-bugs,matteo_belloni,5/4/06 4:58,2006-05-04 06:25:14 UTC,jeff.morriss.ws
919,GTK+ UI,RESOLVED,NOTABUG,Ethereal-0.99.0 can't dissect some GTP header,5/4/06 22:09,Normal,3,Linux (other),wireshark-bugs,foxcafe,5/4/06 8:49,2006-05-04 22:09:54 UTC,foxcafe
920,GTK+ UI,RESOLVED,DUPLICATE,Export does not work,5/4/06 16:28,Minor,2,Windows XP,wireshark-bugs,GaryChaulklin,5/4/06 12:54,2006-05-04 16:28:38 UTC,jeff.morriss.ws
921,GTK+ UI,RESOLVED,FIXED,SMB Exception when TCP subdisector reassembly enabled with AndXoffset non-zero,5/4/06 17:47,Normal,4,All,mbrown,mbrown,5/4/06 16:33,2006-05-04 16:50:55 UTC,mbrown
922,GTK+ UI,RESOLVED,FIXED,Ethereal Crashes when selecting dumpcap documentation during a live capture.,5/5/06 16:29,Normal,8,Windows XP,wireshark-bugs,tdarnell,5/4/06 22:53,2006-05-05 16:29:03 UTC,tdarnell
923,GTK+ UI,RESOLVED,DUPLICATE,Export problems,5/5/06 19:25,Minor,2,Windows XP,wireshark-bugs,tester_1313,5/5/06 7:33,2006-05-05 19:25:49 UTC,jeff.morriss.ws
924,GTK+ UI,RESOLVED,FIXED,DVMRP shows as `malformed packet',5/10/06 17:15,Enhancement,6,Linux (other),wireshark-bugs,grrtrr,5/5/06 12:42,2006-05-10 17:15:20 UTC,jaap.keuter
925,GTK+ UI,RESOLVED,FIXED,crash in SVN's ASN1/ SNMP dissector,5/16/06 9:46,Major,10,Windows XP,wireshark-bugs,ulf.lamping,5/5/06 17:32,2006-05-16 09:46:24 UTC,ulf.lamping
926,GTK+ UI,RESOLVED,FIXED,(yet another) crash in SVN's ASN1/ SNMP dissector,5/10/06 4:14,Critical,5,Linux (other),wireshark-bugs,thomas.anders,5/5/06 18:55,2006-05-10 04:14:28 UTC,thomas.anders
927,GTK+ UI,RESOLVED,FIXED,"Attempting ""Save as"" to an existing trace file name does not work.",8/25/06 12:36,Normal,5,Windows XP,wireshark-bugs,jyoung,5/7/06 19:50,2006-08-23 21:27:14 UTC,jeff.morriss.ws
928,GTK+ UI,RESOLVED,DUPLICATE,** ERROR **: file to_str.c: line 829: should not be reached,7/10/08 10:19,Minor,3,Windows XP,wireshark-bugs,wbenton,5/8/06 2:09,2006-05-08 04:59:36 UTC,bugzilla-admin
929,GTK+ UI,RESOLVED,DUPLICATE,Export Fails,9/1/06 20:33,Major,3,Windows 2000,wireshark-bugs,sundby.stuart,5/8/06 10:11,2006-09-01 20:33:09 UTC,guy
930,GTK+ UI,RESOLVED,FIXED,Ethereal shows all captured radiotap wifi packets as Association Requests,5/8/06 16:05,Critical,2,All,wireshark-bugs,prokrypt,5/8/06 15:48,2006-05-08 16:05:16 UTC,guy
931,GTK+ UI,RESOLVED,NOTABUG,[File/Export to Text] Columns w/network name info can cause misalignment,5/10/06 17:22,Minor,2,Windows XP,wireshark-bugs,gejmis,5/9/06 11:01,2006-05-10 17:22:34 UTC,ulf.lamping
932,GTK+ UI,RESOLVED,DUPLICATE,Abnormal Termination of 0.99.0  on Win 98,5/9/06 21:54,Major,2,Windows 95/98/ME,wireshark-bugs,arts,5/9/06 20:54,2006-05-09 21:54:04 UTC,jeff.morriss.ws
933,GTK+ UI,RESOLVED,FIXED,Installer still uses GTK-Wimp 0.6.2,7/12/06 9:15,Normal,3,Windows XP,wireshark-bugs,jaap.keuter,5/10/06 5:52,2006-07-12 09:15:39 UTC,jaap.keuter
934,GTK+ UI,RESOLVED,NOTOURBUG,"TCP Retransmits are classified as ""Out-of-Order""",6/9/06 23:16,Normal,3,Windows 2000,wireshark-bugs,jonathan,5/10/06 10:11,2006-06-09 23:16:23 UTC,ronniesahlberg
935,GTK+ UI,RESOLVED,FIXED,Flow Graph should show start time or absolute times,1/16/12 7:57,Enhancement,3,Linux (other),wireshark-bugs,toralf.foerster,5/11/06 4:04,2012-01-16 07:57:41 UTC,anders.broman
936,TShark,RESOLVED,DUPLICATE,tethereal do not support correctly '-b filesize:x' option,5/11/06 5:27,Normal,2,Linux (other),wireshark-bugs,carminiello,5/11/06 5:21,2006-05-11 05:27:09 UTC,jeff.morriss.ws
937,GTK+ UI,RESOLVED,DUPLICATE,windows dual screen config: window opens on the top left corner  which is off screen,7/10/08 10:19,Enhancement,3,Windows XP,wireshark-bugs,ckalk,5/11/06 5:32,2006-05-11 10:47:36 UTC,bugzilla-admin
938,GTK+ UI,RESOLVED,FIXED,ISUP IAM message marked as Malformed packet,5/11/06 15:34,Normal,3,Windows XP,wireshark-bugs,ppavosevic,5/11/06 7:43,2006-05-11 15:34:20 UTC,a.broman
939,GTK+ UI,RESOLVED,FIXED,Trying to save file with packet range does not work,8/22/06 19:45,Normal,3,Windows XP,wireshark-bugs,manstew,5/11/06 10:33,2006-08-22 19:45:07 UTC,ulf.lamping
940,GTK+ UI,RESOLVED,FIXED,eDonkey dissected as HSRP,11/24/06 6:04,Minor,5,Linux (other),wireshark-bugs,toralf.foerster,5/11/06 13:38,2006-11-24 06:04:57 UTC,stephenfisher
941,GTK+ UI,RESOLVED,NOTABUG,File -> Open,5/11/06 16:54,Normal,2,Windows XP,wireshark-bugs,scrmacdo,5/11/06 16:53,2006-05-11 16:54:53 UTC,scrmacdo
942,GTK+ UI,RESOLVED,FIXED,File -> Open dialog's Filter button does nothing,3/27/08 17:31,Normal,15,Windows XP,wireshark-bugs,scrmacdo,5/11/06 16:59,2008-03-27 17:31:25 UTC,gerald
943,GTK+ UI,RESOLVED,NOTOURBUG,Capture dialog tiles on popup,8/22/06 18:44,Trivial,2,Windows XP,wireshark-bugs,scrmacdo,5/11/06 17:11,2006-08-22 18:44:01 UTC,ulf.lamping
944,GTK+ UI,RESOLVED,NOTABUG,Ethereal cannot dissect gsm-map MT-ForwardSM returnResultLast,5/15/06 3:39,Normal,2,Windows XP,wireshark-bugs,palos,5/12/06 2:45,2006-05-15 03:39:44 UTC,anders.broman
945,GTK+ UI,RESOLVED,DUPLICATE,Multiple file capture  second and later cap files are single packets,5/12/06 8:51,Normal,2,Windows XP,wireshark-bugs,john.gwinner,5/12/06 8:37,2006-05-12 08:51:03 UTC,jeff.morriss.ws
946,GTK+ UI,RESOLVED,DUPLICATE,Toolbar Buttons Sometimes Unresponsive,1/12/07 3:20,Minor,4,Windows XP,wireshark-bugs,scrmacdo,5/12/06 9:41,2007-01-12 03:20:42 UTC,stephenfisher
947,GTK+ UI,RESOLVED,FIXED,Dropdown menus do not auto-cancel properly,1/10/07 3:14,Normal,2,Windows XP,wireshark-bugs,scrmacdo,5/12/06 9:47,2007-01-10 03:14:11 UTC,stephenfisher
948,GTK+ UI,RESOLVED,FIXED,Apply Capture Preferences not applying,11/16/06 7:05,Normal,3,All,wireshark-bugs,scrmacdo,5/12/06 10:10,2006-11-16 07:05:33 UTC,stephenfisher
949,GTK+ UI,RESOLVED,DUPLICATE,Ethereal crashes with filter containing multiple conditions,5/17/06 13:56,Critical,4,Windows XP,wireshark-bugs,david.madden,5/12/06 16:44,2006-05-17 13:56:36 UTC,david.madden
950,GTK+ UI,RESOLVED,DUPLICATE,'Err file enen.c: line 252: assertion failed: <ret == TRUE>',5/13/06 1:54,Normal,2,Windows 95/98/ME,wireshark-bugs,ethereal.forum,5/12/06 22:32,2006-05-13 01:54:02 UTC,guy
951,GTK+ UI,RESOLVED,FIXED,UMA: message URR_RELEASE not decoded corretly,5/15/06 15:24,Normal,2,All,wireshark-bugs,markus.meier,5/15/06 4:16,2006-05-15 15:24:21 UTC,a.broman
952,GTK+ UI,RESOLVED,FIXED,UMA: IE length-field of UMA-message can always be 2 bytes,5/15/06 15:24,Normal,2,All,wireshark-bugs,markus.meier,5/15/06 4:46,2006-05-15 15:24:35 UTC,a.broman
953,GTK+ UI,RESOLVED,FIXED,Incorrectly parsing SIP Contact information,12/22/09 12:33,Normal,7,Windows XP,wireshark-bugs,henry_chosta,5/15/06 13:19,2009-12-22 12:33:07 UTC,jaap.keuter
954,GTK+ UI,RESOLVED,FIXED,LDAP and other Statistics filter strings are limited to 255 chars,11/28/07 3:06,Major,6,Linux (other),wireshark-bugs,toralf.foerster,5/16/06 6:55,2007-11-28 03:06:10 UTC,stephenfisher
955,GTK+ UI,RESOLVED,FIXED,UMA: Handover Command message not decoded,5/17/06 13:12,Normal,3,All,wireshark-bugs,markus.meier,5/16/06 7:10,2006-05-17 13:12:12 UTC,a.broman
956,GTK+ UI,RESOLVED,FIXED,UMA: multirate-configuration not decoded correctly,10/9/12 9:50,Normal,2,All,wireshark-bugs,markus.meier,5/16/06 7:15,2006-05-17 13:12:37 UTC,bugzilla-admin
957,GTK+ UI,RESOLVED,FIXED,UMA: Received Signal Level List not decoded,5/17/06 13:13,Normal,2,All,wireshark-bugs,markus.meier,5/16/06 7:23,2006-05-17 13:13:21 UTC,a.broman
958,GTK+ UI,RESOLVED,FIXED,Graphical corruption,3/21/08 17:38,Minor,9,Windows XP,wireshark-bugs,scrmacdo,5/16/06 9:35,2008-03-21 17:38:39 UTC,stephenfisher
959,GTK+ UI,RESOLVED,NOTABUG,Drop Down List Displayed Incorrectly,11/24/06 23:39,Minor,2,Windows XP,wireshark-bugs,scrmacdo,5/16/06 9:37,2006-11-24 23:39:11 UTC,stephenfisher
960,TShark,RESOLVED,DUPLICATE,Running tethereal -b filesize results in [seeming] single-packet files upon first rollover,5/16/06 20:08,Critical,2,Linux (other),wireshark-bugs,aoz.syn,5/16/06 12:07,2006-05-16 20:08:01 UTC,jeff.morriss.ws
961,GTK+ UI,RESOLVED,FIXED,PGM does not recognize IPV6 NLA,7/1/06 19:20,Normal,5,Windows XP,wireshark-bugs,rameshnaik1,5/16/06 17:43,2006-07-01 19:20:31 UTC,jaap.keuter
962,Build process,RESOLVED,NOTABUG,'make' failed with Solaris 'make',1/26/15 22:33,Normal,11,Solaris,wireshark-bugs,henryjen,5/16/06 20:39,2007-11-12 20:48:55 UTC,guy
963,GTK+ UI,RESOLVED,NOTABUG,radius packet interpreted as sliMP3 protocol,5/17/06 8:43,Minor,3,Windows 2000,wireshark-bugs,michael.van.slingerland,5/17/06 7:24,2006-05-17 08:43:17 UTC,luis.ontanon
964,GTK+ UI,RESOLVED,WONTFIX,Win98SE: Can't get pathname of Ethereal: GetModuleFileName failed,7/30/14 20:04,Normal,22,Windows 95/98/ME,wireshark-bugs,ethereal.forum,5/17/06 16:03,2014-07-30 20:04:18 UTC,guy
965,GTK+ UI,RESOLVED,FIXED,Q.931 USER and NETWORK interchanged,9/22/06 7:40,Normal,2,Windows XP,wireshark-bugs,johann,5/18/06 3:13,2006-09-22 07:40:40 UTC,anders.broman
966,GTK+ UI,RESOLVED,NOTOURBUG,cygethereal-0.dll built without DEF (exports),11/23/07 23:17,Major,3,Windows XP,wireshark-bugs,richardvoigt,5/18/06 12:47,2007-11-23 23:17:36 UTC,ulf.lamping
967,GTK+ UI,RESOLVED,FIXED,crash on fuzzed SNMP capture,8/24/06 0:44,Critical,8,Linux (other),wireshark-bugs,thomas.anders,5/18/06 16:27,2006-08-23 18:46:10 UTC,anders.broman
968,GTK+ UI,RESOLVED,FIXED,"Ethereal v.0.99 crashes  if ""multiple files"" are used.",7/18/06 17:46,Normal,5,Windows Server 2003,wireshark-bugs,frank.elliger,5/19/06 3:32,2006-07-18 17:46:06 UTC,ulf.lamping
969,GTK+ UI,RESOLVED,DUPLICATE,"Ethereal v.0.99 crashes  if ""multiple files"" are used.",5/19/06 3:38,Normal,2,Windows Server 2003,wireshark-bugs,frank.elliger,5/19/06 3:33,2006-05-19 03:38:45 UTC,jeff.morriss.ws
971,GTK+ UI,RESOLVED,FIXED,Facility IE dissection error in GSM_DTAP,6/15/06 21:31,Minor,3,Windows XP,wireshark-bugs,palos,6/14/06 3:57,2006-06-15 21:31:30 UTC,anders.broman
972,GTK+ UI,RESOLVED,FIXED,Packet range: -8000 doesn't filter anything  1-8000 does work,9/14/06 10:31,Minor,3,All,wireshark-bugs,ulf.lamping,6/19/06 10:17,2006-09-14 10:31:32 UTC,ulf.lamping
973,GTK+ UI,RESOLVED,FIXED,if close Wireshark while it is minimized  next time you start it  can't un-minimize it,8/12/06 22:08,Minor,2,Windows 2000,wireshark-bugs,jeff.morriss.ws,6/20/06 8:16,2006-08-12 22:08:57 UTC,ulf.lamping
974,GTK+ UI,RESOLVED,FIXED,"RMCP dissector doesn't support ""Secure RMCP"" (ASF 2.0)",10/29/10 15:39,Normal,7,Windows XP,wireshark-bugs,swindell,6/21/06 20:27,2010-10-29 15:39:23 UTC,Christopher.Maynard
975,GTK+ UI,RESOLVED,DUPLICATE,1.1.0-SVN-18539 epan/Makefile missing gcrypt stuff,7/20/06 0:52,Major,4,Linux (other),wireshark-bugs,jgsack,6/22/06 5:42,2006-07-20 00:52:20 UTC,jeff.morriss.ws
976,TShark,RESOLVED,NOTOURBUG,Buildbot crash output: fuzz-2006-06-26-2594.pcap,2/11/07 5:11,Critical,7,Mac OS X 10.3,wireshark-bugs,buildbot-do-not-reply,6/26/06 21:15,2007-02-11 05:11:54 UTC,ulf.lamping
977,GTK+ UI,RESOLVED,NOTOURBUG,In H323 if the port is different then 1720 the H225 is not recognized,12/28/06 10:50,Major,3,Windows XP,wireshark-bugs,fmichael123,6/27/06 11:20,2006-12-28 10:50:30 UTC,anders.broman
978,GTK+ UI,RESOLVED,FIXED,"TIPC: Malformed Packet when valid ""Cluster Internal Connection Based Non-Routed Message""",6/29/06 6:34,Normal,5,Linux (other),wireshark-bugs,martinmeis,6/28/06 12:42,2006-06-29 06:34:37 UTC,anders.broman
979,GTK+ UI,RESOLVED,FIXED,TIPC: descriptions switched in dissected package,6/29/06 6:36,Minor,3,Linux (other),wireshark-bugs,martinmeis,6/28/06 15:55,2006-06-29 06:36:38 UTC,anders.broman
980,GTK+ UI,RESOLVED,FIXED,"TIPC: ""Source Droppable"" bit is missing in dissected message",6/29/06 6:33,Normal,3,Linux (other),wireshark-bugs,martinmeis,6/28/06 16:53,2006-06-29 06:33:34 UTC,anders.broman
981,GTK+ UI,RESOLVED,NOTOURBUG,re-ordering pppoed Tags,7/3/06 9:47,Trivial,3,Linux (other),wireshark-bugs,toralf.foerster,7/2/06 9:14,2006-07-03 09:47:32 UTC,jaap.keuter
982,GTK+ UI,RESOLVED,FIXED,Norton AV reporting a trojan in the 0.99.1pre1 Windows installer,7/4/06 15:07,Major,4,Windows XP,wireshark-bugs,gerald,7/3/06 17:41,2006-07-04 15:07:40 UTC,gerald
983,Documentation,RESOLVED,FIXED,"tethereal(1) manpage refers to non-existant ""capture file format"" section in ethereal(1) manpage",7/9/06 22:50,Minor,2,Linux (other),wireshark-bugs,cheal,7/4/06 5:32,2006-07-09 22:50:16 UTC,guy
984,GTK+ UI,RESOLVED,FIXED,"Warn Dissector bug  protocol SSL  in packet 189: packet-ber.c:1071: failed assertion ""eoffset > offset""",7/7/06 21:42,Normal,4,Linux (other),wireshark-bugs,toralf.foerster,7/7/06 15:31,2006-07-07 21:42:58 UTC,toralf.foerster
985,TShark,RESOLVED,FIXED,Buildbot crash output: fuzz-2006-07-07-11032.pcap,7/8/06 1:41,Critical,2,Mac OS X 10.3,wireshark-bugs,buildbot-do-not-reply,7/7/06 21:05,2006-07-08 01:41:16 UTC,gerald
986,GTK+ UI,RESOLVED,DUPLICATE,Win32: save to an existing filename asks twice,7/8/06 14:36,Normal,3,Windows XP,wireshark-bugs,ulf.lamping,7/8/06 13:49,2006-07-08 14:36:28 UTC,ulf.lamping
987,TShark,RESOLVED,FIXED,Buildbot crash output: fuzz-2006-07-09-348.pcap,7/19/06 10:03,Critical,2,Mac OS X 10.3,wireshark-bugs,buildbot-do-not-reply,7/9/06 20:05,2006-07-19 10:03:59 UTC,ronniesahlberg
988,Documentation,RESOLVED,FIXED,Buildbot crash output: fuzz-2006-07-09-13403.pcap,1/5/07 0:34,Critical,5,Mac OS X 10.3,wireshark-bugs,buildbot-do-not-reply,7/9/06 21:05,2007-01-05 00:34:07 UTC,stephenfisher
989,TShark,RESOLVED,FIXED,Buildbot crash output: fuzz-2006-07-09-6023.pcap,7/10/06 13:54,Critical,3,Mac OS X 10.3,wireshark-bugs,buildbot-do-not-reply,7/10/06 3:05,2006-07-10 13:53:46 UTC,gerald
990,GTK+ UI,RESOLVED,DUPLICATE,unexpected end of filter string,9/14/06 9:36,Minor,4,Linux (other),wireshark-bugs,toralf.foerster,7/10/06 10:38,2006-09-14 09:36:47 UTC,toralf.foerster
991,TShark,RESOLVED,DUPLICATE,Buildbot crash output: fuzz-2006-07-10-25724.pcap,7/10/06 13:54,Critical,2,Mac OS X 10.3,wireshark-bugs,buildbot-do-not-reply,7/10/06 11:05,2006-07-10 13:54:05 UTC,gerald
992,TShark,RESOLVED,FIXED,Stopping capture after specified time does not work properly,11/17/07 17:39,Major,3,Linux (other),wireshark-bugs,TBoehne,7/10/06 13:53,2007-11-17 17:39:10 UTC,sake
993,TShark,RESOLVED,FIXED,Buildbot crash output: fuzz-2006-07-10-12219.pcap,7/10/06 21:41,Critical,2,Mac OS X 10.3,wireshark-bugs,buildbot-do-not-reply,7/10/06 21:30,2006-07-10 21:41:56 UTC,bugzilla-admin
994,GTK+ UI,RESOLVED,NOTOURBUG,0.99Pre2  HTTP counter missing HTTP Reponses,10/26/08 10:10,Normal,4,All,wireshark-bugs,irwillumsen,7/11/06 15:37,2008-10-26 10:10:37 UTC,sake
995,GTK+ UI,RESOLVED,FIXED,Error when attempting to export a capture,7/18/06 17:41,Normal,4,Windows XP,wireshark-bugs,dave.brooks,7/11/06 15:49,2006-07-18 17:41:18 UTC,ulf.lamping
996,GTK+ UI,RESOLVED,FIXED,All RTP streams shown but cannot be analyzed,5/20/15 11:04,Normal,5,All,wireshark-bugs,jaap.keuter,7/12/06 9:26,2015-05-20 11:04:00 UTC,gerrit-do-not-reply
997,Dissection engine (libwireshark),RESOLVED,FIXED,A11 extention MSID incorrent and filter not work,10/3/12 0:58,Major,3,All,bugzilla-admin,simon.sui,7/12/06 9:47,2006-07-18 06:16:29 UTC,guy
998,TShark,RESOLVED,FIXED,Buildbot crash output: fuzz-2006-07-12-21273.pcap,7/12/06 18:27,Critical,4,Mac OS X 10.3,wireshark-bugs,buildbot-do-not-reply,7/12/06 15:20,2006-07-12 18:27:16 UTC,bugzilla-admin
999,TShark,RESOLVED,DUPLICATE,Buildbot crash output: fuzz-2006-07-12-26098.pcap,7/12/06 18:27,Critical,2,Mac OS X 10.3,wireshark-bugs,buildbot-do-not-reply,7/12/06 17:30,2006-07-12 18:27:27 UTC,bugzilla-admin
1000,TShark,RESOLVED,DUPLICATE,Buildbot crash output: fuzz-2006-07-12-5192.pcap,7/12/06 18:27,Critical,2,Mac OS X 10.3,wireshark-bugs,buildbot-do-not-reply,7/12/06 18:20,2006-07-12 18:27:48 UTC,bugzilla-admin
1001,GTK+ UI,RESOLVED,NOTOURBUG,free() invalid pointer in dissect_802_3 at packet-ieee8023.c:71,11/12/06 11:43,Major,28,Linux (other),wireshark-bugs,gentoo-a7x,7/13/06 21:16,2006-07-31 13:20:25 UTC,dgautheron
1002,GTK+ UI,RESOLVED,NOTABUG,wireshark is much slower then tshark,8/14/07 16:24,Normal,7,Linux (other),wireshark-bugs,toralf.foerster,7/14/06 9:32,2007-08-14 16:24:02 UTC,toralf.foerster
1003,GTK+ UI,RESOLVED,FIXED,GUI | When returning from the capture window to the main window  cannot click on the button,8/7/08 9:18,Minor,7,Windows XP,wireshark-bugs,_ib,7/15/06 21:02,2008-08-07 09:18:54 UTC,anders.broman
1004,GTK+ UI,RESOLVED,NOTABUG,Win98 compatible version available now?,7/17/06 2:07,Blocker,2,Windows 95/98/ME,wireshark-bugs,rickhg12hs,7/16/06 6:43,2006-07-17 02:07:33 UTC,jeff.morriss.ws
1005,GTK+ UI,RESOLVED,FIXED,Build can't find gcrypt.h from libgcrypt installed via DarwinPorts,7/17/06 19:56,Normal,4,Mac OS X 10.4,wireshark-bugs,stephenfisher,7/17/06 19:20,2006-07-17 19:56:35 UTC,jmayer
1006,GTK+ UI,RESOLVED,FIXED,wireshark link fails on systems with no TLS library but with grypt library (missing -lgrcyprt),7/20/06 0:52,Normal,5,Linux (other),wireshark-bugs,jeff.morriss.ws,7/18/06 2:05,2006-07-19 14:03:37 UTC,jeff.morriss.ws
1007,GTK+ UI,RESOLVED,FIXED,WireShark 0.99.2 doesn't work with winpcap 3.0,8/13/06 1:11,Normal,2,Windows 2000,wireshark-bugs,gena01,7/19/06 14:42,2006-08-13 01:11:16 UTC,ulf.lamping
1008,GTK+ UI,RESOLVED,DUPLICATE,Replace existing file under save as fails,7/19/06 18:49,Minor,2,Windows 2000,wireshark-bugs,stephenfisher,7/19/06 18:40,2006-07-19 18:49:48 UTC,stephenfisher
1009,GTK+ UI,RESOLVED,FIXED,XML dissector frees wrong object,7/20/06 17:32,Blocker,2,All,wireshark-bugs,wireshark,7/19/06 19:03,2006-07-20 17:32:43 UTC,luis.ontanon
1010,GTK+ UI,RESOLVED,FIXED,xml dtd parsing of element and attribute names is incorrect,7/20/06 17:25,Normal,8,All,wireshark-bugs,wireshark,7/19/06 20:02,2006-07-20 17:25:13 UTC,luis.ontanon
1011,GTK+ UI,RESOLVED,FIXED,Dissectors crash when wireshark is built with -DNDEBUG,3/16/07 10:13,Normal,7,Linux (other),wireshark-bugs,zlynx,7/21/06 0:17,2007-03-16 10:13:50 UTC,jeff.morriss.ws
1012,GTK+ UI,RESOLVED,FIXED,H225 Dissector Bug & VoIP Calls graph not OK,7/31/06 16:37,Normal,4,Windows XP,wireshark-bugs,aoosterlinck,7/21/06 15:34,2006-07-31 16:37:19 UTC,aoosterlinck
1013,GTK+ UI,RESOLVED,FIXED,Patch that adds --display to wireshark command line help,8/13/06 0:14,Enhancement,5,FreeBSD,wireshark-bugs,stephenfisher,7/22/06 0:36,2006-08-13 00:14:13 UTC,ulf.lamping
1014,GTK+ UI,RESOLVED,FIXED,unable to build due to missing packet-per.h,8/10/06 9:03,Normal,6,Solaris,wireshark-bugs,io,7/25/06 20:35,2006-08-10 09:03:23 UTC,jmayer
1015,GTK+ UI,RESOLVED,FIXED,buffer overflow in nettl.c due renaming ethereal,7/27/06 8:23,Normal,6,Linux (other),wireshark-bugs,postadal,7/25/06 23:58,2006-07-26 06:40:30 UTC,jmayer
1016,GTK+ UI,RESOLVED,FIXED,Compilation fails on OpenBSD 3.9,8/13/06 17:18,Normal,9,OpenBSD,wireshark-bugs,clock,7/26/06 12:45,2006-08-13 17:18:33 UTC,jmayer
1017,GTK+ UI,RESOLVED,FIXED,Add http connect subdissector support to packet-http.c,8/17/06 20:16,Enhancement,4,FreeBSD,wireshark-bugs,stephenfisher,7/26/06 21:35,2006-08-17 20:16:23 UTC,stephenfisher
1018,GTK+ UI,RESOLVED,FIXED,Add device and port id to info column of cdp frames,8/2/06 16:58,Enhancement,3,FreeBSD,wireshark-bugs,stephenfisher,7/26/06 21:50,2006-08-02 16:58:07 UTC,anders.broman
1019,GTK+ UI,RESOLVED,FIXED,Add TCP support to the time protocol dissector,8/2/06 17:02,Enhancement,3,FreeBSD,wireshark-bugs,stephenfisher,7/26/06 21:58,2006-08-02 17:02:23 UTC,anders.broman
1020,GTK+ UI,RESOLVED,FIXED,New dissector: daytime protocol,8/2/06 17:13,Enhancement,3,FreeBSD,wireshark-bugs,stephenfisher,7/26/06 22:12,2006-08-02 17:13:50 UTC,anders.broman
1021,GTK+ UI,RESOLVED,FIXED,COM interfaces registry lookup feature broken,7/26/06 22:30,Normal,2,Windows XP,wireshark-bugs,jbm.lists,7/26/06 22:25,2006-07-26 22:30:38 UTC,jbm.lists
1022,TShark,RESOLVED,FIXED,Loss run length in RTCP Extended Report (XR) is not correctly displayed.,7/28/06 16:43,Normal,2,All,wireshark-bugs,luis.ontanon,7/28/06 16:35,2006-07-28 16:43:11 UTC,luis.ontanon
1023,GTK+ UI,RESOLVED,FIXED,"""apply as filter"" doesn't work for content of an PPP IPCP packet",8/2/06 11:10,Minor,5,Linux (other),wireshark-bugs,toralf.foerster,7/30/06 8:33,2006-08-02 11:10:02 UTC,martin.mathieson
1024,GTK+ UI,RESOLVED,LATER,0.99.2 crashes on big/long capture,8/6/06 22:39,Major,9,Windows XP,wireshark-bugs,graeme.nelson,7/31/06 1:03,2006-07-31 08:25:15 UTC,graeme.nelson
1025,GTK+ UI,RESOLVED,FIXED,dhcp packet crashes wireshark,8/20/06 21:21,Major,10,Windows XP,wireshark-bugs,nathan.scarlett,8/1/06 12:02,2006-08-12 21:10:03 UTC,ulf.lamping
1026,TShark,RESOLVED,FIXED,"Invalid characters in PDML output when a packet containing ""aim.sst.icon"" is found (a AOL AIM message)",11/7/06 21:19,Normal,8,All,wireshark-bugs,paul.blankenbaker,8/1/06 19:11,2006-11-07 21:19:29 UTC,guy
1027,GTK+ UI,RESOLVED,FIXED,Length in UDP header is shown as bogus when including Options in IPv6,8/3/06 20:25,Minor,4,Windows XP,wireshark-bugs,Frank,8/2/06 13:19,2006-08-03 20:25:13 UTC,jaap.keuter
1028,GTK+ UI,RESOLVED,FIXED,wireshark.desktop still contains old project name,8/2/06 13:47,Trivial,2,All,wireshark-bugs,peter.kovar,8/2/06 13:37,2006-08-02 13:47:54 UTC,jmayer
1029,TShark,RESOLVED,LATER,"Tshark -R doesn't support ""frame.time >= Jul 20  2006 17:51:38.368""",10/29/10 16:17,Normal,10,Windows XP,wireshark-bugs,david,8/3/06 13:53,2010-10-29 16:17:25 UTC,jeff.morriss.ws
1030,GTK+ UI,RESOLVED,FIXED,TCP RTT calculations not displayed in detail decode.,10/24/06 8:04,Normal,2,Windows XP,wireshark-bugs,brent.robbins,8/3/06 14:23,2006-10-24 08:04:12 UTC,ronniesahlberg
1031,GTK+ UI,RESOLVED,DUPLICATE,"Vertical scroll bar of the ""Packet List"" pane does not refresh appropriately",8/7/06 6:48,Normal,2,Windows 2000,wireshark-bugs,gussabina,8/5/06 16:30,2006-08-07 06:48:20 UTC,jaap.keuter
1033,GTK+ UI,RESOLVED,FIXED,"Crash when ""Following TCP Stream"" in large packets",10/6/06 15:19,Blocker,5,Linux (other),wireshark-bugs,oscar+wiresharkbugzilla,8/6/06 17:59,2006-10-06 15:19:06 UTC,oscar+wiresharkbugzilla
1034,GTK+ UI,RESOLVED,FIXED,Segfault when dissecting iSCSI traffic,8/7/06 14:40,Normal,3,Linux (other),wireshark-bugs,fpeters,8/7/06 14:11,2006-08-07 14:40:50 UTC,gerald
1035,GTK+ UI,RESOLVED,FIXED,SSL Message Interpretation,4/3/07 13:24,Normal,5,Windows XP,wireshark-bugs,Gary.Chaulklin,8/8/06 19:30,2007-04-03 13:24:59 UTC,Gary.Chaulklin
1036,GTK+ UI,RESOLVED,FIXED,m3ua ANSI 24-bit Point Code byte order,9/14/06 10:52,Normal,8,Linux (other),jmayer,xoid,8/9/06 18:35,2006-09-14 10:52:34 UTC,jmayer
1037,GTK+ UI,RESOLVED,FIXED,Support for MOBIKE extension to IKEv2 in ISAKMP dissector,8/10/06 3:13,Enhancement,3,Linux (other),wireshark-bugs,efung,8/9/06 19:57,2006-08-10 03:13:40 UTC,jmayer
1038,GTK+ UI,RESOLVED,FIXED,Wireshark preference window too large ~ buttons outside of screen!,8/22/06 18:55,Normal,3,Linux (other),wireshark-bugs,charmender,8/9/06 22:12,2006-08-22 18:55:03 UTC,ulf.lamping
1039,GTK+ UI,RESOLVED,DUPLICATE,"can't start wireshark -- ""cant get pathname of wireshark""",1/5/07 13:50,Normal,3,Windows 95/98/ME,wireshark-bugs,paulh177,8/10/06 19:27,2006-08-12 21:30:12 UTC,kheal
1040,GTK+ UI,RESOLVED,FIXED,imap packet: not all infos are displayed,10/26/06 15:49,Minor,3,Linux (other),wireshark-bugs,toralf.foerster,8/11/06 8:57,2006-10-26 15:49:08 UTC,stephenfisher
1041,GTK+ UI,RESOLVED,NOTABUG,802.11 frame data not decoded,7/31/08 4:59,Normal,9,Mac OS X 10.4,wireshark-bugs,steve,8/11/06 21:59,2008-07-31 04:59:21 UTC,anders.broman
1042,GTK+ UI,VERIFIED,FIXED,Can't recognize RTP-event as in previous versions.,9/5/06 7:46,Major,7,Windows XP,wireshark-bugs,ofir.gal,8/16/06 14:20,2006-09-05 07:45:32 UTC,ofir.gal
1043,GTK+ UI,RESOLVED,FIXED,ASCII display in Stream Content window is missing characters,3/5/07 17:28,Major,11,Windows XP,wireshark-bugs,ddaney,8/18/06 5:54,2006-11-03 13:18:24 UTC,gerald
1044,GTK+ UI,RESOLVED,FIXED,patch for epan/dissectors/packet-ntp.c,8/23/06 15:51,Normal,4,Linux (other),wireshark-bugs,toralf.foerster,8/18/06 20:31,2006-08-23 15:51:59 UTC,jaap.keuter
1045,GTK+ UI,RESOLVED,FIXED,TCP Window in SYN packet,9/10/06 14:35,Minor,2,Linux (other),wireshark-bugs,rani,8/19/06 0:52,2006-09-10 14:35:27 UTC,ronniesahlberg
1046,TShark,RESOLVED,FIXED,Buildbot crash output: fuzz-2006-08-20-13888.pcap,8/22/06 16:09,Critical,2,Mac OS X 10.3,wireshark-bugs,buildbot-do-not-reply,8/20/06 19:20,2006-08-22 16:09:24 UTC,gerald
1047,GTK+ UI,RESOLVED,FIXED,64bit counters in SNMP response do not show correct values,8/23/06 8:06,Major,4,Windows 2000,wireshark-bugs,vip,8/21/06 14:49,2006-08-23 08:06:34 UTC,ronniesahlberg
1048,TShark,RESOLVED,FIXED,Buildbot crash output: fuzz-2006-08-21-10372.pcap,8/22/06 15:56,Critical,2,Mac OS X 10.3,wireshark-bugs,buildbot-do-not-reply,8/21/06 17:50,2006-08-22 15:56:52 UTC,gerald
1049,GTK+ UI,RESOLVED,DUPLICATE,Linefeeds added to every line when using Follow TCP Stream and Save as text,1/8/07 4:25,Normal,3,Windows XP,wireshark-bugs,jkoorts,8/23/06 14:52,2007-01-08 04:25:06 UTC,stephenfisher
1050,TShark,RESOLVED,FIXED,Buildbot crash output: fuzz-2006-08-23-6489.pcap,8/24/06 22:05,Critical,2,Mac OS X 10.3,wireshark-bugs,buildbot-do-not-reply,8/23/06 20:30,2006-08-24 22:05:40 UTC,gerald
1051,GTK+ UI,RESOLVED,DUPLICATE,unable to overwrite files with GTK2 user interface.,8/25/06 12:36,Major,7,Windows XP,wireshark-bugs,frank-buettner,8/24/06 6:51,2006-08-25 12:36:51 UTC,jeff.morriss.ws
1052,GTK+ UI,RESOLVED,NOTOURBUG,Recieved error message when trying to access capture panel or list available interfaces,12/28/06 10:55,Major,3,Windows XP,wireshark-bugs,madifor,8/24/06 12:22,2006-12-28 10:55:11 UTC,anders.broman
1053,GTK+ UI,RESOLVED,FIXED,New SNMP filtering is broken,11/2/06 8:50,Major,11,FreeBSD,wireshark-bugs,jclarke,8/25/06 7:12,2006-11-02 08:50:05 UTC,tomas.kukosa
1054,GTK+ UI,RESOLVED,FIXED,crash on fuzzed LDAP capture,9/5/06 15:15,Critical,3,Linux (other),wireshark-bugs,thomas.anders,8/25/06 14:35,2006-09-05 15:15:18 UTC,ronniesahlberg
1055,GTK+ UI,RESOLVED,FIXED,Crash at start a new capture (after loading a file through command line),8/26/06 18:50,Major,2,All,wireshark-bugs,ulf.lamping,8/25/06 14:38,2006-08-26 18:50:27 UTC,guy
1056,GTK+ UI,RESOLVED,FIXED,Timestamping seems to be broken,5/21/07 20:42,Minor,7,Windows XP,wireshark-bugs,aaron.isotton,8/25/06 14:47,2007-05-21 20:42:56 UTC,stephenfisher
1057,GTK+ UI,RESOLVED,FIXED,compile error: dlg_utils.c: In function `dlg_button_row_new':,8/25/06 19:13,Normal,3,Linux (other),wireshark-bugs,toralf.foerster,8/25/06 15:52,2006-08-25 19:13:24 UTC,ulf.lamping
1058,GTK+ UI,RESOLVED,FIXED,ESP Protocol Preferences refuses to accept 192 bit key for 3DES,10/24/14 21:43,Blocker,4,Linux (other),wireshark-bugs,jharvell,8/25/06 20:48,2006-09-07 15:32:29 UTC,wmeier
1059,GTK+ UI,RESOLVED,FIXED,Compilation error for 0.99.3 under Mac OS X,8/26/06 1:03,Blocker,2,All,wireshark-bugs,marius,8/26/06 0:21,2006-08-26 01:03:08 UTC,guy
1060,GTK+ UI,RESOLVED,FIXED,"""Filter Field Reference"" points to non-existing content",9/18/06 22:23,Minor,3,Windows XP,wireshark-bugs,sake,8/26/06 5:47,2006-09-18 22:23:36 UTC,gerald
1061,GTK+ UI,RESOLVED,FIXED,"""Protocol preferences..."" opens the default preferences tab instead of the protocol preferences tab",8/28/06 22:57,Normal,2,All,wireshark-bugs,sake,8/26/06 9:09,2006-08-28 22:57:58 UTC,ulf.lamping
1062,GTK+ UI,RESOLVED,NOTABUG,No network access after Wireshark Installation,8/26/06 12:12,Blocker,1,Windows XP,wireshark-bugs,info,8/26/06 12:04,2006-08-26 12:12:17 UTC,info
1063,Documentation,RESOLVED,FIXED,Missed change for Ethereal due to typo,8/27/06 11:47,Trivial,2,Windows XP,wireshark-bugs,sshnug.si,8/26/06 12:24,2006-08-27 11:47:48 UTC,ulf.lamping
1064,TShark,RESOLVED,FIXED,Buildbot crash output: fuzz-2006-08-26-17686.pcap,8/28/06 2:15,Critical,11,Mac OS X 10.3,wireshark-bugs,buildbot-do-not-reply,8/26/06 17:20,2006-08-28 02:07:29 UTC,bugzilla-admin
1065,TShark,RESOLVED,DUPLICATE,Buildbot crash output: fuzz-2006-08-26-7561.pcap,8/28/06 2:09,Critical,2,Mac OS X 10.3,wireshark-bugs,buildbot-do-not-reply,8/26/06 19:00,2006-08-28 02:09:24 UTC,bugzilla-admin
1066,TShark,RESOLVED,DUPLICATE,Buildbot crash output: fuzz-2006-08-26-27284.pcap,8/28/06 2:10,Critical,2,Mac OS X 10.3,wireshark-bugs,buildbot-do-not-reply,8/26/06 20:40,2006-08-28 02:10:56 UTC,bugzilla-admin
1067,TShark,RESOLVED,DUPLICATE,Buildbot crash output: fuzz-2006-08-27-10793.pcap,8/28/06 2:11,Critical,2,Mac OS X 10.3,wireshark-bugs,buildbot-do-not-reply,8/27/06 9:30,2006-08-28 02:11:36 UTC,bugzilla-admin
1068,TShark,RESOLVED,DUPLICATE,Buildbot crash output: fuzz-2006-08-27-677.pcap,8/28/06 2:12,Critical,2,Mac OS X 10.3,wireshark-bugs,buildbot-do-not-reply,8/27/06 10:40,2006-08-28 02:12:31 UTC,bugzilla-admin
1069,TShark,RESOLVED,DUPLICATE,Buildbot crash output: fuzz-2006-08-27-23430.pcap,8/28/06 2:13,Critical,2,Mac OS X 10.3,wireshark-bugs,buildbot-do-not-reply,8/27/06 11:40,2006-08-28 02:13:02 UTC,bugzilla-admin
1070,TShark,RESOLVED,DUPLICATE,Buildbot crash output: fuzz-2006-08-27-13147.pcap,8/28/06 2:13,Critical,2,Mac OS X 10.3,wireshark-bugs,buildbot-do-not-reply,8/27/06 13:50,2006-08-28 02:13:35 UTC,bugzilla-admin
1071,TShark,RESOLVED,DUPLICATE,Buildbot crash output: fuzz-2006-08-27-19853.pcap,8/28/06 2:14,Critical,2,Mac OS X 10.3,wireshark-bugs,buildbot-do-not-reply,8/27/06 14:40,2006-08-28 02:14:04 UTC,bugzilla-admin
1072,TShark,RESOLVED,DUPLICATE,Buildbot crash output: fuzz-2006-08-27-8027.pcap,8/28/06 2:14,Critical,2,Mac OS X 10.3,wireshark-bugs,buildbot-do-not-reply,8/27/06 20:10,2006-08-28 02:14:38 UTC,bugzilla-admin
1073,TShark,RESOLVED,DUPLICATE,Buildbot crash output: fuzz-2006-08-27-26008.pcap,8/28/06 2:15,Critical,2,Mac OS X 10.3,wireshark-bugs,buildbot-do-not-reply,8/27/06 21:30,2006-08-28 02:15:05 UTC,bugzilla-admin
1075,TShark,RESOLVED,FIXED,tshark -b duration:value bug,3/1/07 3:16,Normal,3,Windows XP,wireshark-bugs,frasten,8/28/06 8:18,2007-03-01 03:16:38 UTC,jeff.morriss.ws
1076,GTK+ UI,RESOLVED,FIXED,RTP analysis' jitter values are thrown off by RTP events,9/4/07 5:32,Major,5,Windows XP,wireshark-bugs,alex,8/28/06 14:45,2007-09-04 05:32:38 UTC,anders.broman
1077,GTK+ UI,RESOLVED,FIXED,Bad array initialisation leads to a crash,8/29/06 16:34,Normal,4,Linux (other),wireshark-bugs,florent.drouin,8/29/06 12:01,2006-08-29 12:18:46 UTC,florent.drouin
1078,GTK+ UI,RESOLVED,FIXED,If gnutls libraries are in funny places  CPPFLAGS aren't set appropriately,8/31/06 13:15,Trivial,4,Linux (other),wireshark-bugs,jsberg,8/29/06 18:44,2006-08-31 13:15:53 UTC,jmayer
1079,TShark,RESOLVED,FIXED,Buildbot crash output: fuzz-2006-08-30-7254.pcap,9/5/06 14:32,Critical,2,Mac OS X 10.3,wireshark-bugs,buildbot-do-not-reply,8/30/06 21:10,2006-09-05 14:32:54 UTC,ronniesahlberg
1080,GTK+ UI,RESOLVED,FIXED,"Megaco ""Malformed Packet""",9/2/06 15:51,Normal,4,Windows XP,wireshark-bugs,leigh.fiddes,8/31/06 0:55,2006-09-02 15:51:04 UTC,anders.broman
1081,GTK+ UI,RESOLVED,FIXED,scrolling,12/4/06 22:54,Minor,4,Windows XP,wireshark-bugs,martdaw,8/31/06 2:10,2006-12-04 22:54:53 UTC,jaap.keuter
1082,GTK+ UI,RESOLVED,NOTOURBUG,incorrect merging,2/11/07 5:21,Normal,3,Windows XP,wireshark-bugs,martdaw,8/31/06 2:33,2007-02-11 05:21:06 UTC,ulf.lamping
1083,GTK+ UI,RESOLVED,FIXED,compilation broken since updated to revision 19100,9/1/06 7:14,Normal,2,Linux (other),wireshark-bugs,toralf.foerster,8/31/06 16:28,2006-09-01 07:14:36 UTC,toralf.foerster
1084,Dissection engine (libwireshark),CONFIRMED, ---,Handle packet data encoded using base64  uuencode  etc.,4/12/13 12:08,Enhancement,5,All,bugzilla-admin,wireshark,9/1/06 0:11,,guy
1085,GTK+ UI,RESOLVED,FIXED,FCS presence identification not working,10/25/06 15:17,Normal,5,Windows XP,gram,jwright,9/1/06 14:34,2006-10-25 15:17:20 UTC,gram
1087,GTK+ UI,RESOLVED,FIXED,Ethereal 0.10.14-16.5 & 0.10.14-16.8 segfault sniffing samba traffic,7/10/08 10:19,Critical,7,Linux (other),wireshark-bugs,sorensenj,9/2/06 9:31,2006-09-03 03:16:43 UTC,bugzilla-admin
1088,GTK+ UI,RESOLVED,FIXED,SNMP Object Names not displayed in the info column,3/9/08 14:19,Major,10,All,wireshark-bugs,joel.kergozou,9/3/06 5:02,2008-03-09 14:19:04 UTC,stig
1089,GTK+ UI,RESOLVED,NOTOURBUG,doesn't log all the SNMP packets,12/28/06 10:59,Major,4,Linux (other),wireshark-bugs,elie_cohen,9/3/06 6:17,2006-12-28 10:59:25 UTC,anders.broman
1090,GTK+ UI,RESOLVED,NOTABUG,Windows messenger protocol wronlgy dissected as ICMP,9/4/06 8:44,Normal,4,Linux (other),wireshark-bugs,toralf.foerster,9/3/06 10:12,2006-09-04 08:39:20 UTC,jaap.keuter
1091,GTK+ UI,RESOLVED,FIXED,"Ethereal is closed after selecting ""Decode As"".",9/11/06 20:36,Major,4,Windows XP,wireshark-bugs,pierrick.cerisier,9/4/06 9:52,2006-09-11 20:36:21 UTC,anders.broman
1092,GTK+ UI,RESOLVED,FIXED,TFTP last packet not recognized when larger than 511 bytes,9/5/06 15:59,Normal,5,Windows XP,wireshark-bugs,ayvalr,9/4/06 11:12,2006-09-05 15:59:21 UTC,jmayer
1093,GTK+ UI,RESOLVED,FIXED,IKEv2 short-type attribute type value is not decoded properly,9/5/06 12:23,Trivial,2,All,wireshark-bugs,atsushi.fukumoto,9/5/06 9:40,2006-09-05 12:23:05 UTC,jaap.keuter
1094,Documentation,RESOLVED,FIXED,typo in decode string,12/28/06 11:02,Trivial,5,All,wireshark-bugs,atsushi.fukumoto,9/5/06 10:59,2006-12-28 11:02:35 UTC,anders.broman
1096,GTK+ UI,RESOLVED,FIXED,Installation Problem,11/4/06 9:07,Blocker,16,Windows XP,wireshark-bugs,ocsrdo,9/9/06 10:16,2006-11-04 09:07:58 UTC,jaap.keuter
1097,GTK+ UI,RESOLVED,FIXED,Dissector bug  protocol SNMP: STATUS_ACCESS_VIOLATION: dissector accessed an invalid memory address,12/1/06 9:04,Critical,6,Windows XP,wireshark-bugs,maksim.vaisbrot,9/11/06 13:05,2006-12-01 09:04:37 UTC,anders.broman
1098,GTK+ UI,RESOLVED,FIXED,STP not decoded,9/12/06 12:58,Normal,4,Windows XP,wireshark-bugs,nick.lewis,9/12/06 7:49,2006-09-12 12:58:50 UTC,jaap.keuter
1099,TShark,RESOLVED,DUPLICATE,Fatal: Could not acquire crypto context from Windows.,9/20/06 17:42,Major,4,Windows XP,wireshark-bugs,steve,9/12/06 15:41,2006-09-20 17:42:47 UTC,gerald
1100,GTK+ UI,RESOLVED,NOTOURBUG,IO Graphs: Display filter colour syntax highlighting no longer shows,6/29/07 13:39,Minor,8,Linux (other),wireshark-bugs,martin.mathieson,9/12/06 17:20,2007-06-29 13:39:05 UTC,martin.mathieson
1101,Dissection engine (libwireshark),RESOLVED,DUPLICATE,MSSQL TDS traffic no longer parses well. Maybe due to MSSQL 2005?,1/24/17 21:41,Normal,4,All,wireshark-bugs,mwreynolds,9/14/06 4:25,2008-12-05 16:06:00 UTC,guy
1102,GTK+ UI,RESOLVED,FIXED,Japan MTP3 PCs not set in columns if unstructured display,9/18/06 10:15,Minor,4,All,wireshark-bugs,jeff.morriss.ws,9/14/06 6:36,2006-09-18 10:15:19 UTC,jmayer
1103,GTK+ UI,RESOLVED,FIXED,Incorrect ICMPv6 checksum calculation in messages with Home Address Option or Routing Header type 2,5/8/07 22:25,Minor,4,Linux (other),wireshark-bugs,wild,9/14/06 7:55,2007-05-08 22:25:46 UTC,jaap.keuter
1104,Documentation,RESOLVED,NOTABUG,make: *** [release-notes.txt] Error 127,9/14/06 11:21,Minor,2,Linux (other),wireshark-bugs,toralf.foerster,9/14/06 8:01,2006-09-14 11:21:37 UTC,jmayer
1105,Extras,RESOLVED,REMIND,editcap: new features,9/15/06 8:38,Enhancement,2,Windows XP,wireshark-bugs,jono,9/14/06 16:25,2006-09-15 08:38:44 UTC,jaap.keuter
1106,GTK+ UI,RESOLVED,FIXED,packet-lapd.c change on 2006-03-02 (17452) by etxrab swaps SRC/DST for the default case,9/21/06 19:41,Normal,2,Linux (other),wireshark-bugs,rolf.fiedler,9/14/06 18:53,2006-09-21 19:41:14 UTC,anders.broman
1107,GTK+ UI,RESOLVED,FIXED,The UMA decoder has some bugs,9/17/06 19:43,Normal,2,All,wireshark-bugs,jaap.keuter,9/15/06 8:27,2006-09-17 19:43:49 UTC,anders.broman
1108,Documentation,RESOLVED,NOTABUG,release-notes.txt not build using links or lynx,3/16/07 9:11,Minor,9,Linux (other),wireshark-bugs,toralf.foerster,9/15/06 13:35,2007-03-16 09:11:35 UTC,toralf.foerster
1109,GTK+ UI,RESOLVED,FIXED,"Ability to do ""greater than"" display filter on http content lenth",11/18/06 1:10,Enhancement,4,Windows Server 2003,wireshark-bugs,mwreynolds,9/17/06 20:24,2006-10-25 21:17:56 UTC,stephenfisher
1110,TShark,VERIFIED,FIXED,Invalid characters in show attribute in PDML output,10/29/06 7:34,Normal,19,Linux (other),wireshark-bugs,paul.blankenbaker,9/18/06 11:08,2006-09-28 19:13:54 UTC,pierre.juhen
1111,GTK+ UI,RESOLVED,NOTOURBUG,Limitation of Information field and output truncated,4/5/07 23:38,Normal,13,Linux (other),wireshark-bugs,postadal,9/18/06 17:39,2007-04-05 23:38:26 UTC,alpha096
1112,TShark,RESOLVED,WORKSFORME,Buildbot crash output: fuzz-2006-09-19-5138.pcap,10/16/06 17:58,Critical,3,Mac OS X 10.3,wireshark-bugs,buildbot-do-not-reply,9/20/06 0:30,2006-10-16 17:58:22 UTC,gerald
1113,GTK+ UI,RESOLVED,FIXED,Several crash when SE_DEBUG_FREE used,3/17/08 17:53,Normal,6,Linux (other),wireshark-bugs,florent.drouin,9/20/06 8:52,2008-03-17 17:53:59 UTC,jeff.morriss.ws
1114,GTK+ UI,RESOLVED,FIXED, @SHELL@ not replaced in idl2wrs,11/22/11 7:53,Major,7,Solaris,wireshark-bugs,io,9/20/06 13:32,2006-10-30 18:19:19 UTC,balint
1115,GTK+ UI,RESOLVED,NOTABUG,Users shouldn't have to accept GNU GPL,9/21/06 6:15,Normal,2,Windows 2000,wireshark-bugs,shawn-wireshark,9/20/06 15:42,2006-09-21 06:15:55 UTC,jaap.keuter
1116,GTK+ UI,RESOLVED,NOTABUG,Can't capture on an IP-over-InfiniBand interface in RHEL 4,9/20/06 17:47,Normal,2,Linux (other),wireshark-bugs,guy,9/20/06 17:42,2006-09-20 17:47:55 UTC,guy
1117,GTK+ UI,VERIFIED,FIXED,Crash on next action when Flow graph window is opened,12/1/06 8:30,Minor,5,Windows XP,wireshark-bugs,florent.drouin,9/21/06 12:26,2006-12-01 02:57:08 UTC,florent.drouin
1118,GTK+ UI,RESOLVED,WONTFIX,Mergecap should be able to get infile list from a text file,7/30/14 20:05,Enhancement,2,Windows XP,wireshark-bugs,cp,9/21/06 14:55,2014-07-30 20:05:37 UTC,guy
1119,GTK+ UI,RESOLVED,FIXED,SSL dissector not decrypting SSLv3 and TLS 1.0 traffic (only tested in win32),3/20/15 21:57,Major,3,Windows XP,wireshark-bugs,phantal,9/21/06 17:33,2006-12-28 12:21:06 UTC,ian.vanhoudt
1120,GTK+ UI,RESOLVED,NOTABUG,packet-text-media doesn't setup a heur_dissector_list or call dissector_try_heuristic,9/25/06 5:32,Blocker,2,Windows XP,wireshark-bugs,phantal,9/21/06 19:06,2006-09-25 05:32:45 UTC,anders.broman
1121,GTK+ UI,RESOLVED,NOTABUG,new dissector for IBMLotus Sametime Protocol,1/3/07 10:50,Enhancement,8,Linux (other),wireshark-bugs,toralf.foerster,9/22/06 15:10,2007-01-03 10:50:25 UTC,toralf.foerster
1122,GTK+ UI,RESOLVED,FIXED,Wrong pdml output,10/29/06 7:35,Major,3,Linux (other),wireshark-bugs,pierre.juhen,9/24/06 11:51,2006-10-29 07:35:36 UTC,pierre.juhen
1123,GTK+ UI,RESOLVED,FIXED,Index multiple instances of the same field name to reduce preferences file size,6/3/11 5:12,Enhancement,22,All,wireshark-bugs,ulf.lamping,9/24/06 17:16,2011-06-02 00:19:51 UTC,alexis.lagoutte
1124,GTK+ UI,RESOLVED,DUPLICATE,Application level protocol PDUs not dissected properly if minimal header broken across packets,5/12/08 3:35,Major,16,Linux (other),wireshark-bugs,jhoger,9/25/06 5:46,2008-05-12 03:35:28 UTC,florent.drouin
1125,GTK+ UI,RESOLVED,FIXED,Not decoding SNMP trap agent address if data length is not equal to 4,4/5/07 22:18,Normal,11,All,wireshark-bugs,k.pause,9/26/06 20:59,2007-04-05 22:18:27 UTC,luis.ontanon
1126,GTK+ UI,RESOLVED,FIXED,check_col returning false when it shouldn't,11/19/06 7:44,Major,9,Windows XP,wireshark-bugs,phantal,9/27/06 15:06,2006-11-19 07:44:53 UTC,stephenfisher
1128,GTK+ UI,RESOLVED,FIXED,samr.opnum==nn display filter no longer works,11/18/06 1:04,Normal,8,Windows XP,wireshark-bugs,mwreynolds,9/28/06 0:50,2006-11-01 09:25:22 UTC,ronniesahlberg
1129,Build process,RESOLVED,FIXED,"idl2wrs produces invalid procedure names if input file name contains a ""-""",1/27/15 0:12,Minor,5,Linux (other),wireshark-bugs,martinmeis,9/28/06 10:33,2011-02-13 17:46:13 UTC,guy
1130,GTK+ UI,RESOLVED,DUPLICATE,Will not launch after installing,9/28/06 20:47,Major,2,Windows XP,wireshark-bugs,jsarcone,9/28/06 16:35,2006-09-28 20:47:24 UTC,gerald
1133,GTK+ UI,RESOLVED,FIXED,Crash in packet-xot.c: 126,9/29/06 19:42,Major,4,Linux (other),wireshark-bugs,florent.drouin,9/29/06 11:50,2006-09-29 19:42:06 UTC,jaap.keuter
1134,TShark,RESOLVED,FIXED,Buildbot crash output: fuzz-2006-09-29-18465.pcap,10/16/06 18:45,Critical,3,Mac OS X 10.3,wireshark-bugs,buildbot-do-not-reply,9/30/06 2:40,2006-10-16 18:45:14 UTC,gerald
1135,TShark,RESOLVED,FIXED,Buildbot crash output: fuzz-2006-09-29-28586.pcap,10/16/06 23:17,Critical,2,Mac OS X 10.3,wireshark-bugs,buildbot-do-not-reply,9/30/06 3:40,2006-10-16 23:17:19 UTC,ulf.lamping
1136,GTK+ UI,RESOLVED,FIXED,TCP checksum validation,4/1/07 15:42,Minor,11,Windows XP,wireshark-bugs,nishikawa.shun,10/1/06 9:56,2007-04-01 15:42:57 UTC,sebastien
1137,GTK+ UI,RESOLVED,FIXED,Wireshark will not start capture,1/5/07 12:53,Critical,11,Windows XP,wireshark-bugs,elittos,10/1/06 12:43,2007-01-05 12:53:50 UTC,elittos
1138,GTK+ UI,RESOLVED,FIXED,Follow TCP Streams gets stream direction wrong if started from a server->client frame,3/18/08 5:06,Normal,9,Windows XP,wireshark-bugs,jeff.morriss.ws,10/2/06 3:08,2008-03-18 05:06:42 UTC,stephenfisher
1139,GTK+ UI,RESOLVED,WORKSFORME,NFSv4 filehandle length is ignored,10/2/06 20:21,Normal,4,Linux (other),wireshark-bugs,jlayton,10/2/06 13:17,2006-10-02 20:21:54 UTC,jlayton
1140,GTK+ UI,RESOLVED,FIXED,Filtering messes up packet list sort order,1/11/07 19:53,Minor,3,Windows XP,wireshark-bugs,bruppert,10/2/06 16:56,2007-01-11 19:53:14 UTC,stephenfisher
1141,GTK+ UI,RESOLVED,WONTFIX,"""Save as"" doesn't work for an existing file if the existing file can not be deleted.",6/16/16 0:23,Enhancement,10,All,wireshark-bugs,toralf.foerster,10/2/06 18:08,2016-06-16 00:23:55 UTC,balint
1142,GTK+ UI,RESOLVED,FIXED,http packet detail window is struggled,11/10/06 20:54,Normal,6,Linux (other),wireshark-bugs,toralf.foerster,10/2/06 18:23,2006-11-10 20:54:25 UTC,ronniesahlberg
1143,GTK+ UI,RESOLVED,FIXED,Can't read packet details....bad color scheme forced,3/14/08 6:15,Major,3,Windows XP,wireshark-bugs,licause,10/2/06 18:39,2008-03-14 06:15:33 UTC,stephenfisher
1144,GTK+ UI,RESOLVED,NOTABUG,Wireshark crashes when applying filter via File -> Open dialog,3/11/08 7:14,Critical,16,Windows XP,wireshark-bugs,josh.thorson,10/2/06 21:24,2008-03-11 07:14:44 UTC,jaap.keuter
1146,GTK+ UI,RESOLVED,NOTABUG,Various instances of wireshark reading from various named pipes -> closing error,11/6/06 7:36,Major,3,Solaris,wireshark-bugs,Kitty.Janssens,10/3/06 11:45,2006-11-06 07:36:58 UTC,Kitty.Janssens
1148,GTK+ UI,RESOLVED,FIXED,LDAP parser error on NTLMSSP authentication + probably NTLMSSP encryption,11/11/06 20:06,Major,4,Windows Server 2003,wireshark-bugs,ondra,10/4/06 15:11,2006-11-11 20:06:26 UTC,ronniesahlberg
1149,GTK+ UI,RESOLVED,FIXED,dce-style flag for gss-api,10/5/06 11:36,Normal,4,Mac OS X 10.0,wireshark-bugs,lha,10/5/06 10:13,2006-10-05 11:36:04 UTC,jaap.keuter
1150,TShark,RESOLVED,FIXED,Some details of RANAP message missing while exporting .cap file as text,9/4/07 18:06,Normal,4,Windows XP,wireshark-bugs,heikki.tuohiniemi,10/6/06 10:48,2007-09-04 17:56:09 UTC,guy
1151,TShark,RESOLVED,FIXED,Wireshark/tshark very slow to start with lots of IP addresses on eth device,3/2/12 6:40,Normal,12,Linux (other),wireshark-bugs,tamas,10/6/06 11:58,2012-03-02 06:40:55 UTC,anders.broman
1153,GTK+ UI,RESOLVED,FIXED,SSL debug file cosmetic problems,7/19/07 13:06,Minor,4,Linux (other),wireshark-bugs,joshkel,10/7/06 18:18,2007-07-19 13:06:34 UTC,jeff.morriss.ws
1154,GTK+ UI,VERIFIED,FIXED,STATUS_ACCESS_VIOLATION in WTP dissector,10/13/06 9:03,Critical,5,Windows 2000,wireshark-bugs,gyorgy.szaniszlo,10/9/06 9:41,2006-10-11 07:37:06 UTC,gyorgy.szaniszlo
1156,GTK+ UI,RESOLVED,FIXED,If a dissector depends on a new datasource created by a new tvb  that dissector's protocol can't be filtered on.,11/4/06 17:34,Major,3,All,stephenfisher,phantal,10/11/06 2:55,2006-11-04 17:34:11 UTC,stephenfisher
1157,GTK+ UI,RESOLVED,FIXED,Build fails with Windows native Python,10/29/06 17:24,Major,4,Windows XP,wireshark-bugs,Neil,10/11/06 9:34,2006-10-29 17:24:31 UTC,ulf.lamping
1158,Extras,RESOLVED,FIXED,Editcap Stop time option,9/30/08 1:18,Minor,22,Windows XP,wireshark-bugs,steven.l.reich,10/11/06 11:36,2008-09-30 01:18:39 UTC,sake
1159,GTK+ UI,RESOLVED,FIXED,Wireshark packet-list pane not displayed/updated correctly after two empty display filters,10/30/06 2:11,Minor,8,Windows XP,wireshark-bugs,jyoung,10/12/06 3:50,2006-10-30 02:11:22 UTC,ulf.lamping
1160,TShark,RESOLVED,FIXED,Buildbot crash output: fuzz-2006-10-12-5715.pcap,10/12/06 15:03,Critical,3,Mac OS X 10.3,wireshark-bugs,buildbot-do-not-reply,10/12/06 8:10,2006-10-12 15:01:02 UTC,gerald
1161,TShark,RESOLVED,DUPLICATE,Buildbot crash output: fuzz-2006-10-12-5190.pcap,10/12/06 15:03,Critical,2,Mac OS X 10.3,wireshark-bugs,buildbot-do-not-reply,10/12/06 11:50,2006-10-12 15:03:53 UTC,gerald
1162,GTK+ UI,RESOLVED,FIXED,Wireshark doesn't compile on WinXP: bash version issue,12/4/06 5:52,Minor,8,Windows XP,wireshark-bugs,olivier.jacques,10/13/06 8:03,2006-12-04 05:52:20 UTC,wmeier
1163,Dissection engine (libwireshark),CONFIRMED, ---,Dissector bug.  ISO8073 COTP protocol.,6/17/14 22:37,Normal,19,Windows XP,bugzilla-admin,comein,10/13/06 8:23,,guy
1164,GTK+ UI,RESOLVED,FIXED,Text in color filter name is always black  causing it to be invisible with black backgrounds,11/18/07 4:22,Minor,8,FreeBSD,wireshark-bugs,stephenfisher,10/13/06 18:47,2007-11-18 04:22:31 UTC,stephenfisher
1165,GTK+ UI,RESOLVED,FIXED,Changing background of color filter changes the filter string color also,10/19/06 22:04,Minor,2,Mac OS X 10.4,wireshark-bugs,stephenfisher,10/14/06 6:12,2006-10-19 22:04:46 UTC,stephenfisher
1166,GTK+ UI,RESOLVED,FIXED,Missing part of BACnet decoder (with solution),10/20/06 5:58,Normal,6,Linux (other),wireshark-bugs,mikeg,10/16/06 20:30,2006-10-19 17:12:13 UTC,mikeg
1167,TShark,RESOLVED,FIXED,Buildbot crash output: fuzz-2006-10-16-4549.pcap,10/17/06 0:50,Critical,2,Mac OS X 10.3,wireshark-bugs,buildbot-do-not-reply,10/16/06 23:40,2006-10-17 00:50:54 UTC,gerald
1168,Capture file support (libwiretap),RESOLVED,FIXED,Delta time rollover in recording saved in SNIFFER format,12/21/15 0:15,Major,6,All,wireshark-bugs,mark.a.wigmore,10/17/06 10:38,2006-10-20 01:21:03 UTC,guy
1169,GTK+ UI,RESOLVED,NOTABUG,HPR/IP frames are NOT decoded when DSAP is x'c8',12/22/06 14:18,Normal,6,Windows XP,wireshark-bugs,jloeb,10/17/06 21:40,2006-12-22 14:18:05 UTC,jaap.keuter
1170,GTK+ UI,RESOLVED,FIXED,Wireshark interpretation of WBXML does not comply with Spec.,12/28/06 12:27,Normal,9,Windows XP,wireshark-bugs,james.armstrong,10/18/06 17:10,2006-12-28 12:27:10 UTC,anders.broman
1171,GTK+ UI,RESOLVED,NOTABUG,Create different output files that can be read by X-Base or CSV,5/10/07 6:28,Enhancement,4,Linux (other),wireshark-bugs,alpha096,10/20/06 8:18,2007-05-10 06:28:18 UTC,jaap.keuter
1172,TShark,RESOLVED,FIXED,Buildbot crash output: fuzz-2006-10-20-9067.pcap,10/20/06 19:37,Critical,2,Mac OS X 10.3,wireshark-bugs,buildbot-do-not-reply,10/20/06 16:20,2006-10-20 19:37:45 UTC,gerald
1173,GTK+ UI,RESOLVED,FIXED,Incorrect Export format for CSV,10/22/06 20:03,Normal,3,Windows XP,wireshark-bugs,rograham,10/21/06 5:56,2006-10-22 14:30:03 UTC,jaap.keuter
1174,GTK+ UI,RESOLVED,FIXED,"missing space and comma in text ""About""",10/21/06 17:50,Trivial,2,All,wireshark-bugs,toralf.foerster,10/21/06 17:31,2006-10-21 17:50:00 UTC,guy
1175,GTK+ UI,RESOLVED,NOTABUG,tcp.flags.syn does not filter packets correctly,10/28/06 21:44,Normal,3,Windows XP,wireshark-bugs,sfletcher,10/23/06 0:58,2006-10-28 21:44:20 UTC,jaap.keuter
1176,GTK+ UI,RESOLVED,FIXED,Wireshark Start Capture Closes Wireshark,10/27/06 12:16,Critical,18,Windows XP,wireshark-bugs,keithfrench,10/23/06 13:29,2006-10-27 12:16:32 UTC,keithfrench
1177,GTK+ UI,RESOLVED,DUPLICATE,show snmp oid in info column,10/24/06 19:00,Minor,2,Windows XP,wireshark-bugs,correojose,10/23/06 16:00,2006-10-24 19:00:45 UTC,stephenfisher
1178,GTK+ UI,RESOLVED,FIXED,Crashes on Add Expression with predefined values and FT_INT24 and BASE_DEC,10/23/06 22:46,Normal,2,All,wireshark-bugs,junderx,10/23/06 21:07,2006-10-23 22:46:24 UTC,jaap.keuter
1179,TShark,RESOLVED,NOTOURBUG,cmake build integration + dbus + bunch of memleak fixes,11/6/06 9:45,Enhancement,27,Linux (other),wireshark-bugs,frederic.heem,10/24/06 12:56,2006-11-05 00:33:01 UTC,ulf.lamping
1180,TShark,VERIFIED,FIXED,field without name in pdml output,10/29/06 7:34,Major,4,Linux (other),wireshark-bugs,pierre.juhen,10/25/06 20:11,2006-10-28 07:36:46 UTC,pierre.juhen
1181,GTK+ UI,RESOLVED,FIXED,Delays in real-time packet capture,3/20/08 21:30,Major,13,Linux (other),wireshark-bugs,bugzilla,10/26/06 11:29,2007-08-24 15:39:34 UTC,sake
1182,TShark,RESOLVED,FIXED,dumcap doens't compile with -Wall -Werror,4/5/07 22:49,Minor,6,Linux (other),wireshark-bugs,frederic.heem,10/26/06 12:40,2007-04-05 22:49:10 UTC,stephenfisher
1183,Build process,RESOLVED,FIXED,cmake stuff: CMakeInstallDirs.cmake FindPCAP.cmake etc ...,1/26/15 22:34,Enhancement,3,Linux (other),wireshark-bugs,frederic.heem,10/26/06 14:03,2006-10-26 15:42:17 UTC,guy
1184,Qt UI,CONFIRMED, ---,*Shark should support associating TCP and UDP packets with processes,7/7/16 5:42,Enhancement,14,All,wireshark-bugs,jeremiah.jahn,10/26/06 15:35,,alexis.lagoutte
1185,GTK+ UI,RESOLVED,FIXED,cross compilation fails,10/31/06 11:37,Major,3,Linux (other),wireshark-bugs,r.schwebel,10/27/06 16:02,2006-10-31 11:37:17 UTC,jmayer
1186,GTK+ UI,RESOLVED,NOTABUG,dup ack frames,1/5/07 0:52,Major,4,Windows XP,wireshark-bugs,thomas.heiss,10/28/06 11:31,2007-01-05 00:52:33 UTC,stephenfisher
1187,GTK+ UI,VERIFIED,FIXED,Need a tcp.options with a name for pdml output,10/29/06 7:40,Minor,3,Linux (other),wireshark-bugs,pierre.juhen,10/28/06 13:17,2006-10-29 07:39:36 UTC,pierre.juhen
1188,GTK+ UI,RESOLVED,FIXED,Automatic Scrolling not showing most recent packets,10/29/06 12:54,Minor,2,FreeBSD,wireshark-bugs,crsacer,10/29/06 3:05,2006-10-29 12:54:14 UTC,ulf.lamping
1189,GTK+ UI,RESOLVED,FIXED,New request for evolution int packet-tcp,10/29/06 7:39,Enhancement,2,Linux (other),wireshark-bugs,pierre.juhen,10/29/06 6:41,2006-10-29 07:39:50 UTC,pierre.juhen
1190,Capture file support (libwiretap),RESOLVED,FIXED,over 2GBytes files have incorrect size in the open dialog and status bar,1/27/15 0:42,Normal,18,Windows XP,wireshark-bugs,krouer,10/29/06 14:25,2011-04-10 14:04:54 UTC,guy
1191,GTK+ UI,RESOLVED,FIXED,IEEE 802.11e dissector,11/2/06 9:27,Enhancement,3,All,wireshark-bugs,yi.zhu,10/30/06 3:38,2006-11-02 09:27:24 UTC,jmayer
1192,GTK+ UI,RESOLVED,NOTABUG,"Preferences dialog ""option menus"" resizing vertically when selected",7/31/08 5:06,Minor,5,Windows XP,wireshark-bugs,scrmacdo,10/31/06 16:48,2008-07-31 05:06:22 UTC,anders.broman
1193,GTK+ UI,RESOLVED,FIXED,Toolbar buttons not sized correctly,11/14/07 9:37,Minor,3,Windows XP,wireshark-bugs,scrmacdo,10/31/06 16:53,2007-11-14 09:37:40 UTC,ulf.lamping
1194,GTK+ UI,RESOLVED,NOTABUG,Timestamp oddness,8/20/08 15:32,Normal,8,Windows XP,wireshark-bugs,scrmacdo,10/31/06 20:25,2008-08-20 07:12:12 UTC,sake
1195,Build process,RESOLVED,FIXED,make-version.pl fails with SVN 1.4.0,1/26/15 22:35,Normal,9,Linux (other),wireshark-bugs,jaap.keuter,10/31/06 21:33,2006-12-22 12:55:54 UTC,guy
1196,GTK+ UI,RESOLVED,FIXED,packet detail / packet bytes window not updated,1/11/07 6:36,Minor,3,Linux (other),wireshark-bugs,toralf.foerster,11/1/06 16:14,2007-01-11 06:36:59 UTC,stephenfisher
1197,GTK+ UI,RESOLVED,NOTABUG,"IP packet display with Protocol ""TCP""",11/8/06 21:56,Normal,13,Linux (other),wireshark-bugs,toralf.foerster,11/1/06 16:27,2006-11-08 21:56:59 UTC,stephenfisher
1198,GTK+ UI,RESOLVED,FIXED,GTK+ 2.8 crashes while selecting text,1/13/07 0:07,Normal,3,Windows XP,wireshark-bugs,gerald,11/1/06 17:42,2007-01-13 00:07:10 UTC,gerald
1199,Extras,CONFIRMED, ---,Add subpackage devel for convenient generation of custom dissector plugins,11/17/07 15:29,Enhancement,6,Linux (other),wireshark-bugs,carsten.prescher,11/3/06 9:29,,stephenfisher
1200,GTK+ UI,RESOLVED,FIXED,Wireshark hangs while opening a particular capture file,11/7/06 13:20,Major,9,All,wireshark-bugs,sharptorpedo,11/3/06 17:11,2006-11-07 13:20:51 UTC,ronniesahlberg
1201,GTK+ UI,RESOLVED,NOTABUG,No VPN after tracing,11/4/06 18:12,Major,6,Windows XP,wireshark-bugs,vadimrapp,11/4/06 13:40,2006-11-04 18:12:32 UTC,jmayer
1202,GTK+ UI,RESOLVED,NOTABUG,net-analyzer/wireshark-0.99.3/0.99.4 does double-free on 802.3 frames,9/1/07 10:51,Major,8,Linux (other),wireshark-bugs,daniel.subs,11/4/06 13:53,2007-09-01 10:51:13 UTC,jaap.keuter
1203,GTK+ UI,RESOLVED,FIXED,The rule on top of the coloring rule list is not executed,11/7/06 0:06,Minor,3,All,wireshark-bugs,rleutert,11/4/06 16:59,2006-11-07 00:06:51 UTC,ulf.lamping
1204,GTK+ UI,RESOLVED,NOTOURBUG,(lt-wireshark:11607): GLib-GObject-CRITICAL **: g_object_get_data: assertion `G_IS_OBJECT (object)' failed,11/6/06 19:30,Minor,6,Linux (other),wireshark-bugs,toralf.foerster,11/4/06 18:21,2006-11-06 19:30:10 UTC,jaap.keuter
1205,GTK+ UI,RESOLVED,FIXED,Wireshark allocates space to the 'Packet List Window' according to the space requirement of the last opened capture file.,11/14/06 6:31,Trivial,6,Windows XP,wireshark-bugs,deapesh,11/5/06 8:23,2006-11-14 06:31:23 UTC,stephenfisher
1206,TShark,RESOLVED,FIXED,MEGACO message cannot be decoded correctly for ServiceChange Command,4/4/07 10:51,Normal,11,Windows XP,wireshark-bugs,pubate.satienpoch,11/6/06 10:13,2007-04-04 10:51:55 UTC,luis.ontanon
1207,TShark,RESOLVED,FIXED,The wildcard mechanism for Termination ID of H248 message is decoded oppositely between ALL and CHOOSE.,11/7/06 4:22,Major,4,Windows XP,wireshark-bugs,pubate.satienpoch,11/6/06 10:23,2006-11-06 12:20:31 UTC,jaap.keuter
1208,GTK+ UI,RESOLVED,DUPLICATE,SNMP Plugin does not display OID in information panel.,11/6/06 20:11,Minor,2,Windows XP,wireshark-bugs,qstyk,11/6/06 19:52,2006-11-06 20:11:12 UTC,stephenfisher
1209,TShark,RESOLVED,FIXED,The parameter value of mediadescriptor in H248 message is not decoded  compare to the old build.,4/5/07 22:50,Major,6,Windows XP,wireshark-bugs,pubate.satienpoch,11/7/06 5:36,2007-04-05 22:50:57 UTC,luis.ontanon
1211,TShark,RESOLVED,FIXED,TShark is missing usage description of -S,11/23/06 1:48,Trivial,3,All,wireshark-bugs,jwright,11/7/06 13:40,2006-11-23 01:48:04 UTC,stephenfisher
1212,GTK+ UI,RESOLVED,FIXED,Follow SSL/UDP Stream gets direction wrong if started from a server->client frame,3/22/08 5:50,Normal,2,All,wireshark-bugs,stephenfisher,11/8/06 22:39,2008-03-22 05:50:36 UTC,stephenfisher
1213,GTK+ UI,RESOLVED,FIXED,RSVP dissector do not handle RSVP NOTIFY messages,11/22/06 23:21,Enhancement,3,Windows XP,wireshark-bugs,cyril.margaria,11/9/06 15:57,2006-11-22 23:21:29 UTC,anders.broman
1214,TShark,RESOLVED,NOTABUG,multiple uninitialised variables at startup,11/9/06 19:36,Normal,2,Linux (other),wireshark-bugs,frederic.heem,11/9/06 17:45,2006-11-09 19:36:35 UTC,guy
1216,GTK+ UI,RESOLVED,WORKSFORME,Wireshark Crashes when trying to start a capture,9/22/07 17:49,Critical,7,Windows XP,wireshark-bugs,lcampbell,11/10/06 18:14,2007-09-22 17:49:55 UTC,toadpole
1217,TShark,VERIFIED,WORKSFORME,Output of tshark to a pipe is buffered  and I don't no why,11/13/06 5:01,Normal,2,Linux (other),wireshark-bugs,pierre.juhen,11/10/06 22:20,2006-11-13 05:01:30 UTC,pierre.juhen
1218,GTK+ UI,VERIFIED,FIXED,enable-ucd-snmp-compatibility build error on Red Hat Enterprise Linux ,12/22/06 17:24,Minor,16,Linux (other),wireshark-bugs,seitz,11/11/06 0:17,2006-12-22 17:00:36 UTC,seitz
1219,Dissection engine (libwireshark),RESOLVED,LATER,TDS 'defragmentation' fails in many cases,9/23/14 4:31,Normal,10,All,bugzilla-admin,wmeier,11/12/06 23:40,2014-09-23 04:31:30 UTC,eapache
1220,GTK+ UI,VERIFIED,FIXED,Wireshark is unduly buffered when reading from a pipe,1/31/07 16:31,Major,6,Linux (other),pierre.juhen,pierre.juhen,11/13/06 5:05,2007-01-01 17:11:49 UTC,pierre.juhen
1221,GTK+ UI,RESOLVED,NOTABUG,CHild process crashes,11/14/06 19:46,Major,2,Linux (other),wireshark-bugs,pierre.juhen,11/13/06 5:14,2006-11-14 19:46:03 UTC,pierre.juhen
1222,GTK+ UI,RESOLVED,FIXED,Crash when opening network trace,11/13/06 18:45,Normal,6,Windows XP,wireshark-bugs,aaron.isotton,11/13/06 16:49,2006-11-13 18:45:19 UTC,wmeier
1223,GTK+ UI,RESOLVED,FIXED,Font problem (unusable program) after upgrade,11/17/06 11:59,Major,3,Windows XP,wireshark-bugs,aaron.isotton,11/13/06 17:41,2006-11-17 11:59:42 UTC,anders.broman
1224,Dissection engine (libwireshark),RESOLVED,LATER,TDS5 Query Packet problem,1/24/17 21:40,Minor,5,All,wireshark-bugs,pillault,11/14/06 8:41,2007-04-05 22:55:55 UTC,guy
1225,GTK+ UI,RESOLVED,FIXED,duplicated includes,11/14/06 20:38,Minor,3,All,wireshark-bugs,nikai,11/14/06 18:00,2006-11-14 20:38:33 UTC,jmayer
1226,GTK+ UI,RESOLVED,FIXED,DCE RPC malformed packet,12/19/06 12:26,Minor,4,All,wireshark-bugs,benja,11/15/06 12:44,2006-11-21 21:12:17 UTC,sujeet.jog
1227,Build process,RESOLVED,FIXED,cmake patches,1/26/15 22:35,Enhancement,8,Linux (other),wireshark-bugs,frederic.heem,11/16/06 9:13,2007-10-28 23:51:34 UTC,guy
1228,GTK+ UI,RESOLVED,NOTOURBUG,open file causes assertion,11/16/06 16:24,Major,2,Windows XP,wireshark-bugs,harald.mainka,11/16/06 14:45,2006-11-16 16:24:07 UTC,ulf.lamping
1229,GTK+ UI,RESOLVED,FIXED,MMS not being dissected,11/17/06 14:47,Normal,5,Linux (other),wireshark-bugs,Steven.Schaeffer,11/16/06 15:51,2006-11-17 01:54:03 UTC,stephenfisher
1230,GTK+ UI,RESOLVED,FIXED,build fails on packet-scsi-osd.c,11/21/06 21:14,Major,3,Solaris,wireshark-bugs,io,11/16/06 19:29,2006-11-21 21:14:33 UTC,ronniesahlberg
1231,GTK+ UI,RESOLVED,FIXED,build fails on packet-usb.h and packet-usb.c,11/21/06 21:15,Major,4,Solaris,wireshark-bugs,io,11/16/06 20:23,2006-11-21 21:15:35 UTC,ronniesahlberg
1232,GTK+ UI,RESOLVED,NOTOURBUG,"Problematic choice of a name for ""sbus.dll""...",4/5/07 23:53,Major,4,Windows XP,wireshark-bugs,alexandre.g.cardoso,11/17/06 14:53,2007-04-05 23:53:18 UTC,jaap.keuter
1233,GTK+ UI,RESOLVED,FIXED,packet-ntp.c : fix bug in switch { },1/5/07 19:52,Normal,11,Linux (other),wireshark-bugs,toralf.foerster,11/17/06 15:23,2007-01-05 19:52:02 UTC,jaap.keuter
1234,TShark,RESOLVED,FIXED,Invalid characters in PDML output for ssh packet capture,11/22/06 12:04,Major,4,Linux (other),wireshark-bugs,paul.blankenbaker,11/19/06 16:58,2006-11-22 12:04:16 UTC,paul.blankenbaker
1235,GTK+ UI,RESOLVED,FIXED,DHCPv6 doesn't interpret elapsed time correctly,11/22/06 22:39,Minor,3,Windows XP,wireshark-bugs,akostur,11/20/06 17:26,2006-11-22 22:39:14 UTC,akostur
1236,GTK+ UI,RESOLVED,NOTOURBUG,TCP allow subdissector to reassemble TCP stream does not work / tcp.analysis problems,11/23/06 1:07,Major,6,Windows XP,wireshark-bugs,f.zarifian,11/22/06 10:10,2006-11-22 23:56:46 UTC,f.zarifian
1237,Qt UI,CONFIRMED, ---,Add option to save files in CWD,3/13/17 11:42,Enhancement,13,All,wireshark-bugs,vandry,11/22/06 18:21,,michal.tomasz.labedzki
1238,GTK+ UI,RESOLVED,FIXED,Lua plugin not working,1/20/07 15:30,Normal,12,Windows XP,luis.ontanon,sebbaz+ws,11/22/06 23:26,2007-01-20 15:30:03 UTC,sebbaz+ws
1239,TShark,RESOLVED,FIXED,Absolute seconds timestamp format for Tshark/WireShark,1/20/07 16:59,Enhancement,4,All,wireshark-bugs,sebbaz+ws,11/23/06 12:49,2007-01-20 16:59:46 UTC,sebbaz+ws
1240,GTK+ UI,RESOLVED,FIXED,Add CobraNet ethertype,11/25/06 12:06,Enhancement,3,Linux (other),wireshark-bugs,linux,11/24/06 2:05,2006-11-25 12:06:02 UTC,anders.broman
1241,TShark,RESOLVED,FIXED,Buildbot crash output: fuzz-2006-11-24-4742.pcap,11/26/06 0:25,Critical,3,Mac OS X 10.3,wireshark-bugs,buildbot-do-not-reply,11/24/06 14:31,2006-11-26 00:25:13 UTC,wmeier
1242,GTK+ UI,RESOLVED,FIXED,arrow keys doesn't navigate any longer between neighbour packets,11/25/06 15:57,Minor,2,Linux (other),wireshark-bugs,toralf.foerster,11/24/06 20:20,2006-11-25 15:57:28 UTC,toralf.foerster
1244,TShark,RESOLVED,FIXED,tshark dies producing a pdml file from a capture file,8/31/07 5:40,Major,7,Windows XP,wireshark-bugs,jhuysing,11/25/06 7:51,2007-08-31 05:40:55 UTC,jaap.keuter
1245,Extras,RESOLVED,NOTABUG,Source archive for 0.99.4 does not correspond with SVN release dir,1/4/07 7:18,Normal,2,All,wireshark-bugs,sebbaz+ws,11/25/06 22:08,2007-01-04 07:18:12 UTC,jaap.keuter
1246,GTK+ UI,RESOLVED,FIXED,detection of net-snmp fails due to typo in acinclude.m4/configure,2/2/07 6:15,Major,5,All,wireshark-bugs,wireshark.org,11/26/06 7:01,2006-11-26 08:28:44 UTC,guy
1247,GTK+ UI,RESOLVED,FIXED,useless origfile,11/27/06 9:00,Trivial,2,All,wireshark-bugs,nikns,11/26/06 21:11,2006-11-27 09:00:45 UTC,ronniesahlberg
1248,GTK+ UI,RESOLVED,FIXED,Fatal error while decoding noncompliant Veritas LLT,11/28/06 16:21,Major,5,Windows XP,wireshark-bugs,mark.r.rogaski,11/27/06 16:52,2006-11-28 16:21:23 UTC,mark.r.rogaski
1249,GTK+ UI,RESOLVED,FIXED,udp protocol analysis - several problems,12/11/06 9:57,Enhancement,4,All,wireshark-bugs,work,11/28/06 14:17,2006-12-11 09:57:10 UTC,guy
1250,TShark,RESOLVED,FIXED,tshark -c option broken on Solaris,11/22/07 1:22,Major,2,All,wireshark-bugs,jim.mewes,11/28/06 22:59,2007-11-22 01:22:57 UTC,guy
1251,GTK+ UI,RESOLVED,FIXED,open help -> About -> any tab; click text body; will suddenly go the end of text,4/23/07 2:35,Minor,8,Windows XP,wireshark-bugs,lotus,11/29/06 8:36,2007-04-23 02:35:51 UTC,jeff.morriss.ws
1252,GTK+ UI,RESOLVED,NOTABUG,Following SSL stream without server private key,4/5/07 23:09,Enhancement,4,All,wireshark-bugs,wireshark,11/30/06 12:46,2007-04-05 23:09:04 UTC,luis.ontanon
1253,GTK+ UI,RESOLVED,NOTOURBUG,wireshark 0.99.4 doesn't support Chinese ?,2/11/07 5:45,Major,4,Windows XP,wireshark-bugs,yandong6666,11/30/06 13:53,2007-02-11 05:45:25 UTC,ulf.lamping
1254,Dissection engine (libwireshark),VERIFIED,FIXED,MSSQL / TDS parser should decode passwords,1/24/17 21:40,Enhancement,5,All,wireshark-bugs,jhunter,12/1/06 13:20,2006-12-02 01:13:15 UTC,guy
1255,GTK+ UI,RESOLVED,FIXED,Packet panel RHS scroll bar refresh error,12/22/06 8:42,Minor,3,Windows 2000,wireshark-bugs,chris.cornish,12/4/06 13:04,2006-12-22 08:42:23 UTC,chris.cornish
1256,GTK+ UI,RESOLVED,FIXED,Wave 7 Optics MAC OUI listed as HP MAC OUI,7/10/08 10:19,Normal,3,All,wireshark-bugs,firewrks,12/4/06 19:52,2006-12-05 15:29:57 UTC,bugzilla-admin
1257,Qt UI,CONFIRMED, ---,"""Save As ..."" shouldn't reload the temp file",6/16/16 1:12,Enhancement,5,All,wireshark-bugs,toralf.foerster,12/5/06 8:36,,guy
1258,GTK+ UI,RESOLVED,DUPLICATE,speed up filter routine,10/25/10 14:25,Enhancement,8,Linux (other),wireshark-bugs,toralf.foerster,12/5/06 8:46,2010-10-25 14:25:55 UTC,jeff.morriss.ws
1259,GTK+ UI,RESOLVED,FIXED,ssdp (http) dissected as SliMP3,5/19/07 22:34,Normal,5,All,wireshark-bugs,toralf.foerster,12/5/06 10:13,2007-05-19 22:34:44 UTC,guy
1260,GTK+ UI,RESOLVED,FIXED,"packet-text-media.c should print control chars ""\r\n"" too",12/6/06 23:36,Trivial,5,Linux (other),wireshark-bugs,toralf.foerster,12/5/06 13:47,2006-12-06 23:36:26 UTC,stephenfisher
1261,GTK+ UI,RESOLVED,FIXED,First coloring rule ignored,2/2/07 19:38,Trivial,3,Windows XP,wireshark-bugs,mauro,12/6/06 8:46,2007-02-02 19:38:10 UTC,stephenfisher
1262,GTK+ UI,RESOLVED,NOTOURBUG,capture not working on Check Point VPN-1 SecureClient interface,12/6/06 19:34,Major,2,Windows XP,wireshark-bugs,simon_weibel,12/6/06 19:18,2006-12-06 19:34:09 UTC,ulf.lamping
1263,GTK+ UI,RESOLVED,NOTOURBUG,Wireshark crashes while capturing packets,12/7/06 17:17,Major,3,Windows XP,wireshark-bugs,cgf671,12/7/06 15:22,2006-12-07 16:10:44 UTC,ulf.lamping
1264,TShark,RESOLVED,FIXED,Buildbot crash output: fuzz-2006-12-08-11198.pcap,3/10/07 18:10,Critical,16,Mac OS X 10.3,wireshark-bugs,buildbot-do-not-reply,12/8/06 23:40,2007-03-09 01:47:36 UTC,gerald
1265,GTK+ UI,RESOLVED,FIXED,"""About Wireshark"" reports wrong SNMP configure option",12/9/06 22:36,Trivial,2,All,wireshark-bugs,toralf.foerster,12/9/06 18:11,2006-12-09 22:36:06 UTC,guy
1266,GTK+ UI,RESOLVED,FIXED,"Decoding diameter gives ""Diameter Error: Invalid application (name=Diameter Common Messages  id=0)""",12/12/06 9:05,Normal,4,Windows 2000,wireshark-bugs,je.johansson,12/11/06 9:41,2006-12-12 09:04:37 UTC,je.johansson
1267,GTK+ UI,RESOLVED,NOTABUG,wireshark crashes mid-startup,7/31/08 5:15,Critical,16,Mac OS X 10.2,wireshark-bugs,ephraim_owns,12/13/06 1:03,2008-07-31 05:15:25 UTC,anders.broman
1268,Extras,RESOLVED,FIXED,idl2eth does not manage long long  unsigned long long,4/10/07 14:42,Normal,6,Linux (other),wireshark-bugs,jeremy.vies,12/15/06 14:34,2007-04-10 14:42:16 UTC,jeff.morriss.ws
1269,GTK+ UI,RESOLVED,NOTABUG,wireshare crashes with Err file emem.c: line 291: assertion failed,12/28/06 12:46,Major,3,Windows XP,wireshark-bugs,sunruh,12/15/06 20:05,2006-12-28 12:46:24 UTC,anders.broman
1270,GTK+ UI,RESOLVED,DUPLICATE,messenger:packets always malformed,12/21/06 20:05,Minor,3,Linux (other),wireshark-bugs,toralf.foerster,12/17/06 10:56,2006-12-21 20:05:14 UTC,stephenfisher
1271,GTK+ UI,RESOLVED,NOTABUG,"rsync: ""Follow TCP stream ..."" is truncated",1/6/07 20:19,Normal,14,Linux (other),wireshark-bugs,toralf.foerster,12/18/06 14:45,2006-12-22 22:19:04 UTC,stephenfisher
1272,GTK+ UI,RESOLVED,FIXED,CORBA dissectors show malformed packet errors for requests with no body.,4/5/07 23:16,Normal,3,Windows 2000,wireshark-bugs,Andy.Ling,12/19/06 10:54,2007-04-05 23:16:48 UTC,luis.ontanon
1273,TShark,RESOLVED,FIXED,Hex/ASCII dump of reassembled TCP packet,3/9/08 16:30,Normal,5,FreeBSD,wireshark-bugs,tyriker,12/19/06 16:20,2008-03-09 16:30:47 UTC,jeff.morriss.ws
1274,GTK+ UI,RESOLVED,FIXED,Wireshark doesn't build on Solaris 9,12/20/06 20:48,Blocker,2,Solaris,wireshark-bugs,leozh,12/19/06 18:10,2006-12-20 20:48:31 UTC,jaap.keuter
1275,GTK+ UI,RESOLVED,FIXED,Update time display in background,9/23/09 21:15,Enhancement,3,All,wireshark-bugs,kovarththanan.rajaratnam,12/20/06 10:10,2009-09-23 21:15:24 UTC,kovarththanan.rajaratnam
1276,GTK+ UI,RESOLVED,FIXED,nettl (HP-UX): Need support for NS_LS_TELNET trace records,1/1/07 19:16,Enhancement,7,All,mbrown,mbrown,12/21/06 21:17,2006-12-21 21:33:34 UTC,mbrown
1277,GTK+ UI,RESOLVED,WORKSFORME,TCP not captured,4/5/07 23:29,Major,5,Windows XP,wireshark-bugs,daver,12/22/06 7:34,2007-04-05 23:29:22 UTC,luis.ontanon
1278,GTK+ UI,RESOLVED,FIXED,GUI: wlan and display filter.,12/29/06 22:26,Minor,2,All,wireshark-bugs,leakim.wikstrom,12/22/06 11:41,2006-12-29 22:26:48 UTC,stephenfisher
1279,GTK+ UI,RESOLVED,FIXED,Negative values for RTCP round trip delay cannot be stored in guint32,1/10/07 13:56,Normal,5,Windows XP,wireshark-bugs,trav.ethereal,12/22/06 18:46,2007-01-10 13:56:10 UTC,martin.mathieson
1280,TShark,RESOLVED,DUPLICATE,Buildbot crash output: fuzz-2006-12-25-26408.pcap,12/27/06 6:14,Critical,3,Mac OS X 10.3,wireshark-bugs,buildbot-do-not-reply,12/25/06 11:10,2006-12-27 06:14:29 UTC,stephenfisher
1281,TShark,RESOLVED,DUPLICATE,Buildbot crash output: fuzz-2006-12-25-11774.pcap,12/27/06 6:13,Critical,3,Mac OS X 10.3,wireshark-bugs,buildbot-do-not-reply,12/26/06 1:30,2006-12-27 06:13:53 UTC,stephenfisher
1282,GTK+ UI,RESOLVED,DUPLICATE,Wireshark crashes when saving in Statistics->Flow Graph,12/26/06 11:28,Normal,2,Linux (other),wireshark-bugs,msbatista,12/26/06 10:59,2006-12-26 11:28:35 UTC,jaap.keuter
1283,TShark,RESOLVED,DUPLICATE,Buildbot crash output: fuzz-2006-12-26-20848.pcap,12/27/06 6:13,Critical,3,Mac OS X 10.3,wireshark-bugs,buildbot-do-not-reply,12/26/06 20:00,2006-12-27 06:13:29 UTC,stephenfisher
1284,Dissection engine (libwireshark),RESOLVED,FIXED,802.11 Probe Response fails to parse.,10/16/12 18:44,Major,9,All,wireshark-bugs,sbrown,12/28/06 21:07,2012-10-16 18:27:31 UTC,guy
1285,GTK+ UI,RESOLVED,FIXED,parse NAPTR records in dns dissector (rfc 3403),12/31/06 0:01,Enhancement,4,Linux (other),wireshark-bugs,pee,12/29/06 23:02,2006-12-31 00:01:01 UTC,jaap.keuter
1286,GTK+ UI,RESOLVED,DUPLICATE,Problem with capturing on an Accton EN1207D ethernet card,12/31/06 16:31,Major,2,Windows 95/98/ME,wireshark-bugs,mandrake,12/31/06 16:19,2006-12-31 16:31:50 UTC,ulf.lamping
1287,GTK+ UI,RESOLVED,NOTOURBUG,Problem with capturing on an Accton EN1207D ethernet card,12/31/06 16:35,Major,3,Windows 95/98/ME,wireshark-bugs,mandrake,12/31/06 16:20,2006-12-31 16:35:36 UTC,ulf.lamping
1288,GTK+ UI,RESOLVED,NOTABUG,predefined filter should be applied automatically,1/1/07 19:27,Enhancement,2,Linux (other),wireshark-bugs,toralf.foerster,1/1/07 17:50,2007-01-01 19:27:39 UTC,jaap.keuter
1289,GTK+ UI,RESOLVED,FIXED,'svnversion' conflict with gtk 2.10.6,2/6/07 2:28,Major,3,Mac OS X 10.4,wireshark-bugs,wireshark.org,1/3/07 4:23,2007-02-06 02:28:26 UTC,jeff.morriss.ws
1290,GTK+ UI,RESOLVED,FIXED,iuup parsing of rate control messages is incorrect,1/3/07 19:26,Normal,5,Linux (other),wireshark-bugs,Peter.Vestman,1/3/07 15:14,2007-01-03 19:26:06 UTC,anders.broman
1291,GTK+ UI,RESOLVED,DUPLICATE,Follow TCP stream hides last character when not in HEX or C mode,1/7/07 2:38,Normal,6,Windows XP,wireshark-bugs,piotr,1/4/07 11:41,2007-01-07 02:38:30 UTC,jmayer
1292,GTK+ UI,RESOLVED,FIXED,Win32: confusing setup target warning if cl.exe is not in path,4/30/10 13:26,Normal,8,Windows XP,wireshark-bugs,ulf.lamping,1/5/07 3:34,2010-04-30 13:26:11 UTC,wmeier
1293,GTK+ UI,RESOLVED,FIXED,"""VoIP Calls"" does not show start & stop time of calls in anything other than secs since start of capture.",12/22/16 2:59,Enhancement,16,All,wireshark-bugs,keithfrench,1/5/07 13:28,2016-12-22 02:59:44 UTC,jeff.morriss.ws
1295,GTK+ UI,RESOLVED,NOTABUG,"packet is not P_MUL + ""Do not dissect"" does not work",1/10/07 2:47,Minor,3,Linux (other),wireshark-bugs,toralf.foerster,1/9/07 15:27,2007-01-10 02:47:26 UTC,stephenfisher
1296,GTK+ UI,RESOLVED,FIXED,SMB Close Request (0x04) FID have incorrect File Name.,1/23/07 21:15,Minor,6,Windows 2000,wireshark-bugs,paulsleonardo,1/10/07 18:05,2007-01-23 21:15:38 UTC,ronniesahlberg
1297,GTK+ UI,RESOLVED,FIXED,CSV Export may produce invalid format,11/8/10 9:05,Normal,5,Windows XP,wireshark-bugs,bzikmund,1/10/07 21:05,2010-11-08 09:05:53 UTC,Christopher.Maynard
1298,GTK+ UI,RESOLVED,DUPLICATE,FormatMessage failed,1/11/07 21:08,Critical,2,Windows 95/98/ME,wireshark-bugs,engineering,1/11/07 19:42,2007-01-11 21:08:29 UTC,jaap.keuter
1300,GTK+ UI,RESOLVED,DUPLICATE,Can't get pathname of Wireshark: GetModuleFileName failed: 120,1/12/07 17:41,Major,2,Windows 95/98/ME,wireshark-bugs,bosman.sander,1/12/07 14:56,2007-01-12 17:41:41 UTC,jeff.morriss.ws
1301,GTK+ UI,VERIFIED,FIXED,File Open dialog preview needs > 3s for large invalid files and appears dead,1/14/07 15:49,Major,3,Windows XP,wireshark-bugs,ulf.lamping,1/14/07 5:41,2007-01-14 06:13:55 UTC,ulf.lamping
1302,GTK+ UI,RESOLVED,NOTOURBUG,Wireshark breaks outbound TCP connections with an Intel Pro/100 S adapter,12/13/07 5:04,Major,8,Windows XP,wireshark-bugs,wireshark,1/14/07 16:21,2007-12-13 05:04:56 UTC,stephenfisher
1303,GTK+ UI,RESOLVED,DUPLICATE,Bug in selecting the last packet displayed on the Packet List,1/14/07 17:38,Minor,2,Windows XP,wireshark-bugs,asdfasdf205,1/14/07 17:14,2007-01-14 17:38:53 UTC,asdfasdf205
1304,GTK+ UI,RESOLVED,FIXED,Bug in selecting the last packet displayed on the Packet List,2/11/08 23:23,Minor,7,Windows XP,wireshark-bugs,asdfasdf205,1/14/07 17:27,2008-02-11 23:23:41 UTC,asdfasdf205
1305,GTK+ UI,RESOLVED,NOTABUG,SNMP decode misses enterprise names,1/16/07 11:18,Normal,3,All,wireshark-bugs,jaap.keuter,1/15/07 13:39,2007-01-16 11:18:15 UTC,jaap.keuter
1306,TShark,RESOLVED,FIXED,Buildbot crash output: fuzz-2007-01-16-8311.pcap,1/16/07 20:23,Critical,4,Mac OS X 10.3,wireshark-bugs,buildbot-do-not-reply,1/16/07 11:00,2007-01-16 20:21:57 UTC,gerald
1307,TShark,RESOLVED,DUPLICATE,Buildbot crash output: fuzz-2007-01-16-10044.pcap,1/16/07 20:22,Critical,2,Mac OS X 10.3,wireshark-bugs,buildbot-do-not-reply,1/16/07 13:20,2007-01-16 20:22:17 UTC,gerald
1308,GTK+ UI,RESOLVED,FIXED,tacacs decoding fails,1/24/07 4:58,Normal,6,FreeBSD,wireshark-bugs,cwf-ml,1/16/07 15:26,2007-01-24 04:58:50 UTC,stephenfisher
1309,GTK+ UI,RESOLVED,DUPLICATE,UI update can take many minutes.,11/18/07 19:21,Normal,3,Windows XP,wireshark-bugs,bill.ward,1/16/07 15:27,2007-11-18 19:21:40 UTC,did447
1310,TShark,RESOLVED,DUPLICATE,Buildbot crash output: fuzz-2007-01-16-11857.pcap,1/16/07 20:23,Critical,2,Mac OS X 10.3,wireshark-bugs,buildbot-do-not-reply,1/16/07 17:30,2007-01-16 20:23:09 UTC,gerald
1311,GTK+ UI,RESOLVED,NOTABUG,Plugin system not C++ friendly,1/18/07 23:19,Major,7,Linux (other),wireshark-bugs,gjc,1/17/07 13:30,2007-01-18 18:23:42 UTC,jaap.keuter
1312,GTK+ UI,RESOLVED,FIXED,"For ""Continuation or non-HTTP traffic""  there is extraneon section in ""packet decode"" (=middle) pane",11/17/07 17:05,Major,7,Windows XP,wireshark-bugs,lotus,1/18/07 2:15,2007-11-17 17:05:47 UTC,sake
1313,GTK+ UI,RESOLVED,FIXED,"wireshark crashs within ""Save as""",3/19/07 9:57,Major,4,Linux (other),wireshark-bugs,toralf.foerster,1/18/07 15:53,2007-03-19 09:57:55 UTC,toralf.foerster
1314,GTK+ UI,CONFIRMED, ---,VoIP Call graph error - picks up a telnet frame as an RTP frame,6/16/16 2:02,Normal,6,Windows XP,wireshark-bugs,mike.oliveras,1/18/07 16:48,,balint
1315,GTK+ UI,RESOLVED,NOTABUG,Wireshark causes Airport to disconnect when starting packet captures,3/2/12 9:23,Major,15,Mac OS X 10.4,wireshark-bugs,bahamat,1/18/07 18:02,2012-03-02 06:50:57 UTC,anders.broman
1316,Build process,RESOLVED,FIXED,docbook: make failed b/c wrong perms of ./check_svn_version.sh,1/26/15 22:35,Minor,7,Linux (other),wireshark-bugs,toralf.foerster,1/19/07 16:30,2007-02-02 21:04:52 UTC,guy
1317,GTK+ UI,RESOLVED,FIXED,Elliptic curve key-exchange decoding for TLS (rfc 4492),1/31/10 12:01,Enhancement,6,All,wireshark-bugs,tejus.ag,1/20/07 13:56,2010-01-31 12:01:14 UTC,jaap.keuter
1318,Documentation,RESOLVED,FIXED,NEWS.txt is out of date,1/31/07 1:19,Minor,2,Windows XP,wireshark-bugs,sebbaz+ws,1/20/07 15:47,2007-01-31 01:19:10 UTC,stephenfisher
1319,Build process,RESOLVED,FIXED,make: *** No rule to make target `user-guide.zip'  needed by `wsug'.  Stop.,1/26/15 22:36,Minor,4,Linux (other),wireshark-bugs,toralf.foerster,1/21/07 10:53,2007-01-28 19:47:46 UTC,guy
1320,TShark,RESOLVED,FIXED,gui_enabled() is true for tshark,1/21/07 17:07,Normal,2,Windows XP,wireshark-bugs,sebbaz+ws,1/21/07 10:54,2007-01-21 17:07:29 UTC,luis.ontanon
1321,TShark,RESOLVED,FIXED,Don't override print() as info() when running tshark,1/21/07 17:06,Enhancement,2,Windows XP,wireshark-bugs,sebbaz+ws,1/21/07 11:00,2007-01-21 17:06:54 UTC,luis.ontanon
1322,Documentation,RESOLVED,NOTABUG,docbook: warning: failed to load external entity,1/22/07 7:01,Minor,2,Linux (other),wireshark-bugs,toralf.foerster,1/21/07 14:01,2007-01-22 07:01:38 UTC,jaap.keuter
1323,Qt UI,CONFIRMED, ---,Add zip support,6/22/16 2:50,Enhancement,2,Windows XP,wireshark-bugs,sebbaz+ws,1/22/07 13:30,,mmann78
1324,GTK+ UI,RESOLVED,WORKSFORME,PacketGetAdapterNames Error when selecting/listing interfaces,8/7/07 6:53,Critical,7,Windows XP,wireshark-bugs,trav.ethereal,1/22/07 17:03,2007-08-07 06:53:14 UTC,jaap.keuter
1325,GTK+ UI,RESOLVED,FIXED,"""Protocol Hierarchie Statistics"" has an empty line for ICMPv6",1/25/07 23:00,Minor,4,Linux (other),wireshark-bugs,toralf.foerster,1/24/07 16:56,2007-01-25 23:00:45 UTC,stephenfisher
1326,GTK+ UI,RESOLVED,FIXED,Coverity CID 216: Dead code in epan/req_resp_hdrs.c,8/20/08 8:12,Minor,4,All,wireshark-bugs,gerald,1/25/07 7:14,2008-08-20 08:12:12 UTC,sake
1327,TShark,RESOLVED,DUPLICATE,Buildbot crash output: fuzz-2007-01-25-27617.pcap,1/25/07 23:08,Critical,2,Mac OS X 10.3,wireshark-bugs,buildbot-do-not-reply,1/25/07 15:51,2007-01-25 23:08:55 UTC,stephenfisher
1328,GTK+ UI,RESOLVED,FIXED,H.248: wrong decoding of 3GUP pckg UP mode property,2/3/07 20:22,Minor,4,Windows XP,wireshark-bugs,agoerb,1/25/07 16:34,2007-02-03 20:22:10 UTC,anders.broman
1329,GTK+ UI,RESOLVED,WORKSFORME,Large HTTP PDU causes Wireshark to loop forever?,11/18/07 19:21,Critical,8,Windows XP,wireshark-bugs,jhg,1/25/07 18:32,2007-05-24 15:22:04 UTC,did447
1330,GTK+ UI,RESOLVED,FIXED,Diameter Acct-Multi-Session-ID (50) decoded as Unsigned32,5/26/07 7:23,Major,3,Linux (other),wireshark-bugs,achud,1/25/07 19:07,2007-01-31 20:55:43 UTC,martin.mathieson
1331,GTK+ UI,RESOLVED,FIXED,1st coloring rule is ignored,1/25/07 20:51,Major,3,Linux (other),wireshark-bugs,kneufeld,1/25/07 20:40,2007-01-25 20:49:20 UTC,ulf.lamping
1332,GTK+ UI,VERIFIED,FIXED,Diameter Address format AVPs don't decode properly,1/31/07 15:41,Major,14,Linux (other),wireshark-bugs,achud,1/25/07 21:49,2007-01-31 10:58:57 UTC,achud
1333,GTK+ UI,RESOLVED,FIXED,Diameter AVP type 287 does not decode,1/31/07 20:56,Major,4,Linux (other),wireshark-bugs,achud,1/25/07 22:07,2007-01-31 20:56:28 UTC,martin.mathieson
1334,GTK+ UI,RESOLVED,FIXED,Console errors when clicking on Filter button in File Open dialog,6/17/07 0:55,Trivial,2,FreeBSD,wireshark-bugs,stephenfisher,1/26/07 3:27,2007-06-17 00:55:51 UTC,stephenfisher
1335,GTK+ UI,RESOLVED,FIXED,H.248: wrong decoding of Termination Id wildcard,8/17/07 11:48,Major,16,Windows XP,wireshark-bugs,agoerb,1/26/07 13:58,2007-03-09 01:13:36 UTC,luis.ontanon
1336,GTK+ UI,RESOLVED,FIXED,statistics with MTP3 MSUs get empty result,3/17/07 8:57,Major,4,Windows XP,wireshark-bugs,david.marin,1/29/07 15:14,2007-03-17 08:57:56 UTC,jeff.morriss.ws
1337,GTK+ UI,RESOLVED,FIXED,Export IO Graphs,1/20/08 17:40,Enhancement,8,Windows XP,wireshark-bugs,persio,1/31/07 10:30,2008-01-20 17:40:41 UTC,stig
1338,TShark,RESOLVED,FIXED,tshark doesn't die when writing on a closed pipe !!!,10/26/08 10:40,Major,5,Linux (other),wireshark-bugs,pierre.juhen,1/31/07 16:38,2008-10-26 10:40:46 UTC,sake
1339,GTK+ UI,RESOLVED,DUPLICATE,Missing characters in Follow TCP Stream of XML data,2/5/07 6:33,Normal,2,Windows XP,wireshark-bugs,shanis,1/31/07 20:31,2007-02-05 06:33:01 UTC,jeff.morriss.ws
1340,Extras,RESOLVED,FIXED,text2pcap doesn't handle 'timeft' option under Windows,9/20/07 16:37,Major,7,Windows XP,wireshark-bugs,haziza,1/31/07 20:35,2007-09-20 16:37:34 UTC,wmeier
1341,GTK+ UI,RESOLVED,FIXED,'dfilter_macros': popup window,2/3/07 15:15,Minor,4,Linux (other),wireshark-bugs,toralf.foerster,2/1/07 11:07,2007-02-03 14:27:07 UTC,luis.ontanon
1342,GTK+ UI,RESOLVED,FIXED,Wireshark crashes in MMS/BER dissector endless loop,12/30/09 2:22,Normal,24,Windows XP,wireshark-bugs,fe.amorim,2/1/07 13:32,2009-12-30 02:22:05 UTC,fe.amorim
1343,GTK+ UI,RESOLVED,DUPLICATE,Typo in acinclude.m4 (and so in configure script),2/1/07 18:53,Normal,2,Linux (other),wireshark-bugs,goudron_et_plumes,2/1/07 17:35,2007-02-01 18:53:54 UTC,guy
1344,GTK+ UI,RESOLVED,FIXED,Tooltips unexpectedly raise main window,11/29/07 19:56,Normal,3,Windows XP,wireshark-bugs,gerald,2/1/07 20:56,2007-11-29 19:56:49 UTC,gerald
1345,GTK+ UI,RESOLVED,FIXED,V0.99.5 & Coloring Rules Not Acted On,2/10/07 15:51,Major,3,Windows XP,wireshark-bugs,keithfrench,2/4/07 22:45,2007-02-10 15:51:52 UTC,keithfrench
1346,GTK+ UI,RESOLVED,FIXED,udp dissector labels length as bogus for reassembled ip datagram,7/14/13 12:51,Normal,4,Windows 2000,wireshark-bugs,bob,2/5/07 6:13,2007-02-05 21:46:07 UTC,guy
1347,GTK+ UI,VERIFIED,FIXED,sminmpec_values is not exported properly,2/20/07 5:26,Minor,3,Windows XP,wireshark-bugs,Boris.Misenov,2/5/07 13:17,2007-02-05 16:27:14 UTC,magnitude99
1348,GTK+ UI,RESOLVED,DUPLICATE,wireshark/tshark extremely slow to start with lots of interfaces.,2/7/07 2:14,Major,2,Linux (other),wireshark-bugs,greearb,2/5/07 22:54,2007-02-07 02:14:13 UTC,jeff.morriss.ws
1349,GTK+ UI,RESOLVED,FIXED,About dialog: all text selected when switching tabs,9/22/08 14:29,Minor,5,Windows XP,wireshark-bugs,ulf.lamping,2/6/07 9:27,2008-09-22 14:29:31 UTC,anders.broman
1350,GTK+ UI,RESOLVED,FIXED,function dissect_ansi_map_sms_originationrestrictions is missing return value,2/7/07 2:42,Trivial,3,Linux (other),wireshark-bugs,prusnak,2/6/07 10:21,2007-02-07 02:42:10 UTC,jeff.morriss.ws
1351,GTK+ UI,RESOLVED,WONTFIX,Won't start on Windows NT4,7/30/14 20:11,Major,4,Windows NT,wireshark-bugs,flavour,2/6/07 13:01,2014-07-30 20:11:57 UTC,guy
1353,GTK+ UI,RESOLVED,NOTABUG,PAUSE is not displayed on receiving part (Windows 2000),6/29/07 19:11,Normal,8,Windows 2000,wireshark-bugs,jamontagnon,2/7/07 8:49,2007-06-29 19:11:32 UTC,jaap.keuter
1354,GTK+ UI,RESOLVED,NOTOURBUG,Y-Axis scale in kbits,5/28/07 0:01,Enhancement,4,Windows XP,wireshark-bugs,persio,2/7/07 10:11,2007-05-28 00:01:58 UTC,stephenfisher
1355,GTK+ UI,RESOLVED,NOTABUG,Duplicate packets when saving from Proconvert file to .pcap,11/29/07 19:41,Normal,5,Windows XP,wireshark-bugs,persio,2/7/07 10:15,2007-11-29 19:41:17 UTC,sake
1356,GTK+ UI,RESOLVED,NOTABUG,Add Acterna capture files compatibility,6/29/07 11:01,Enhancement,4,All,wireshark-bugs,persio,2/7/07 10:16,2007-06-29 11:01:33 UTC,jaap.keuter
1357,GTK+ UI,VERIFIED,FIXED,"""lemon"" creates bogus "".c"" sources files which crash GCC 3.3.x",2/7/07 17:14,Major,4,NetBSD,wireshark-bugs,tron,2/7/07 15:02,2007-02-07 16:11:02 UTC,tron
1358,TShark,RESOLVED,NOTABUG,tshark -q -r -z io stat 60 ... fails on 10Gb file,2/8/07 0:58,Normal,2,Windows XP,wireshark-bugs,ben,2/7/07 16:12,2007-02-08 00:58:24 UTC,jeff.morriss.ws
1359,GTK+ UI,RESOLVED,NOTOURBUG,Hangs when doing a marked packet save with same file name,11/17/07 5:20,Minor,5,Windows XP,wireshark-bugs,bobgus,2/7/07 18:39,2007-11-17 05:20:54 UTC,stephenfisher
1360,GTK+ UI,RESOLVED,FIXED,cannot dissect WAP SIR,5/16/07 19:53,Critical,12,Windows XP,wireshark-bugs,ghsun,2/8/07 5:43,2007-05-16 19:53:07 UTC,gerald
1361,GTK+ UI,RESOLVED,FIXED,Support for additional time filter formats,8/1/11 19:05,Enhancement,4,Windows XP,wireshark-bugs,sebbaz+ws,2/8/07 12:45,2011-08-01 19:05:00 UTC,Christopher.Maynard
1362,GTK+ UI,RESOLVED,NOTABUG,Filter button missing help,2/8/07 23:20,Minor,1,Windows XP,wireshark-bugs,scrmacdo,2/8/07 23:19,2007-02-08 23:20:03 UTC,scrmacdo
1363,GTK+ UI,RESOLVED,NOTOURBUG,Missing help in the File -> Open dialog,2/9/07 1:49,Minor,2,Windows XP,wireshark-bugs,scrmacdo,2/8/07 23:22,2007-02-09 01:49:39 UTC,ulf.lamping
1364,GTK+ UI,RESOLVED,NOTOURBUG,Other Wireshark windows don't redraw if Open File or Save File dialog is open,6/16/14 23:07,Minor,20,Windows XP,wireshark-bugs,scrmacdo,2/8/07 23:25,2014-06-16 23:07:59 UTC,jmayer
1365,GTK+ UI,RESOLVED,FIXED,Authentication Quintuplet decoding fails,2/12/07 21:49,Major,4,Windows XP,wireshark-bugs,pasi.paakala,2/9/07 8:01,2007-02-12 21:49:55 UTC,anders.broman
1366,GTK+ UI,RESOLVED,FIXED,Support for RPCAP features in GUI,12/4/07 11:24,Enhancement,11,All,wireshark-bugs,Boris.Misenov,2/9/07 9:12,2007-12-04 11:24:18 UTC,tomas.kukosa
1367,GTK+ UI,RESOLVED,NOTABUG,Invalid checksums with TCP offloading hardware.,2/10/07 15:41,Minor,2,Windows NT,wireshark-bugs,john,2/10/07 14:12,2007-02-10 15:41:36 UTC,luis.ontanon
1368,GTK+ UI,RESOLVED,FIXED,adware included with installation of 0.99.5,2/14/07 6:45,Critical,11,Windows XP,wireshark-bugs,GaryChaulklin,2/10/07 17:03,2007-02-14 06:45:07 UTC,gerald
1369,GTK+ UI,RESOLVED,FIXED,Execution after build fails with dtap symbol undefined,2/11/07 19:59,Major,2,Linux (other),wireshark-bugs,andersen7,2/11/07 15:36,2007-02-11 19:59:15 UTC,andersen7
1370,GTK+ UI,RESOLVED,FIXED,LUA function all_field_infos() causes wire shark to terminate.,3/8/07 23:03,Major,4,Windows XP,wireshark-bugs,doug.h.rice,2/12/07 21:57,2007-03-08 23:03:02 UTC,luis.ontanon
1371,GTK+ UI,RESOLVED,FIXED,BSSGP dissector: incorrect TLLI field name handling,2/19/07 16:26,Major,5,Windows XP,wireshark-bugs,pilyuk,2/13/07 8:45,2007-02-16 06:58:34 UTC,anders.broman
1372,Dissection engine (libwireshark),CONFIRMED, ---,Non-ASCII printable characters in strings are displayed as escapes rather than as themselves,7/20/15 11:35,Enhancement,3,All,bugzilla-admin,fpeters,2/13/07 16:06,,pahan
1373,GTK+ UI,RESOLVED,NOTABUG,Info field remains truncated monitoring UDP 514 IDS/IDP/Routers vetc,7/30/14 20:13,Enhancement,8,All,wireshark-bugs,alpha096,2/15/07 0:08,2014-07-30 20:13:35 UTC,guy
1374,GTK+ UI,RESOLVED,NOTABUG,packetreceivepacket failed w/ airpcap,8/31/07 6:33,Major,7,Windows XP,wireshark-bugs,magnitude99,2/15/07 1:12,2007-08-31 06:33:33 UTC,jaap.keuter
1375,GTK+ UI,RESOLVED,FIXED,Capture Options with many IP addresses scrolls off screen,3/16/07 22:12,Normal,4,All,wireshark-bugs,Alvey.H.Stubblefield,2/16/07 0:38,2007-03-16 22:12:19 UTC,stephenfisher
1376,GTK+ UI,RESOLVED,FIXED,payload missing when interprete mpeg2ts packet with adaptation field,4/7/07 10:19,Normal,5,All,wireshark-bugs,sio4,2/16/07 2:01,2007-04-07 10:19:12 UTC,jaap.keuter
1377,GTK+ UI,RESOLVED,FIXED,Empty Error Dialog Box Window - 'Capture' -> 'Interfaces...' -> 'Options',3/13/13 0:15,Major,17,Windows Server 2003,wireshark-bugs,Alvey.H.Stubblefield,2/16/07 17:05,2007-04-11 04:59:34 UTC,fanchaoting
1378,GTK+ UI,RESOLVED,DUPLICATE,Opens Off Screen - Multi-Monitor,3/27/08 21:24,Major,3,Windows XP,wireshark-bugs,Alvey.H.Stubblefield,2/16/07 18:19,2008-03-27 21:24:50 UTC,gerald
1379,GTK+ UI,RESOLVED,FIXED,Add Connection Configuration Object support to EtherNet/IP dissector,2/22/07 3:48,Enhancement,3,All,wireshark-bugs,wamslers,2/16/07 22:31,2007-02-22 03:48:52 UTC,wmeier
1380,TShark,RESOLVED,FIXED,Buildbot crash output: fuzz-2007-02-17-22957.pcap,2/18/07 10:20,Critical,5,Mac OS X 10.3,wireshark-bugs,buildbot-do-not-reply,2/17/07 18:11,2007-02-18 10:20:16 UTC,jeff.morriss.ws
1381,TShark,RESOLVED,DUPLICATE,Buildbot crash output: fuzz-2007-02-17-28608.pcap,2/17/07 22:40,Critical,2,Mac OS X 10.3,wireshark-bugs,buildbot-do-not-reply,2/17/07 21:21,2007-02-17 22:40:05 UTC,wmeier
1382,TShark,RESOLVED,DUPLICATE,Buildbot crash output: fuzz-2007-02-17-4450.pcap,2/18/07 7:15,Critical,2,Mac OS X 10.3,wireshark-bugs,buildbot-do-not-reply,2/18/07 4:41,2007-02-18 07:15:21 UTC,stephenfisher
1383,GTK+ UI,RESOLVED,FIXED,support for the epmd protocol,3/10/07 14:17,Enhancement,12,Linux (other),wireshark-bugs,joost,2/18/07 12:24,2007-03-10 08:44:08 UTC,jeff.morriss.ws
1384,GTK+ UI,RESOLVED,FIXED,BSSGP.TLLI is not recognized properly in filter,9/11/07 7:48,Normal,7,Windows XP,wireshark-bugs,veli-matti.truhponen,2/19/07 9:57,2007-09-03 16:39:39 UTC,anders.broman
1385,TShark,RESOLVED,FIXED,local control descriptor of H.248 message is decoded incorrectly,3/8/07 22:33,Normal,8,Windows XP,luis.ontanon,pubate.satienpoch,2/20/07 10:38,2007-03-08 22:33:21 UTC,luis.ontanon
1386,GTK+ UI,RESOLVED,WORKSFORME,LUA Dumper.dump() creates wrong timestamps,4/5/07 7:07,Major,7,Windows XP,luis.ontanon,j.verriere,2/20/07 13:24,2007-04-04 22:49:13 UTC,luis.ontanon
1387,Build process,RESOLVED,FIXED,lemon Makefile breaks BSD make compatiblity,1/26/15 22:36,Major,2,OpenBSD,wireshark-bugs,nikns,2/20/07 15:31,2007-02-20 17:41:33 UTC,guy
1388,GTK+ UI,RESOLVED,FIXED,syntax errors in airpdcap_dijandel.h and airpdcap_ccmp.c,2/28/07 21:18,Major,4,Solaris,wireshark-bugs,io,2/20/07 17:02,2007-02-25 23:28:34 UTC,guy
1389,GTK+ UI,RESOLVED,LATER,Interface is not readable in 256-color mode  (Windows 2K  2003),9/7/08 21:13,Major,9,Windows Server 2003,wireshark-bugs,vwolf1,2/21/07 8:38,2008-09-07 21:13:42 UTC,acolbeck
1390,GTK+ UI,RESOLVED,FIXED,wrong UDP header warning,2/21/07 16:46,Major,3,Windows XP,wireshark-bugs,jhchd,2/21/07 14:53,2007-02-21 16:46:52 UTC,anders.broman
1391,GTK+ UI,RESOLVED,FIXED,wireshark links against installed old version,12/29/08 4:25,Major,2,OpenBSD,wireshark-bugs,nikns,2/21/07 14:56,2008-12-29 04:25:26 UTC,jaap.keuter
1392,Dissection engine (libwireshark),RESOLVED,FIXED,RPC portmap classification switched to TCP after filtering,1/12/17 23:12,Normal,13,All,wireshark-bugs,toralf.foerster,2/21/07 15:15,2008-04-15 15:55:11 UTC,guy
1393,GTK+ UI,RESOLVED,NOTOURBUG,0.99.5 Will Not Launch on NT 4.0 platform,2/24/07 13:30,Major,3,Windows NT,wireshark-bugs,melen.cw,2/22/07 10:55,2007-02-24 13:30:52 UTC,ulf.lamping
1394,GTK+ UI,RESOLVED,FIXED,Runtime error crash after clicking on HTTP packet,5/5/07 18:14,Critical,4,Windows XP,wireshark-bugs,nimai_malle,2/22/07 22:47,2007-03-16 00:50:44 UTC,gerald
1395,GTK+ UI,RESOLVED,FIXED, --without gnutls fails to build without gnutls if gnutls is present,6/18/07 3:04,Minor,3,Linux (other),wireshark-bugs,luis.ontanon,2/22/07 23:11,2007-06-18 03:04:58 UTC,sebastien
1396,GTK+ UI,RESOLVED,DUPLICATE,Unable to save flow graph data,2/23/07 15:03,Normal,2,Windows XP,wireshark-bugs,fritz.wuest,2/23/07 14:47,2007-02-23 15:03:50 UTC,jeff.morriss.ws
1397,GTK+ UI,RESOLVED,WONTFIX,Program crashes when trying to select a capture interface.,7/30/14 20:14,Critical,9,Windows 2000,wireshark-bugs,chris.t.bridenbaugh,2/24/07 2:30,2014-07-30 20:14:19 UTC,guy
1398,TShark,RESOLVED,DUPLICATE,Buildbot crash output: fuzz-2007-02-23-3722.pcap,2/24/07 4:10,Critical,2,Mac OS X 10.3,wireshark-bugs,buildbot-do-not-reply,2/24/07 3:11,2007-02-24 04:10:29 UTC,wmeier
1399,GTK+ UI,RESOLVED,NOTOURBUG,packets in promiscuous mode,12/21/07 23:17,Major,4,Windows XP,wireshark-bugs,obiwan,2/25/07 3:23,2007-12-21 23:17:29 UTC,stephenfisher
1400,TShark,RESOLVED,DUPLICATE,Buildbot crash output: fuzz-2007-02-24-20333.pcap,2/26/07 2:43,Critical,2,Mac OS X 10.3,wireshark-bugs,buildbot-do-not-reply,2/25/07 4:01,2007-02-26 02:43:59 UTC,stephenfisher
1401,TShark,RESOLVED,DUPLICATE,Buildbot crash output: fuzz-2007-02-25-12805.pcap,2/26/07 2:46,Critical,2,Mac OS X 10.3,wireshark-bugs,buildbot-do-not-reply,2/26/07 1:41,2007-02-26 02:46:18 UTC,stephenfisher
1402,Qt UI,CONFIRMED, ---,Analyze-> Enabled protocols : activate dependend protocols,6/22/16 2:50,Enhancement,4,All,wireshark-bugs,toralf.foerster,2/26/07 13:11,,mmann78
1403,GTK+ UI,RESOLVED,NOTABUG,IPP response packets malformed.,3/19/07 9:55,Normal,2,Linux (other),wireshark-bugs,toralf.foerster,2/26/07 13:18,2007-03-19 09:55:42 UTC,toralf.foerster
1404,GTK+ UI,RESOLVED,DUPLICATE,Follow TCP stream output missing characters that are in raw capture file,2/27/07 1:35,Normal,2,All,wireshark-bugs,cis_shawn,2/26/07 18:44,2007-02-27 01:35:35 UTC,jeff.morriss.ws
1405,TShark,RESOLVED,DUPLICATE,Buildbot crash output: fuzz-2007-02-26-17423.pcap,2/28/07 0:11,Critical,2,Mac OS X 10.3,wireshark-bugs,buildbot-do-not-reply,2/26/07 21:31,2007-02-28 00:11:39 UTC,stephenfisher
1406,TShark,RESOLVED,FIXED,H.248 local descriptor is decoded incorrectly for TMR=speech,2/27/07 10:30,Normal,4,Windows XP,wireshark-bugs,pubate.satienpoch,2/27/07 8:51,2007-02-27 10:29:11 UTC,luis.ontanon
1407,TShark,RESOLVED,FIXED,H.248 local descriptor is decoded incorrectly for IPv4 address,2/27/07 10:49,Normal,4,Windows XP,wireshark-bugs,pubate.satienpoch,2/27/07 9:24,2007-02-27 10:49:18 UTC,luis.ontanon
1408,GTK+ UI,RESOLVED,FIXED,proto_tree_add_bitmask not exported,2/28/07 0:08,Minor,3,Windows XP,wireshark-bugs,michael.wojcik,2/27/07 23:36,2007-02-28 00:08:48 UTC,stephenfisher
1410,GTK+ UI,RESOLVED,DUPLICATE,Wireshark selct adapter error,4/13/07 14:00,Major,10,Windows Server 2003,wireshark-bugs,ceiland,3/1/07 19:33,2007-04-11 05:13:05 UTC,jeff.morriss.ws
1411,GTK+ UI,RESOLVED,DUPLICATE,Text color changes when using remote desktop,3/1/07 21:35,Major,2,Windows Server 2003,wireshark-bugs,ceiland,3/1/07 19:35,2007-03-01 21:35:27 UTC,ulf.lamping
1412,GTK+ UI,RESOLVED,FIXED,"HTTP ""dissector bug"" when downloading large chunks of data",3/6/07 0:42,Normal,5,Windows XP,stephenfisher,ulf.lamping,3/3/07 10:01,2007-03-06 00:42:53 UTC,stephenfisher
1413,GTK+ UI,RESOLVED,FIXED,SVN version detection doesn't work if svn is not found,9/7/11 19:01,Minor,23,Windows XP,wireshark-bugs,ulf.lamping,3/3/07 10:27,2011-09-07 19:01:21 UTC,jeff.morriss.ws
1415,TShark,RESOLVED,FIXED,SIGTRAP while opening capture file,3/7/07 1:17,Blocker,2,Linux (other),wireshark-bugs,bugzilla,3/5/07 9:08,2007-03-07 01:17:35 UTC,gerald
1416,GTK+ UI,RESOLVED,FIXED,crash (stack smashing) on single DHCP packet,5/26/07 6:22,Critical,11,Linux (other),wireshark-bugs,thomas.anders,3/5/07 9:38,2007-05-26 00:46:48 UTC,stephenfisher
1417,GTK+ UI,RESOLVED,FIXED,Inaccurate RTCP Parsing,3/6/07 13:55,Normal,2,Windows XP,wireshark-bugs,brettcclark,3/5/07 16:33,2007-03-06 13:55:25 UTC,martin.mathieson
1418,GTK+ UI,RESOLVED,NOTABUG,RTCP Parsing NTP,5/9/07 6:54,Normal,2,Windows XP,wireshark-bugs,brettcclark,3/5/07 16:37,2007-05-09 06:54:33 UTC,jaap.keuter
1419,GTK+ UI,CONFIRMED, ---,dumpcap keeps running after Wireshark crashes,3/12/14 17:05,Major,7,Windows XP,wireshark-bugs,haluk.ozoguz,3/5/07 17:29,,Sloven0
1420,GTK+ UI,RESOLVED,FIXED,802.11 WPA/WPA2-PSK Unable to decode Group Keys,7/30/08 15:33,Major,8,Windows XP,gerald,sohkamyung,3/6/07 5:14,2008-07-30 15:33:45 UTC,gerald
1421,GTK+ UI,RESOLVED,WORKSFORME,BER  Error on sNMPV2-TRAP,4/4/07 22:18,Major,4,Windows XP,wireshark-bugs,p.dubarry,3/6/07 12:46,2007-04-04 22:18:16 UTC,luis.ontanon
1423,GTK+ UI,RESOLVED,DUPLICATE,packet header decode is truncated,11/29/07 20:27,Trivial,4,Windows XP,wireshark-bugs,brian.hartson,3/6/07 19:47,2007-11-29 20:27:15 UTC,sake
1424,GTK+ UI,RESOLVED,FIXED,IUA Interface IID filter doesn't work,3/7/07 19:04,Critical,6,All,wireshark-bugs,juvancic,3/7/07 9:09,2007-03-07 19:04:46 UTC,Michael.Tuexen
1425,TShark,RESOLVED,FIXED,HTTP will fail to dissect the body if it comes in the next packet,11/8/07 3:47,Minor,4,All,wireshark-bugs,luis.ontanon,3/7/07 9:47,2007-11-08 03:47:46 UTC,did447
1426,GTK+ UI,RESOLVED,NOTABUG,Bluetooth SDP never loads when I open a .cap file,7/17/07 8:54,Major,4,Windows XP,wireshark-bugs,henrik.arendrup,3/7/07 10:14,2007-07-17 08:54:52 UTC,jaap.keuter
1427,GTK+ UI,RESOLVED,FIXED,"Change ""Continue without saving"" button to ""Close without saving"" in close dialog",6/7/09 22:21,Trivial,5,Linux (other),wireshark-bugs,halfdan,3/7/07 21:15,2009-05-26 19:48:24 UTC,jaap.keuter
1428,TShark,RESOLVED,DUPLICATE,Buildbot crash output: fuzz-2007-03-07-8496.pcap,3/8/07 23:35,Critical,2,Mac OS X 10.3,wireshark-bugs,buildbot-do-not-reply,3/8/07 2:11,2007-03-08 23:35:47 UTC,gerald
1429,GTK+ UI,RESOLVED,FIXED,Wireshark fails to desegment SIP body,4/17/07 15:46,Major,14,Windows XP,wireshark-bugs,peter.makrai,3/8/07 13:13,2007-04-17 15:46:35 UTC,luis.ontanon
1430,GTK+ UI,RESOLVED,FIXED,EtherCAT dissector,2/25/08 15:24,Enhancement,57,All,wireshark-bugs,anders.blomdell,3/8/07 16:34,2008-02-25 15:24:59 UTC,jeff.morriss.ws
1431,TShark,RESOLVED,DUPLICATE,Buildbot crash output: fuzz-2007-03-08-14839.pcap,3/10/07 18:10,Critical,2,Mac OS X 10.3,wireshark-bugs,buildbot-do-not-reply,3/8/07 23:31,2007-03-10 18:10:51 UTC,wmeier
1432,GTK+ UI,RESOLVED,FIXED,Wireshark can not decode H248 over TCP.,3/19/07 14:06,Major,5,Windows XP,wireshark-bugs,krisztian.papp,3/10/07 15:29,2007-03-17 21:48:29 UTC,luis.ontanon
1433,TShark,RESOLVED,FIXED,Buildbot crash output: fuzz-2007-03-13-15254.pcap,3/14/07 23:05,Critical,9,Mac OS X 10.3,wireshark-bugs,buildbot-do-not-reply,3/13/07 21:50,2007-03-14 23:02:02 UTC,jmayer
1434,TShark,RESOLVED,DUPLICATE,Buildbot crash output: fuzz-2007-03-13-19730.pcap,3/14/07 23:02,Critical,2,Mac OS X 10.3,wireshark-bugs,buildbot-do-not-reply,3/14/07 4:00,2007-03-14 23:02:23 UTC,jmayer
1435,TShark,RESOLVED,DUPLICATE,Buildbot crash output: fuzz-2007-03-14-24230.pcap,3/14/07 23:02,Critical,2,Mac OS X 10.3,wireshark-bugs,buildbot-do-not-reply,3/14/07 7:30,2007-03-14 23:02:47 UTC,jmayer
1436,TShark,RESOLVED,DUPLICATE,Buildbot crash output: fuzz-2007-03-14-28690.pcap,3/14/07 23:03,Critical,2,Mac OS X 10.3,wireshark-bugs,buildbot-do-not-reply,3/14/07 8:31,2007-03-14 23:03:09 UTC,jmayer
1437,GTK+ UI,RESOLVED,FIXED,MS SQL packet classified as TAPA respectively DNS,3/28/07 7:05,Minor,9,Linux (other),jmayer,toralf.foerster,3/14/07 10:38,2007-03-28 07:05:27 UTC,jmayer
1438,GTK+ UI,RESOLVED,FIXED,atm-pdus-untruncated support for libpcap files,3/6/08 20:24,Normal,8,All,wireshark-bugs,j.pedro.fonseca,3/14/07 11:35,2008-03-06 20:24:55 UTC,anders.broman
1439,TShark,RESOLVED,DUPLICATE,Buildbot crash output: fuzz-2007-03-14-3356.pcap,3/14/07 23:04,Critical,2,Mac OS X 10.3,wireshark-bugs,buildbot-do-not-reply,3/14/07 16:50,2007-03-14 23:04:07 UTC,jmayer
1440,TShark,RESOLVED,DUPLICATE,Buildbot crash output: fuzz-2007-03-14-7823.pcap,3/14/07 23:04,Critical,2,Mac OS X 10.3,wireshark-bugs,buildbot-do-not-reply,3/14/07 18:30,2007-03-14 23:04:27 UTC,jmayer
1441,TShark,RESOLVED,DUPLICATE,Buildbot crash output: fuzz-2007-03-14-12291.pcap,3/14/07 23:04,Critical,2,Mac OS X 10.3,wireshark-bugs,buildbot-do-not-reply,3/14/07 19:30,2007-03-14 23:04:48 UTC,jmayer
1442,TShark,RESOLVED,DUPLICATE,Buildbot crash output: fuzz-2007-03-14-16756.pcap,3/14/07 23:05,Critical,2,Mac OS X 10.3,wireshark-bugs,buildbot-do-not-reply,3/14/07 20:40,2007-03-14 23:05:10 UTC,jmayer
1443,Dissection engine (libwireshark),CONFIRMED, ---,Enhancements to configuration of sub-dissectors using display filters,6/17/14 22:39,Enhancement,7,Windows XP,bugzilla-admin,douglas.pratley,3/15/07 8:53,,guy
1444,TShark,RESOLVED,FIXED,New TShark output format with user-defined fields,3/26/07 20:32,Enhancement,5,Windows XP,wireshark-bugs,douglas.pratley,3/15/07 9:12,2007-03-26 20:32:38 UTC,stephenfisher
1445,GTK+ UI,RESOLVED,FIXED,"Add ability to provide a ""named subnets"" file in addition to ""hosts"" file.",6/2/15 16:24,Enhancement,16,Windows XP,wireshark-bugs,douglas.pratley,3/15/07 9:31,2008-01-21 21:46:02 UTC,Christopher.Maynard
1446,GTK+ UI,RESOLVED,FIXED,lynx builds release-notes.txt as a html page,8/18/07 15:52,Minor,6,Linux (other),wireshark-bugs,toralf.foerster,3/16/07 9:26,2007-08-18 15:52:54 UTC,wmeier
1447,GTK+ UI,RESOLVED,FIXED,Follow TCP Stream show only the first stream,9/30/08 6:33,Normal,4,Windows XP,wireshark-bugs,mauro,3/16/07 10:00,2008-09-30 06:33:32 UTC,sake
1448,Extras,RESOLVED,FIXED,buildbot doesn't run unit tests,4/3/07 1:57,Major,3,All,wireshark-bugs,bugzilla,3/16/07 14:11,2007-04-03 01:57:39 UTC,bugzilla
1449,GTK+ UI,RESOLVED,FIXED,"Add accelerator key for ""copy as filter + Correct some items in documentation",3/23/07 0:44,Enhancement,5,All,wireshark-bugs,sake,3/17/07 10:48,2007-03-23 00:44:30 UTC,stephenfisher
1450,Dissection engine (libwireshark),CONFIRMED, ---,irc dissector don't show CTCP commands,6/17/14 22:39,Enhancement,13,Linux (other),bugzilla-admin,toralf.foerster,3/18/07 10:15,,guy
1451,TShark,RESOLVED,FIXED,Buildbot crash output: fuzz-2007-03-18-17676.pcap,3/18/07 13:54,Critical,2,Mac OS X 10.3,wireshark-bugs,buildbot-do-not-reply,3/18/07 13:40,2007-03-18 13:54:34 UTC,luis.ontanon
1452,TShark,RESOLVED,FIXED,Buildbot crash output: fuzz-2007-03-18-17465.pcap,3/24/07 10:07,Critical,2,Mac OS X 10.3,wireshark-bugs,buildbot-do-not-reply,3/18/07 17:50,2007-03-24 10:07:57 UTC,jeff.morriss.ws
1454,GTK+ UI,RESOLVED,NOTABUG,messenger packets ok after pp0 but malformed after eth0,3/24/07 13:32,Normal,5,Linux (other),wireshark-bugs,toralf.foerster,3/20/07 14:34,2007-03-24 13:07:28 UTC,jeff.morriss.ws
1455,GTK+ UI,VERIFIED,NOTABUG,LLDPDU MAC-PHY TLV PMD Auto-Neg field is being analyzed incorrectly,1/22/08 11:10,Normal,36,All,wireshark-bugs,jhilman,3/20/07 18:47,2008-01-22 11:08:44 UTC,jhilman
1456,GTK+ UI,RESOLVED,FIXED,Unable to find any Interfaces using Vista Ultimate (64 bit),11/27/07 21:25,Major,5,Windows Vista,wireshark-bugs,dave.hormel,3/20/07 22:03,2007-09-19 19:31:05 UTC,gerald
1457,GTK+ UI,RESOLVED,FIXED,Manual Edit of Coloring Rules shuts Wireshark down,9/24/07 21:37,Major,7,Linux (other),wireshark-bugs,hutch,3/20/07 22:45,2007-09-24 21:37:26 UTC,wmeier
1459,GTK+ UI,RESOLVED,FIXED,"The filter ""ip.version == 6"" doesn't work",11/18/07 8:18,Normal,11,All,wireshark-bugs,ulf.lamping,3/21/07 3:52,2007-11-18 08:18:30 UTC,ulf.lamping
1460,GTK+ UI,RESOLVED,DUPLICATE,Main form positions itself poorly with Multiple Monitors,7/18/08 7:47,Minor,6,Windows XP,wireshark-bugs,ldew,3/21/07 13:32,2008-07-18 07:47:46 UTC,jeff.morriss.ws
1461,GTK+ UI,RESOLVED,FIXED,ISO/IEC 13818-1 filter broken,8/15/07 10:45,Major,5,Windows XP,wireshark-bugs,nigel,3/21/07 16:57,2007-08-15 10:45:07 UTC,jaap.keuter
1462,GTK+ UI,RESOLVED,FIXED,Fragmented UDP length & checksum validation incorrect,3/22/07 9:45,Minor,3,Windows XP,wireshark-bugs,nigel,3/22/07 9:18,2007-03-22 09:45:00 UTC,jeff.morriss.ws
1463,GTK+ UI,RESOLVED,DUPLICATE,Ability to dissect and decode encapsulated traffic in OpenVPN,1/20/13 22:06,Enhancement,7,Windows XP,wireshark-bugs,bill.fassler,3/23/07 18:22,2013-01-20 22:06:43 UTC,anders.broman
1464,GTK+ UI,RESOLVED,FIXED,patch for packet-symantec.c for new capture file format,4/10/07 7:03,Enhancement,6,Windows XP,wireshark-bugs,sgsguy,3/23/07 18:41,2007-04-10 07:03:19 UTC,jeff.morriss.ws
1465,TShark,RESOLVED,FIXED,Buildbot crash output: fuzz-2007-03-23-27263.pcap,3/25/07 23:46,Critical,30,Mac OS X 10.3,wireshark-bugs,buildbot-do-not-reply,3/23/07 19:01,2007-03-25 19:06:43 UTC,luis.ontanon
1466,TShark,RESOLVED,DUPLICATE,Buildbot crash output: fuzz-2007-03-23-3696.pcap,3/24/07 7:13,Critical,2,Mac OS X 10.3,wireshark-bugs,buildbot-do-not-reply,3/23/07 20:00,2007-03-24 07:13:54 UTC,jeff.morriss.ws
1467,TShark,RESOLVED,DUPLICATE,Buildbot crash output: fuzz-2007-03-23-10052.pcap,3/24/07 7:14,Critical,2,Mac OS X 10.3,wireshark-bugs,buildbot-do-not-reply,3/23/07 23:50,2007-03-24 07:14:03 UTC,jeff.morriss.ws
1468,TShark,RESOLVED,DUPLICATE,Buildbot crash output: fuzz-2007-03-23-16350.pcap,3/24/07 7:14,Critical,2,Mac OS X 10.3,wireshark-bugs,buildbot-do-not-reply,3/24/07 0:50,2007-03-24 07:14:15 UTC,jeff.morriss.ws
1469,TShark,RESOLVED,DUPLICATE,Buildbot crash output: fuzz-2007-03-23-12077.pcap,3/24/07 7:14,Critical,2,Mac OS X 10.3,wireshark-bugs,buildbot-do-not-reply,3/24/07 2:50,2007-03-24 07:14:23 UTC,jeff.morriss.ws
1470,TShark,RESOLVED,DUPLICATE,Buildbot crash output: fuzz-2007-03-23-18369.pcap,3/24/07 7:14,Critical,2,Mac OS X 10.3,wireshark-bugs,buildbot-do-not-reply,3/24/07 3:50,2007-03-24 07:14:39 UTC,jeff.morriss.ws
1471,TShark,RESOLVED,DUPLICATE,Buildbot crash output: fuzz-2007-03-24-24702.pcap,3/24/07 9:39,Critical,2,Mac OS X 10.3,wireshark-bugs,buildbot-do-not-reply,3/24/07 8:10,2007-03-24 09:39:53 UTC,jeff.morriss.ws
1472,TShark,RESOLVED,DUPLICATE,Buildbot crash output: fuzz-2007-03-24-1130.pcap,3/24/07 9:40,Critical,2,Mac OS X 10.3,wireshark-bugs,buildbot-do-not-reply,3/24/07 9:11,2007-03-24 09:40:06 UTC,jeff.morriss.ws
1473,TShark,RESOLVED,DUPLICATE,Buildbot crash output: fuzz-2007-03-24-7504.pcap,3/24/07 11:29,Critical,2,Mac OS X 10.3,wireshark-bugs,buildbot-do-not-reply,3/24/07 11:10,2007-03-24 11:29:20 UTC,jeff.morriss.ws
1474,TShark,RESOLVED,DUPLICATE,Buildbot crash output: fuzz-2007-03-24-13927.pcap,3/24/07 14:41,Critical,2,Mac OS X 10.3,wireshark-bugs,buildbot-do-not-reply,3/24/07 14:20,2007-03-24 14:41:53 UTC,jeff.morriss.ws
1475,TShark,RESOLVED,DUPLICATE,Buildbot crash output: fuzz-2007-03-24-20214.pcap,3/25/07 0:45,Critical,2,Mac OS X 10.3,wireshark-bugs,buildbot-do-not-reply,3/24/07 15:20,2007-03-25 00:45:02 UTC,jeff.morriss.ws
1476,GTK+ UI,RESOLVED,FIXED,Allow users to specify where Wireshark stores plugins  preferences  history  etc. on Unix,11/17/07 16:16,Enhancement,10,Linux (other),wireshark-bugs,ryker,3/24/07 18:10,2007-11-17 16:16:35 UTC,stephenfisher
1477,TShark,RESOLVED,DUPLICATE,Buildbot crash output: fuzz-2007-03-24-26551.pcap,3/25/07 0:45,Critical,2,Mac OS X 10.3,wireshark-bugs,buildbot-do-not-reply,3/24/07 19:41,2007-03-25 00:45:13 UTC,jeff.morriss.ws
1478,TShark,RESOLVED,DUPLICATE,Buildbot crash output: fuzz-2007-03-24-3016.pcap,3/25/07 0:45,Critical,2,Mac OS X 10.3,wireshark-bugs,buildbot-do-not-reply,3/24/07 23:10,2007-03-25 00:45:27 UTC,jeff.morriss.ws
1479,TShark,RESOLVED,DUPLICATE,Buildbot crash output: fuzz-2007-03-24-9333.pcap,11/15/11 11:00,Critical,4,Mac OS X 10.3,wireshark-bugs,buildbot-do-not-reply,3/25/07 1:00,2007-03-25 01:27:44 UTC,jeff.morriss.ws
1480,TShark,RESOLVED,DUPLICATE,Buildbot crash output: fuzz-2007-03-24-15623.pcap,3/25/07 3:17,Critical,2,Mac OS X 10.3,wireshark-bugs,buildbot-do-not-reply,3/25/07 1:50,2007-03-25 03:17:46 UTC,jeff.morriss.ws
1481,TShark,RESOLVED,DUPLICATE,Buildbot crash output: fuzz-2007-03-24-21953.pcap,3/25/07 7:23,Critical,2,Mac OS X 10.3,wireshark-bugs,buildbot-do-not-reply,3/25/07 6:30,2007-03-25 07:23:52 UTC,jeff.morriss.ws
1482,TShark,RESOLVED,DUPLICATE,Buildbot crash output: fuzz-2007-03-25-28459.pcap,3/25/07 11:37,Critical,2,Mac OS X 10.3,wireshark-bugs,buildbot-do-not-reply,3/25/07 9:31,2007-03-25 11:37:46 UTC,jeff.morriss.ws
1483,TShark,RESOLVED,DUPLICATE,Buildbot crash output: fuzz-2007-03-25-5157.pcap,3/25/07 11:37,Critical,2,Mac OS X 10.3,wireshark-bugs,buildbot-do-not-reply,3/25/07 10:30,2007-03-25 11:37:33 UTC,jeff.morriss.ws
1484,TShark,RESOLVED,DUPLICATE,Buildbot crash output: fuzz-2007-03-25-11639.pcap,3/25/07 11:45,Critical,2,Mac OS X 10.3,wireshark-bugs,buildbot-do-not-reply,3/25/07 11:31,2007-03-25 11:45:36 UTC,jeff.morriss.ws
1485,TShark,RESOLVED,DUPLICATE,Buildbot crash output: fuzz-2007-03-25-18119.pcap,3/25/07 12:42,Critical,2,Mac OS X 10.3,wireshark-bugs,buildbot-do-not-reply,3/25/07 12:30,2007-03-25 12:42:11 UTC,jeff.morriss.ws
1486,TShark,RESOLVED,DUPLICATE,Buildbot crash output: fuzz-2007-03-25-24625.pcap,3/25/07 14:00,Critical,2,Mac OS X 10.3,wireshark-bugs,buildbot-do-not-reply,3/25/07 13:30,2007-03-25 14:00:17 UTC,jeff.morriss.ws
1487,GTK+ UI,RESOLVED,NOTABUG,Bad iSCSI parsing,3/26/07 3:49,Major,3,Windows XP,wireshark-bugs,erang,3/25/07 15:11,2007-03-26 03:49:58 UTC,ronniesahlberg
1488,TShark,RESOLVED,DUPLICATE,Buildbot crash output: fuzz-2007-03-25-10555.pcap,3/25/07 23:46,Critical,2,Mac OS X 10.3,wireshark-bugs,buildbot-do-not-reply,3/25/07 16:20,2007-03-25 23:46:51 UTC,jeff.morriss.ws
1489,TShark,RESOLVED,DUPLICATE,Buildbot crash output: fuzz-2007-03-25-26278.pcap,3/25/07 23:46,Critical,2,Mac OS X 10.3,wireshark-bugs,buildbot-do-not-reply,3/25/07 17:10,2007-03-25 23:46:39 UTC,jeff.morriss.ws
1490,TShark,RESOLVED,DUPLICATE,Buildbot crash output: fuzz-2007-03-25-12151.pcap,3/25/07 19:04,Critical,2,Mac OS X 10.3,wireshark-bugs,buildbot-do-not-reply,3/25/07 18:10,2007-03-25 19:04:30 UTC,luis.ontanon
1491,GTK+ UI,RESOLVED,DUPLICATE,Fonts do not display when using Terminal Services,3/27/07 1:59,Blocker,2,Windows 2000,wireshark-bugs,sam,3/25/07 20:59,2007-03-27 01:59:58 UTC,jeff.morriss.ws
1492,GTK+ UI,RESOLVED,FIXED,ciscoci plugin adapted for wireshark,12/21/07 22:13,Enhancement,6,All,wireshark-bugs,ssinyagin,3/26/07 15:12,2007-12-21 22:13:17 UTC,ssinyagin
1493,GTK+ UI,RESOLVED,DUPLICATE,Packet to Packet receive failure,6/14/07 15:19,Normal,5,Windows Vista,wireshark-bugs,dewcraver,3/27/07 7:32,2007-06-14 15:19:59 UTC,jaap.keuter
1494,TShark,RESOLVED,NOTOURBUG,Diameter dissector : the applicationID isn't taken into account when decoding an AVP,2/21/08 19:46,Major,5,All,wireshark-bugs,xameziane,3/27/07 13:47,2008-02-21 19:46:08 UTC,anders.broman
1495,GTK+ UI,RESOLVED,WORKSFORME,multiple files creates a ton of empty 1 or  2 K files,4/7/07 2:57,Major,3,Windows XP,wireshark-bugs,tlange,3/27/07 19:53,2007-04-07 02:57:17 UTC,jeff.morriss.ws
1496,GTK+ UI,RESOLVED,NOTABUG,Hex pane shows inconsistent data,3/28/07 7:29,Major,3,Windows XP,wireshark-bugs,gianluca.varenni,3/27/07 21:07,2007-03-28 07:29:48 UTC,jmayer
1497,GTK+ UI,RESOLVED,FIXED,IP DSCP Value column not exported to CSV format,5/9/07 22:28,Normal,2,Windows XP,wireshark-bugs,claridgestephen,3/27/07 21:18,2007-05-09 22:28:17 UTC,jaap.keuter
1498,GTK+ UI,RESOLVED,FIXED,GSM_MAP dissector decodes MAPv2 MT-ForwardShortMessage incorrectly,4/23/07 21:29,Normal,9,Windows XP,wireshark-bugs,sarkar.abhik,3/28/07 3:50,2007-04-23 21:29:21 UTC,anders.broman
1499,GTK+ UI,RESOLVED,FIXED,H.248.1 TMR property decoding error,3/28/07 9:05,Normal,5,Windows XP,wireshark-bugs,boglarka.gobolos,3/28/07 8:25,2007-03-28 09:05:42 UTC,luis.ontanon
1500,GTK+ UI,RESOLVED,NOTABUG,"wrong tcp checksum not always caused by ""TCP checksum offload""",3/30/07 7:24,Trivial,3,Linux (other),wireshark-bugs,toralf.foerster,3/28/07 17:06,2007-03-30 07:24:14 UTC,toralf.foerster
1501,TShark,RESOLVED,FIXED,Buildbot crash output: fuzz-2007-03-29-2953.pcap,4/1/07 3:08,Critical,2,Mac OS X 10.3,wireshark-bugs,buildbot-do-not-reply,3/30/07 5:20,2007-04-01 03:08:32 UTC,jeff.morriss.ws
1502,GTK+ UI,RESOLVED,NOTABUG,how to disable passwords in wireshark & provide localized keys?,3/24/08 6:58,Normal,20,All,wireshark-bugs,nagendra0123,3/30/07 14:54,2008-03-24 06:58:35 UTC,stephenfisher
1503,GTK+ UI,RESOLVED,FIXED,SSLv2 record length and version shown wrong,4/10/07 18:41,Major,9,All,wireshark-bugs,vlada,3/30/07 16:14,2007-04-10 18:41:09 UTC,bugzilla
1504,GTK+ UI,RESOLVED,WORKSFORME,RUDP plugin doesn't work in Wireshark >= 0.99.3,4/2/07 6:38,Major,4,Windows XP,wireshark-bugs,redalex,3/30/07 16:25,2007-04-02 06:38:57 UTC,jeff.morriss.ws
1505,GTK+ UI,RESOLVED,FIXED,dcerpc-spoolss dissector doesn't support getprinterdriver levels,4/26/07 6:01,Normal,5,Linux (other),wireshark-bugs,Aaron.Staley,3/30/07 21:28,2007-04-26 06:01:24 UTC,jaap.keuter
1506,GTK+ UI,RESOLVED,NOTABUG,"ntp : ""Reference Clock ID"" misinterpreted and results in : Invalid UTF-8 string passed to pango_layout_set_text()",4/2/07 11:55,Minor,5,Linux (other),wireshark-bugs,toralf.foerster,4/1/07 11:37,2007-04-02 06:07:48 UTC,jaap.keuter
1507,GTK+ UI,RESOLVED,FIXED,WireShark Bluetooth SDP packet parsing infinite loop condition,11/26/07 21:27,Critical,6,Linux (other),wireshark-bugs,c0r31mp4ct,4/2/07 8:39,2007-11-26 21:27:57 UTC,gerald
1508,GTK+ UI,RESOLVED,FIXED,CIC parameter in ISUP message not decoded correctly,4/4/07 2:28,Normal,3,Windows XP,wireshark-bugs,chrsco,4/3/07 2:07,2007-04-03 06:29:35 UTC,jeff.morriss.ws
1509,TShark,RESOLVED,NOTABUG,Undefined reference to gtk_text_buffer_select_range,4/10/07 17:14,Normal,4,Linux (other),wireshark-bugs,Christopher.Maynard,4/3/07 14:13,2007-04-10 17:14:23 UTC,jmayer
1510,GTK+ UI,RESOLVED,NOTABUG,IO Graphs produce unreasonable result,6/23/07 6:19,Major,3,Windows XP,wireshark-bugs,wwycheuk,4/4/07 4:01,2007-06-23 06:19:59 UTC,stephenfisher
1511,TShark,RESOLVED,FIXED,gassert in packet-pana.c lead to a crash.,4/18/07 7:07,Normal,5,Linux (other),wireshark-bugs,florent.drouin,4/4/07 8:41,2007-04-10 14:31:51 UTC,jeff.morriss.ws
1512,TShark,RESOLVED,FIXED,Acces to uninitialized memory in packet-smpp,6/5/07 20:37,Normal,7,Linux (other),wireshark-bugs,florent.drouin,4/4/07 9:02,2007-06-05 20:37:10 UTC,jaap.keuter
1513,TShark,RESOLVED,FIXED,Wrong length for tvb_memcpy in packet-bthci_acl.c,10/3/08 14:47,Normal,10,Linux (other),wireshark-bugs,florent.drouin,4/4/07 9:31,2008-04-29 08:33:49 UTC,gerald
1514,GTK+ UI,RESOLVED,LATER,no display of concatenated h.225 messages,9/12/07 8:52,Major,4,Windows XP,wireshark-bugs,thierry.grethen,4/4/07 9:47,2007-09-12 08:52:22 UTC,jaap.keuter
1515,GTK+ UI,RESOLVED,FIXED,SSL bug with mutual authentication,4/10/07 15:13,Blocker,3,Windows XP,wireshark-bugs,diguardo,4/4/07 10:00,2007-04-10 15:13:30 UTC,tomas.kukosa
1516,Dissection engine (libwireshark),CONFIRMED, ---,dissect_ber_choice might infinitely loop,1/15/13 10:14,Major,7,All,bugzilla-admin,luis.ontanon,4/4/07 11:05,,honarbacht
1517,TShark,RESOLVED,FIXED,Error decode H.248 SC and AV,4/4/07 21:26,Major,3,Windows XP,wireshark-bugs,dmmgri,4/4/07 12:11,2007-04-04 21:26:44 UTC,luis.ontanon
1518,GTK+ UI,RESOLVED,FIXED,Bad g_asser in color_filter for coloring rules edition,8/21/07 21:19,Major,14,Linux (other),wireshark-bugs,florent.drouin,4/4/07 13:04,2007-08-21 21:18:01 UTC,bugzilla
1519,GTK+ UI,RESOLVED,FIXED,wireshark and tshark hang opening capture,9/1/07 11:00,Major,12,Windows XP,wireshark-bugs,nospam,4/4/07 18:56,2007-09-01 11:00:39 UTC,jaap.keuter
1520,GTK+ UI,RESOLVED,FIXED,"PDML Export sets empty ""value"" attribute for ip.fragments and sip.msg.hdr",3/28/11 7:56,Enhancement,9,All,wireshark-bugs,cbaratay.ext,4/5/07 9:14,2011-03-28 07:56:44 UTC,Christopher.Maynard
1521,GTK+ UI,RESOLVED,FIXED,Crash when writing in filter box if no file is open,4/17/07 15:20,Blocker,11,Windows 2000,wireshark-bugs,luis.ontanon,4/5/07 12:45,2007-04-17 15:20:13 UTC,luis.ontanon
1522,GTK+ UI,RESOLVED,FIXED,Update to WLCCP Packet Decode,4/13/07 14:02,Enhancement,10,All,wireshark-bugs,maillistnoll,4/5/07 15:25,2007-04-13 06:51:48 UTC,jeff.morriss.ws
1523,GTK+ UI,RESOLVED,FIXED,fix decoding display of Cisco Skinny DialedNumber message,4/5/07 23:43,Normal,3,Windows XP,wireshark-bugs,robby.rose,4/5/07 18:27,2007-04-05 23:43:39 UTC,jaap.keuter
1524,GTK+ UI,RESOLVED,FIXED,Diameter Event-Type Content-Length : type mismatch,4/23/07 9:23,Normal,2,Windows XP,wireshark-bugs,marc.levesque,4/5/07 21:07,2007-04-23 09:23:34 UTC,anders.broman
1526,GTK+ UI,RESOLVED,FIXED,iSeries Wiretap fails  probably due to upper case text,4/10/07 5:39,Critical,3,All,wireshark-bugs,cybermaus,4/6/07 6:52,2007-04-10 05:39:53 UTC,jaap.keuter
1527,GTK+ UI,RESOLVED,FIXED,Statistics/Conversations counters for ethernet & IPv4 do not count truncated packets,9/28/07 5:51,Normal,5,Windows XP,wireshark-bugs,tim.everitt,4/7/07 12:43,2007-09-28 05:51:10 UTC,ronniesahlberg
1528,TShark,RESOLVED,NOTABUG,unable to load ulog pcap dumps,9/5/08 23:05,Major,15,Linux (other),wireshark-bugs,fpeters,4/8/07 19:01,2008-02-29 02:05:18 UTC,jeff.morriss.ws
1529,GTK+ UI,RESOLVED,NOTABUG,Netflow v8 ToS field is shown not correctly,4/26/07 17:22,Major,3,Windows XP,wireshark-bugs,pavel,4/12/07 10:59,2007-04-26 17:22:38 UTC,olivier.montanuy
1530,GTK+ UI,RESOLVED,FIXED,Graph Analysis window misbehaves if Flow Window that creates it is closed.,5/30/07 19:45,Major,6,Windows 2000,stephenfisher,luis.ontanon,4/12/07 12:05,2007-05-30 19:45:34 UTC,stephenfisher
1531,GTK+ UI,RESOLVED,FIXED,Problems redrawing packet-list with less packets than fit into the window,5/23/07 14:54,Normal,5,Windows 2000,wireshark-bugs,luis.ontanon,4/12/07 12:18,2007-05-23 14:54:04 UTC,luis.ontanon
1532,GTK+ UI,RESOLVED,FIXED,Problems with fw1 dissector,5/8/07 19:12,Major,7,All,wireshark-bugs,kgolomb,4/12/07 15:33,2007-05-08 19:12:19 UTC,stephenfisher
1533,GTK+ UI,RESOLVED,NOTABUG,malformed packet in iSNS server response,7/3/07 12:45,Major,3,Windows XP,wireshark-bugs,victor.engle,4/12/07 15:57,2007-07-03 12:45:40 UTC,ronniesahlberg
1534,GTK+ UI,RESOLVED,FIXED,Reassembled TCP packets tab doesn't include last packet,7/31/08 5:37,Normal,3,Linux (other),wireshark-bugs,alvarezp,4/13/07 3:58,2008-07-31 05:37:25 UTC,anders.broman
1535,GTK+ UI,RESOLVED,WORKSFORME,FD: BAD Descriptor - could not open /tmp/etherXXXX3AXLQT,3/17/08 17:56,Major,6,Linux (other),wireshark-bugs,noel.delrosario,4/13/07 6:11,2008-03-17 17:56:43 UTC,jeff.morriss.ws
1536,GTK+ UI,RESOLVED,FIXED,Wireshark packet-gtp.c error in decoding IMEI,9/3/07 16:42,Minor,3,All,wireshark-bugs,frank.maerz,4/13/07 7:16,2007-09-03 16:42:56 UTC,anders.broman
1537,GTK+ UI,RESOLVED,DUPLICATE,no reassembling of TCP SIP,4/13/07 11:55,Normal,3,Windows 2000,wireshark-bugs,Rolf.Schriemer,4/13/07 11:52,2007-04-13 11:55:38 UTC,luis.ontanon
1538,GTK+ UI,RESOLVED,FIXED,GSM_MAP dissector decodes user-level SEGMENTED MAPv3 SendRoutingInfo incorrectly,4/23/07 20:25,Major,6,Windows XP,wireshark-bugs,igor.lobiv,4/13/07 15:12,2007-04-23 20:25:26 UTC,anders.broman
1539,GTK+ UI,RESOLVED,FIXED,Applying filter for signed integer (FT_INT32) hf_ entries with base BASE_HEX causes a crash,10/25/11 18:25,Major,9,All,wireshark-bugs,jeff.morriss.ws,4/16/07 9:52,2008-03-15 22:53:38 UTC,jeff.morriss.ws
1540,GTK+ UI,RESOLVED,DUPLICATE,Blank error dialog every time Wireshark:Capture Interfaces->Options is clicked,4/18/07 4:39,Normal,4,Windows Server 2003,wireshark-bugs,mark.e.huss,4/17/07 12:50,2007-04-18 04:39:43 UTC,jeff.morriss.ws
1541,GTK+ UI,RESOLVED,FIXED,The GIOP dissector gets alignment wrong for long longs,4/22/07 10:30,Minor,2,Windows XP,wireshark-bugs,Andy.Ling,4/17/07 14:47,2007-04-22 10:30:17 UTC,jaap.keuter
1543,GTK+ UI,RESOLVED,NOTABUG,GSM CAMEL-3 GPRS InvokeInitialDPGPRS.APN decoded incorrectly,9/28/12 9:32,Major,7,Windows XP,wireshark-bugs,igor.lobiv,4/18/07 12:21,2012-09-28 09:32:30 UTC,pascal.quantin
1544,GTK+ UI,RESOLVED,FIXED,CAMEL-2 Return error  error code is not decoded,4/20/07 8:28,Major,4,Windows XP,wireshark-bugs,igor.lobiv,4/18/07 17:31,2007-04-20 08:28:33 UTC,igor.lobiv
1545,GTK+ UI,RESOLVED,FIXED,Improperly decodes BACnet foreign device registration.,5/11/07 6:32,Normal,11,Windows XP,wireshark-bugs,randypalex,4/19/07 18:17,2007-05-11 06:32:11 UTC,jaap.keuter
1546,GTK+ UI,RESOLVED,FIXED,Statistics routine stats_tree_get_strs_from_node in (stats_tree.c) use milliseconds to calculate Rate,6/4/10 16:17,Normal,5,All,wireshark-bugs,jlhm,4/20/07 3:05,2010-06-04 16:17:22 UTC,gerald
1547,GTK+ UI,RESOLVED,FIXED,"Expert Info Composite column ""Count"" is not sorting numerically",4/20/07 23:12,Minor,2,Windows XP,wireshark-bugs,turner,4/20/07 13:32,2007-04-20 23:12:34 UTC,stephenfisher
1548,GTK+ UI,RESOLVED,FIXED,"call of ""Protocol Preferences"" results in GTK error msg at the command line",5/16/07 21:45,Minor,5,Linux (other),wireshark-bugs,toralf.foerster,4/20/07 20:00,2007-05-16 21:45:24 UTC,stephenfisher
1549,GTK+ UI,RESOLVED,DUPLICATE,Colors Make Text Unreadable,11/14/07 6:25,Major,2,Windows XP,wireshark-bugs,fopebek,4/20/07 23:17,2007-11-14 06:25:26 UTC,stephenfisher
1550,GTK+ UI,RESOLVED,FIXED,TCP dissector incorrectly assumes SYN's ACK field is zeros,7/7/07 22:28,Minor,4,All,wireshark-bugs,luke,4/22/07 22:43,2007-07-07 22:28:29 UTC,ronniesahlberg
1551,GTK+ UI,RESOLVED,FIXED,DIAMETER protocol dissection: wrong type of IMS-Information AVP,5/26/07 7:24,Minor,3,Linux (other),wireshark-bugs,tomasz.radziszewski,4/23/07 8:08,2007-04-23 09:16:00 UTC,anders.broman
1552,GTK+ UI,RESOLVED,FIXED,Coloring by session would be very useful,11/29/07 18:57,Enhancement,9,Linux (other),wireshark-bugs,tomasz.radziszewski,4/23/07 8:13,2007-11-29 18:57:49 UTC,sake
1553,GTK+ UI,RESOLVED,FIXED,Crash when opening the preferences while capturing,3/2/12 6:58,Normal,9,Mac OS X 10.4,wireshark-bugs,stig,4/23/07 11:30,2012-03-02 06:58:13 UTC,anders.broman
1554,GTK+ UI,RESOLVED,FIXED,BER Error while decoding H248 message - 82 01 01 decoding,4/24/07 20:39,Major,7,Windows XP,wireshark-bugs,laurent.berny,4/24/07 8:14,2007-04-24 19:28:36 UTC,luis.ontanon
1555,TShark,RESOLVED,FIXED,Buildbot crash output: fuzz-2007-04-24-28628.pcap,4/27/07 20:58,Critical,2,Mac OS X 10.3,wireshark-bugs,buildbot-do-not-reply,4/24/07 10:31,2007-04-27 20:58:14 UTC,gerald
1556,GTK+ UI,RESOLVED,FIXED,Wireshark occasionally mucks up RxRPC/AFS packet decoding,3/17/08 14:32,Normal,6,Linux (other),wireshark-bugs,rvokal,4/24/07 13:02,2008-03-17 14:32:34 UTC,jeff.morriss.ws
1557,GTK+ UI,RESOLVED,NOTOURBUG,Failed Assertion in Expert Info Composite Display,1/10/08 3:11,Normal,5,Windows XP,wireshark-bugs,randrewreynolds,4/24/07 15:01,2008-01-10 03:11:08 UTC,stephenfisher
1558,GTK+ UI,RESOLVED,WORKSFORME,Cannot save captured trace to a file,9/30/07 23:15,Major,2,Linux (other),wireshark-bugs,mackendw,4/24/07 16:50,2007-09-30 23:15:32 UTC,wmeier
1559,TShark,RESOLVED,FIXED,Buildbot crash output: fuzz-2007-04-24-2933.pcap,4/27/07 20:58,Critical,2,Mac OS X 10.3,wireshark-bugs,buildbot-do-not-reply,4/24/07 18:10,2007-04-27 20:58:14 UTC,gerald
1560,GTK+ UI,RESOLVED,DUPLICATE,H248 protocol BER Error when decoding 'sublist,4/24/07 20:39,Normal,2,Windows 2000,wireshark-bugs,Christian.Sieboerger,4/24/07 20:01,2007-04-24 20:39:37 UTC,luis.ontanon
1561,GTK+ UI,RESOLVED,DUPLICATE,H248 protocol BER error when decoding 'extraInfo' of PropertyParm,4/24/07 20:38,Normal,3,Windows 2000,wireshark-bugs,Christian.Sieboerger,4/24/07 20:11,2007-04-24 20:38:29 UTC,luis.ontanon
1562,TShark,RESOLVED,FIXED,Buildbot crash output: fuzz-2007-04-24-21597.pcap,4/27/07 20:58,Critical,3,Mac OS X 10.3,wireshark-bugs,buildbot-do-not-reply,4/24/07 22:30,2007-04-27 20:58:14 UTC,gerald
1563,GTK+ UI,RESOLVED,WORKSFORME,rtp analysis: wireshark hangs while creating huge file in /tmp,1/7/10 7:34,Normal,5,Linux (other),wireshark-bugs,stefan.sayer,4/24/07 22:41,2009-12-31 00:22:36 UTC,jeff.morriss.ws
1564,TShark,RESOLVED,FIXED,PSML - structure context node missing,12/31/09 11:15,Minor,4,All,wireshark-bugs,rwhalb,4/25/07 0:55,2009-12-31 11:15:43 UTC,stephenfisher
1565,TShark,RESOLVED,FIXED,Buildbot crash output: fuzz-2007-04-25-16170.pcap,4/27/07 20:53,Critical,2,Mac OS X 10.3,wireshark-bugs,buildbot-do-not-reply,4/25/07 7:30,2007-04-27 20:53:21 UTC,gerald
1566,GTK+ UI,RESOLVED,NOTABUG,SIP parse error of the Via header,4/25/07 11:27,Major,4,Windows XP,wireshark-bugs,orid,4/25/07 10:28,2007-04-25 11:27:26 UTC,orid
1567,TShark,RESOLVED,FIXED,Buildbot crash output: fuzz-2007-04-25-11110.pcap,4/27/07 20:58,Critical,2,Mac OS X 10.3,wireshark-bugs,buildbot-do-not-reply,4/25/07 11:20,2007-04-27 20:58:15 UTC,gerald
1568,TShark,RESOLVED,FIXED,Buildbot crash output: fuzz-2007-04-25-6979.pcap,4/27/07 20:58,Critical,2,Mac OS X 10.3,wireshark-bugs,buildbot-do-not-reply,4/25/07 12:20,2007-04-27 20:58:15 UTC,gerald
1569,TShark,RESOLVED,FIXED,Buildbot crash output: fuzz-2007-04-25-2027.pcap,4/26/07 19:49,Critical,2,Mac OS X 10.3,wireshark-bugs,buildbot-do-not-reply,4/25/07 18:50,2007-04-26 19:49:11 UTC,guy
1570,GTK+ UI,RESOLVED,NOTOURBUG,"""decoded as"" cannot be reverted",8/9/08 1:41,Minor,5,Linux (other),wireshark-bugs,toralf.foerster,4/25/07 19:24,2008-08-09 01:41:26 UTC,sake
1571,TShark,RESOLVED,FIXED,Buildbot crash output: fuzz-2007-04-25-13952.pcap,4/27/07 20:58,Critical,2,Mac OS X 10.3,wireshark-bugs,buildbot-do-not-reply,4/26/07 4:50,2007-04-27 20:58:15 UTC,gerald
1572,TShark,RESOLVED,FIXED,Buildbot crash output: fuzz-2007-04-25-9825.pcap,4/27/07 20:58,Critical,2,Mac OS X 10.3,wireshark-bugs,buildbot-do-not-reply,4/26/07 5:50,2007-04-27 20:58:18 UTC,gerald
1573,GTK+ UI,RESOLVED,DUPLICATE,Empty error message on selecting 'Capture options',4/26/07 6:18,Normal,3,Windows XP,wireshark-bugs,syam.krishnan,4/26/07 6:13,2007-04-26 06:18:22 UTC,jeff.morriss.ws
1574,TShark,RESOLVED,FIXED,Buildbot crash output: fuzz-2007-04-25-5694.pcap,4/27/07 20:58,Critical,2,Mac OS X 10.3,wireshark-bugs,buildbot-do-not-reply,4/26/07 6:30,2007-04-27 20:58:19 UTC,gerald
1575,TShark,RESOLVED,FIXED,Buildbot crash output: fuzz-2007-04-26-720.pcap,4/27/07 20:58,Critical,2,Mac OS X 10.3,wireshark-bugs,buildbot-do-not-reply,4/26/07 7:30,2007-04-27 20:58:20 UTC,gerald
1576,TShark,RESOLVED,FIXED,Buildbot crash output: fuzz-2007-04-26-25141.pcap,4/27/07 20:58,Critical,2,Mac OS X 10.3,wireshark-bugs,buildbot-do-not-reply,4/26/07 8:21,2007-04-27 20:58:20 UTC,gerald
1577,TShark,RESOLVED,FIXED,Buildbot crash output: fuzz-2007-04-26-21010.pcap,4/27/07 20:58,Critical,2,Mac OS X 10.3,wireshark-bugs,buildbot-do-not-reply,4/26/07 9:20,2007-04-27 20:58:21 UTC,gerald
1578,TShark,RESOLVED,FIXED,Buildbot crash output: fuzz-2007-04-26-17790.pcap,4/27/07 20:58,Critical,2,Mac OS X 10.3,wireshark-bugs,buildbot-do-not-reply,4/26/07 16:40,2007-04-27 20:58:21 UTC,gerald
1579,GTK+ UI,RESOLVED,FIXED,Netflow Dissector - cannot decode v9 options - patch provided,5/4/07 6:09,Major,6,All,wireshark-bugs,olivier.montanuy,4/26/07 16:56,2007-05-04 06:09:13 UTC,anders.broman
1580,GTK+ UI,VERIFIED,FIXED,wireshark hangs when performing rtp analysis on attached file,5/18/07 0:52,Critical,4,Windows XP,wireshark-bugs,mike.oliveras,4/27/07 21:02,2007-05-17 18:42:21 UTC,mike.oliveras
1581,GTK+ UI,RESOLVED,FIXED,Problem with HTTP reassembly,10/3/07 17:08,Normal,6,Windows XP,wireshark-bugs,mario,4/29/07 13:27,2007-10-03 17:08:07 UTC,sake
1582,GTK+ UI,RESOLVED,FIXED,SSL dissector can go into infinite loop,4/24/08 2:42,Normal,3,All,wireshark-bugs,Shaun.Voigt,4/30/07 4:11,2007-05-03 17:04:34 UTC,sarkar.abhik
1583,TShark,RESOLVED,DUPLICATE,Autostop Doesn't Work,5/10/07 6:53,Normal,5,Linux (other),wireshark-bugs,cjorsinger,5/1/07 1:31,2007-05-10 06:53:51 UTC,jeff.morriss.ws
1584,GTK+ UI,RESOLVED,FIXED,WEP decryption fails when WEP Key specified with colon separation,6/21/07 20:24,Normal,6,Windows XP,wireshark-bugs,jwright,5/1/07 18:22,2007-06-21 20:24:04 UTC,gerald
1585,GTK+ UI,RESOLVED,FIXED,Add support for IAX MODEM frame type,6/29/07 19:03,Minor,2,Windows XP,wireshark-bugs,wireshark,5/3/07 10:20,2007-06-29 19:03:23 UTC,jaap.keuter
1586,GTK+ UI,RESOLVED,FIXED,Problems with reassembly for proxied SSL connections,12/26/07 18:31,Normal,6,Windows XP,wireshark-bugs,jsmall,5/4/07 3:00,2007-12-26 18:31:13 UTC,sake
1587,GTK+ UI,RESOLVED,DUPLICATE,Can not compile on Solaris 2.8,5/10/07 8:11,Major,5,Solaris,wireshark-bugs,bernd.kuhls,5/4/07 13:41,2007-05-10 08:11:08 UTC,jeff.morriss.ws
1588,GTK+ UI,RESOLVED,DUPLICATE,Wireshark crashes when displaying HTTP Redirect packet,5/5/07 18:14,Critical,3,Windows XP,wireshark-bugs,moike,5/5/07 1:40,2007-05-05 18:14:28 UTC,gerald
1589,GTK+ UI,RESOLVED,NOTABUG,Wrong interpretation of RTP packets,5/9/07 21:40,Normal,7,Linux (other),wireshark-bugs,takis.issaris,5/7/07 15:37,2007-05-09 21:40:35 UTC,jaap.keuter
1590,Capture file support (libwiretap),RESOLVED,WORKSFORME,Duplication of data from a Sniffer trace,12/21/15 0:11,Normal,5,Windows XP,wireshark-bugs,jim.mcgarrity,5/7/07 15:57,2015-12-21 00:11:12 UTC,guy
1591,Extras,RESOLVED,FIXED,dumpcap in ring buffer mode. overflow,5/16/07 14:35,Major,6,Windows XP,wireshark-bugs,zheltov,5/8/07 8:00,2007-05-16 12:51:32 UTC,jaap.keuter
1592,GTK+ UI,RESOLVED,FIXED,LDAP/GSS-API decoder does not decode replies split across several packets,7/3/07 12:14,Normal,4,Windows Server 2003,wireshark-bugs,awebster,5/8/07 13:08,2007-07-03 12:14:18 UTC,ronniesahlberg
1593,Qt UI,CONFIRMED, ---,Enhancement to add data flow reversal counts to TCP statistics,6/22/16 2:50,Enhancement,1,All,wireshark-bugs,Mike.Engbrecht,5/8/07 16:02,,mmann78
1594,GTK+ UI,RESOLVED,FIXED,Analyze-> Exper Info Composite stats false,12/2/07 10:15,Minor,7,Linux (other),wireshark-bugs,toralf.foerster,5/9/07 9:45,2007-12-02 10:15:31 UTC,ulf.lamping
1595,Build process,RESOLVED,FIXED,"When building in the source tree  ""make distclean"" deletes src files among others epan/dtd_parse.c",1/26/15 22:36,Minor,6,Linux (other),wireshark-bugs,johan.r.ericson,5/9/07 11:48,2007-10-23 20:47:51 UTC,guy
1596,GTK+ UI,RESOLVED,NOTABUG,Wrong (X11) protocol shown for TCP packets,5/14/07 14:23,Normal,3,Windows Server 2003,wireshark-bugs,kbrach,5/11/07 14:29,2007-05-11 18:51:08 UTC,jaap.keuter
1597,GTK+ UI,VERIFIED,FIXED,Unable to find any Interfaces using Vista Home Prem (32bit),5/15/07 2:14,Major,4,Windows Vista,wireshark-bugs,t.j.reichel,5/14/07 1:35,2007-05-15 02:13:50 UTC,t.j.reichel
1599,GTK+ UI,RESOLVED,DUPLICATE,Options Error Window,5/15/07 7:08,Major,2,Windows XP,wireshark-bugs,purefun,5/15/07 6:41,2007-05-15 07:08:38 UTC,jeff.morriss.ws
1600,GTK+ UI,RESOLVED,FIXED,Merge feature from File menu does'nt do what it shoul (append vs prepend),5/22/07 0:35,Normal,4,Windows XP,wireshark-bugs,andre.noel,5/15/07 15:25,2007-05-22 00:35:56 UTC,stephenfisher
1601,GTK+ UI,RESOLVED,FIXED,pppdump wiretap fails on 0-length packets,5/23/07 6:05,Major,6,All,wireshark-bugs,b-wireshark,5/16/07 14:45,2007-05-23 06:05:22 UTC,jaap.keuter
1602,GTK+ UI,RESOLVED,DUPLICATE,Extranneous dialog appears with interface options dialog,5/16/07 17:48,Minor,3,Windows XP,wireshark-bugs,wab,5/16/07 15:45,2007-05-16 17:48:00 UTC,jaap.keuter
1604,GTK+ UI,RESOLVED,FIXED,Follow TCP stream gives : Short read from temporary file /tmp/followXXXXtTLWfu: expected 24  got 0,5/22/07 0:02,Minor,3,All,wireshark-bugs,toralf.foerster,5/17/07 13:21,2007-05-22 00:02:22 UTC,guy
1605,GTK+ UI,RESOLVED,FIXED,Wireshark doesn't dynamically update the packet list,1/27/10 6:47,Major,13,Windows XP,wireshark-bugs,eric.paul,5/17/07 19:16,2010-01-27 06:47:19 UTC,jeff.morriss.ws
1606,GTK+ UI,RESOLVED,FIXED,Improve preferences for Netflow,10/8/07 14:06,Enhancement,8,All,wireshark-bugs,acferen,5/18/07 0:31,2007-10-05 21:28:06 UTC,jeff.morriss.ws
1607,GTK+ UI,RESOLVED,WORKSFORME,saving remote trace,11/25/08 2:23,Normal,5,Linux (other),wireshark-bugs,pariamentz,5/18/07 8:53,2008-11-25 02:23:38 UTC,stephenfisher
1608,GTK+ UI,RESOLVED,FIXED,File name on the title bar disappears,5/23/07 0:51,Major,7,All,wireshark-bugs,sundarrd,5/21/07 3:51,2007-05-22 02:22:15 UTC,guy
1609,GTK+ UI,RESOLVED,DUPLICATE,Blank error  message in interface - options,5/21/07 8:41,Major,3,Windows XP,wireshark-bugs,zanohu,5/21/07 8:37,2007-05-21 08:41:24 UTC,jeff.morriss.ws
1610,GTK+ UI,RESOLVED,FIXED,Ctrl-M to mark a packet moves focus to filter box,5/22/07 23:07,Minor,4,All,wireshark-bugs,jeff.morriss.ws,5/21/07 10:11,2007-05-22 23:07:57 UTC,gerald
1611,GTK+ UI,RESOLVED,DUPLICATE,Mismatched dual monitor resolutions cause Wireshark to spawn outside display boundary.,10/5/12 7:59,Normal,2,Windows Vista,wireshark-bugs,graff.dave,5/21/07 19:18,2007-05-21 20:15:29 UTC,Christopher.Maynard
1612,GTK+ UI,VERIFIED,WORKSFORME,Crash when parsing a packet containing an HTTP 302 from Yahoo Mail,5/23/07 14:20,Major,5,Windows XP,wireshark-bugs,mikutoc,5/22/07 21:42,2007-05-23 06:35:35 UTC,mikutoc
1613,GTK+ UI,RESOLVED,FIXED,Crash in LDAP dissector on Windows: 0.99.4  0.99.5  0.99.6-SVN-21889,3/16/08 22:55,Critical,10,Windows XP,wireshark-bugs,cjorden,5/23/07 14:01,2008-03-16 22:55:01 UTC,jeff.morriss.ws
1614,TShark,RESOLVED,FIXED,export capture-file as pdml with tshark isnt xml-conform,5/25/07 6:47,Major,2,Windows XP,wireshark-bugs,pascal.schoettle,5/24/07 9:12,2007-05-25 06:47:25 UTC,jaap.keuter
1615,GTK+ UI,RESOLVED,WORKSFORME,Large PDU decode line expand/collapse problems,10/21/10 12:03,Minor,3,Windows XP,wireshark-bugs,jhg,5/24/07 16:42,2010-10-21 12:03:50 UTC,Christopher.Maynard
1616,GTK+ UI,RESOLVED,FIXED,ICMPv6 & UDP w/IPv6 checksum error with a routing header & remaining segments,7/17/07 7:02,Normal,10,Linux (other),wireshark-bugs,robertjpoulin,5/24/07 20:23,2007-07-17 07:02:44 UTC,jaap.keuter
1617,GTK+ UI,RESOLVED,FIXED,The case of the disappearing icon,7/23/07 22:59,Trivial,9,Windows XP,wireshark-bugs,jr,5/25/07 13:10,2007-07-23 22:59:59 UTC,jeff.morriss.ws
1618,GTK+ UI,RESOLVED,NOTABUG,"maybe caused by ""TCP checksum offload""?",5/26/07 7:18,Critical,2,Linux (other),wireshark-bugs,feng.he,5/26/07 6:34,2007-05-26 07:18:04 UTC,ulf.lamping
1619,GTK+ UI,RESOLVED,NOTABUG,decode Origin-Realm AVP (code 296) to UTF8String  error!,6/25/07 10:35,Normal,3,Linux (other),wireshark-bugs,feng.he,5/26/07 7:31,2007-06-25 10:35:53 UTC,martin.mathieson
1620,GTK+ UI,RESOLVED,NOTABUG,decode Vendor-Id  AVP and Session-Id AVP  wrong,6/2/13 23:47,Normal,6,Linux (other),wireshark-bugs,feng.he,5/26/07 7:37,2007-06-16 16:52:42 UTC,subhasdaas
1621,GTK+ UI,RESOLVED,DUPLICATE,decode Vendor-Id  AVP and Session-Id AVP  wrong,5/27/07 3:49,Normal,2,Linux (other),wireshark-bugs,feng.he,5/26/07 7:37,2007-05-27 03:49:58 UTC,jaap.keuter
1622,GTK+ UI,RESOLVED,DUPLICATE,Capture->Interfaces->Options causes error message box,5/28/07 8:50,Major,2,Windows XP,wireshark-bugs,Arkady.Tunik,5/28/07 7:39,2007-05-28 08:50:41 UTC,jeff.morriss.ws
1623,GTK+ UI,RESOLVED,FIXED,Add column heading for wlan.bssid,5/5/08 13:49,Enhancement,6,Windows XP,wireshark-bugs,dfc,5/29/07 9:01,2008-05-05 13:49:30 UTC,stephenfisher
1624,Capture file support (libwiretap),RESOLVED,FIXED,Wireshark shows timestamps incorrectly for certain Sniffer capture files,12/21/15 0:13,Normal,2,All,wireshark-bugs,wmeier,5/29/07 15:26,2007-05-29 15:31:53 UTC,guy
1625,GTK+ UI,RESOLVED,DUPLICATE,Top-level window doesn't refresh when File!Open window moved,5/30/07 2:04,Minor,3,Windows XP,wireshark-bugs,wmeier,5/30/07 1:29,2007-05-30 02:04:18 UTC,wmeier
1626,GTK+ UI,RESOLVED,FIXED,Ability to define buttons on the toolbar,6/19/07 18:11,Enhancement,6,All,wireshark-bugs,findkobel,5/30/07 9:58,2007-06-18 21:56:30 UTC,findkobel
1627,Qt UI,CONFIRMED, ---,Provide CSV showing bandwidth usage over time,6/22/16 2:50,Enhancement,1,Windows XP,wireshark-bugs,MICHAEL_FEENY,5/30/07 19:30,,mmann78
1628,GTK+ UI,RESOLVED,FIXED,Add File->Import capability,4/3/13 14:36,Enhancement,8,All,wireshark-bugs,Christopher.Maynard,5/30/07 20:22,2013-04-03 14:36:33 UTC,Christopher.Maynard
1629,GTK+ UI,RESOLVED,NOTABUG,dhcp : Seconds Elapsed byte order wrong,6/14/07 17:26,Minor,3,Linux (other),wireshark-bugs,toralf.foerster,5/31/07 9:24,2007-06-14 17:26:21 UTC,jaap.keuter
1631,GTK+ UI,RESOLVED,NOTABUG,Wireshark crashes Windows XP machine,6/11/08 2:34,Major,8,Windows XP,wireshark-bugs,Christy.Winters,5/31/07 21:12,2008-06-11 02:34:49 UTC,jaap.keuter
1632,GTK+ UI,RESOLVED,FIXED,Dissector for Fibre Channel ELS has bits for FCP PRLI param wrong,6/13/07 6:55,Minor,2,All,wireshark-bugs,joe,6/1/07 5:58,2007-06-13 06:55:16 UTC,jaap.keuter
1633,GTK+ UI,RESOLVED,FIXED,"Fibre Channel BLS ABTS frames cause message ""malformed packet""",6/13/07 6:53,Minor,2,All,wireshark-bugs,joe,6/1/07 6:33,2007-06-13 06:53:16 UTC,jaap.keuter
1634,GTK+ UI,RESOLVED,FIXED,ssdp (http) dissected as RADIUS,9/30/07 23:15,Minor,3,Linux (other),wireshark-bugs,toralf.foerster,6/1/07 9:32,2007-09-30 23:15:31 UTC,ronniesahlberg
1635,GTK+ UI,RESOLVED,NOTABUG,"SSL Decode not reliable  does not reliably detect ""Finished"" messages",6/5/07 14:20,Major,4,Windows XP,wireshark-bugs,shradecky,6/1/07 13:24,2007-06-05 14:20:38 UTC,tomas.kukosa
1636,GTK+ UI,RESOLVED,FIXED,Wireshark does not provide a way to export packets as plain text in a format that can then be imported to recover the original pcap file.,6/19/13 8:25,Enhancement,10,All,wireshark-bugs,Christopher.Maynard,6/4/07 19:46,2013-06-19 08:25:50 UTC,Christopher.Maynard
1637,Qt UI,CONFIRMED, ---,"Ability to save conversation from ""follow tcp stream""  in a colored format",6/22/16 2:50,Enhancement,3,All,wireshark-bugs,dfc,6/4/07 20:05,,mmann78
1638,GTK+ UI,RESOLVED,FIXED,SMB Pipe dissector bug on certain packets,6/5/07 21:24,Normal,3,Linux (other),wireshark-bugs,stephenfisher,6/4/07 22:01,2007-06-05 21:24:49 UTC,guy
1639,GTK+ UI,RESOLVED,FIXED,Cannot decrypt 802.11 WPA/WPA2 with QoS frames,6/15/07 15:32,Normal,7,Linux (other),wireshark-bugs,ctuffli,6/5/07 0:59,2007-06-14 23:33:34 UTC,gerald
1640,GTK+ UI,RESOLVED,FIXED,"RADIUS change ""Change-Filter-Request (43)"" to ""CoA-Request (43)""",7/13/07 20:01,Minor,2,All,wireshark-bugs,philippe.rosenfeld,6/5/07 10:41,2007-07-13 20:01:15 UTC,anders.broman
1641,GTK+ UI,RESOLVED,FIXED,configure doesn't check the presence of a (f)lex package.,6/27/09 21:37,Enhancement,11,All,guy,tom.uijldert,6/5/07 13:12,2009-06-27 21:37:21 UTC,balint
1642,GTK+ UI,RESOLVED,FIXED,Dissector bug  protocol SMPP,6/5/07 20:26,Normal,4,Windows 2000,wireshark-bugs,tomas.holidaya,6/5/07 14:07,2007-06-05 20:26:52 UTC,jaap.keuter
1643,GTK+ UI,RESOLVED,FIXED,RADIUS: VSA CableLabs 'Element Type' value is unknown.,6/6/07 19:58,Minor,2,All,wireshark-bugs,philippe.rosenfeld,6/6/07 7:16,2007-06-06 19:58:54 UTC,jaap.keuter
1644,GTK+ UI,RESOLVED,FIXED,RADIUS: VSA CableLabs 'Timezone' text display problem,6/6/07 19:50,Minor,2,All,wireshark-bugs,philippe.rosenfeld,6/6/07 7:33,2007-06-06 19:50:55 UTC,jaap.keuter
1645,GTK+ UI,RESOLVED,WORKSFORME,null list of adapters on vista,10/31/07 7:05,Critical,8,Windows Vista,wireshark-bugs,mario.proenca,6/6/07 11:09,2007-10-31 07:05:22 UTC,ulf.lamping
1646,GTK+ UI,RESOLVED,FIXED,Wireshark doesn't dissect IceP over UDP,6/10/12 1:24,Enhancement,6,Linux (other),wireshark-bugs,dvilla,6/7/07 18:47,2012-06-10 01:24:35 UTC,anders.broman
1647,GTK+ UI,RESOLVED,FIXED,Saving a UAT fails if personal dir has not yet been created,6/25/11 15:27,Minor,2,All,wireshark-bugs,luis.ontanon,6/8/07 22:42,2011-06-25 15:27:15 UTC,stig
1648,GTK+ UI,RESOLVED,FIXED,Coverity CID 240: Overrun in packet-k12.c,6/17/07 5:03,Critical,3,All,wireshark-bugs,gerald,6/12/07 22:40,2007-06-17 05:03:31 UTC,luis.ontanon
1649,GTK+ UI,RESOLVED,FIXED,Coverity CID 244: Dead code in wiretap/k12.c,6/17/07 5:04,Normal,2,All,wireshark-bugs,gerald,6/12/07 22:41,2007-06-17 05:04:29 UTC,luis.ontanon
1650,GTK+ UI,CONFIRMED, ---,"When selecting ""use multiple files""  file error occurs when captured data rate is too high.",10/11/13 14:37,Major,12,Windows XP,wireshark-bugs,pdyk,6/14/07 0:24,,jeff.morriss.ws
1651,GTK+ UI,RESOLVED,NOTOURBUG,Warn dissector bug  memory error  crashes Wireshark,11/5/07 14:07,Normal,3,Windows XP,wireshark-bugs,lanellallen,6/18/07 14:23,2007-11-05 14:07:59 UTC,anders.broman
1652,GTK+ UI,RESOLVED,FIXED,A bug in CAMEL Connect message.,7/13/07 15:56,Minor,12,Windows XP,wireshark-bugs,palos,6/19/07 7:20,2007-07-13 15:56:14 UTC,anders.broman
1654,Documentation,RESOLVED,NOTABUG,typo in docbook/Makefile,1/26/15 22:37,Trivial,2,Linux (other),wireshark-bugs,toralf.foerster,6/20/07 8:14,2007-06-21 08:29:18 UTC,guy
1655,GTK+ UI,RESOLVED,FIXED,Can't decode CAP message.,6/21/07 1:57,Major,5,Windows XP,wireshark-bugs,kobyostb,6/20/07 12:26,2007-06-21 01:57:26 UTC,kobyostb
1656,GTK+ UI,RESOLVED,NOTABUG,Diameter AVP dictionary: Cause-Code Unknown AVP,6/22/07 8:42,Minor,3,Windows XP,wireshark-bugs,donatello.boccaforno,6/21/07 8:33,2007-06-22 08:42:02 UTC,donatello.boccaforno
1657,GTK+ UI,RESOLVED,FIXED,Error: Can't get list of Wireless interfaces,1/23/08 1:29,Normal,3,Windows XP,wireshark-bugs,chrish,6/21/07 14:02,2008-01-23 01:29:13 UTC,louis
1658,GTK+ UI,RESOLVED,FIXED,OSPF LSA with DNA bit set displays wrong age,6/26/07 7:03,Minor,2,Windows XP,wireshark-bugs,oliver_meuter,6/22/07 22:19,2007-06-26 07:03:41 UTC,jaap.keuter
1659,GTK+ UI,RESOLVED,FIXED,eth_dir_get_name macro is incorrect for glib 1,8/9/07 20:41,Minor,2,All,wireshark-bugs,jmmikkel,6/23/07 4:21,2007-08-09 20:41:38 UTC,jaap.keuter
1660,GTK+ UI,RESOLVED,FIXED,CLDAP PDUs with multiple responses are decoded wrongly.,7/3/07 13:24,Normal,5,Windows XP,wireshark-bugs,shibu.samuel,6/23/07 11:41,2007-07-03 13:24:00 UTC,ronniesahlberg
1661,Qt UI,CONFIRMED, ---,Analyse/Voip Calls only based on call ID and not on from and to Tags,6/22/16 2:50,Enhancement,1,Windows XP,wireshark-bugs,hlabruyere,6/25/07 8:57,,mmann78
1662,GTK+ UI,RESOLVED,FIXED,Allow customized port protocol mapping,8/1/08 3:11,Enhancement,4,Windows XP,wireshark-bugs,hlabruyere,6/25/07 9:36,2008-07-31 05:59:10 UTC,hlabruyere
1663,GTK+ UI,RESOLVED,FIXED,NFSv4 SETATTR not decoding properly,7/7/07 22:06,Normal,4,Windows 2000,wireshark-bugs,chcosta75,6/25/07 11:36,2007-07-07 22:06:11 UTC,ronniesahlberg
1664,GTK+ UI,RESOLVED,FIXED,display filter font size not optimal   too large,12/31/09 0:47,Minor,4,Windows XP,wireshark-bugs,matthias.kuzmits,6/25/07 11:36,2009-12-31 00:47:36 UTC,stephenfisher
1665,GTK+ UI,RESOLVED,FIXED,latest capture_opts.c breaks compilation,6/25/07 19:04,Major,2,OpenBSD,wireshark-bugs,nikns,6/25/07 13:23,2007-06-25 19:04:51 UTC,stephenfisher
1666,GTK+ UI,RESOLVED,DUPLICATE,Segmented SIP message was not decoded as SIP,5/23/09 2:03,Normal,5,Windows XP,wireshark-bugs,hongzhan,6/25/07 15:18,2009-05-23 02:03:15 UTC,sake
1667,GTK+ UI,RESOLVED,FIXED,Missing check in mpeg-2 ts parser,8/15/07 10:45,Normal,6,FreeBSD,wireshark-bugs,pete,6/26/07 1:52,2007-08-15 10:45:09 UTC,jaap.keuter
1668,GTK+ UI,RESOLVED,FIXED,Error in File > Export > Objects > HTTP,7/31/08 6:04,Major,5,Windows Vista,wireshark-bugs,lchappell,6/27/07 23:22,2008-07-31 06:04:06 UTC,anders.broman
1669,GTK+ UI,RESOLVED,FIXED,bacapp.c: Wrong decoding of BACnet ComplexACK to readProperty,6/28/07 19:04,Major,3,Windows XP,wireshark-bugs,rudolf.weidmann,6/28/07 8:00,2007-06-28 19:04:25 UTC,jaap.keuter
1670,GTK+ UI,RESOLVED,FIXED,bacapp.c: BACnetEventTransitionBits decoded as Enumerated instead of Bit String,7/6/07 22:37,Normal,6,Windows XP,wireshark-bugs,rudolf.weidmann,6/28/07 10:49,2007-07-06 22:37:49 UTC,jaap.keuter
1671,GTK+ UI,RESOLVED,FIXED,Export HTTP > All - System Appears Hung (but isn't),4/14/11 13:01,Minor,14,Windows Vista,wireshark-bugs,lchappell,6/29/07 20:29,2010-11-08 08:58:02 UTC,Christopher.Maynard
1672,GTK+ UI,RESOLVED,FIXED,RTP MPEG-II Transport Stream flow packet length pointer error,8/15/07 10:44,Normal,4,Windows XP,wireshark-bugs,thomas_rasmus44,7/4/07 13:03,2007-08-15 10:44:56 UTC,jaap.keuter
1673,GTK+ UI,RESOLVED,FIXED,pana header parsing : Session Id field left,7/11/07 17:34,Trivial,4,All,wireshark-bugs,romain.raynaud,7/5/07 11:43,2007-07-11 17:34:36 UTC,romain.raynaud
1674,GTK+ UI,RESOLVED,DUPLICATE,Authentication: Failed calcuated & Decrypted data not formated as expected  wrong key?,7/6/07 20:23,Normal,2,Windows XP,wireshark-bugs,nagendra0123,7/6/07 17:34,2007-07-06 20:23:56 UTC,jmayer
1675,GTK+ UI,RESOLVED,FIXED,bad cast fals Build on trunk (r22223 of wireshark/epan/dissectors/packet-pe r.c),7/16/07 21:38,Major,3,Linux (other),wireshark-bugs,jgsack,7/9/07 3:08,2007-07-16 21:38:03 UTC,jeff.morriss.ws
1676,GTK+ UI,RESOLVED,FIXED,"G_GINT64_MODIFIER not set to ""l"" on LP64 platforms",8/7/07 16:42,Normal,14,Linux (other),wireshark-bugs,pva,7/9/07 16:03,2007-08-07 16:42:41 UTC,guy
1677,Build process,RESOLVED,FIXED,wireshark does not compile with --as-needed,1/22/16 2:16,Major,33,Gentoo,wireshark-bugs,pva,7/10/07 11:58,2009-08-09 13:02:00 UTC,guy
1678,GTK+ UI,CONFIRMED, ---,"""Follow TCP Stream"" adds extra 0A char when saving as ASCII",6/22/16 4:33,Normal,9,All,wireshark-bugs,peter,7/10/07 13:13,,mmann78
1679,GTK+ UI,VERIFIED,WORKSFORME,Function is not here any more,7/10/07 22:16,Major,1,Windows XP,wireshark-bugs,tcpipmpls,7/10/07 21:53,2007-07-10 22:16:05 UTC,tcpipmpls
1681,GTK+ UI,RESOLVED,FIXED,Version 0.99.6 does not decode MAP dialog portion,7/13/07 13:47,Normal,9,Windows XP,wireshark-bugs,apertio,7/11/07 16:40,2007-07-13 13:45:46 UTC,jeff.morriss.ws
1682,GTK+ UI,RESOLVED,FIXED,Wireshark 0.99.6 crashes on wake - MacBook,3/16/08 10:32,Critical,10,Mac OS X 10.4,wireshark-bugs,richard.e.brown,7/12/07 2:47,2008-03-16 10:32:59 UTC,jaap.keuter
1684,GTK+ UI,RESOLVED,FIXED,the application crash !,7/27/07 13:44,Normal,5,Windows Vista,wireshark-bugs,evald80,7/12/07 19:05,2007-07-27 13:44:57 UTC,jeff.morriss.ws
1685,GTK+ UI,RESOLVED,FIXED,change message for a network interface which was brought down,9/2/07 23:33,Trivial,3,Linux (other),wireshark-bugs,toralf.foerster,7/15/07 19:08,2007-09-02 23:33:38 UTC,guy
1686,GTK+ UI,RESOLVED,NOTABUG,V5UA : Envelope function address is not correctly dissected,10/8/07 9:10,Normal,4,Windows XP,wireshark-bugs,christian.mouden,7/16/07 8:50,2007-10-08 09:10:49 UTC,anders.broman
1687,GTK+ UI,RESOLVED,FIXED,V5UA : Message class is 14 instead of 9 for V5 boundary primitives,10/8/07 9:09,Normal,4,Windows XP,wireshark-bugs,christian.mouden,7/16/07 8:57,2007-10-08 09:09:53 UTC,anders.broman
1688,GTK+ UI,VERIFIED,WORKSFORME,"Checkpoint Firwall - ""fw monitor"" capture",7/17/07 15:46,Minor,5,Windows XP,wireshark-bugs,piyush_bhakta,7/16/07 15:43,2007-07-17 15:45:38 UTC,piyush_bhakta
1689,GTK+ UI,RESOLVED,FIXED,compilation fail if you have libgcrypt installed.,12/21/07 23:08,Major,5,Linux (other),wireshark-bugs,pva,7/16/07 18:52,2007-12-21 23:08:28 UTC,stephenfisher
1690,GTK+ UI,RESOLVED,FIXED,Feature request: Support EBCDIC display for DRDA protocol,8/1/08 11:17,Enhancement,18,Windows 2000,wireshark-bugs,ifranzki,7/16/07 19:23,2008-08-01 11:17:44 UTC,anders.broman
1691,GTK+ UI,RESOLVED,FIXED,Delta Time is not working properly in a filtered view on WS 0.99.6,11/17/07 4:27,Normal,13,All,wireshark-bugs,fschorr,7/17/07 18:25,2007-11-17 04:27:05 UTC,wireshark
1692,GTK+ UI,RESOLVED,FIXED,"Details of a NFSv4 ""compound"" frame is not brought up to the Packet List for that frame",7/31/08 6:28,Normal,6,All,wireshark-bugs,fschorr,7/17/07 20:05,2008-07-31 06:28:19 UTC,anders.broman
1693,Dissection engine (libwireshark),CONFIRMED, ---,"NFSv4 ""compound"" frames show up as procedure ""compound"" procedure in Service Response Time rather actually operations in the ""compound"" frames.",6/22/16 2:48,Enhancement,12,All,bugzilla-admin,fschorr,7/17/07 20:26,,mmann78
1694,GTK+ UI,RESOLVED,FIXED,802.11 needs to detect link-layer retransmissions and hand only one to higher-level protocols,12/14/07 17:26,Normal,11,All,wireshark-bugs,steven.leung,7/18/07 0:39,2007-12-14 17:26:01 UTC,steven.leung
1695,GTK+ UI,RESOLVED,FIXED,statistics for ip-conversation tshark <-> wireshark differ,12/31/09 11:24,Minor,4,Linux (other),wireshark-bugs,rostrot,7/19/07 8:41,2009-12-31 11:24:48 UTC,stephenfisher
1696,Extras,RESOLVED,FIXED,dfilter-test.py reports failures for ntp.precision tests on 64bit,4/30/10 14:45,Minor,3,Linux (other),wireshark-bugs,kavol,7/19/07 14:38,2010-04-30 14:45:25 UTC,jeff.morriss.ws
1697,GTK+ UI,RESOLVED,FIXED,add heur_dissector_delete,8/7/07 21:27,Enhancement,3,Linux (other),wireshark-bugs,wireshark,7/19/07 21:54,2007-08-07 21:27:12 UTC,luis.ontanon
1698,GTK+ UI,RESOLVED,FIXED,Desegment Chunked HTTP Bodies,8/21/07 21:00,Normal,6,All,wireshark-bugs,wireshark,7/19/07 22:00,2007-08-21 21:00:01 UTC,bugzilla
1699,GTK+ UI,VERIFIED,FIXED,Bad decoding of Camel PromptAndCollectUserInfo,7/24/07 12:50,Minor,6,Linux (other),wireshark-bugs,florent.drouin,7/20/07 16:35,2007-07-23 23:08:44 UTC,florent.drouin
1700,GTK+ UI,RESOLVED,FIXED,Performance due to packet bytes pane is creating problems,9/20/12 22:23,Major,5,All,wireshark-bugs,phantal,7/20/07 20:01,2012-09-20 18:08:58 UTC,guy
1701,GTK+ UI,RESOLVED,NOTABUG,New feature request -- NDIS 802.11 support,2/6/12 11:31,Enhancement,7,Windows Vista,wireshark-bugs,bool101,7/21/07 4:20,2012-02-06 11:31:37 UTC,anders.broman
1702,GTK+ UI,RESOLVED,FIXED,PPPoE packets in Ethernet captures on Linux have bogus payload lengths,9/3/07 9:33,Normal,3,Linux (other),wireshark-bugs,toralf.foerster,7/22/07 10:11,2007-09-03 09:33:33 UTC,toralf.foerster
1703,GTK+ UI,RESOLVED,FIXED,"distinguish between ""Capture Filter"" and ""Display Filter""",10/30/08 6:20,Minor,4,Linux (other),wireshark-bugs,toralf.foerster,7/22/07 16:29,2008-10-30 06:20:46 UTC,balint
1704,GTK+ UI,RESOLVED,FIXED,wireshark-0.99.6 does not compiles with if C library is not libc (uclibc),10/16/07 19:04,Major,4,Linux (other),wireshark-bugs,pva,7/24/07 8:31,2007-08-09 06:52:50 UTC,jaap.keuter
1705,GTK+ UI,RESOLVED,FIXED,unable to build packet-ber.c on Solaris with Sun C,7/24/07 19:05,Major,2,Solaris,wireshark-bugs,io,7/24/07 19:00,2007-07-24 19:05:13 UTC,jeff.morriss.ws
1706,Dissection engine (libwireshark),RESOLVED,FIXED,GTP dissector tries to dissect Tivole Endpoint packets,3/6/13 10:06,Minor,8,All,bugzilla-admin,toralf.foerster,7/25/07 11:37,2013-03-05 16:02:58 UTC,guy
1707,GTK+ UI,RESOLVED,FIXED,Cannot save K12 file currently edited with Wireshark,7/25/07 21:32,Normal,3,Linux (other),wireshark-bugs,florent.drouin,7/25/07 16:25,2007-07-25 21:32:08 UTC,luis.ontanon
1708,GTK+ UI,RESOLVED,FIXED,packet-ber.h does not compile on solaris with sun c,9/3/07 0:12,Major,9,Solaris,wireshark-bugs,io,7/25/07 18:15,2007-09-03 00:12:04 UTC,guy
1709,GTK+ UI,RESOLVED,NOTABUG,packet-kerberos.c does not build on solaris with sun c,1/9/08 16:35,Major,6,Solaris,wireshark-bugs,io,7/25/07 18:41,2008-01-09 16:35:49 UTC,jeff.morriss.ws
1710,GTK+ UI,RESOLVED,FIXED,Assertion failed when doing File->Quit->Save during live capture,10/5/11 13:21,Minor,10,Windows XP,wireshark-bugs,johngammel,7/25/07 19:48,2011-10-04 22:54:26 UTC,mmann78
1711,GTK+ UI,RESOLVED,FIXED,Some Toshiba format files with LAPD  cannot be open,11/9/07 16:02,Normal,11,Windows XP,wireshark-bugs,sindelka,7/26/07 16:31,2007-11-06 19:28:22 UTC,anders.broman
1712,GTK+ UI,RESOLVED,FIXED,Add 'application/json' to list of text media types,7/30/07 13:09,Enhancement,3,All,wireshark-bugs,wireshark,7/26/07 21:48,2007-07-30 13:08:16 UTC,jaap.keuter
1713,GTK+ UI,RESOLVED,FIXED,Incorrectly decoded IMSI in RANAP prot./id-CommonID procedure,9/3/07 16:41,Minor,3,Windows XP,wireshark-bugs,martin.dubovsky,7/27/07 0:18,2007-09-03 16:41:22 UTC,anders.broman
1714,GTK+ UI,RESOLVED,FIXED,Some GSM/DTAP message type names not include in info column,9/21/07 7:28,Normal,10,Windows XP,wireshark-bugs,martin.dubovsky,7/27/07 0:33,2007-09-21 07:28:15 UTC,martin.dubovsky
1715,GTK+ UI,RESOLVED,WORKSFORME,Memory consumes more and more while reopening pcap files,2/28/08 1:41,Normal,4,Windows XP,wireshark-bugs,alphahunters,7/27/07 2:16,2008-02-28 01:41:18 UTC,jeff.morriss.ws
1716,GTK+ UI,RESOLVED,FIXED,"Unable to decode SIP-T encapsulation with ""white space""",8/9/07 12:18,Normal,7,Windows XP,wireshark-bugs,jackdaniels1955,7/27/07 5:49,2007-08-09 12:18:57 UTC,anders.broman
1717,GTK+ UI,RESOLVED,FIXED,Add support for the (Juniper) NetScreen snoop file format,8/17/07 11:49,Enhancement,6,All,wireshark-bugs,sake,7/29/07 22:56,2007-08-17 08:44:45 UTC,sake
1719,GTK+ UI,RESOLVED,FIXED,A bug in CAMEL ApplyCharging message.,1/3/08 11:13,Minor,2,Windows XP,wireshark-bugs,palos,7/31/07 8:46,2008-01-03 11:13:32 UTC,anders.broman
1720,GTK+ UI,RESOLVED,FIXED,export payload,11/17/07 16:06,Enhancement,3,Windows XP,wireshark-bugs,erik.linder,7/31/07 14:16,2007-11-17 16:06:17 UTC,stephenfisher
1721,Documentation,RESOLVED,FIXED,FAQ addition: capturing local traffic on Windows,10/5/07 14:01,Minor,3,All,wireshark-bugs,greg.fenton,8/1/07 16:56,2007-10-05 14:01:49 UTC,jaap.keuter
1722,GTK+ UI,RESOLVED,FIXED,TCP reassembly missing payload of FIN packet  when DESEGMENT_UNTIL_FIN is set,8/21/07 22:15,Normal,5,Linux (other),wireshark-bugs,sunyin51,8/1/07 18:25,2007-08-21 22:15:35 UTC,bugzilla
1723,Extras,RESOLVED,FIXED,Enhancement of text2cap for parsing flexibility,12/21/11 19:24,Enhancement,18,Windows XP,wireshark-bugs,jacyu,8/2/07 2:36,2011-12-21 19:24:53 UTC,Christopher.Maynard
1724,GTK+ UI,RESOLVED,FIXED,[PATCH] packet-bootp.c: enhancement to decode DHCP option 249,8/21/07 21:41,Enhancement,6,All,wireshark-bugs,devel.fx.lebail,8/2/07 9:37,2007-08-21 21:41:04 UTC,bugzilla
1725,GTK+ UI,RESOLVED,FIXED,"Enhance tcp-analysis with ""reused tcp session""",8/31/07 15:18,Enhancement,4,All,wireshark-bugs,sake,8/4/07 7:21,2007-08-31 15:18:19 UTC,sake
1726,GTK+ UI,RESOLVED,FIXED,crash when selecting mp3 file,8/5/07 5:58,Normal,2,Linux (other),wireshark-bugs,tropikhajma,8/4/07 17:08,2007-08-05 05:58:55 UTC,jaap.keuter
1727,GTK+ UI,RESOLVED,FIXED,Capture file cut short in middle of packet,1/9/08 22:59,Major,6,Windows XP,wireshark-bugs,amcq,8/6/07 14:23,2008-01-09 22:59:57 UTC,jeff.morriss.ws
1728,GTK+ UI,RESOLVED,NOTABUG,No TCP capture with TOE enabled on NIC.,8/8/07 13:40,Normal,4,Windows XP,wireshark-bugs,support.ss7,8/7/07 6:58,2007-08-08 13:40:19 UTC,jeff.morriss.ws
1729,GTK+ UI,RESOLVED,DUPLICATE,Patches to PANA Protocol Dissector (packet-pana.c),8/7/07 22:03,Normal,2,Linux (other),wireshark-bugs,vfajardo,8/7/07 21:58,2007-08-07 22:03:47 UTC,vfajardo
1730,GTK+ UI,RESOLVED,FIXED,Patches to PANA Protocol Dissector (packet-pana.c),9/10/07 6:53,Normal,7,Linux (other),wireshark-bugs,vfajardo,8/7/07 21:59,2007-09-10 06:53:21 UTC,jaap.keuter
1731,TShark,RESOLVED,NOTABUG,Unhandled exception (group=1  code=6) error,9/1/07 10:44,Major,4,Linux (other),wireshark-bugs,ralph_xavier,8/7/07 23:52,2007-09-01 10:44:40 UTC,jaap.keuter
1732,GTK+ UI,RESOLVED,FIXED,Implement desegment for SIGCOMP over TCP,8/17/07 11:56,Normal,4,Windows XP,wireshark-bugs,rao.daniel,8/8/07 9:44,2007-08-08 12:45:31 UTC,sake
1733,GTK+ UI,RESOLVED,FIXED,Enhanced packet dissector for IEEE1588/PTP,8/8/07 20:58,Enhancement,5,All,wireshark-bugs,markus.seehofer,8/8/07 11:32,2007-08-08 20:58:17 UTC,ulf.lamping
1734,GTK+ UI,RESOLVED,FIXED,Protocol Hierarchy Statistics shows LDAP lines recursively,4/18/16 23:43,Minor,13,Linux (other),wireshark-bugs,toralf.foerster,8/9/07 9:48,2016-03-12 03:05:09 UTC,gerald
1735,GTK+ UI,RESOLVED,FIXED,Packet Details Pane showing white text highlighting - Can't read it,11/2/12 5:24,Major,15,Linux (other),wireshark-bugs,jeff_blake2,8/9/07 15:22,2012-11-02 05:24:31 UTC,anders.broman
1736,GTK+ UI,RESOLVED,FIXED,Add support for BDAT simple chunking in SMTP dissector,8/15/07 22:40,Enhancement,5,All,wireshark-bugs,stig,8/11/07 12:16,2007-08-15 22:40:13 UTC,stig
1737,TShark,RESOLVED,WORKSFORME,emem_tree_lookup32_array can alter the key,8/13/07 12:00,Normal,2,Mac OS X 10.0,wireshark-bugs,luis.ontanon,8/12/07 14:33,2007-08-13 12:00:35 UTC,luis.ontanon
1738,TShark,RESOLVED,NOTOURBUG,fop-0.93-r1: wireshark user guide coud not be build,8/13/07 13:34,Minor,2,Linux (other),wireshark-bugs,toralf.foerster,8/13/07 12:11,2007-08-13 13:34:49 UTC,jaap.keuter
1739,GTK+ UI,VERIFIED,FIXED,Small fixes in BER  RTSE  IMF and DOP,8/15/07 22:41,Enhancement,5,All,wireshark-bugs,stig,8/13/07 13:53,2007-08-13 16:42:27 UTC,stig
1740,GTK+ UI,RESOLVED,FIXED,"window ""capture->Interfaces"" cannot be closed",6/3/09 4:26,Minor,38,Linux (other),wireshark-bugs,toralf.foerster,8/13/07 17:25,2009-06-03 04:26:37 UTC,toralf.foerster
1741,GTK+ UI,RESOLVED,FIXED,Privilege separation patch,8/30/07 0:26,Normal,11,All,wireshark-bugs,gerald,8/13/07 21:50,2007-08-30 00:26:07 UTC,gerald
1742,GTK+ UI,RESOLVED,NOTOURBUG,NLM filtering misses some packets,12/11/11 3:45,Major,4,Windows XP,wireshark-bugs,joseph.blough,8/14/07 0:46,2011-12-11 03:45:12 UTC,jaap.keuter
1743,GTK+ UI,RESOLVED,DUPLICATE,Bug in LLDP Auto-Negotiation field bitmasks,8/14/07 11:19,Minor,3,Linux (other),wireshark-bugs,Carles.kishimoto,8/14/07 10:29,2007-08-14 11:19:46 UTC,jmayer
1744,Dissection engine (libwireshark),RESOLVED,NOTABUG,TDS Packet Decode ?,1/24/17 21:39,Major,3,All,wireshark-bugs,dennis.hollarn,8/14/07 18:57,2007-08-15 06:37:29 UTC,guy
1745,GTK+ UI,RESOLVED,FIXED,dissection of encrypted SRTP payloads and SRTCP unhelpful,8/21/07 7:24,Enhancement,7,Windows XP,wireshark-bugs,Neil,8/15/07 1:28,2007-08-21 07:24:18 UTC,jaap.keuter
1746,GTK+ UI,RESOLVED,FIXED,new SNMP dissector shows convoluted tree,8/28/07 6:12,Major,8,All,wireshark-bugs,thomas.anders,8/15/07 14:38,2007-08-27 22:19:05 UTC,luis.ontanon
1747,GTK+ UI,RESOLVED,NOTABUG,Decoding of WEP encrypted frames is incorrect,8/16/07 23:23,Normal,3,Windows XP,wireshark-bugs,paul.gallant,8/16/07 11:14,2007-08-16 23:23:15 UTC,paul.gallant
1748,GTK+ UI,RESOLVED,DUPLICATE,Wildcards used in H248 messages are shown incorrectly,8/17/07 11:48,Normal,2,All,wireshark-bugs,sami,8/17/07 11:22,2007-08-17 11:48:22 UTC,luis.ontanon
1749,GTK+ UI,RESOLVED,NOTOURBUG,SSL BER Dissector for OID not implemented,1/3/10 6:41,Enhancement,3,All,wireshark-bugs,icmp30,8/18/07 5:45,2010-01-03 06:41:16 UTC,anders.broman
1750,GTK+ UI,RESOLVED,FIXED,HCI dissectors is outdated with the current Bluetooth specification,9/23/07 19:42,Normal,4,All,wireshark-bugs,allan.m,8/18/07 13:11,2007-09-23 19:42:15 UTC,jaap.keuter
1751,GTK+ UI,RESOLVED,FIXED,Direction info missing for Bluetooth H4 captures in pcap-format,8/1/08 8:24,Major,20,All,paolo.abeni,allan.m,8/18/07 13:52,2008-08-01 08:24:27 UTC,anders.broman
1752,GTK+ UI,RESOLVED,FIXED,Follow TCP dialog in ASCII and raw modes is too slow,6/17/14 0:47,Normal,9,Linux (other),wireshark-bugs,jkohen,8/19/07 19:57,2014-06-17 00:47:58 UTC,wireshark
1753,GTK+ UI,RESOLVED,FIXED,mpeg: Further improvements to the MPEG decoder,8/21/07 22:01,Enhancement,3,All,wireshark-bugs,sjackman,8/20/07 6:30,2007-08-21 22:01:57 UTC,bugzilla
1756,GTK+ UI,RESOLVED,FIXED,BGP MP_(UN)REACH_NLRI parsing broken,8/23/07 9:17,Normal,3,Mac OS X 10.4,wireshark-bugs,dhelder,8/20/07 22:35,2007-08-23 09:17:17 UTC,jaap.keuter
1757,GTK+ UI,RESOLVED,FIXED,main_cf_cb_live_capture_update_continue slows down live captures,8/22/07 16:30,Major,3,All,wireshark-bugs,j.pedro.fonseca,8/22/07 9:39,2007-08-22 16:30:47 UTC,jeff.morriss.ws
1758,Capture file support (libwiretap),RESOLVED,FIXED,For Review - Added ATM support for Visual Networks file type,6/6/13 11:29,Enhancement,8,All,wireshark-bugs,scott.robinson,8/22/07 14:27,2007-08-23 22:12:59 UTC,guy
1759,GTK+ UI,RESOLVED,FIXED,Traffic  from NamedPipes can not be stopped.,9/23/10 12:57,Normal,7,Windows XP,wireshark-bugs,mmh,8/22/07 14:53,2010-09-23 12:57:08 UTC,stephenfisher
1760,GTK+ UI,RESOLVED,FIXED,BACnet Who-Is-Router-To-Network decoding,8/23/07 6:56,Normal,5,Linux (other),wireshark-bugs,steve,8/22/07 16:23,2007-08-23 06:56:34 UTC,jaap.keuter
1761,GTK+ UI,VERIFIED,FIXED,LACP packets with states of 0 prints the state summary incorrectly,8/23/07 14:51,Trivial,4,All,wireshark-bugs,todd.martin,8/22/07 20:40,2007-08-22 21:59:05 UTC,todd.martin
1763,GTK+ UI,RESOLVED,FIXED,IO Graphs: frames missing from the graph,12/29/07 21:06,Normal,9,Mac OS X 10.4,wireshark-bugs,stig,8/22/07 23:08,2007-12-29 21:06:21 UTC,stig
1764,GTK+ UI,RESOLVED,FIXED,"""Follow TCP Stream"" hex dump is too wide for average screens",5/17/09 12:35,Normal,4,All,wireshark-bugs,roland.illig,8/23/07 12:03,2009-05-17 12:35:02 UTC,gerald
1765,GTK+ UI,RESOLVED,FIXED,TCP segment data display incorrect,11/24/07 23:05,Normal,4,Windows XP,wireshark-bugs,graham.bloice,8/23/07 12:58,2007-11-24 23:05:48 UTC,stig
1766,GTK+ UI,RESOLVED,FIXED,Wirshark not use the correct identification RTP packets,9/23/14 4:32,Normal,5,Windows XP,wireshark-bugs,tobyhui,8/23/07 16:16,2014-09-23 04:32:14 UTC,eapache
1767,GTK+ UI,RESOLVED,FIXED,packet-3com-xns.c display filter field problems,8/30/07 5:00,Minor,5,All,wireshark-bugs,Christopher.Maynard,8/23/07 17:09,2007-08-30 04:58:45 UTC,anders.broman
1768,GTK+ UI,RESOLVED,FIXED,packet-ieee8011.c display filter field problems,10/7/07 23:26,Minor,3,Windows XP,wireshark-bugs,Christopher.Maynard,8/23/07 17:17,2007-10-07 23:26:45 UTC,bugzilla
1769,GTK+ UI,RESOLVED,FIXED,packet-slowprotocols.c display filter field problems,8/30/07 5:03,Minor,3,Windows XP,wireshark-bugs,Christopher.Maynard,8/23/07 17:20,2007-08-30 05:03:01 UTC,anders.broman
1770,GTK+ UI,RESOLVED,FIXED,packet-aim-admin.c display filter field problems,8/30/07 5:06,Minor,3,Windows XP,wireshark-bugs,Christopher.Maynard,8/23/07 17:25,2007-08-30 05:06:13 UTC,anders.broman
1771,GTK+ UI,RESOLVED,FIXED,packet-aim-bos.c display filter field problems,8/30/07 5:31,Minor,3,Windows XP,wireshark-bugs,Christopher.Maynard,8/23/07 17:27,2007-08-30 05:31:02 UTC,anders.broman
1772,GTK+ UI,RESOLVED,FIXED,packet-aim-buddylist.c display filter field problems,8/30/07 5:23,Minor,3,Windows XP,wireshark-bugs,Christopher.Maynard,8/23/07 17:30,2007-08-30 05:23:49 UTC,anders.broman
1773,GTK+ UI,RESOLVED,FIXED,packet-aim-generic.c display filter field problems,8/30/07 5:24,Minor,3,Windows XP,wireshark-bugs,Christopher.Maynard,8/23/07 17:32,2007-08-30 05:24:22 UTC,anders.broman
1774,GTK+ UI,RESOLVED,FIXED,packet-aim-location.c display filter field problems,8/30/07 5:24,Minor,3,Windows XP,wireshark-bugs,Christopher.Maynard,8/23/07 17:35,2007-08-30 05:24:46 UTC,anders.broman
1775,GTK+ UI,RESOLVED,FIXED,packet-aim-messaging.c display filter field problems,8/30/07 5:25,Minor,3,Windows XP,wireshark-bugs,Christopher.Maynard,8/23/07 17:37,2007-08-30 05:25:19 UTC,anders.broman
1776,GTK+ UI,RESOLVED,FIXED,packet-aim-signon.c display filter field problems,8/30/07 5:25,Minor,3,Windows XP,wireshark-bugs,Christopher.Maynard,8/23/07 17:39,2007-08-30 05:25:42 UTC,anders.broman
1777,GTK+ UI,RESOLVED,FIXED,packet-aim-ssi.c display filter field problems,8/30/07 5:26,Minor,3,Windows XP,wireshark-bugs,Christopher.Maynard,8/23/07 17:40,2007-08-30 05:26:05 UTC,anders.broman
1778,GTK+ UI,RESOLVED,FIXED,packet-aim-sst.c display filter field problems,8/30/07 5:26,Minor,3,Windows XP,wireshark-bugs,Christopher.Maynard,8/23/07 17:43,2007-08-30 05:26:20 UTC,anders.broman
1779,GTK+ UI,RESOLVED,FIXED,packet-aim-userlookup.c display filter field problems,8/30/07 5:26,Minor,3,Windows XP,wireshark-bugs,Christopher.Maynard,8/23/07 17:46,2007-08-30 05:26:40 UTC,anders.broman
1780,GTK+ UI,RESOLVED,FIXED,packet-amr.c display filter field problems,8/24/07 5:59,Minor,3,Windows XP,wireshark-bugs,Christopher.Maynard,8/23/07 17:48,2007-08-24 05:59:39 UTC,anders.broman
1781,GTK+ UI,RESOLVED,FIXED,packet-ansi_637.c display filter field problems,8/30/07 4:49,Minor,6,All,wireshark-bugs,Christopher.Maynard,8/23/07 17:50,2007-08-30 04:49:33 UTC,anders.broman
1782,GTK+ UI,RESOLVED,FIXED,packet-ansi_a.c display filter field problems,10/2/07 21:26,Minor,3,Windows XP,wireshark-bugs,Christopher.Maynard,8/23/07 17:52,2007-10-02 21:26:52 UTC,ronniesahlberg
1783,GTK+ UI,RESOLVED,FIXED,packet-ansi_map.c display filter field problems,9/6/09 10:18,Minor,5,All,wireshark-bugs,Christopher.Maynard,8/23/07 17:53,2007-08-24 06:00:55 UTC,guy
1784,GTK+ UI,RESOLVED,FIXED,packet-ansi_tcap.c display filter field problems,8/24/07 6:01,Minor,3,Windows XP,wireshark-bugs,Christopher.Maynard,8/23/07 17:55,2007-08-24 06:01:20 UTC,anders.broman
1785,GTK+ UI,RESOLVED,FIXED,packet-dcerpc-atsvc.c display filter field problems,8/30/07 5:27,Minor,3,Windows XP,wireshark-bugs,Christopher.Maynard,8/23/07 18:00,2007-08-30 05:27:51 UTC,anders.broman
1786,GTK+ UI,RESOLVED,FIXED,packet-llc.c display filter field problems,10/7/07 23:34,Minor,3,Windows XP,wireshark-bugs,Christopher.Maynard,8/23/07 18:31,2007-10-07 23:34:19 UTC,bugzilla
1787,GTK+ UI,RESOLVED,FIXED,packet-bfd.c display filter field problems,1/4/15 17:55,Minor,7,Windows XP,wireshark-bugs,Christopher.Maynard,8/23/07 18:33,2007-11-27 21:07:08 UTC,pascal.quantin
1788,GTK+ UI,RESOLVED,DUPLICATE,packet-bssap.c display filter field problems,8/10/08 22:12,Minor,8,All,wireshark-bugs,Christopher.Maynard,8/23/07 18:34,2008-08-10 22:12:48 UTC,Christopher.Maynard
1789,GTK+ UI,RESOLVED,FIXED,packet-c*.c display filter field problems,8/24/07 0:00,Minor,5,Windows XP,wireshark-bugs,Christopher.Maynard,8/23/07 20:02,2007-08-24 00:00:18 UTC,bugzilla
1790,GTK+ UI,RESOLVED,FIXED,packet-cisco-erspan.c enhancements,8/25/07 0:30,Enhancement,4,Windows XP,wireshark-bugs,ohuchi,8/24/07 5:28,2007-08-25 00:30:27 UTC,stig
1791,GTK+ UI,RESOLVED,FIXED,cannot open file with File -> Open,12/22/11 7:00,Major,12,Linux (other),wireshark-bugs,fpeters,8/24/07 10:09,2011-12-22 07:00:14 UTC,Christopher.Maynard
1792,GTK+ UI,VERIFIED,FIXED,ISIS dissector does not decode Restart Signaling CLVs correctly,8/26/07 4:22,Normal,4,All,wireshark-bugs,todd.martin,8/24/07 17:43,2007-08-24 22:23:59 UTC,todd.martin
1793,GTK+ UI,RESOLVED,FIXED,mp2t: Call the mpeg-pes dissector,8/25/07 0:50,Enhancement,3,All,wireshark-bugs,sjackman,8/24/07 18:36,2007-08-25 00:50:41 UTC,stig
1794,GTK+ UI,VERIFIED,FIXED,OSPF dissector does not decode TLVs in a Grace LSA,8/27/07 15:29,Normal,7,All,wireshark-bugs,todd.martin,8/24/07 18:39,2007-08-26 13:44:16 UTC,todd.martin
1795,GTK+ UI,RESOLVED,FIXED,Feature Request: Ability To Open CommView Capture Files,11/27/07 17:30,Enhancement,30,All,wireshark-bugs,tyson.key,8/24/07 19:31,2007-11-27 05:44:21 UTC,stephenfisher
1796,GTK+ UI,RESOLVED,FIXED,Crash when capturing SSL data,8/25/07 17:59,Major,6,Mac OS X 10.4,wireshark-bugs,stig,8/25/07 11:48,2007-08-25 17:59:35 UTC,luis.ontanon
1797,GTK+ UI,RESOLVED,FIXED,docsis plugin display filter fields not named properly,10/7/07 23:47,Minor,3,All,wireshark-bugs,Christopher.Maynard,8/25/07 17:07,2007-10-07 23:47:20 UTC,bugzilla
1798,GTK+ UI,RESOLVED,FIXED,packet-d*.c display filter fields incorrectly named.,10/8/07 0:26,Minor,3,All,wireshark-bugs,Christopher.Maynard,8/25/07 20:33,2007-10-08 00:26:27 UTC,bugzilla
1799,GTK+ UI,RESOLVED,FIXED,packet-dcerpc-afs4int.c display filter field problems,9/7/07 22:16,Minor,4,All,wireshark-bugs,Christopher.Maynard,8/25/07 20:47,2007-09-07 22:16:03 UTC,guy
1800,GTK+ UI,RESOLVED,FIXED,Missing 802.11 WMM TSPEC dissector fixes,8/27/07 21:24,Major,2,Windows XP,wireshark-bugs,maattanen,8/27/07 5:30,2007-08-27 21:24:32 UTC,stig
1801,GTK+ UI,RESOLVED,FIXED,wireshark segmentation fault,8/28/07 2:14,Major,4,Linux (other),wireshark-bugs,toralf.foerster,8/27/07 9:47,2007-08-28 02:14:44 UTC,stephenfisher
1802,GTK+ UI,RESOLVED,FIXED,"""E"" display filter field problems",10/31/07 7:54,Minor,3,All,wireshark-bugs,Christopher.Maynard,8/27/07 15:59,2007-10-31 07:54:00 UTC,anders.broman
1803,GTK+ UI,RESOLVED,FIXED,"""F"" display filter field problems",9/30/07 22:35,Minor,3,All,wireshark-bugs,Christopher.Maynard,8/27/07 19:41,2007-09-30 22:35:07 UTC,ronniesahlberg
1804,GTK+ UI,RESOLVED,DUPLICATE,packet-fcsb3.c display filter field problems,8/10/08 22:13,Minor,4,All,wireshark-bugs,Christopher.Maynard,8/27/07 19:50,2008-08-10 22:13:35 UTC,Christopher.Maynard
1805,GTK+ UI,RESOLVED,DUPLICATE,Window location is off the screen at application start-up.,8/29/07 14:01,Major,2,Windows XP,wireshark-bugs,rcassick,8/27/07 21:00,2007-08-29 14:01:20 UTC,wmeier
1806,GTK+ UI,VERIFIED,FIXED,IP dissector Expert Info flags packets with a low TTL when the TTL should be low,9/8/07 21:13,Minor,13,All,wireshark-bugs,todd.martin,8/28/07 15:50,2007-08-28 21:03:13 UTC,todd.martin
1807,GTK+ UI,RESOLVED,FIXED,BACnet UnconfirmedEventNotification inconsistent decoding,9/1/07 11:48,Minor,5,Linux (other),wireshark-bugs,steve,8/28/07 18:27,2007-09-01 11:48:41 UTC,jaap.keuter
1808,GTK+ UI,RESOLVED,FIXED,ACN dissector bugs,9/12/07 5:58,Minor,6,Windows XP,wireshark-bugs,bill.florac,8/28/07 18:32,2007-09-12 05:58:48 UTC,jaap.keuter
1809,GTK+ UI,RESOLVED,FIXED,Implement 3GPP protocoll SABP (ASN.1) #25.419,3/19/08 19:14,Enhancement,13,All,wireshark-bugs,hello.martin,8/28/07 21:09,2008-03-19 19:14:36 UTC,anders.broman
1810,GTK+ UI,RESOLVED,WORKSFORME,Menu Preferences- User Interface/ Layout Pane Selection,9/18/07 9:32,Minor,5,Windows XP,wireshark-bugs,dennis.cradock,8/29/07 11:03,2007-09-18 09:32:52 UTC,jaap.keuter
1811,GTK+ UI,RESOLVED,FIXED,New WiMAX ASN Control Protocol (WIMAXASNCP) Dissector,9/6/07 10:47,Enhancement,9,All,wireshark-bugs,stephen.d.croll,8/29/07 19:48,2007-09-06 10:47:14 UTC,martin.r.mathieson
1812,GTK+ UI,RESOLVED,FIXED,Radiotap dissector out of sync with the current specification.,7/2/09 13:31,Major,7,All,wireshark-bugs,gerald,8/31/07 16:56,2009-07-02 13:31:28 UTC,gerald
1813,GTK+ UI,RESOLVED,FIXED,Creating new Display Filter Macro,9/2/07 12:39,Minor,2,Windows Vista,wireshark-bugs,marosik,8/31/07 23:02,2007-09-02 12:39:31 UTC,wmeier
1814,GTK+ UI,CONFIRMED, ---,Capture filters not work when capturing from named pipes or stdin,5/11/16 20:23,Major,7,All,wireshark-bugs,mmh,9/1/07 13:55,,wireshark
1815,GTK+ UI,RESOLVED,DUPLICATE,The last received packet from pipe is not shown in packet list.,1/21/08 5:11,Major,2,Windows XP,wireshark-bugs,mmh,9/1/07 14:06,2008-01-21 05:11:33 UTC,benjamin_tse
1816,GTK+ UI,RESOLVED,FIXED,LSSU types for MTP2 protocol.,9/3/07 5:57,Enhancement,2,All,wireshark-bugs,mmh,9/1/07 14:18,2007-09-03 05:57:32 UTC,jaap.keuter
1817,GTK+ UI,RESOLVED,DUPLICATE,window starts offscreen on multidisplay computer,9/6/07 19:09,Trivial,3,Windows XP,wireshark-bugs,timeless,9/3/07 11:34,2007-09-06 19:09:42 UTC,jeff.morriss.ws
1818,GTK+ UI,RESOLVED,WORKSFORME,about dialog tabs are upside down,11/28/08 2:38,Trivial,4,Windows XP,wireshark-bugs,timeless,9/3/07 11:42,2008-11-28 02:38:51 UTC,timeless
1819,GTK+ UI,RESOLVED,FIXED,packet-hsrp.c enhancement,9/4/07 6:56,Enhancement,4,Windows XP,wireshark-bugs,ohuchi,9/4/07 2:00,2007-09-04 06:56:39 UTC,jaap.keuter
1820,GTK+ UI,VERIFIED,FIXED,ANSI MAP systemMyTypeCode should be OPTIONAL,9/10/07 2:51,Normal,8,Windows XP,wireshark-bugs,peter.leeming,9/4/07 3:59,2007-09-06 21:19:08 UTC,peter.leeming
1821,GTK+ UI,RESOLVED,FIXED,ANSI TCAP component Parameter should be CHOICE of Set or Sequence,9/18/07 14:10,Normal,7,Windows XP,wireshark-bugs,peter.leeming,9/4/07 5:12,2007-09-18 14:10:11 UTC,jeff.morriss.ws
1822,GTK+ UI,RESOLVED,FIXED,UNISTIM Tap interface plus call grapher,9/10/07 18:02,Enhancement,17,All,wireshark-bugs,csinger,9/5/07 1:03,2007-09-10 07:22:59 UTC,jaap.keuter
1823,TShark,RESOLVED,FIXED,crash on fuzzed capture in RTSE dissector,9/5/07 7:37,Critical,3,Linux (other),wireshark-bugs,jeff.morriss.ws,9/5/07 1:09,2007-09-05 07:37:20 UTC,stig
1824,GTK+ UI,RESOLVED,FIXED,packet-netflow.c can not dissect ipv6 addresses on netflow v9 fields.,9/5/07 6:59,Minor,3,Windows XP,wireshark-bugs,ohuchi,9/5/07 1:32,2007-09-05 06:59:54 UTC,jaap.keuter
1825,GTK+ UI,VERIFIED,FIXED,ANSI MAP triggerAddressList BER Error: Wrong field in SQ OF,9/10/07 2:53,Normal,3,Windows XP,wireshark-bugs,peter.leeming,9/5/07 5:23,2007-09-06 21:19:53 UTC,peter.leeming
1826,GTK+ UI,RESOLVED,NOTABUG,Wireshark does NOT decode SIP messages which use TCP and non default port,9/5/07 11:37,Normal,3,Windows XP,wireshark-bugs,peter.makrai,9/5/07 8:05,2007-09-05 11:37:56 UTC,jaap.keuter
1827,Dissection engine (libwireshark),CONFIRMED, ---,problem with accentuated letters,6/16/16 18:57,Major,20,Windows 2000,wireshark-bugs,pascal.herve,9/5/07 13:08,,balint
1828,GTK+ UI,RESOLVED,FIXED,ipprotostr() not exported,9/6/07 14:03,Major,2,Windows XP,wireshark-bugs,gvanem,9/6/07 13:53,2007-09-06 14:03:20 UTC,stig
1829,GTK+ UI,RESOLVED,FIXED,No interfaces,9/9/07 18:13,Major,2,Windows Vista,wireshark-bugs,yanai.gottlieb,9/6/07 20:24,2007-09-09 18:13:44 UTC,yanai.gottlieb
1830,GTK+ UI,VERIFIED,FIXED,Enhancements to the packet-bfd.c dissector,9/8/07 21:12,Enhancement,11,All,wireshark-bugs,todd.martin,9/7/07 18:29,2007-09-07 19:08:53 UTC,todd.martin
1831,GTK+ UI,RESOLVED,FIXED,Packet Bytes pane not always highlighting all bytes,8/5/11 11:11,Enhancement,11,All,wireshark-bugs,stig,9/7/07 23:06,2011-08-05 11:11:41 UTC,Christopher.Maynard
1832,GTK+ UI,RESOLVED,FIXED,Incorrect Report of Malformed UDP packet In an ICMP Dest Unreachable,10/2/07 15:49,Major,2,All,wireshark-bugs,keithfrench,9/8/07 14:56,2007-10-02 15:49:46 UTC,stig
1833,GTK+ UI,RESOLVED,FIXED,Dissector for srvloc protocol (SLP) does not display attribute-list correctly,1/25/08 23:19,Minor,16,Windows XP,wireshark-bugs,bill.florac,9/10/07 3:38,2008-01-25 23:19:39 UTC,bill.florac
1834,TShark,RESOLVED,FIXED,Converting a HP-UX nettl IP packet dump to pcap does not work,9/11/07 21:31,Minor,3,FreeBSD,wireshark-bugs,pieter,9/10/07 8:32,2007-09-11 21:31:55 UTC,jaap.keuter
1835,GTK+ UI,RESOLVED,FIXED,Truncated packets are omited from statistics calculations,9/28/07 8:01,Major,3,Windows XP,wireshark-bugs,dmitry.a.vompe,9/10/07 19:36,2007-09-28 08:01:46 UTC,ronniesahlberg
1836,GTK+ UI,VERIFIED,FIXED,Text2pcap doesn't handle timestamp starting with 00:,9/21/07 10:13,Major,14,Windows XP,wireshark-bugs,mike,9/11/07 14:52,2007-09-20 16:28:26 UTC,mike
1837,GTK+ UI,RESOLVED,DUPLICATE,plugin for ieee 802.15.4 protocol,3/5/08 14:16,Normal,5,Windows XP,wireshark-bugs,fallier.renaud,9/11/07 17:14,2008-03-05 14:16:35 UTC,anders.broman
1838,GTK+ UI,RESOLVED,NOTABUG,libfreetype.6.dylib not exists at Leopard,9/12/07 21:13,Critical,3,Mac OS X 10.5,wireshark-bugs,actuosus,9/12/07 15:59,2007-09-12 21:13:38 UTC,guy
1839,GTK+ UI,RESOLVED,FIXED,Add support of ERF encapsulation with a specific dissector,10/8/07 11:43,Enhancement,4,Linux (other),wireshark-bugs,florent.drouin,9/12/07 18:43,2007-10-08 11:43:44 UTC,anders.broman
1840,TShark,RESOLVED,WORKSFORME,"Tshark randomly crashes while using  ""-Tfields ""  options.",9/30/07 22:49,Major,8,Linux (other),wireshark-bugs,avachhani,9/13/07 0:01,2007-09-30 22:49:03 UTC,wmeier
1841,GTK+ UI,RESOLVED,FIXED,crash after adding&deleting a column,11/20/07 23:22,Major,5,Windows XP,wireshark-bugs,stefankaerst,9/13/07 10:14,2007-11-20 23:22:31 UTC,stephenfisher
1842,GTK+ UI,RESOLVED,FIXED,TCP window size incorrect when conversation filter applied.,9/16/07 13:19,Normal,3,All,wireshark-bugs,Christopher.Maynard,9/13/07 16:14,2007-09-16 13:19:36 UTC,stig
1843,GTK+ UI,RESOLVED,FIXED,Update FCoE dissector to match T11 August 2007 changes to the protocol,9/20/07 6:51,Enhancement,10,Linux (other),wireshark-bugs,joe,9/14/07 1:35,2007-09-20 06:51:39 UTC,jaap.keuter
1844,GTK+ UI,RESOLVED,FIXED,Wireshark crashes when opening capture file,9/18/07 14:09,Major,4,Windows XP,wireshark-bugs,peter.leeming,9/14/07 5:49,2007-09-18 14:09:35 UTC,jeff.morriss.ws
1845,GTK+ UI,RESOLVED,FIXED,Add decodes for more FC ELS opcodes,9/16/07 12:57,Minor,3,Linux (other),wireshark-bugs,joe,9/14/07 17:57,2007-09-16 12:57:15 UTC,jaap.keuter
1846,GTK+ UI,RESOLVED,FIXED,Add decode for Fibre Channel Virtual Fabric Tag (VSANs),9/16/07 9:08,Enhancement,4,Linux (other),wireshark-bugs,joe,9/14/07 18:03,2007-09-16 09:08:15 UTC,jaap.keuter
1847,Dissection engine (libwireshark),RESOLVED,FIXED,"TCP Duplicate ACK's not being marked as such in ""Expert Info"".",7/31/15 14:08,Normal,7,All,bugzilla-admin,Christopher.Maynard,9/14/07 18:28,2015-07-28 14:17:50 UTC,Christopher.Maynard
1848,GTK+ UI,RESOLVED,NOTOURBUG,New WiMAX ASN Protocol (WMXA) Dissector,11/5/07 21:23,Major,6,Linux (other),wireshark-bugs,tle01423,9/17/07 8:19,2007-11-05 21:23:07 UTC,anders.broman
1849,TShark,RESOLVED,FIXED,tshark conversation output does not include start date/time for the conversation,12/19/12 17:20,Enhancement,7,All,wireshark-bugs,david,9/17/07 13:50,2012-12-19 17:20:11 UTC,mmann78
1850,TShark,RESOLVED,LATER,tshark IO statistics output only includes offset timestamps,2/9/13 17:55,Enhancement,5,Linux (other),wireshark-bugs,david,9/17/07 14:01,2013-02-09 17:55:58 UTC,eapache
1851,TShark,RESOLVED,FIXED,failure on HTTP's payload over reasembled TCP,10/3/07 17:08,Major,3,All,wireshark-bugs,luis.ontanon,9/17/07 19:22,2007-10-03 17:08:45 UTC,sake
1852,GTK+ UI,RESOLVED,FIXED,packet-g*.c display filter field problems.,1/11/08 15:50,Minor,5,All,wireshark-bugs,Christopher.Maynard,9/17/07 19:52,2008-01-10 16:44:54 UTC,bugzilla
1853,GTK+ UI,RESOLVED,FIXED,new dissector for TPNCP protocol,11/14/07 17:40,Enhancement,8,All,wireshark-bugs,valery.sigalov,9/18/07 13:09,2007-11-11 13:25:01 UTC,valery.sigalov
1854,GTK+ UI,RESOLVED,FIXED,Graph Analysis displays IPv6-Addresses only overlapping each other,10/29/08 0:30,Normal,2,Linux (other),wireshark-bugs,srich,9/18/07 14:50,2008-10-29 00:30:04 UTC,jaap.keuter
1855,GTK+ UI,RESOLVED,NOTOURBUG,TCP connections blocked in presence of Kerio firewall (Sunbelt),9/18/07 20:31,Major,3,Windows XP,wireshark-bugs,christophe,9/18/07 16:50,2007-09-18 20:15:09 UTC,jaap.keuter
1856,GTK+ UI,VERIFIED,FIXED,Wireshark is not able to parse MGCP over TCP with ASCII TPKT header,10/19/07 17:29,Normal,5,All,harmeet.sawhney,harmeet.sawhney,9/19/07 7:26,2007-09-19 10:34:32 UTC,jaap.keuter
1857,Dissection engine (libwireshark),RESOLVED,FIXED,added nortel/polycom conf phone as a hardware type,1/1/17 23:20,Enhancement,4,All,wireshark-bugs,dnewton,9/19/07 16:46,2007-09-19 18:57:50 UTC,guy
1858,GTK+ UI,RESOLVED,FIXED,IP packets captured on TSO hardware are uninterpretted,9/24/07 6:47,Normal,4,Linux (other),wireshark-bugs,jonathan,9/19/07 20:31,2007-09-24 06:47:29 UTC,jaap.keuter
1859,GTK+ UI,RESOLVED,FIXED,Wireshark doesn't parse iSCSI PDUs that their header spans multiple TCP segments,7/30/08 7:28,Major,4,Windows XP,wireshark-bugs,erang,9/20/07 12:59,2008-07-30 07:28:27 UTC,anders.broman
1860,GTK+ UI,RESOLVED,FIXED,Expert info should only apply to filtered packets  not all packets.,7/16/14 4:12,Normal,11,All,wireshark-bugs,Christopher.Maynard,9/21/07 15:11,2014-07-16 01:57:03 UTC,eapache
1861,GTK+ UI,RESOLVED,FIXED,Bugfix for unistim open stream and addition of UFTP to dissector,9/24/07 6:21,Enhancement,10,All,wireshark-bugs,csinger,9/22/07 3:22,2007-09-24 06:21:58 UTC,jaap.keuter
1862,GTK+ UI,RESOLVED,FIXED,JPEG (JFIF) packet always malformed,11/29/07 0:04,Minor,5,Linux (other),wireshark-bugs,toralf.foerster,9/24/07 13:16,2007-11-29 00:04:51 UTC,wmeier
1863,GTK+ UI,RESOLVED,FIXED,added null term in uftp and cleaned comments in packet-unistim,9/24/07 19:58,Major,3,Linux (other),wireshark-bugs,dnewton,9/24/07 19:16,2007-09-24 19:57:53 UTC,stig
1864,Capture file support (libwiretap),RESOLVED,FIXED,Fix errors that cause make rpm-package failure,1/26/15 22:38,Major,6,Linux (other),wireshark-bugs,cwen01390,9/25/07 2:43,2007-09-28 17:41:32 UTC,guy
1865,GTK+ UI,RESOLVED,FIXED,DCCP Dissector: Feature-Negotiation options  updates  and decoding CCID3 options,9/25/07 19:43,Enhancement,3,All,wireshark-bugs,francesco.fondelli,9/25/07 14:26,2007-09-25 19:43:21 UTC,jaap.keuter
1866,GTK+ UI,RESOLVED,NOTABUG,"protocol name ""0x6002"" for a DEC packet",9/25/07 19:38,Trivial,5,Linux (other),wireshark-bugs,toralf.foerster,9/25/07 15:21,2007-09-25 19:38:07 UTC,toralf.foerster
1867,GTK+ UI,RESOLVED,FIXED,Pango-WARNING **: Invalid UTF-8 string passed to pango_layout_set_text(),11/10/10 13:41,Minor,7,Linux (other),wireshark-bugs,toralf.foerster,9/25/07 19:39,2010-11-10 13:41:44 UTC,Christopher.Maynard
1868,GTK+ UI,RESOLVED,FIXED,http-reassembly does not work correctly,10/3/07 17:09,Normal,4,Windows XP,wireshark-bugs,stevenc,9/25/07 21:05,2007-10-03 17:09:12 UTC,sake
1869,GTK+ UI,RESOLVED,WONTFIX,"""Forward"" and ""backward"" button for Filter request",6/16/14 23:30,Enhancement,11,Linux (other),wireshark-bugs,toralf.foerster,9/26/07 12:32,2014-06-16 23:30:57 UTC,anders.broman
1870,GTK+ UI,RESOLVED,FIXED,new protocol dissector for the protocol PCE,12/29/07 0:57,Major,25,All,wireshark-bugs,silviacristina.tejedor,9/27/07 9:54,2007-12-23 14:21:11 UTC,guy
1871,GTK+ UI,RESOLVED,FIXED,SIP pkt in Hammer cap file incorrectly analysed as SAIA S-BUS,10/2/07 22:05,Normal,5,Windows XP,wireshark-bugs,craig_watkinson,9/27/07 10:00,2007-10-02 22:05:32 UTC,ronniesahlberg
1873,GTK+ UI,RESOLVED,NOTABUG,error while capturing packets: read error: packetreceivepacket failed,10/12/07 22:03,Normal,3,Windows Vista,wireshark-bugs,photonuv,9/27/07 23:17,2007-10-12 22:03:00 UTC,jeff.morriss.ws
1874,GTK+ UI,RESOLVED,FIXED,Filesize variable over runs its limit  shows negative value.,9/28/07 14:12,Minor,2,Windows XP,wireshark-bugs,n2ohh,9/28/07 0:53,2007-09-28 14:12:27 UTC,jeff.morriss.ws
1875,TShark,VERIFIED,FIXED,tshark doesn't appear to flush its' output stream when writting to a file on Windows XP.,9/28/07 15:21,Major,3,Windows XP,wireshark-bugs,g.hassler,9/28/07 13:47,2007-09-28 15:20:59 UTC,g.hassler
1876,GTK+ UI,RESOLVED,FIXED,ethereal: Resizing columns changes the currently-selected packet,11/14/07 6:41,Major,3,Linux (other),wireshark-bugs,fpeters,9/29/07 13:41,2007-11-14 06:41:32 UTC,stephenfisher
1877,GTK+ UI,RESOLVED,FIXED,Try xdg-open instead of htmlview for opening HTML,9/30/07 10:08,Enhancement,3,Linux (other),wireshark-bugs,ville.skytta,9/29/07 21:37,2007-09-30 10:08:20 UTC,stig
1878,GTK+ UI,RESOLVED,FIXED,Substandard .desktop file (patch against latest SVN attached),9/30/07 0:19,Normal,3,Linux (other),wireshark-bugs,leroutier,9/29/07 22:04,2007-09-30 00:19:49 UTC,guy
1879,TShark,RESOLVED,DUPLICATE, -V should support layer selection,6/6/11 12:47,Enhancement,4,Linux (other),wireshark-bugs,fpeters,9/30/07 19:01,2011-05-23 18:26:19 UTC,balint
1880,TShark,CONFIRMED, ---,should provide an option to print tunnel encapsulation,11/8/10 19:58,Enhancement,2,Linux (other),wireshark-bugs,fpeters,9/30/07 19:03,,fpeters
1881,GTK+ UI,RESOLVED,DUPLICATE,"please reword exit button ""Continue without saving"" to ""Quit without saving""",9/30/07 22:15,Enhancement,2,Linux (other),wireshark-bugs,fpeters,9/30/07 19:05,2007-09-30 22:15:27 UTC,wmeier
1882,GTK+ UI,RESOLVED,FIXED,Use more meaningful temp file: /tmp/wireshark.<iface>.YYYY-MM-DD--HHMM-xxxxxx,11/16/10 8:31,Enhancement,13,All,wireshark-bugs,fpeters,9/30/07 19:06,2010-11-16 08:31:19 UTC,gerald
1883,GTK+ UI,RESOLVED,FIXED,Wireshark should be able to capture traffic from a pipe.,5/7/12 8:56,Enhancement,3,Linux (other),wireshark-bugs,fpeters,9/30/07 19:08,2012-05-07 08:56:23 UTC,guy
1884,TShark,RESOLVED,NOTABUG,tshark should not initialize libadns in case of -n,10/15/07 13:50,Enhancement,5,Linux (other),wireshark-bugs,fpeters,9/30/07 19:10,2007-10-13 14:52:44 UTC,jmayer
1885,GTK+ UI,RESOLVED,FIXED,"""Protocol Hierarchy Statistics"" give misleading byte numbers",3/9/16 19:07,Enhancement,5,Linux (other),wireshark-bugs,fpeters,9/30/07 19:11,2016-03-09 13:18:28 UTC,gerrit-do-not-reply
1886,GTK+ UI,RESOLVED,FIXED,"Conversation exposes ""Dissector bug  protocol NCP""",10/8/07 3:29,Major,4,All,wireshark-bugs,jyoung,10/1/07 3:53,2007-10-08 03:29:14 UTC,jyoung
1887,GTK+ UI,RESOLVED,DUPLICATE,16 Unknown Algorithms offered by Firefox 2.0.0.7,10/1/07 15:12,Normal,2,Windows XP,wireshark-bugs,GaryChaulklin,10/1/07 14:54,2007-10-01 15:12:56 UTC,jaap.keuter
1888,GTK+ UI,RESOLVED,FIXED,New Versions of ASN.1 dissectors for pkix- CMP and pkix- CRMF,10/7/07 16:03,Enhancement,16,All,wireshark-bugs,wireshark,10/1/07 16:34,2007-10-07 16:03:17 UTC,anders.broman
1889,GTK+ UI,RESOLVED,FIXED,"NFSv3 filehandles being ""returned"" incorrectly.",10/2/07 16:48,Major,3,All,wireshark-bugs,fschorr,10/2/07 15:32,2007-10-02 16:48:38 UTC,stig
1890,TShark,RESOLVED,FIXED,When displaying int using BASE_DEC_HEX type  BASE_OCT is displayed instead.,10/2/07 16:30,Trivial,2,Linux (other),wireshark-bugs,richard.nichols,10/2/07 16:19,2007-10-02 16:30:09 UTC,stig
1891,GTK+ UI,VERIFIED,FIXED,Fields in the SCSI INQUIRY data are parsed incorrectly,10/4/07 8:39,Normal,4,Windows XP,wireshark-bugs,gvvua,10/3/07 9:24,2007-10-03 15:01:39 UTC,gvvua
1892,GTK+ UI,RESOLVED,DUPLICATE,Show SNMP OID in info column option doesn't work,10/3/07 18:40,Normal,2,Windows XP,wireshark-bugs,jackcslewis,10/3/07 18:28,2007-10-03 18:40:19 UTC,stig
1893,GTK+ UI,RESOLVED,FIXED,h261.ebit misinterpreted,10/4/07 13:23,Normal,2,Linux (other),wireshark-bugs,martin,10/4/07 12:39,2007-10-04 13:23:14 UTC,stig
1894,TShark,RESOLVED,FIXED,Add IMPS 1.2 and IMPS 1.3 protocols support,10/6/07 7:16,Enhancement,8,All,wireshark-bugs,rubaniuk,10/4/07 18:56,2007-10-05 23:51:19 UTC,stig
1895,GTK+ UI,RESOLVED,FIXED,Sophos Anti-Virus reports that packet.dll contains a virus,10/5/07 8:27,Major,2,Windows 2000,wireshark-bugs,mark.vandenbriele,10/5/07 7:33,2007-10-05 08:27:25 UTC,mark.vandenbriele
1896,GTK+ UI,RESOLVED,FIXED,After canceling a save to an existing file  can no longer save.,1/26/08 16:47,Major,3,Linux (other),wireshark-bugs,aalonzo,10/5/07 13:06,2008-01-26 16:47:14 UTC,stig
1897,GTK+ UI,RESOLVED,FIXED,eDonkey dissector update patch,10/30/07 10:03,Normal,10,Linux (other),wireshark-bugs,stefano.picerno,10/6/07 11:03,2007-10-27 15:29:34 UTC,stefano.picerno
1898,TShark,RESOLVED,WORKSFORME,"When Tshark is running  viewing a trace file with Wireshark ""interupts"" the Tshark execution",4/9/10 9:45,Normal,5,Windows 2000,wireshark-bugs,ioannis_k,10/6/07 21:14,2010-04-09 09:45:53 UTC,jeff.morriss.ws
1899,GTK+ UI,RESOLVED,NOTABUG,Wireshark reports udp bad checksum errors,10/8/07 18:34,Major,2,Windows Vista,wireshark-bugs,bruce.a.st.germain,10/8/07 18:14,2007-10-08 18:34:31 UTC,jeff.morriss.ws
1900,GTK+ UI,RESOLVED,NOTABUG,interfaces disappear,10/8/07 18:37,Major,2,Windows Vista,wireshark-bugs,bruce.a.st.germain,10/8/07 18:20,2007-10-08 18:37:28 UTC,jeff.morriss.ws
1901,GTK+ UI,RESOLVED,FIXED,Flow Graph overflows screen region,1/16/12 8:00,Normal,11,Windows XP,wireshark-bugs,lyricnz,10/9/07 3:31,2012-01-16 08:00:04 UTC,anders.broman
1902,GTK+ UI,RESOLVED,LATER,Don't call tree_view_select/ packet_...column on button 1 event,10/15/07 0:06,Enhancement,4,All,wireshark-bugs,did447,10/9/07 4:24,2007-10-15 00:06:52 UTC,dgautheron
1903,GTK+ UI,RESOLVED,FIXED,wimaxasncp: TLVs defined in XML files,10/15/07 15:33,Enhancement,13,All,wireshark-bugs,stephen.d.croll,10/9/07 4:55,2007-10-15 15:33:22 UTC,martin.r.mathieson
1904,GTK+ UI,RESOLVED,DUPLICATE,IPMB protocol plugin,11/1/07 18:29,Major,28,Windows 2000,wireshark-bugs,chanthy.toeung,10/9/07 15:14,2007-11-01 18:29:15 UTC,jeff.morriss.ws
1905,GTK+ UI,RESOLVED,FIXED,CFM dissector (IEEE 802.1ag),10/13/07 17:38,Major,14,Windows XP,maulkin,maulkin,10/11/07 0:55,2007-10-13 17:38:35 UTC,jaap.keuter
1906,GTK+ UI,RESOLVED,FIXED,Segfault on Statistics/RTP/Show of two frames portmap dump,2/4/08 4:40,Normal,5,Linux (other),wireshark-bugs,fpeters,10/11/07 8:31,2008-02-04 04:40:40 UTC,wmeier
1907,GTK+ UI,RESOLVED,FIXED,illegal info of BGP VPLS NLRI displayed,10/11/07 22:04,Normal,2,Windows 2000,wireshark-bugs,zabe,10/11/07 8:47,2007-10-11 22:04:58 UTC,stig
1908,GTK+ UI,RESOLVED,FIXED,Tivoli Endpoint UDP packet dissected as PANA packet,10/12/07 21:32,Minor,3,Linux (other),wireshark-bugs,toralf.foerster,10/11/07 8:48,2007-10-12 21:32:41 UTC,jeff.morriss.ws
1909,GTK+ UI,RESOLVED,FIXED,typo in packet-netflow comment,10/11/07 16:42,Trivial,3,All,wireshark-bugs,acferen,10/11/07 15:45,2007-10-11 16:42:18 UTC,wmeier
1910,GTK+ UI,RESOLVED,FIXED,add preferences for sFlow,10/11/07 22:20,Enhancement,3,All,wireshark-bugs,acferen,10/11/07 15:50,2007-10-11 22:20:11 UTC,stig
1911,GTK+ UI,RESOLVED,NOTOURBUG,Add support for decoding EISUP (Cisco proprietary ISUP extention),1/3/10 6:46,Enhancement,12,Windows XP,wireshark-bugs,ravasio,10/12/07 14:32,2010-01-03 06:46:38 UTC,anders.broman
1912,Documentation,RESOLVED,FIXED,Fix an assortment of typos and other minor errors in various README files,10/12/07 19:17,Normal,13,All,wireshark-bugs,acferen,10/12/07 17:26,2007-10-12 19:14:06 UTC,stig
1913,Dissection engine (libwireshark),RESOLVED,DUPLICATE,make error,1/26/15 22:41,Trivial,2,Linux (other),wireshark-bugs,toralf.foerster,10/13/07 8:47,2007-10-16 16:19:31 UTC,guy
1914,Dissection engine (libwireshark),RESOLVED,FIXED,*shark complains about missing wimaxasncp XML file when run in build directory,1/26/15 22:40,Trivial,20,Linux (other),wireshark-bugs,toralf.foerster,10/13/07 9:45,2007-11-24 16:12:14 UTC,guy
1915,GTK+ UI,RESOLVED,FIXED,Opening Capture Options Windows sometimes causes Wireshark to crash,10/18/07 19:55,Blocker,9,Windows XP,wireshark-bugs,jyoung,10/14/07 6:59,2007-10-18 19:55:06 UTC,wmeier
1916,GTK+ UI,RESOLVED,FIXED,Can't build wireshark packages from svn on Debian unstable,6/11/08 2:51,Normal,11,Linux (other),wireshark-bugs,max,10/16/07 8:07,2008-06-11 02:51:50 UTC,jaap.keuter
1917,GTK+ UI,RESOLVED,DUPLICATE,Font color wrong over RDP.,10/16/07 22:51,Normal,4,Windows 2000,wireshark-bugs,john.patton,10/16/07 15:50,2007-10-16 16:49:20 UTC,luis.ontanon
1918,Dissection engine (libwireshark),RESOLVED,FIXED,T30 FCF byte decoding masks DTC  CIG and NCS,3/12/17 3:00,Normal,22,All,bugzilla-admin,jaap.keuter,10/16/07 20:23,2017-03-11 17:45:14 UTC,gerrit-do-not-reply
1919,GTK+ UI,RESOLVED,FIXED,"Spelling error on GDS DB protocol dissector: ""Buffer lenght:""",10/16/07 23:53,Trivial,3,Windows XP,wireshark-bugs,tmiller,10/16/07 23:25,2007-10-16 23:45:33 UTC,wmeier
1920,GTK+ UI,RESOLVED,NOTABUG,Bug in Sigcomp decoding  STATE-ACCESS instruction,1/3/10 6:48,Normal,6,All,wireshark-bugs,rgarcia2,10/18/07 11:24,2010-01-03 06:48:27 UTC,anders.broman
1921,GTK+ UI,RESOLVED,FIXED,Additional preferences for sFlow,10/19/07 9:55,Enhancement,5,All,wireshark-bugs,acferen,10/18/07 15:02,2007-10-19 09:53:41 UTC,sake
1922,GTK+ UI,RESOLVED,FIXED,RTSP streams cause Wireshark to crash,3/6/08 20:41,Major,6,Windows XP,wireshark-bugs,bridavis,10/18/07 15:39,2008-03-06 20:41:44 UTC,anders.broman
1923,GTK+ UI,RESOLVED,FIXED,[patch] Updates for the packet-wlancap dissector,12/14/07 19:12,Enhancement,5,Linux (other),wireshark-bugs,solomon,10/18/07 21:26,2007-12-14 19:12:48 UTC,gerald
1924,GTK+ UI,RESOLVED,NOTABUG,unable to decode the MTP3 - SCCP - TCAP - CAP HexDump,11/5/07 14:03,Major,13,Windows XP,wireshark-bugs,richa.khanna,10/19/07 11:40,2007-11-05 14:03:41 UTC,anders.broman
1925,GTK+ UI,RESOLVED,FIXED,Err  file gui_utils.c: line 501: should not be reached,10/20/07 2:37,Major,3,All,wireshark-bugs,khourihan,10/19/07 16:54,2007-10-20 02:37:13 UTC,guy
1926,GTK+ UI,RESOLVED,FIXED,buffer overflow when parsing iseries files,10/19/07 22:41,Critical,3,All,wireshark-bugs,fabiodds,10/19/07 22:15,2007-10-19 22:41:32 UTC,stephenfisher
1927,GTK+ UI,RESOLVED,FIXED,FCoE dissector shows nothing for partially-captured packets.,11/25/07 16:10,Minor,9,All,wireshark-bugs,joe,10/20/07 7:55,2007-11-25 12:20:35 UTC,stig
1928,GTK+ UI,RESOLVED,FIXED,Unreassembled Packet: MIME multipart,10/29/07 8:18,Normal,4,Windows XP,wireshark-bugs,peter.makrai,10/20/07 8:45,2007-10-29 08:18:03 UTC,peter.makrai
1929,GTK+ UI,RESOLVED,FIXED,Patch to rtp_player.c to resolve 'cc1: warnings being treated as errors' message,10/22/07 15:17,Trivial,3,Linux (other),wireshark-bugs,jyoung,10/22/07 14:33,2007-10-22 15:17:27 UTC,wmeier
1930,GTK+ UI,RESOLVED,FIXED,Patch to rtp_player.c for a smaller default max height of RTP Player window,1/16/08 7:38,Trivial,9,All,wireshark-bugs,jyoung,10/22/07 16:44,2008-01-16 07:38:52 UTC,jaap.keuter
1931,GTK+ UI,RESOLVED,FIXED,Potential infinite loop at line 608 of packet-gdsdb.c,10/23/07 5:38,Major,2,Windows XP,wireshark-bugs,packetsteve,10/22/07 22:03,2007-10-23 05:38:56 UTC,jaap.keuter
1932,GTK+ UI,RESOLVED,FIXED,Possible null pointer in packet-gdsdb.c,10/23/07 5:39,Major,2,Windows XP,wireshark-bugs,packetsteve,10/22/07 22:04,2007-10-23 05:39:14 UTC,jaap.keuter
1934,GTK+ UI,RESOLVED,FIXED,GIOP 1.1 Fragments incorrectly dissected,10/27/07 15:38,Normal,5,NetBSD,wireshark-bugs,steve,10/23/07 8:46,2007-10-27 15:38:57 UTC,anders.broman
1935,GTK+ UI,RESOLVED,FIXED,Wireshark does not parse dhcpv6 vendor-specific option properly,10/27/07 9:25,Normal,12,All,wireshark-bugs,jlange6648,10/23/07 12:37,2007-10-27 09:25:23 UTC,jaap.keuter
1936,Build process,RESOLVED,NOTOURBUG,epan/.libs/libwireshark.so.0.0.1 is not in scope of make,1/26/15 22:41,Normal,2,Linux (other),wireshark-bugs,toralf.foerster,10/24/07 11:37,2008-01-10 17:32:32 UTC,guy
1937,GTK+ UI,RESOLVED,FIXED,K12 capture file format errors,1/6/09 13:29,Major,9,Windows XP,wireshark-bugs,magnus,10/24/07 15:11,2009-01-06 13:29:21 UTC,wmeier
1938,GTK+ UI,RESOLVED,FIXED,nettl (HP-UX) enhancement: Add NS_LS_SCTP support,10/27/07 15:44,Enhancement,4,All,wireshark-bugs,mbrown,10/24/07 18:29,2007-10-27 15:44:50 UTC,anders.broman
1939,GTK+ UI,RESOLVED,DUPLICATE,Wireshard crash,10/25/07 3:57,Normal,2,Windows XP,wireshark-bugs,bichinhoverde,10/25/07 3:17,2007-10-25 03:57:42 UTC,stephenfisher
1940,GTK+ UI,RESOLVED,FIXED,decoding of EoMPLS (draft-martini) frames not correct,7/13/08 10:38,Major,2,All,wireshark-bugs,guan,10/25/07 6:54,2008-07-13 10:38:34 UTC,jaap.keuter
1941,GTK+ UI,RESOLVED,FIXED,New TIPC version,10/27/07 15:49,Enhancement,4,All,wireshark-bugs,wireshark,10/25/07 9:34,2007-10-27 15:49:10 UTC,anders.broman
1942,GTK+ UI,RESOLVED,FIXED,wrong value for GetDeviceID_data_DeviceSDR in ipmi dissector,10/27/07 15:53,Normal,4,Linux (other),wireshark-bugs,stephane,10/25/07 16:53,2007-10-27 15:53:55 UTC,anders.broman
1943,Documentation,RESOLVED,FIXED,Fix an assortment of typos and other minor errors in README.developer,10/26/07 15:29,Minor,3,All,wireshark-bugs,acferen,10/26/07 14:44,2007-10-26 15:29:22 UTC,wmeier
1944,GTK+ UI,RESOLVED,FIXED,rtsp dissector segfaults if handed incomplete data,10/28/07 16:53,Major,7,Linux (other),wireshark-bugs,acferen,10/26/07 16:47,2007-10-27 15:02:50 UTC,anders.broman
1945,GTK+ UI,RESOLVED,FIXED,The bootp/dhcp v4 dissector doesn't decode all relay suboptions,10/27/07 16:49,Normal,5,All,wireshark-bugs,stefan.puiu,10/27/07 12:15,2007-10-27 16:49:44 UTC,anders.broman
1946,GTK+ UI,RESOLVED,NOTOURBUG,eDonkey dissected as DNS,11/9/10 8:52,Normal,6,Linux (other),wireshark-bugs,toralf.foerster,10/27/07 18:10,2010-11-09 08:52:51 UTC,stephenfisher
1947,GTK+ UI,RESOLVED,FIXED,VNC dissector does not decode properly non-authenticated VNC sessions,11/25/08 17:38,Normal,9,Windows XP,wireshark-bugs,mykaul,10/27/07 20:50,2008-11-25 17:38:50 UTC,stephenfisher
1948,GTK+ UI,RESOLVED,NOTABUG,KFW is not an optional component - it must be compiled  or compilation fails,10/28/07 15:37,Normal,2,Windows XP,wireshark-bugs,mykaul,10/27/07 21:20,2007-10-28 15:37:22 UTC,mykaul
1949,GTK+ UI,RESOLVED,FIXED,GNUTLS is not an optional component - it must be compiled  or compilation fails,10/30/07 7:25,Normal,7,Windows XP,wireshark-bugs,mykaul,10/27/07 21:28,2007-10-30 07:25:29 UTC,mykaul
1950,GTK+ UI,RESOLVED,FIXED,Compilation fails if LUA (an OPTIONAL component) is disabled,10/28/07 19:02,Normal,8,Windows XP,wireshark-bugs,mykaul,10/27/07 21:58,2007-10-28 19:02:04 UTC,mykaul
1951,GTK+ UI,RESOLVED,FIXED,NBAP malformed packet,10/29/07 19:27,Minor,4,Linux (other),wireshark-bugs,hello.martin,10/28/07 21:15,2007-10-29 19:27:28 UTC,tomas.kukosa
1952,GTK+ UI,RESOLVED,FIXED,pkixCMP register OID fix plus OIDs used by Cryptlib,10/31/07 7:52,Minor,3,All,wireshark-bugs,wireshark,10/29/07 11:06,2007-10-31 07:52:09 UTC,anders.broman
1953,GTK+ UI,RESOLVED,NOTABUG,On Leopard  Wireshark starts up and when I choose to start a capture  the program crashes with a BadMatch error.,2/11/08 23:00,Major,13,Mac OS X 10.5,wireshark-bugs,timiller1,10/29/07 17:25,2007-11-03 18:33:30 UTC,guy
1954,GTK+ UI,RESOLVED,FIXED,DTLS: Support OpenSSL 0.9.8f,12/5/07 6:50,Enhancement,6,All,wireshark-bugs,mikma264,10/29/07 21:48,2007-11-05 23:06:47 UTC,jaap.keuter
1955,Dissection engine (libwireshark),CONFIRMED, ---,DRDA: dissect sql payload,6/17/14 22:44,Enhancement,3,Linux (other),bugzilla-admin,toralf.foerster,10/30/07 11:56,,guy
1956,GTK+ UI,RESOLVED,FIXED,Wireshark crashes on certain display filters (ftype ipv4),11/6/07 18:39,Major,9,All,wireshark-bugs,ellocodelassembler,10/30/07 17:59,2007-11-06 09:20:29 UTC,guy
1957,GTK+ UI,RESOLVED,FIXED,New Dissector: EPCglobal Low-Level Reader Protocol,8/6/12 8:33,Enhancement,36,Windows XP,wireshark-bugs,matt.poduska,10/30/07 18:14,2012-05-02 04:07:08 UTC,magonk
1958,GTK+ UI,RESOLVED,FIXED,HTTP parser limits with Content-Length,4/8/10 18:44,Trivial,6,All,wireshark-bugs,ellocodelassembler,10/30/07 18:32,2010-04-08 18:44:04 UTC,jeff.morriss.ws
1959,GTK+ UI,RESOLVED,NOTABUG,Could not run Wireshark remotely from another PC running X-Window,10/31/07 7:14,Major,2,Windows XP,wireshark-bugs,noel.delrosario,10/31/07 3:29,2007-10-31 07:14:41 UTC,ulf.lamping
1961,GTK+ UI,RESOLVED,DUPLICATE,wireshark 0.99.6a version  RTP analysis for Jitter value is not right,7/2/09 9:26,Major,5,Windows XP,wireshark-bugs,frank.sun,10/31/07 4:29,2009-07-02 09:26:02 UTC,anders.broman
1962,GTK+ UI,RESOLVED,DUPLICATE,white text on white background over RDP,10/31/07 13:23,Normal,2,Windows XP,wireshark-bugs,jiri.novak,10/31/07 4:51,2007-10-31 13:23:22 UTC,jeff.morriss.ws
1964,GTK+ UI,RESOLVED,FIXED,Wireshark is not able to parse MGCP over TCP with ASCII TPKT header,11/16/07 8:19,Minor,7,All,wireshark-bugs,harmeet.sawhney,10/31/07 7:36,2007-11-16 08:19:05 UTC,anders.broman
1965,GTK+ UI,RESOLVED,FIXED,playing around with lua dissector,9/16/08 7:06,Minor,3,Linux (other),wireshark-bugs,david.maciejak,10/31/07 13:24,2008-09-16 07:06:18 UTC,balint
1966,GTK+ UI,RESOLVED,NOTOURBUG,HTTP not recognised for GET without headers,11/6/07 17:00,Major,11,Windows XP,wireshark-bugs,nick.lewis,10/31/07 15:57,2007-11-06 09:25:47 UTC,nick.lewis
1967,GTK+ UI,RESOLVED,NOTABUG,Not able to add to Protocol or Information column from a plugin,11/27/08 19:36,Normal,9,Windows XP,wireshark-bugs,fschorr,10/31/07 18:51,2008-11-27 19:36:31 UTC,stephenfisher
1968,GTK+ UI,RESOLVED,FIXED,New dissector proposed: WakeOnLAN,11/6/07 5:30,Enhancement,2,All,wireshark-bugs,Christopher.Maynard,11/1/07 14:43,2007-11-06 05:30:24 UTC,stephenfisher
1969,GTK+ UI,RESOLVED,DUPLICATE,plugin IPMB protocol with GPL version 2 and tool use to capturing packet from i2c bus,11/1/07 18:28,Major,2,Linux (other),wireshark-bugs,chanthy.toeung,11/1/07 17:36,2007-11-01 18:28:01 UTC,jeff.morriss.ws
1970,GTK+ UI,RESOLVED,NOTOURBUG,review_for_checkin : plugins IPMB protocol with GPL version 2,9/26/08 7:25,Major,58,Linux (other),wireshark-bugs,chanthy.toeung,11/1/07 18:00,2008-09-26 07:25:31 UTC,anders.broman
1971,GTK+ UI,RESOLVED,NOTABUG,UI very slow,1/30/08 17:06,Major,10,Windows XP,wireshark-bugs,gregyfun,11/4/07 19:22,2008-01-30 17:06:53 UTC,gregyfun
1972,Capture file support (libwiretap),RESOLVED,FIXED,Fail to load I4B traces,5/17/13 0:32,Major,6,All,bugzilla-admin,mantovani,11/5/07 11:31,2007-11-05 20:46:05 UTC,guy
1973,GTK+ UI,RESOLVED,FIXED,ISDN filters for direction,11/21/07 16:49,Enhancement,13,Windows 2000,wireshark-bugs,mantovani,11/5/07 11:46,2007-11-16 11:47:01 UTC,martin.r.mathieson
1974,GTK+ UI,RESOLVED,FIXED,Some enhancement for wimaxasncp,11/17/07 16:17,Major,11,Linux (other),wireshark-bugs,cwen01390,11/5/07 15:56,2007-11-17 16:17:31 UTC,martin.r.mathieson
1975,Dissection engine (libwireshark),RESOLVED,FIXED,CFM dissector bugfixes and code update for ITU inclusion,9/11/14 17:21,Major,4,Windows XP,wireshark-bugs,maulkin,11/6/07 3:39,2007-11-06 19:48:04 UTC,wmeier
1976,GTK+ UI,RESOLVED,FIXED,"""DISSECTOR_ASSERT_NOT_REACHED"" failures in packet-ber.c from LDAP",12/6/07 11:25,Normal,6,Mac OS X 10.5,wireshark-bugs,guy,11/6/07 4:33,2007-12-06 11:25:05 UTC,tomas.kukosa
1977,GTK+ UI,RESOLVED,FIXED,airpdcap.c: In function `parse_key_string',11/8/07 23:05,Normal,2,Linux (other),wireshark-bugs,gagan.82,11/8/07 22:41,2007-11-08 23:05:40 UTC,jeff.morriss.ws
1978,GTK+ UI,RESOLVED,NOTABUG,"Interface drop down in ""Capture Options"" not displaying user readable names",12/2/08 10:36,Normal,9,Windows Vista,wireshark-bugs,avi.weiss,11/8/07 23:05,2008-12-02 10:36:30 UTC,stephenfisher
1979,GTK+ UI,RESOLVED,DUPLICATE,When editing a coloring-rule  the filter-name text color stays black,11/10/07 14:33,Minor,2,Linux (other),wireshark-bugs,sake,11/10/07 12:15,2007-11-10 14:33:35 UTC,sake
1980,GTK+ UI,RESOLVED,DUPLICATE,X Window crash on Mac OS X 10.5,11/12/07 18:26,Major,4,Mac OS X 10.5,wireshark-bugs,tiennou7,11/12/07 9:30,2007-11-12 18:26:34 UTC,guy
1981,GTK+ UI,VERIFIED,FIXED,Updated dissector for LINX protocols.,11/14/07 11:34,Major,3,All,wireshark-bugs,dejan.bucar,11/13/07 14:26,2007-11-13 22:06:14 UTC,dejan.bucar
1982,GTK+ UI,RESOLVED,FIXED,ASN Patch for TCAP DialoguePortion decoding,11/13/07 22:01,Normal,4,All,wireshark-bugs,florent.drouin,11/13/07 14:29,2007-11-13 22:01:19 UTC,anders.broman
1983,Extras,RESOLVED,FIXED,Editcap crash during fuzztest,11/20/07 7:43,Normal,4,Linux (other),wireshark-bugs,florent.drouin,11/13/07 14:50,2007-11-20 07:43:43 UTC,florent.drouin
1984,GTK+ UI,RESOLVED,FIXED,Endian error in 802.11e QBSS IE dissector,11/27/07 1:03,Normal,4,All,wireshark-bugs,maattanen,11/13/07 17:35,2007-11-27 01:03:03 UTC,gerald
1985,GTK+ UI,VERIFIED,FIXED,"A bug in calculating the ""Avg. packet size"" shown in  Wireshark->Summary: Traffic: Avg. packet size",11/18/07 14:50,Trivial,4,All,wireshark-bugs,smhuang,11/14/07 6:28,2007-11-18 14:49:58 UTC,smhuang
1986,GTK+ UI,RESOLVED,FIXED,Open Capture File dialog non-functional on error,1/26/08 16:51,Normal,2,Mac OS X 10.4,wireshark-bugs,stig,11/14/07 9:56,2008-01-26 16:51:30 UTC,stig
1987,GTK+ UI,RESOLVED,FIXED,Cannot specify capture file with non-ASCII path,11/27/07 8:30,Normal,5,Windows XP,wireshark-bugs,igtorque,11/14/07 10:20,2007-11-26 16:41:47 UTC,jeff.morriss.ws
1988,GTK+ UI,RESOLVED,NOTOURBUG,IBM Access Connections unable to access wireless network after Wireshark has been installed and the laptop rebooted,11/17/07 17:28,Major,2,Windows XP,wireshark-bugs,scott.fella,11/14/07 11:51,2007-11-17 17:28:33 UTC,sake
1989,GTK+ UI,RESOLVED,FIXED,Don't stop dissection at malformed ASN.1 BER CHOICE of zero length,11/23/07 12:29,Enhancement,8,All,wireshark-bugs,wireshark,11/14/07 14:12,2007-11-19 17:48:08 UTC,stig
1990,GTK+ UI,RESOLVED,FIXED,Wireshark incorectly dissect nfsv4 open under delegation,11/24/07 22:46,Major,5,All,wireshark-bugs,Alex.Burlyga,11/15/07 7:45,2007-11-24 22:46:47 UTC,stig
1991,GTK+ UI,RESOLVED,FIXED,Support of multiple port for protocol,11/15/07 11:41,Enhancement,2,Windows 2000,wireshark-bugs,Laurent.Knoepfli,11/15/07 10:07,2007-11-15 11:41:08 UTC,anders.broman
1992,GTK+ UI,RESOLVED,NOTABUG,Packets lost in Wireshark on Virtual VPN interface.,11/16/07 23:03,Major,2,Windows XP,wireshark-bugs,billbarasch,11/15/07 11:16,2007-11-16 23:03:27 UTC,jaap.keuter
1993,GTK+ UI,RESOLVED,FIXED,Small suggested changes to etsie2e4.xml,11/16/07 8:23,Trivial,4,All,wireshark-bugs,martin.gignac,11/15/07 13:57,2007-11-16 08:23:20 UTC,anders.broman
1994,GTK+ UI,RESOLVED,FIXED,Bugfix for CFM dissector: Sender ID TLV,11/21/07 20:35,Major,5,Windows XP,wireshark-bugs,maulkin,11/17/07 18:14,2007-11-21 20:34:36 UTC,sake
1995,GTK+ UI,RESOLVED,FIXED,Add support for dissection NFSv4.1,7/30/08 5:09,Enhancement,6,Linux (other),wireshark-bugs,bfields,11/19/07 15:46,2008-07-30 05:09:26 UTC,anders.broman
1996,GTK+ UI,RESOLVED,FIXED,Windows uninstall error,11/20/07 17:08,Minor,3,Windows XP,wireshark-bugs,jeff.morriss.ws,11/19/07 16:05,2007-11-20 17:08:56 UTC,jeff.morriss.ws
1997,GTK+ UI,RESOLVED,FIXED,[PATCH] NHRP dissector improvements,11/25/07 18:16,Normal,5,All,wireshark-bugs,timo.teras,11/20/07 8:28,2007-11-25 18:16:44 UTC,sake
1998,GTK+ UI,RESOLVED,FIXED,Missing bounds check in packet-portmap.c can cause segv,7/30/08 5:11,Major,13,Linux (other),wireshark-bugs,wireshark-bugs,11/20/07 10:49,2008-07-30 05:11:17 UTC,anders.broman
1999,GTK+ UI,RESOLVED,FIXED,Patch: Wifi Protected Setup Dissector Support,11/29/07 17:26,Enhancement,10,All,wireshark-bugs,jensb,11/20/07 10:52,2007-11-29 17:26:40 UTC,stig
2000,GTK+ UI,RESOLVED,FIXED,RTP Stream Analysis - Save Payload error with .enc files from Cisco NAM,11/27/07 6:50,Normal,9,Windows XP,wireshark-bugs,carl,11/20/07 14:38,2007-11-27 06:50:21 UTC,jaap.keuter
2001,TShark,RESOLVED,FIXED,Buildbot crash output: fuzz-2007-11-20-7185.pcap,11/21/07 17:01,Critical,2,Linux (other),wireshark-bugs,buildbot-do-not-reply,11/21/07 6:10,2007-11-21 17:01:18 UTC,gerald
2002,GTK+ UI,RESOLVED,FIXED,Add ability to make any field a column,5/10/08 18:01,Enhancement,5,All,wireshark-bugs,richa.khanna,11/21/07 13:11,2008-05-10 18:01:30 UTC,stephenfisher
2003,Extras,RESOLVED,FIXED,dumpcap does not cleanly close capture file,11/21/07 22:51,Major,2,FreeBSD,wireshark-bugs,mkucenski,11/21/07 14:32,2007-11-21 22:51:08 UTC,guy
2004,GTK+ UI,RESOLVED,NOTABUG,Wireshark doesn't understand IPv6 addrs in /etc/resolv.conf,1/9/08 17:26,Enhancement,8,Linux (other),wireshark-bugs,rvokal,11/21/07 16:27,2007-11-24 13:38:25 UTC,gerald
2005,GTK+ UI,RESOLVED,FIXED,Visual Network format KO in Wireshark  OK in Ethereal 0.10.14.,11/24/07 23:44,Major,8,All,wireshark-bugs,mantovani,11/21/07 16:37,2007-11-24 23:44:03 UTC,guy
2006,GTK+ UI,RESOLVED,FIXED,SCCP associations treat UDT as having DLR=SLR=0,11/24/07 15:38,Normal,3,Windows XP,wireshark-bugs,Neil,11/21/07 16:53,2007-11-24 15:38:56 UTC,jeff.morriss.ws
2007,TShark,RESOLVED,FIXED,Buildbot crash output: fuzz-2007-11-21-10148.pcap,11/23/07 21:48,Critical,2,Linux (other),wireshark-bugs,buildbot-do-not-reply,11/22/07 8:30,2007-11-23 21:48:02 UTC,gerald
2008,GTK+ UI,VERIFIED,FIXED,"Improvement for ""choice with length==0""",11/23/07 12:54,Minor,7,Linux (other),wireshark-bugs,florent.drouin,11/22/07 15:01,2007-11-23 12:23:15 UTC,florent.drouin
2009,GTK+ UI,RESOLVED,FIXED,Very long SIP header truncated,3/9/08 14:50,Major,6,Linux (other),wireshark-bugs,unicorn,11/22/07 15:41,2008-03-09 14:50:53 UTC,jeff.morriss.ws
2010,GTK+ UI,RESOLVED,FIXED,Wireshark doesn't start when LC_ALL is set to tr_TR,11/27/07 22:40,Major,11,Linux (other),wireshark-bugs,ismail,11/23/07 4:47,2007-11-27 19:00:35 UTC,guy
2011,GTK+ UI,RESOLVED,FIXED,RANAP dissector (via SSN) not called,11/24/07 15:44,Minor,4,Linux (other),wireshark-bugs,florent.drouin,11/23/07 7:09,2007-11-24 15:44:20 UTC,jeff.morriss.ws
2012,GTK+ UI,RESOLVED,FIXED,crash in emem.c 915  fuzz-2007-11-21-16867.pcap,11/23/07 23:32,Major,3,Linux (other),wireshark-bugs,florent.drouin,11/23/07 7:32,2007-11-23 23:32:06 UTC,gerald
2013,GTK+ UI,RESOLVED,NOTABUG,Crash in packet-usb-masstorage.c:261 fuzz-2007-11-16-18765.pcap,11/26/07 9:21,Major,4,Linux (other),wireshark-bugs,florent.drouin,11/23/07 7:56,2007-11-26 09:21:54 UTC,florent.drouin
2014,GTK+ UI,RESOLVED,FIXED,crash at packet-sctp.c:2288 fuzz-2007-11-23-31074.pcap,11/24/07 17:57,Major,3,Linux (other),wireshark-bugs,florent.drouin,11/23/07 8:09,2007-11-24 17:57:39 UTC,jeff.morriss.ws
2015,GTK+ UI,RESOLVED,FIXED,Crash if a Cancelled action in preferences is applied,11/26/07 18:04,Major,6,Linux (other),wireshark-bugs,florent.drouin,11/23/07 8:56,2007-11-26 18:04:46 UTC,jeff.morriss.ws
2016,GTK+ UI,RESOLVED,FIXED,Patches/enhancements to support SITA libpcap and new airline protocol dissectors,12/20/07 13:44,Major,11,Linux (other),wireshark-bugs,fulko.hew,11/23/07 16:32,2007-12-16 14:25:48 UTC,stig
2018,Qt UI,CONFIRMED, ---,UDP stream graph,6/22/16 2:50,Enhancement,1,Windows XP,wireshark-bugs,duvi,11/24/07 10:19,,mmann78
2019,TShark,RESOLVED,FIXED,Buildbot crash output: fuzz-2007-11-25-29727.pcap,11/25/07 23:10,Critical,2,Linux (other),wireshark-bugs,buildbot-do-not-reply,11/25/07 21:00,2007-11-25 23:10:57 UTC,gerald
2020,GTK+ UI,RESOLVED,FIXED,"Crash wireshark if ""Colorize Conversation"" feature attempted with no open trace file",11/27/07 2:14,Major,4,Windows XP,wireshark-bugs,jyoung,11/26/07 2:50,2007-11-27 02:14:29 UTC,jyoung
2021,GTK+ UI,RESOLVED,FIXED,Crash at packet-usb-masstorage.c:357 fuzz-2007-11-20-9547.pcap.gz,11/27/07 7:58,Major,5,Linux (other),wireshark-bugs,florent.drouin,11/26/07 9:33,2007-11-27 07:58:17 UTC,florent.drouin
2022,GTK+ UI,RESOLVED,FIXED,Crash when editing SNMP preferences,1/22/08 10:53,Major,6,Linux (other),wireshark-bugs,florent.drouin,11/26/07 10:34,2008-01-22 10:53:30 UTC,florent.drouin
2023,GTK+ UI,RESOLVED,FIXED,Dissect the PRINTER_INFO structure on SpoolssEnumPrinters,11/26/07 16:39,Enhancement,6,Linux (other),wireshark-bugs,kai,11/26/07 12:34,2007-11-26 16:38:31 UTC,stig
2024,GTK+ UI,RESOLVED,FIXED,Fix disector not able to show partial FIX messages,1/9/10 7:08,Major,5,FreeBSD,wireshark-bugs,mayank,11/26/07 12:50,2010-01-01 18:50:48 UTC,wmeier
2025,GTK+ UI,RESOLVED,NOTABUG,No NIC recognized in an IBM Laptop,12/18/07 16:11,Major,5,Windows XP,wireshark-bugs,martin.guti,11/26/07 15:20,2007-12-18 16:11:54 UTC,jeff.morriss.ws
2026,GTK+ UI,RESOLVED,FIXED,subdissection capabilites for RTP header extension,1/6/08 11:50,Major,6,Windows XP,wireshark-bugs,t_travi,11/26/07 17:23,2008-01-06 11:50:02 UTC,jaap.keuter
2027,GTK+ UI,VERIFIED,FIXED,Bad Diameter dictionary can cause a crash,11/27/07 1:43,Major,2,All,guy,guy,11/27/07 1:38,2007-11-27 01:42:04 UTC,guy
2028,GTK+ UI,RESOLVED,FIXED,Infinite loop in packet_sctp.c,11/27/07 18:35,Major,3,Linux (other),wireshark-bugs,florent.drouin,11/27/07 8:34,2007-11-27 18:27:37 UTC,jeff.morriss.ws
2029,GTK+ UI,RESOLVED,FIXED,tvb_get_ephemeral_stringz not exported from libwireshark.dll,11/27/07 11:21,Minor,2,Windows XP,wireshark-bugs,bert.broekhuizen,11/27/07 11:08,2007-11-27 11:21:39 UTC,stig
2030,GTK+ UI,RESOLVED,NOTOURBUG,Add savng to PDML format to the Save As... dialog,11/28/07 9:09,Enhancement,3,Windows XP,wireshark-bugs,taleinat,11/27/07 14:12,2007-11-27 18:13:48 UTC,ulf.lamping
2031,Qt UI,CONFIRMED, ---,Add a new view - time graph,6/22/16 2:50,Enhancement,3,Windows XP,wireshark-bugs,taleinat,11/27/07 14:20,,mmann78
2032,GTK+ UI,RESOLVED,FIXED,Unable to double click an FT_FRAME element in Packet Details,11/28/07 12:31,Normal,3,Mac OS X 10.4,wireshark-bugs,stig,11/27/07 15:33,2007-11-28 12:31:44 UTC,stig
2033,GTK+ UI,RESOLVED,DUPLICATE,reinstall after reboot,11/27/07 21:25,Major,2,Windows Vista,wireshark-bugs,dsherman,11/27/07 21:11,2007-11-27 21:25:09 UTC,gerald
2034,GTK+ UI,RESOLVED,FIXED,CFM Packet Decoder Bugs,11/28/07 19:01,Normal,3,Windows XP,wireshark-bugs,briana,11/27/07 21:34,2007-11-28 19:01:34 UTC,jaap.keuter
2035,GTK+ UI,RESOLVED,FIXED,infinite loop in packet-atalk.c,11/28/07 9:30,Normal,3,All,wireshark-bugs,did447,11/28/07 2:19,2007-11-28 09:30:49 UTC,stig
2036,GTK+ UI,RESOLVED,NOTABUG,How to make Wireshark resolve DNS names only using hosts file,11/28/07 8:53,Normal,2,Windows XP,wireshark-bugs,findkobel,11/28/07 8:27,2007-11-28 08:53:11 UTC,ulf.lamping
2037,GTK+ UI,RESOLVED,NOTABUG,Bad use of the C fwrite function in pcapio.c,11/28/07 20:16,Normal,3,Linux (other),wireshark-bugs,daniel-jamet,11/28/07 14:39,2007-11-28 15:40:45 UTC,wmeier
2038,GTK+ UI,RESOLVED,FIXED,Marked packages does not get colorized,11/28/07 18:02,Minor,2,All,wireshark-bugs,stig,11/28/07 16:30,2007-11-28 18:02:40 UTC,sake
2039,TShark,CONFIRMED, ---,Triggered Capture,8/15/16 11:32,Enhancement,12,All,wireshark-bugs,wireshark,11/28/07 20:52,,jfs.world+wiresharkbugzilla
2040,GTK+ UI,RESOLVED,FIXED,Optimisation - Fix up goto at compilation time in gencode.c,11/28/07 22:38,Enhancement,3,Windows XP,wireshark-bugs,anders.broman,11/28/07 21:52,2007-11-28 22:38:44 UTC,wmeier
2041,GTK+ UI,RESOLVED,FIXED,Optimisation - dfvm.c The loop is done twice  remove one.,11/28/07 22:18,Enhancement,3,Windows XP,wireshark-bugs,anders.broman,11/28/07 21:59,2007-11-28 22:18:38 UTC,wmeier
2042,GTK+ UI,RESOLVED,FIXED,Optimisation - Move constants initialisation at compile time. dfilter.c,11/28/07 22:45,Enhancement,3,Windows XP,wireshark-bugs,anders.broman,11/28/07 22:04,2007-11-28 22:45:49 UTC,wmeier
2043,GTK+ UI,RESOLVED,FIXED,Error in subset refcounting.  tvbuff.c,12/22/11 6:38,Enhancement,6,All,wireshark-bugs,anders.broman,11/28/07 22:08,2011-12-22 06:38:15 UTC,wmeier
2044,GTK+ UI,RESOLVED,FIXED,Bug when dissecting nfsv4 GETATTR with fs_locations attribute,12/18/07 22:42,Major,7,Linux (other),wireshark-bugs,Alex.Burlyga,11/28/07 22:37,2007-12-18 22:42:01 UTC,jaap.keuter
2045,GTK+ UI,RESOLVED,FIXED,Don't set data_source if the tree is not visible  in this case it's never used,8/19/09 2:21,Enhancement,5,Windows XP,wireshark-bugs,anders.broman,11/29/07 6:09,2009-08-19 02:21:31 UTC,dgautheron
2046,GTK+ UI,RESOLVED,NOTABUG,Don't use reference counting for interesting fields  only set/unset. It's not used.,7/21/09 8:29,Enhancement,3,Windows XP,wireshark-bugs,anders.broman,11/29/07 6:16,2009-07-21 08:29:30 UTC,dgautheron
2047,Dissection engine (libwireshark),RESOLVED,WONTFIX,create edt once,7/30/14 20:16,Enhancement,5,All,bugzilla-admin,anders.broman,11/29/07 6:25,2014-07-30 20:16:43 UTC,guy
2048,GTK+ UI,RESOLVED,FIXED,Enhancements to IPMI dissector,8/7/08 12:34,Enhancement,16,Linux (other),wireshark-bugs,avn,11/29/07 13:52,2008-08-07 12:34:07 UTC,anders.broman
2049,GTK+ UI,RESOLVED,NOTABUG,Does not display WWAN modem in list of interfaces - even when running as Administrator,11/30/07 23:32,Major,2,Windows Vista,wireshark-bugs,dtrahand,11/29/07 20:10,2007-11-30 23:32:23 UTC,stephenfisher
2050,Dissection engine (libwireshark),RESOLVED,NOTABUG,Duplicate display filter fields with SVN22825 of packet-bfd.c,7/30/14 20:35,Normal,7,All,bugzilla-admin,Christopher.Maynard,11/29/07 21:45,2014-07-30 20:26:32 UTC,guy
2051,GTK+ UI,RESOLVED,FIXED,Crash in packet_ansi_a.c (bsap),12/3/07 22:49,Major,13,Linux (other),wireshark-bugs,florent.drouin,11/30/07 14:01,2007-12-03 21:48:22 UTC,guy
2052,GTK+ UI,RESOLVED,FIXED,infinite loop in packet-rpl.c,11/30/07 15:56,Major,4,Linux (other),wireshark-bugs,florent.drouin,11/30/07 14:08,2007-11-30 15:56:33 UTC,stig
2053,GTK+ UI,RESOLVED,WORKSFORME,non systematic crash after applying new preferences,8/12/12 16:49,Major,34,Red Hat,wireshark-bugs,florent.drouin,11/30/07 14:30,2012-08-12 16:49:13 UTC,eapache
2054,GTK+ UI,RESOLVED,FIXED,RTT values (tcp.analysis.ack_rtt) not accurate in advanced io graph,1/14/10 23:09,Normal,8,Windows XP,wireshark-bugs,ed.staszko,11/30/07 21:03,2010-01-14 23:07:58 UTC,anders.broman
2055,GTK+ UI,RESOLVED,FIXED,V0.99.7 Pre 2 problem - File Save Not Working Correctly,12/12/07 18:30,Major,23,Windows XP,wireshark-bugs,keithfrench,12/1/07 16:02,2007-12-12 18:30:35 UTC,gerald
2056,GTK+ UI,RESOLVED,NOTABUG,Problems sniffing on DOCSIS packets,12/2/07 23:20,Trivial,6,Windows XP,wireshark-bugs,admin2,12/1/07 16:43,2007-12-02 22:04:34 UTC,guy
2057,GTK+ UI,RESOLVED,FIXED,ansi_map -> pstn parameter,1/16/08 16:40,Major,12,All,wireshark-bugs,shmulik.bezalel,12/2/07 11:30,2008-01-16 16:40:20 UTC,anders.broman
2058,GTK+ UI,RESOLVED,FIXED,ansi map - origination request result,12/3/07 22:12,Major,4,All,wireshark-bugs,shmulik.bezalel,12/2/07 11:34,2007-12-03 22:12:23 UTC,anders.broman
2059,GTK+ UI,RESOLVED,FIXED,XUDTS are not reassembled,12/3/07 18:12,Major,4,All,wireshark-bugs,shmulik.bezalel,12/2/07 12:05,2007-12-03 18:12:59 UTC,jeff.morriss.ws
2060,GTK+ UI,RESOLVED,FIXED,wireshark complains about misssing interfaces at the command line,5/19/10 7:05,Trivial,5,Linux (other),wireshark-bugs,toralf.foerster,12/2/07 12:19,2010-05-19 07:05:38 UTC,jeff.morriss.ws
2061,GTK+ UI,RESOLVED,FIXED,packet-camel.c connect destination routing address,12/4/07 12:12,Major,3,All,wireshark-bugs,shmulik.bezalel,12/2/07 12:25,2007-12-04 12:12:34 UTC,shmulik.bezalel
2062,GTK+ UI,RESOLVED,FIXED,SNMP (libsmi) register_mibs() related crash,12/11/07 21:22,Major,6,OpenBSD,wireshark-bugs,nikns,12/2/07 12:40,2007-12-11 21:22:23 UTC,gerald
2063,GTK+ UI,RESOLVED,FIXED,non-ANSI COO/COA are not dissected correctly (malformed packet),12/3/07 17:51,Major,6,All,wireshark-bugs,shmulik.bezalel,12/2/07 13:55,2007-12-03 17:34:24 UTC,jeff.morriss.ws
2064,GTK+ UI,RESOLVED,FIXED,GSM_MAP decodes SendRoutingInfov2 incorrectly,12/5/07 21:59,Major,11,All,wireshark-bugs,shmulik.bezalel,12/2/07 15:35,2007-12-05 21:59:46 UTC,anders.broman
2065,GTK+ UI,RESOLVED,FIXED,configure warnings_as_errors_default fix,12/2/07 20:25,Trivial,2,Linux (other),wireshark-bugs,nikns,12/2/07 16:39,2007-12-02 20:25:44 UTC,guy
2066,GTK+ UI,RESOLVED,FIXED,Crash after using any Wireshark Combo Box (gtk_combo),1/29/08 17:51,Blocker,19,Windows XP,wireshark-bugs,wmeier,12/2/07 17:25,2008-01-29 17:51:54 UTC,wmeier
2067,Extras,RESOLVED,FIXED,"mergecap fails when ""time_t"" is ""int""",12/5/07 10:41,Minor,5,OpenBSD,wireshark-bugs,nikns,12/2/07 21:19,2007-12-05 10:41:53 UTC,guy
2068,GTK+ UI,RESOLVED,FIXED,Crash when newly added display filter macro is first used,12/29/07 9:14,Major,4,All,wireshark-bugs,jyoung,12/3/07 12:24,2007-12-29 09:14:56 UTC,sake
2069,GTK+ UI,RESOLVED,FIXED,H323 VoIP call  alias setting  mobileUIM aliases decode wrongly,12/28/07 10:45,Major,12,Windows XP,wireshark-bugs,obasol,12/3/07 12:25,2007-12-28 10:45:56 UTC,tomas.kukosa
2070,GTK+ UI,RESOLVED,FIXED,Inability to read local dfilter_macros file in one exists in datadir,12/16/07 13:18,Normal,3,All,wireshark-bugs,jyoung,12/4/07 6:21,2007-12-16 13:18:26 UTC,stig
2071,GTK+ UI,RESOLVED,DUPLICATE,Problem with DTLS packets,12/5/07 6:50,Major,4,Linux (other),wireshark-bugs,martin.vladic,12/4/07 21:54,2007-12-05 06:50:31 UTC,jaap.keuter
2072,TShark,RESOLVED,FIXED,Buildbot crash output: fuzz-2007-12-05-9158.pcap,12/6/07 20:33,Critical,8,Linux (other),wireshark-bugs,buildbot-do-not-reply,12/5/07 12:40,2007-12-06 20:33:14 UTC,jeff.morriss.ws
2073,GTK+ UI,RESOLVED,FIXED,Install Uses White Text That's Impossible To See,12/9/07 6:07,Critical,4,Windows 2000,wireshark-bugs,BGGaudreault,12/5/07 17:52,2007-12-09 06:07:09 UTC,BGGaudreault
2074,GTK+ UI,RESOLVED,FIXED,new protocol dissector for the protocol FF-HSE,1/15/08 7:28,Major,16,FreeBSD,wireshark-bugs,Yukiyo.Akisada,12/6/07 1:33,2008-01-11 07:30:14 UTC,jaap.keuter
2075,GTK+ UI,RESOLVED,FIXED,Force adns rebuild for msvcrt compatibility,7/24/08 0:20,Enhancement,11,Windows XP,wireshark-bugs,graham.bloice,12/6/07 15:52,2008-04-13 14:42:40 UTC,pascal.quantin
2076,GTK+ UI,RESOLVED,FIXED,Please add support for the CliqueRM protocol,7/18/12 13:13,Enhancement,13,Linux (other),wireshark-bugs,sjoerd,12/7/07 12:53,2012-07-18 13:13:51 UTC,mmann78
2077,GTK+ UI,RESOLVED,FIXED,configuring with --with-plugins not behaving like documented,12/7/07 17:31,Major,3,Linux (other),wireshark-bugs,sjoerd,12/7/07 16:25,2007-12-07 17:31:45 UTC,wmeier
2078,Dissection engine (libwireshark),RESOLVED,FIXED,New dissector for RTMP(T) protocol,11/16/12 14:14,Enhancement,5,All,wireshark-bugs,metatechbe,12/8/07 7:12,2007-12-17 20:43:58 UTC,guy
2079,GTK+ UI,RESOLVED,FIXED,"packet-usb.c:1003: failed assertion ""DISSECTOR_ASSERT_NOT_REACHED""",12/9/07 10:59,Normal,4,Linux (other),wireshark-bugs,nm127,12/8/07 20:55,2007-12-09 10:59:45 UTC,jaap.keuter
2080,GTK+ UI,RESOLVED,FIXED,"2d save of ""Save As foo.pcap"" ""Save As foo.pcap"" sequence fails",6/16/14 23:05,Minor,5,Windows XP,wireshark-bugs,wmeier,12/8/07 22:01,2014-06-16 23:05:12 UTC,jmayer
2081,GTK+ UI,RESOLVED,NOTOURBUG,Support for USB Audio class 1.0,2/5/12 6:59,Enhancement,10,Linux (other),wireshark-bugs,nm127,12/9/07 17:31,2012-02-05 06:59:41 UTC,anders.broman
2082,GTK+ UI,RESOLVED,FIXED,wireshark freezes when reading from pipe,4/8/10 18:47,Major,7,Linux (other),wireshark-bugs,lucas,12/9/07 18:56,2010-04-08 18:47:37 UTC,jeff.morriss.ws
2083,GTK+ UI,RESOLVED,FIXED,Packet list is incomplete until another packet is captured,1/30/08 14:50,Major,11,Linux (other),wireshark-bugs,trelliot,12/10/07 1:42,2008-01-30 14:50:12 UTC,jeff.morriss.ws
2084,GTK+ UI,RESOLVED,FIXED,dissector for Distributed Lock Protocol version 3,12/11/07 6:36,Major,8,Linux (other),wireshark-bugs,jet,12/10/07 6:28,2007-12-11 06:36:02 UTC,jaap.keuter
2085,Documentation,RESOLVED,FIXED,typo fixed in ReadMe.Developer,12/10/07 9:22,Trivial,3,All,wireshark-bugs,mspeck,12/10/07 8:56,2007-12-10 09:22:56 UTC,stig
2086,GTK+ UI,RESOLVED,NOTABUG,packet DSI use 16 bytes for the fixed length,12/10/07 19:33,Normal,7,All,wireshark-bugs,did447,12/10/07 11:13,2007-12-10 19:33:22 UTC,did447
2087,GTK+ UI,RESOLVED,DUPLICATE,Recent Windows Buildbot versions crash when Capture Interface is changed,12/11/07 1:47,Major,2,Windows XP,wireshark-bugs,jyoung,12/11/07 0:43,2007-12-11 01:47:00 UTC,wmeier
2088,Dissection engine (libwireshark),RESOLVED,FIXED,Patch to packet-vlan.c to add summary info to protocol tree,1/24/17 21:35,Normal,3,All,wireshark-bugs,jyoung,12/11/07 5:22,2007-12-11 07:43:28 UTC,guy
2089,Dissection engine (libwireshark),RESOLVED,FIXED,Win32 compilation fails if NETTLE_DIR is defined,6/18/14 18:06,Major,10,Windows XP,bugzilla-admin,mykaul,12/11/07 8:45,2014-06-18 18:06:57 UTC,pascal.quantin
2090,GTK+ UI,RESOLVED,FIXED,X25 dissector should not assume COTP when no other info,3/16/08 10:20,Minor,7,All,wireshark-bugs,gerhard.nospam,12/11/07 10:41,2008-03-16 10:20:26 UTC,jaap.keuter
2091,GTK+ UI,RESOLVED,FIXED,X25 reassembly when presenting out of order packets,5/4/08 23:25,Normal,12,All,wireshark-bugs,gerhard.nospam,12/11/07 11:30,2008-05-04 23:25:28 UTC,anders.broman
2092,Documentation,RESOLVED,FIXED,small typos in the example code in doc/README.developer,12/11/07 18:40,Normal,3,Linux (other),wireshark-bugs,nm127,12/11/07 18:18,2007-12-11 18:40:28 UTC,stig
2093,GTK+ UI,RESOLVED,DUPLICATE,X11 Error with no device found,12/11/07 22:00,Major,3,Mac OS X 10.5,wireshark-bugs,dave.brooks,12/11/07 20:51,2007-12-11 21:37:25 UTC,gerald
2094,GTK+ UI,RESOLVED,FIXED,New eDOCSIS suboptions in DHCP Oprion 43,12/14/07 20:14,Enhancement,3,All,wireshark-bugs,zbigniew.kopek,12/11/07 21:54,2007-12-14 20:14:52 UTC,jaap.keuter
2095,GTK+ UI,RESOLVED,FIXED,no USB packet captured,12/14/07 18:57,Major,15,Linux (other),wireshark-bugs,nm127,12/12/07 6:06,2007-12-14 18:57:23 UTC,nm127
2096,GTK+ UI,RESOLVED,WORKSFORME,gdk error - cannot launch Wireshark,12/12/07 15:04,Major,3,Windows XP,wireshark-bugs,silvertip257,12/12/07 14:16,2007-12-12 15:01:09 UTC,silvertip257
2098,GTK+ UI,RESOLVED,FIXED,Unistim:  possible infinite loop,12/13/07 8:03,Normal,3,Linux (other),wireshark-bugs,jmayer,12/13/07 0:22,2007-12-13 08:03:36 UTC,jaap.keuter
2099,GTK+ UI,RESOLVED,FIXED,Crash and duplicate entries in the packet list.,10/2/10 9:58,Normal,5,Mac OS X 10.4,wireshark-bugs,stig,12/13/07 13:27,2010-10-02 09:58:18 UTC,stig
2100,GTK+ UI,RESOLVED,FIXED,Crash on closing Wireshark Version 0.99.8-SVN-23853,2/19/08 4:06,Critical,8,Windows XP,wireshark-bugs,keithfrench,12/13/07 14:34,2008-02-19 04:06:47 UTC,wmeier
2101,GTK+ UI,RESOLVED,FIXED,editcap broken,1/12/08 18:32,Major,3,All,wireshark-bugs,jingshao,12/13/07 16:48,2008-01-12 18:32:28 UTC,sake
2102,GTK+ UI,VERIFIED,NOTABUG,BUG in decode TBCP Talk Burst Acknowledgement message,5/22/08 20:18,Major,9,Windows XP,wireshark-bugs,kkkboy,12/14/07 8:49,2008-03-03 20:36:12 UTC,kkkboy
2103,GTK+ UI,RESOLVED,FIXED,tcp_dissect_pdus will not req one_more_segm when tvb<fixed_len,7/30/08 5:23,Major,17,All,wireshark-bugs,gerhard.nospam,12/14/07 12:59,2008-07-30 05:23:43 UTC,anders.broman
2104,GTK+ UI,RESOLVED,FIXED,[PATCH] Adding heuristic dissector to ethernet trailers,12/16/07 0:36,Enhancement,3,All,wireshark-bugs,benn,12/14/07 22:16,2007-12-16 00:36:41 UTC,sake
2105,GTK+ UI,RESOLVED,FIXED,[PATCH] When capturing GRE interface  use GRE dissector table,12/16/07 21:04,Normal,5,All,wireshark-bugs,timo.teras,12/15/07 7:18,2007-12-16 21:04:55 UTC,stig
2106,GTK+ UI,RESOLVED,FIXED,Improve BT support by adding parsing on top of l2cap,11/5/12 6:47,Enhancement,19,Linux (other),andrei.emeltchenko.news,castet.matthieu,12/15/07 22:29,2012-11-05 06:47:37 UTC,anders.broman
2107,Dissection engine (libwireshark),RESOLVED,WORKSFORME,WPA Decrypt,7/7/16 5:45,Enhancement,2,Linux (other),bugzilla-admin,castet.matthieu,12/15/07 22:33,2016-07-07 05:45:27 UTC,alexis.lagoutte
2108,GTK+ UI,RESOLVED,FIXED,Clean up the Linux USB pseudoheader dissection,8/12/08 13:25,Enhancement,11,Linux (other),wireshark-bugs,nm127,12/16/07 8:49,2008-08-12 13:25:15 UTC,anders.broman
2109,GTK+ UI,RESOLVED,FIXED,Copy-paste error message typo at too short WTAP_ENCAP_USB_LINUX packet,12/16/07 13:02,Minor,3,Linux (other),nm127,nm127,12/16/07 12:04,2007-12-16 13:02:03 UTC,stig
2110,GTK+ UI,RESOLVED,FIXED,Can't add byte array to disected tree,12/17/07 9:01,Normal,3,Linux (other),wireshark-bugs,roadrunnerswife,12/17/07 8:40,2007-12-17 09:01:13 UTC,stig
2111,GTK+ UI,RESOLVED,FIXED,Packet incorrectly detected as SMPP,1/10/08 23:17,Major,8,Windows XP,wireshark-bugs,oder,12/17/07 13:53,2008-01-10 23:17:31 UTC,jeff.morriss.ws
2112,TShark,RESOLVED,FIXED,Buildbot crash output: fuzz-2007-12-17-25605.pcap,12/18/07 16:10,Critical,20,Linux (other),wireshark-bugs,buildbot-do-not-reply,12/17/07 15:50,2007-12-18 09:52:46 UTC,tomas.kukosa
2113,TShark,RESOLVED,DUPLICATE,Buildbot crash output: fuzz-2007-12-17-30092.pcap,12/18/07 9:53,Critical,4,Linux (other),wireshark-bugs,buildbot-do-not-reply,12/17/07 20:20,2007-12-18 09:53:48 UTC,tomas.kukosa
2114,TShark,RESOLVED,DUPLICATE,Buildbot crash output: fuzz-2007-12-17-5326.pcap,12/18/07 9:54,Critical,3,Linux (other),wireshark-bugs,buildbot-do-not-reply,12/17/07 20:50,2007-12-18 09:54:16 UTC,tomas.kukosa
2115,TShark,RESOLVED,DUPLICATE,Buildbot crash output: fuzz-2007-12-17-6822.pcap,12/18/07 9:54,Critical,4,Linux (other),wireshark-bugs,buildbot-do-not-reply,12/17/07 21:50,2007-12-18 09:54:47 UTC,tomas.kukosa
2116,GTK+ UI,RESOLVED,FIXED,Incorrect Malformed Packet Error in UCP Protocol,12/17/07 23:12,Major,3,All,wireshark-bugs,larry,12/17/07 21:56,2007-12-17 23:12:27 UTC,sake
2117,GTK+ UI,RESOLVED,FIXED,NSIS packaging build fails due to missing vcredist_x86.exe,12/21/07 5:48,Normal,3,Windows XP,wireshark-bugs,jcwren,12/17/07 22:32,2007-12-21 05:48:11 UTC,anders.broman
2118,TShark,RESOLVED,DUPLICATE,Buildbot crash output: fuzz-2007-12-17-23622.pcap,12/18/07 9:55,Critical,5,Linux (other),wireshark-bugs,buildbot-do-not-reply,12/18/07 0:00,2007-12-18 09:55:57 UTC,tomas.kukosa
2119,TShark,RESOLVED,DUPLICATE,Buildbot crash output: fuzz-2007-12-17-1333.pcap,12/18/07 16:02,Critical,4,Linux (other),wireshark-bugs,buildbot-do-not-reply,12/18/07 0:40,2007-12-18 16:02:31 UTC,jeff.morriss.ws
2120,TShark,RESOLVED,DUPLICATE,Buildbot crash output: fuzz-2007-12-17-5362.pcap,12/18/07 16:03,Critical,3,Linux (other),wireshark-bugs,buildbot-do-not-reply,12/18/07 1:50,2007-12-18 16:03:07 UTC,jeff.morriss.ws
2121,TShark,RESOLVED,DUPLICATE,Buildbot crash output: fuzz-2007-12-17-17357.pcap,12/18/07 16:07,Critical,4,Linux (other),wireshark-bugs,buildbot-do-not-reply,12/18/07 2:40,2007-12-18 16:07:35 UTC,jeff.morriss.ws
2122,TShark,RESOLVED,DUPLICATE,Buildbot crash output: fuzz-2007-12-18-26236.pcap,12/18/07 16:08,Critical,2,Linux (other),wireshark-bugs,buildbot-do-not-reply,12/18/07 9:00,2007-12-18 16:08:59 UTC,jeff.morriss.ws
2123,TShark,RESOLVED,DUPLICATE,Buildbot crash output: fuzz-2007-12-18-23538.pcap,12/18/07 16:09,Critical,2,Linux (other),wireshark-bugs,buildbot-do-not-reply,12/18/07 9:50,2007-12-18 16:09:42 UTC,jeff.morriss.ws
2124,TShark,RESOLVED,DUPLICATE,Buildbot crash output: fuzz-2007-12-18-19759.pcap,12/18/07 16:10,Critical,2,Linux (other),wireshark-bugs,buildbot-do-not-reply,12/18/07 10:31,2007-12-18 16:10:23 UTC,jeff.morriss.ws
2125,GTK+ UI,RESOLVED,FIXED,DCE RPC fragments are reassembled wrongly,2/6/12 11:48,Normal,6,Windows XP,wireshark-bugs,yamisoe,12/18/07 14:14,2012-02-06 11:48:24 UTC,anders.broman
2126,GTK+ UI,RESOLVED,FIXED,Wireshark 0.99.7 IO Graph Save can cause program to crash,1/20/08 23:19,Major,11,Windows XP,wireshark-bugs,keithfrench,12/19/07 12:00,2008-01-20 16:58:49 UTC,stig
2127,GTK+ UI,RESOLVED,FIXED,remove X-KDE-SubstituteUID=true from wireshark.desktop,12/20/07 14:00,Trivial,2,Linux (other),wireshark-bugs,pva,12/20/07 13:36,2007-12-20 14:00:29 UTC,stig
2128,GTK+ UI,RESOLVED,NOTABUG,802.11 fragments truncated with TKIP,8/19/08 14:32,Normal,3,Windows XP,wireshark-bugs,ctuffli,12/20/07 19:21,2008-08-19 14:32:00 UTC,anders.broman
2129,GTK+ UI,RESOLVED,FIXED,Stats tree for SMPP dissector,12/21/07 8:17,Enhancement,3,Windows XP,wireshark-bugs,sarkar.abhik,12/20/07 23:31,2007-12-21 08:17:17 UTC,jaap.keuter
2130,Documentation,RESOLVED,FIXED,Mistake in Readme.stats_tree,12/21/07 22:20,Minor,4,All,wireshark-bugs,sarkar.abhik,12/21/07 21:01,2007-12-21 21:58:41 UTC,stephenfisher
2131,Qt UI,CONFIRMED, ---,Allow in-memory circular capturing,6/22/16 2:50,Enhancement,3,Windows XP,wireshark-bugs,jay-wireshark,12/22/07 13:05,,mmann78
2132,Documentation,RESOLVED,FIXED,man pages refer to tcpdump(8) which isn't available on Windows,4/9/10 6:14,Normal,4,Windows XP,wireshark-bugs,jay-wireshark,12/22/07 14:11,2010-04-08 19:09:30 UTC,jeff.morriss.ws
2133,Documentation,RESOLVED,FIXED,Doc files use UNIX line endings on Windows,5/27/10 11:45,Minor,11,Windows XP,wireshark-bugs,jay-wireshark,12/22/07 14:14,2010-05-27 11:39:38 UTC,wmeier
2134,GTK+ UI,RESOLVED,FIXED,Add preliminary dissector for the network protocol used by Microsoft DirectPlay,12/29/07 5:41,Enhancement,6,Linux (other),wireshark-bugs,kai,12/23/07 13:29,2007-12-29 05:41:40 UTC,stephenfisher
2135,Dissection engine (libwireshark),RESOLVED,FIXED,Incorrectly assumed minimum length of UDHL in packet-gsm_sms.c,4/7/17 17:40,Minor,3,All,wireshark-bugs,sarkar.abhik,12/23/07 16:05,2007-12-24 11:16:40 UTC,guy
2136,TShark,RESOLVED,FIXED,Missing -z proto colinfo ip gtp.teid_cp and -z proto colinfo ip gtp.teid_data,1/7/08 21:05,Normal,2,Linux (other),wireshark-bugs,janvantonder,12/23/07 19:30,2008-01-07 21:05:52 UTC,anders.broman
2137,GTK+ UI,RESOLVED,FIXED,add WTAP_ENCAP_USB_LINUX support to randpkt,5/17/09 14:45,Enhancement,7,Linux (other),wireshark-bugs,nm127,12/23/07 21:16,2009-05-17 14:45:58 UTC,gerald
2138,TShark,RESOLVED,DUPLICATE,Buildbot crash output: fuzz-2007-12-23-1754.pcap,12/27/07 15:33,Critical,3,Linux (other),wireshark-bugs,buildbot-do-not-reply,12/24/07 5:00,2007-12-27 15:33:38 UTC,jyoung
2139,GTK+ UI,RESOLVED,NOTABUG,unable to decode REL 5 parameter : addLcsInformation,1/8/08 11:06,Major,14,Windows XP,wireshark-bugs,richa.khanna,12/26/07 6:56,2008-01-08 10:43:27 UTC,anders.broman
2140,GTK+ UI,RESOLVED,NOTABUG,How to decode XUDT messages,1/2/08 12:40,Major,7,Windows XP,wireshark-bugs,richa.khanna,12/26/07 9:14,2007-12-29 13:06:50 UTC,anders.broman
2141,TShark,RESOLVED,FIXED,Buildbot crash output: fuzz-2007-12-26-32600.pcap,12/27/07 15:33,Critical,4,Linux (other),wireshark-bugs,buildbot-do-not-reply,12/26/07 13:10,2007-12-27 12:02:37 UTC,jaap.keuter
2142,GTK+ UI,RESOLVED,FIXED,DHCPv6 dissector update,12/27/07 10:38,Enhancement,3,All,wireshark-bugs,Francis.Dupont,12/26/07 22:38,2007-12-27 10:38:49 UTC,jaap.keuter
2143,GTK+ UI,RESOLVED,DUPLICATE,"""Save As [filename] all packets displayed"" seems truncate some packets",12/28/07 8:08,Enhancement,6,Windows 2000,wireshark-bugs,mantovani,12/27/07 12:34,2007-12-28 08:08:01 UTC,anders.broman
2144,GTK+ UI,RESOLVED,FIXED,crash on specific snmp packet,12/30/07 22:04,Major,4,Windows XP,wireshark-bugs,ernst.vogel,12/28/07 13:28,2007-12-28 22:27:22 UTC,stig
2145,GTK+ UI,RESOLVED,FIXED,Lua dll is outdated in windows binaries,10/6/08 8:30,Minor,6,Windows 2000,wireshark-bugs,balint,12/28/07 13:47,2008-10-06 08:30:17 UTC,anders.broman
2146,GTK+ UI,RESOLVED,FIXED,TCP reassemby is not usable from Lua,11/21/08 7:48,Enhancement,8,All,wireshark-bugs,balint,12/28/07 13:57,2008-01-07 21:25:04 UTC,balint
2147,GTK+ UI,VERIFIED,NOTABUG,Incorrect filter of IPV6 address,1/4/08 17:50,Major,5,Windows XP,wireshark-bugs,bradsavedbygrace,12/28/07 23:41,2008-01-04 17:49:34 UTC,bradsavedbygrace
2148,GTK+ UI,RESOLVED,FIXED,NFS4 stream shouldn't have malformed packets,4/15/08 16:04,Normal,4,Linux (other),wireshark-bugs,toralf.foerster,12/29/07 10:05,2008-04-15 16:04:17 UTC,sake
2149,GTK+ UI,RESOLVED,DUPLICATE,the wireshark can not capture the Intel pc card  16 bit network card in the windows XP,1/2/08 17:20,Major,4,Windows XP,wireshark-bugs,xiaoyang.liang,12/29/07 16:04,2008-01-02 17:20:05 UTC,jeff.morriss.ws
2150,GTK+ UI,RESOLVED,NOTABUG,it can not recognize the intel  pro/100 pc card (16bit) mbla1600,3/7/08 1:16,Major,5,Windows XP,wireshark-bugs,xiaoyang.liang,12/29/07 16:57,2008-03-07 01:16:46 UTC,jeff.morriss.ws
2151,GTK+ UI,RESOLVED,FIXED,color rule for bad ttl: netmask too large,1/3/08 7:05,Major,6,Linux (other),wireshark-bugs,foss-ml,1/1/08 16:51,2008-01-03 07:05:29 UTC,jaap.keuter
2152,GTK+ UI,RESOLVED,NOTOURBUG,IEEE locally assigned addresses reported as belonging to Microsoft,1/5/08 11:08,Minor,4,Linux (other),wireshark-bugs,markzzzsmith,1/2/08 4:00,2008-01-03 11:14:02 UTC,jmayer
2153,Dissection engine (libwireshark),RESOLVED,FIXED,Bugs in the RTMP(T) decoder,11/16/12 14:14,Normal,12,Windows XP,wireshark-bugs,mflerackers,1/2/08 15:15,2010-01-01 19:07:23 UTC,guy
2154,GTK+ UI,RESOLVED,FIXED,packet_ansi_map function find_saved_invokedata() looks up wrong hash,1/3/08 14:48,Major,4,Windows XP,wireshark-bugs,shmulik.bezalel,1/2/08 17:54,2008-01-03 13:01:39 UTC,jeff.morriss.ws
2155,GTK+ UI,RESOLVED,NOTABUG,ansi_tcap_private.TransactionID_str is always NULL so return result does not continue to ANSI MAP layer,1/3/08 14:50,Major,4,Windows XP,wireshark-bugs,shmulik.bezalel,1/2/08 18:03,2008-01-03 12:59:07 UTC,jeff.morriss.ws
2157,GTK+ UI,RESOLVED,FIXED,SOCKS 5 decoding fails when client pipelines connect request,6/16/14 23:21,Normal,9,Mac OS X 10.0,wireshark-bugs,eric-bugs,1/3/08 0:47,2014-06-16 23:21:17 UTC,anders.broman
2158,Dissection engine (libwireshark),RESOLVED,FIXED,add support ucs2 on ussd string in gsm_map,12/19/13 2:33,Major,12,All,bugzilla-admin,shmulik.bezalel,1/3/08 9:13,2008-01-08 05:30:19 UTC,guy
2159,GTK+ UI,RESOLVED,FIXED,packet_gsm_sms.c: add support for ucs2 on ussd string,1/15/08 18:14,Major,10,Windows XP,wireshark-bugs,shmulik.bezalel,1/3/08 9:48,2008-01-08 05:19:20 UTC,jeff.morriss.ws
2161,GTK+ UI,RESOLVED,LATER,SMPP Optional Parameters and GSM UDH,7/13/08 1:49,Enhancement,10,Windows XP,wireshark-bugs,sarkar.abhik,1/3/08 12:01,2008-07-13 01:49:23 UTC,sarkar.abhik
2162,GTK+ UI,RESOLVED,FIXED,"for() loop evaluation order in ep_strndup() can trigger valgrind ""invalid read of size 1""",3/1/08 23:36,Minor,13,Linux (other),wireshark-bugs,jyoung,1/4/08 6:36,2008-01-07 20:45:18 UTC,jeff.morriss.ws
2163,GTK+ UI,RESOLVED,FIXED,build of wireshark-0.99.7 stopped under HP-UX 11.11,2/26/08 0:58,Major,2,HP-UX,wireshark-bugs,falk.hayn,1/4/08 7:21,2008-02-26 00:58:02 UTC,gerald
2164,GTK+ UI,RESOLVED,FIXED,Packet dissector showing bogus errors in jabber (XMPP) packets,7/27/12 18:38,Normal,6,Windows XP,wireshark-bugs,marco.ullasci,1/4/08 8:39,2012-07-27 18:38:25 UTC,eapache
2167,GTK+ UI,RESOLVED,DUPLICATE,Can no longer load enterprise MIBs in 0.99.7,4/23/08 12:14,Major,13,Windows XP,wireshark-bugs,stephane.sthilaire,1/4/08 21:12,2008-04-23 12:14:56 UTC,anders.broman
2168,GTK+ UI,RESOLVED,FIXED,Add reference how to build from Subversion,1/7/08 21:17,Enhancement,3,Linux (other),wireshark-bugs,nm127,1/5/08 7:41,2008-01-07 21:17:12 UTC,stig
2169,GTK+ UI,RESOLVED,FIXED,g_malloc0() call in uat_unesc() (epan/uat.c) is one byte too short,1/7/08 18:05,Major,5,All,wireshark-bugs,jyoung,1/6/08 4:45,2008-01-07 18:05:49 UTC,jyoung
2170,GTK+ UI,RESOLVED,DUPLICATE,Wireshark fails to restart after setting the preferences for SCCP,3/1/08 23:36,Critical,10,All,wireshark-bugs,arun2.b,1/7/08 12:35,2008-03-01 23:36:41 UTC,jeff.morriss.ws
2171,GTK+ UI,RESOLVED,FIXED,Ericsson.xml missing from (tarball build) installer,1/7/08 22:01,Normal,2,Windows XP,wireshark-bugs,jaap.keuter,1/7/08 14:09,2008-01-07 22:01:10 UTC,anders.broman
2172,GTK+ UI,RESOLVED,FIXED,packet-ethercat-frame.c fails to compile in Solaris 9  Wireshark 0.99.7,1/7/08 21:00,Major,3,Solaris,wireshark-bugs,dhalik,1/7/08 16:13,2008-01-07 20:58:16 UTC,stig
2173,GTK+ UI,RESOLVED,FIXED,Incorrect dissasembly of IPv6 packets with extension headers after the fragment header,7/31/08 2:22,Minor,8,All,wireshark-bugs,brayem,1/7/08 17:56,2008-07-31 02:22:48 UTC,anders.broman
2174,GTK+ UI,RESOLVED,NOTABUG,Wireshark fails to restart after setting the preferences for SCCP,1/8/08 16:35,Critical,4,All,wireshark-bugs,arun2.b,1/8/08 5:36,2008-01-08 16:35:41 UTC,jaap.keuter
2175,GTK+ UI,RESOLVED,DUPLICATE,Saving displayed packets will not save IP fragments other than the first one,6/3/10 8:31,Enhancement,6,All,wireshark-bugs,jg.foulon.dev,1/8/08 12:04,2010-06-03 08:31:01 UTC,jeff.morriss.ws
2176,GTK+ UI,RESOLVED,FIXED,BACnet ReadRange-Ack is displayed as malformed,1/9/08 9:34,Normal,4,Linux (other),wireshark-bugs,steve,1/8/08 16:53,2008-01-09 09:34:48 UTC,jaap.keuter
2177,GTK+ UI,VERIFIED,FIXED,Wireshark 0.99.7 crashes (aborts due to Xlib error) if exec of /usr/bin/dumpcap fails,1/11/08 6:02,Major,3,Linux (other),wireshark-bugs,wireshark.3.8eaf7cd8e5128d8191fe,1/9/08 4:44,2008-01-09 11:41:35 UTC,wireshark.3.8eaf7cd8e5128d8191fe
2178,TShark,RESOLVED,FIXED,Ericsson.xml is not included in Installation,2/1/12 23:45,Normal,4,Windows Server 2003,wireshark-bugs,Rene.Baumann,1/9/08 9:48,2008-02-14 08:28:09 UTC,a-kino
2179,GTK+ UI,RESOLVED,DUPLICATE,Reverse DNS does not work with IPv6 nameservers,1/9/08 17:18,Normal,2,Linux (other),wireshark-bugs,stick,1/9/08 10:26,2008-01-09 17:18:01 UTC,gerald
2180,GTK+ UI,RESOLVED,FIXED,RTCP frame length error indication in RTCP with a Bye chunk,1/9/08 12:40,Normal,4,All,wireshark-bugs,hduarte,1/9/08 10:33,2008-01-09 12:40:53 UTC,martin.mathieson
2181,GTK+ UI,RESOLVED,FIXED,Present the country code description to SCCP,2/25/10 15:57,Enhancement,4,Mac OS X 10.5,wireshark-bugs,shmulik.bezalel,1/9/08 10:51,2008-01-09 21:15:16 UTC,info
2182,GTK+ UI,RESOLVED,FIXED,Present the country code description to gsmmap,1/9/08 21:15,Enhancement,4,All,wireshark-bugs,shmulik.bezalel,1/9/08 12:19,2008-01-09 21:15:39 UTC,anders.broman
2183,GTK+ UI,RESOLVED,FIXED,Wrong inclusion of strptime function,1/9/08 16:05,Normal,3,Linux (other),wireshark-bugs,stick,1/9/08 13:35,2008-01-09 16:05:56 UTC,jmayer
2184,GTK+ UI,RESOLVED,FIXED,ASN.1 BER GeneralizedTime is not completely evaluated and displayed,1/12/08 12:09,Minor,4,All,wireshark-bugs,wireshark,1/9/08 14:01,2008-01-12 12:09:30 UTC,sake
2185,TShark,RESOLVED,FIXED,tshark PDML output is not well formed (unmatched </proto>),1/14/08 13:02,Major,6,All,wireshark-bugs,paul.blankenbaker,1/9/08 15:20,2008-01-12 00:39:28 UTC,martin.r.mathieson
2186,GTK+ UI,RESOLVED,FIXED,many unnamed strcut in packet-ecatmb.h,1/10/08 23:09,Major,4,Solaris,wireshark-bugs,io,1/9/08 15:50,2008-01-10 22:21:01 UTC,jeff.morriss.ws
2187,GTK+ UI,RESOLVED,FIXED,MOS numbers are not interpreted correctly for RTCP-XR packets,4/10/08 6:49,Major,3,Windows 2000,wireshark-bugs,bbhattac,1/10/08 19:46,2008-01-10 22:28:06 UTC,jaap.keuter
2188,GTK+ UI,VERIFIED,FIXED,No dump of data for RECOVERY LABEL rsvp object,5/13/08 16:11,Normal,5,Linux (other),wireshark-bugs,g.giorgi,1/12/08 13:36,2008-04-23 12:22:41 UTC,g.giorgi
2189,GTK+ UI,RESOLVED,FIXED,No support of CDP fields 0x0019  or 0x001a  Power Request and Power Available fields respectivly,1/13/08 11:57,Enhancement,6,All,michael,michael,1/12/08 22:11,2008-01-13 11:57:52 UTC,jaap.keuter
2191,GTK+ UI,RESOLVED,FIXED,Implement BASE_CUSTOM display type,7/30/08 5:30,Enhancement,6,Linux (other),wireshark-bugs,avn,1/14/08 6:21,2008-07-30 05:30:29 UTC,anders.broman
2192,GTK+ UI,RESOLVED,FIXED,RRC NAS Message PDUs are not dissected,1/15/08 6:57,Enhancement,4,Windows XP,wireshark-bugs,Neil,1/14/08 10:20,2008-01-15 06:57:42 UTC,anders.broman
2193,GTK+ UI,RESOLVED,FIXED,PROFINET DCP SetReq field missing,2/3/08 15:40,Minor,9,Windows XP,wireshark-bugs,hg5oju,1/14/08 14:21,2008-02-03 15:40:49 UTC,ulf.lamping
2194,GTK+ UI,RESOLVED,FIXED,DHCP overload flag not parsed,3/13/08 19:54,Trivial,14,Windows XP,wireshark-bugs,yless42,1/14/08 15:25,2008-03-12 21:02:41 UTC,jmayer
2195,GTK+ UI,RESOLVED,FIXED,"ssl decoding stops after TLSV1 package ""Ignored Unknown Record""",2/25/08 13:59,Major,5,All,wireshark-bugs,michael.brumme,1/14/08 15:26,2008-02-25 13:59:59 UTC,sake
2196,GTK+ UI,RESOLVED,FIXED,Wireshark is decoding a field that isn't defined for OSD APPEND packet,3/14/08 7:46,Minor,5,All,wireshark-bugs,daniel.e.messinger,1/14/08 15:36,2008-03-14 07:46:18 UTC,jaap.keuter
2197,GTK+ UI,RESOLVED,FIXED,VoIP calls statistics sometimes misses H.245/RTP parts of calls,9/17/14 20:16,Normal,7,Windows XP,wireshark-bugs,elmer.elmer,1/15/08 8:44,2014-06-19 17:43:55 UTC,guy
2198,TShark,RESOLVED,FIXED,Netflow Dissector - error decoding option scope,9/10/10 7:51,Major,4,All,wireshark-bugs,olivier.montanuy,1/15/08 11:31,2008-01-18 17:04:06 UTC,wmeier
2200,GTK+ UI,RESOLVED,DUPLICATE,Delays in packet capture on Windows with named pipes,7/2/09 11:25,Major,7,Windows XP,wireshark-bugs,benjamin_tse,1/16/08 1:04,2009-07-02 11:25:43 UTC,gerald
2201,GTK+ UI,RESOLVED,FIXED,Problem dumping protection info and generalized uni diversity objects,4/13/08 15:00,Normal,7,Linux (other),wireshark-bugs,g.giorgi,1/16/08 1:50,2008-04-13 15:00:16 UTC,stig
2202,GTK+ UI,RESOLVED,FIXED,"Wrong warning message of Wireshark: ""PPPoE Payload length XX incorrect  should be YY""",2/2/08 9:28,Major,4,Windows XP,wireshark-bugs,Jewgenij.Bytschkow,1/16/08 10:57,2008-02-02 09:28:22 UTC,sake
2203,GTK+ UI,RESOLVED,NOTABUG,IO graph scale in Y axis is incorrect.,2/19/08 2:17,Major,4,Windows 2000,wireshark-bugs,gperezbrun,1/16/08 18:08,2008-02-19 02:17:41 UTC,stephenfisher
2204,GTK+ UI,RESOLVED,DUPLICATE,IO graph scale in Y axis is incorrect.,1/16/08 18:50,Major,2,Windows 2000,wireshark-bugs,gperezbrun,1/16/08 18:09,2008-01-16 18:50:13 UTC,stig
2205,GTK+ UI,RESOLVED,FIXED,New dissector plugin for Hilscher analyzer frames,5/20/08 6:43,Enhancement,17,Windows XP,wireshark-bugs,hpfrommer,1/17/08 8:01,2008-02-27 23:41:16 UTC,sake
2206,TShark,RESOLVED,FIXED,Buildbot crash output: fuzz-2008-01-17-29083.pcap,1/17/08 21:40,Critical,3,Linux (other),wireshark-bugs,buildbot-do-not-reply,1/17/08 10:51,2008-01-17 21:40:56 UTC,jeff.morriss.ws
2207,Extras,RESOLVED,FIXED,editcap relies on gnu extension to strptime(3),1/17/08 21:05,Major,2,OpenBSD,wireshark-bugs,bugzilla.wireshark,1/17/08 17:51,2008-01-17 21:05:53 UTC,wmeier
2208,GTK+ UI,RESOLVED,DUPLICATE,Empty text/xml packets crash wireshark,1/18/08 0:55,Major,2,Windows XP,wireshark-bugs,cholland,1/17/08 23:08,2008-01-18 00:55:10 UTC,stephenfisher
2210,TShark,RESOLVED,FIXED,Some fields output nothing  when using tshark with -T fields,1/22/08 0:58,Major,2,All,wireshark-bugs,n.bruenggel,1/18/08 10:45,2008-01-22 00:58:08 UTC,sake
2211,GTK+ UI,RESOLVED,DUPLICATE,gui starts too high with dual display when mon.1 shorter than mon.2,9/23/10 16:36,Trivial,3,Windows Vista,wireshark-bugs,x16wda,1/20/08 19:47,2010-09-23 16:36:13 UTC,stephenfisher
2212,GTK+ UI,RESOLVED,FIXED,Patch to prefs_dlg.c to display current profile name in Preferences dialog title,4/14/08 8:06,Enhancement,4,All,wireshark-bugs,jyoung,1/21/08 8:28,2008-04-14 08:06:27 UTC,sake
2213,GTK+ UI,RESOLVED,FIXED,ACN NULL address causes improper disection,1/22/08 6:51,Normal,3,All,wireshark-bugs,bill.florac,1/22/08 4:11,2008-01-22 06:51:29 UTC,jaap.keuter
2214,Build process,CONFIRMED, ---,Add option to specify Program Group location,2/27/15 2:13,Enhancement,3,Windows XP,wireshark-bugs,sake,1/22/08 14:18,,guy
2215,GTK+ UI,RESOLVED,NOTABUG,UDP display filter (udp.port != x) does not work,1/23/08 10:40,Major,2,Windows XP,wireshark-bugs,otyshev,1/23/08 10:30,2008-01-23 10:40:01 UTC,stig
2216,GTK+ UI,RESOLVED,DUPLICATE,Wireshark hangs with malformed SSL Client Hello,4/24/08 2:42,Normal,8,Windows XP,wireshark-bugs,olof.johansson,1/24/08 10:49,2008-04-24 02:42:48 UTC,sarkar.abhik
2217,GTK+ UI,RESOLVED,FIXED,IGMP Userfriendlyness Improvement,1/25/08 6:33,Enhancement,3,Linux (other),wireshark-bugs,thomas.morin,1/24/08 11:50,2008-01-25 06:33:29 UTC,jaap.keuter
2218,GTK+ UI,RESOLVED,FIXED,SMPP source_subaddress optional parametar,3/17/08 7:32,Minor,9,All,wireshark-bugs,b.barbulovski,1/24/08 16:23,2008-03-17 07:32:10 UTC,jaap.keuter
2219,GTK+ UI,RESOLVED,FIXED,tvb_free not exported from libwireshark.dll,1/25/08 15:35,Normal,2,Windows XP,wireshark-bugs,crwulff,1/25/08 1:18,2008-01-25 15:35:32 UTC,jeff.morriss.ws
2220,GTK+ UI,RESOLVED,NOTABUG,"Impossible to load  a VMS ""TCPIPtrace"" file that's not in STREAM or STREAM_LF format",1/6/13 13:36,Major,9,All,wireshark-bugs,jean-marc.nogues,1/25/08 15:00,2008-02-20 16:02:41 UTC,guy
2221,GTK+ UI,RESOLVED,DUPLICATE,TCP Retransmit packets identified incorrectly,11/9/10 9:21,Major,2,Windows XP,wireshark-bugs,Greg.Morris,1/25/08 15:04,2010-11-09 09:21:40 UTC,Christopher.Maynard
2222,GTK+ UI,RESOLVED,NOTABUG,Decoding RFC1006 (TPKT),1/25/08 16:56,Minor,4,Windows XP,wireshark-bugs,john.dite,1/25/08 16:14,2008-01-25 16:37:50 UTC,stig
2223,GTK+ UI,RESOLVED,NOTOURBUG,Save file name incorrect after file rename through save file browser.,1/27/08 8:36,Minor,2,Windows XP,wireshark-bugs,kyle.kloepper,1/25/08 17:04,2008-01-27 08:36:26 UTC,jaap.keuter
2224,GTK+ UI,RESOLVED,FIXED,build fail with glib-1.2: wslua.h: expected specifier-qualifier-list before 'DIR',1/26/08 15:29,Major,3,Linux (other),wireshark-bugs,pva,1/26/08 13:44,2008-01-26 15:29:06 UTC,stig
2225,GTK+ UI,RESOLVED,FIXED,Incorrect behavior using sorting in the packet list,10/2/10 9:55,Normal,4,Mac OS X 10.5,wireshark-bugs,stig,1/27/08 15:06,2010-10-02 09:55:14 UTC,stig
2226,GTK+ UI,RESOLVED,FIXED,Mismatching </proto> element in a PDML explort,2/7/08 12:57,Major,20,Windows XP,wireshark-bugs,prasad.shenoy,1/28/08 19:09,2008-02-07 11:52:08 UTC,martin.mathieson
2227,GTK+ UI,RESOLVED,FIXED,Error in MEGACO:  [Packet size limited during capture: MEGACO truncated],11/16/10 11:02,Normal,5,Windows XP,wireshark-bugs,hduarte,1/29/08 10:38,2008-07-30 05:03:06 UTC,Christopher.Maynard
2228,GTK+ UI,RESOLVED,FIXED,Stop capture doesn't work,3/27/08 15:00,Blocker,19,Linux (other),wireshark-bugs,arun2.b,1/29/08 10:52,2008-03-27 15:00:52 UTC,wmeier
2229,GTK+ UI,RESOLVED,FIXED,"MPEG PES decode reports ""Malformed Packet"" when PES packet length is 0",10/27/08 3:54,Normal,6,Windows XP,wireshark-bugs,ved,1/29/08 16:34,2008-10-27 03:54:47 UTC,drogers
2230,GTK+ UI,RESOLVED,NOTABUG,Cross Point Frame Injector dissector problem,2/6/12 11:35,Normal,5,Windows XP,wireshark-bugs,peter.sheynkman,1/29/08 17:05,2012-02-06 11:35:44 UTC,anders.broman
2231,GTK+ UI,RESOLVED,FIXED,Updated the PTP Packet Dissector to the current Draft Version IEEE1588v2.2,3/3/08 20:28,Enhancement,5,Windows XP,wireshark-bugs,markus.seehofer,1/30/08 7:51,2008-03-03 20:28:10 UTC,anders.broman
2232,GTK+ UI,RESOLVED,FIXED,Incorrect decoding of JPEG images which contain a quantization table,2/2/08 16:41,Normal,4,Linux (other),wireshark-bugs,pkj,1/31/08 12:02,2008-02-02 16:41:58 UTC,jaap.keuter
2233,TShark,RESOLVED,FIXED,RTP stream statistics for tshark,2/3/08 10:33,Enhancement,4,All,wireshark-bugs,balint,1/31/08 15:11,2008-02-03 10:33:14 UTC,sake
2234,TShark,CONFIRMED, ---,Filtering tshark captures with read filters (-R) no longer works,3/12/17 11:18,Major,26,Windows XP,wireshark-bugs,wireshark,1/31/08 20:44,,wireshark
2235,GTK+ UI,RESOLVED,FIXED,Add Infiniband plugin GPL v2,3/14/08 17:50,Normal,9,Linux (other),wireshark-bugs,stephen.donnelly,1/31/08 22:08,2008-03-14 17:50:19 UTC,gerald
2236,GTK+ UI,RESOLVED,FIXED,SDP dissector buffer overrun exception,2/3/08 21:19,Normal,2,Windows XP,wireshark-bugs,shane.kearns,2/1/08 14:11,2008-02-03 21:19:14 UTC,stig
2237,GTK+ UI,RESOLVED,FIXED,"add support for ""btsnoop"" log format",2/4/08 11:43,Enhancement,8,Windows XP,wireshark-bugs,shane.kearns,2/1/08 15:09,2008-02-03 21:13:07 UTC,stig
2238,GTK+ UI,RESOLVED,FIXED,BACnet decoding of SubscribeCOVProperty is incorrect,2/2/08 16:31,Minor,3,Windows XP,wireshark-bugs,alan,2/1/08 15:34,2008-02-02 16:31:30 UTC,jaap.keuter
2239,GTK+ UI,RESOLVED,FIXED,bluetooth L2CAP dissector decoding errors,2/4/08 12:13,Normal,5,Windows XP,wireshark-bugs,shane.kearns,2/1/08 17:28,2008-02-04 12:13:06 UTC,stig
2240,GTK+ UI,RESOLVED,NOTABUG,new column title cannot be applied or saved,2/24/08 2:44,Trivial,4,Windows XP,wireshark-bugs,abitlater,2/1/08 18:00,2008-02-24 02:44:12 UTC,stephenfisher
2241,GTK+ UI,RESOLVED,FIXED,L2CAP dissector doesn't understand retransmission mode,10/8/08 13:34,Major,6,Windows XP,wireshark-bugs,shane.kearns,2/1/08 19:53,2008-10-08 13:34:24 UTC,jaap.keuter
2242,GTK+ UI,RESOLVED,FIXED,update SDP attribute and service IDs,2/4/08 11:58,Enhancement,4,Windows XP,wireshark-bugs,shane.kearns,2/1/08 20:07,2008-02-04 11:58:09 UTC,stig
2243,GTK+ UI,RESOLVED,FIXED,LUA: TvbRange __index metamethod not working,10/31/08 11:20,Normal,2,Linux (other),wireshark-bugs,hcgpalm,2/3/08 21:14,2008-10-31 11:20:09 UTC,balint
2244,GTK+ UI,RESOLVED,FIXED,LUA: There's no tvb_get_stringz() equivalent,1/1/10 7:58,Enhancement,2,Linux (other),wireshark-bugs,hcgpalm,2/3/08 21:25,2010-01-01 07:58:20 UTC,stig
2245,GTK+ UI,RESOLVED,FIXED,[PATCH]: PKIXCMP - show type and status of the message in the info column,4/12/08 7:56,Enhancement,2,All,wireshark-bugs,wireshark,2/5/08 16:17,2008-04-12 07:56:38 UTC,stig
2246,Extras,RESOLVED,FIXED,text2pcap: add -o dec option,2/5/08 21:31,Enhancement,2,All,wireshark-bugs,mccart,2/5/08 20:48,2008-02-05 21:31:41 UTC,stig
2247,GTK+ UI,RESOLVED,FIXED,Diameter new AVP 299,2/6/08 22:20,Minor,5,Mac OS X 10.4,wireshark-bugs,grzegorz.szczytowski,2/6/08 2:09,2008-02-06 22:20:54 UTC,anders.broman
2248,TShark,RESOLVED,FIXED,New dissector for RSPLIB Scripting Service Protocol,2/6/08 14:30,Normal,3,All,wireshark-bugs,dreibh,2/6/08 13:19,2008-02-06 14:30:20 UTC,stig
2249,GTK+ UI,RESOLVED,FIXED,BACnet handling of readPropertyMultiple request / response,3/3/08 20:15,Minor,3,Windows XP,wireshark-bugs,alan,2/6/08 15:17,2008-03-03 20:15:36 UTC,anders.broman
2250,GTK+ UI,RESOLVED,FIXED,Build fails on OS X (gtk+ version),2/9/08 1:11,Major,4,Mac OS X 10.5,wireshark-bugs,richard,2/8/08 14:32,2008-02-09 01:11:01 UTC,stephenfisher
2251,GTK+ UI,RESOLVED,FIXED,at midnight the trace date jumps forward,2/10/08 18:35,Normal,5,All,wireshark-bugs,martinstrud,2/8/08 22:56,2008-02-10 18:35:21 UTC,guy
2253,GTK+ UI,RESOLVED,FIXED,SNMP trap dissectors fails,4/21/08 15:31,Normal,6,Windows XP,wireshark-bugs,filip.vandewalle,2/11/08 8:20,2008-04-21 11:38:23 UTC,anders.broman
2254,Dissection engine (libwireshark),CONFIRMED, ---,"Incorrect allocation/classification of ""Type"" fields and incorrect representation of 802.1Q VLAN TAGs in VLAN-tagged frames",6/17/14 23:15,Normal,22,All,bugzilla-admin,Jewgenij.Bytschkow,2/11/08 9:20,,guy
2255,Capture file support (libwiretap),RESOLVED,FIXED,fix build for VS 2005 (MSVC_VARIANT=MSVC2005),1/27/15 0:13,Normal,3,Windows XP,wireshark-bugs,tobias.schoenit,2/11/08 13:32,2008-02-12 12:50:04 UTC,guy
2256,GTK+ UI,RESOLVED,WORKSFORME,ansi_map does not execute is637 subdissector,1/2/13 20:47,Minor,6,All,wireshark-bugs,martin.schimmer,2/11/08 17:28,2013-01-02 20:47:22 UTC,mmann78
2257,GTK+ UI,RESOLVED,FIXED,Issue with the analysis of radius packets,3/3/08 18:08,Normal,5,Windows XP,wireshark-bugs,amir.ro,2/12/08 8:05,2008-03-03 18:08:40 UTC,jmayer
2258,GTK+ UI,RESOLVED,NOTOURBUG,scroll list entries starts in the middle of the list,11/9/10 12:15,Trivial,5,Linux (other),wireshark-bugs,toralf.foerster,2/12/08 10:01,2010-11-09 12:15:37 UTC,stephenfisher
2259,GTK+ UI,RESOLVED,FIXED,Multicast MACs resolve according to unicast MACs in manuf.,2/13/08 17:22,Trivial,2,Windows XP,wireshark-bugs,jfielding,2/12/08 18:05,2008-02-13 17:22:24 UTC,jaap.keuter
2260,TShark,RESOLVED,FIXED,Buildbot crash output: fuzz-2008-02-12-13262.pcap,2/13/08 4:11,Critical,4,Linux (other),wireshark-bugs,buildbot-do-not-reply,2/13/08 3:29,2008-02-13 04:11:10 UTC,gerald
2261,TShark,RESOLVED,DUPLICATE,Buildbot crash output: fuzz-2008-02-12-23000.pcap,2/13/08 4:11,Critical,2,Linux (other),wireshark-bugs,buildbot-do-not-reply,2/13/08 3:29,2008-02-13 04:11:29 UTC,gerald
2262,TShark,RESOLVED,DUPLICATE,Buildbot crash output: fuzz-2008-02-12-921.pcap,2/13/08 4:11,Critical,2,Linux (other),wireshark-bugs,buildbot-do-not-reply,2/13/08 3:29,2008-02-13 04:11:49 UTC,gerald
2263,GTK+ UI,RESOLVED,FIXED,new wireshark dissector for SERCOS III (ethertype 0x88cd),5/10/08 7:47,Enhancement,22,Linux (other),wireshark-bugs,wireshark,2/13/08 12:07,2008-05-10 07:47:53 UTC,jaap.keuter
2264,GTK+ UI,RESOLVED,FIXED,Enable int64  uint64 and ipv4 type fields for the Lua dissectors,2/22/08 21:15,Enhancement,6,All,wireshark-bugs,balint,2/13/08 16:35,2008-02-22 21:15:13 UTC,jeff.morriss.ws
2265,TShark,RESOLVED,FIXED,Buildbot crash output: fuzz-2008-02-13-22773.pcap,2/14/08 23:17,Critical,7,Linux (other),wireshark-bugs,buildbot-do-not-reply,2/14/08 8:30,2008-02-14 23:11:57 UTC,bugzilla-admin
2266,GTK+ UI,RESOLVED,NOTABUG,USB Dissector error with Gadget Zero,12/19/11 13:20,Normal,5,Linux (other),wireshark-bugs,srpoc103,2/14/08 10:15,2011-12-19 13:20:51 UTC,Christopher.Maynard
2267,TShark,RESOLVED,DUPLICATE,Buildbot crash output: fuzz-2008-02-14-11059.pcap,2/14/08 23:13,Critical,2,Linux (other),wireshark-bugs,buildbot-do-not-reply,2/14/08 11:20,2008-02-14 23:13:22 UTC,bugzilla-admin
2268,TShark,RESOLVED,DUPLICATE,Buildbot crash output: fuzz-2008-02-14-9479.pcap,2/14/08 23:14,Critical,2,Linux (other),wireshark-bugs,buildbot-do-not-reply,2/14/08 14:20,2008-02-14 23:14:31 UTC,bugzilla-admin
2269,TShark,RESOLVED,DUPLICATE,Buildbot crash output: fuzz-2008-02-14-8764.pcap,2/14/08 23:15,Critical,2,Linux (other),wireshark-bugs,buildbot-do-not-reply,2/14/08 21:00,2008-02-14 23:15:41 UTC,bugzilla-admin
2270,Qt UI,CONFIRMED, ---,RTP output to .au or raw not interpreting silence suppression correctly,12/12/16 0:14,Enhancement,16,Windows XP,wireshark-bugs,kevin.barnard,2/14/08 21:35,,j.novak
2271,TShark,RESOLVED,DUPLICATE,Buildbot crash output: fuzz-2008-02-14-31011.pcap,2/14/08 23:17,Critical,2,Linux (other),wireshark-bugs,buildbot-do-not-reply,2/14/08 23:10,2008-02-14 23:17:07 UTC,bugzilla-admin
2272,GTK+ UI,RESOLVED,WORKSFORME,DNS dissector incorrect when length field is in frame of its own,9/18/09 20:47,Major,6,Linux (other),wireshark-bugs,David.Leonard,2/15/08 4:33,2008-03-14 06:39:56 UTC,stephenfisher
2273,GTK+ UI,RESOLVED,FIXED,Capture with multiple files fails on reading second file,2/3/11 11:36,Major,6,Mac OS X 10.5,wireshark-bugs,stig,2/15/08 20:44,2011-02-03 11:36:57 UTC,sake
2274,GTK+ UI,RESOLVED,FIXED,"""Restart the running live capture"" when using multiple files makes a long filename",6/16/14 23:31,Normal,3,All,wireshark-bugs,stig,2/15/08 21:00,2014-06-16 23:31:03 UTC,balint
2275,TShark,RESOLVED,LATER,"""Finished writing file"" notification in ring-buffer mode.",3/11/13 19:35,Enhancement,6,Linux (other),wireshark-bugs,martin,2/16/08 14:53,2013-03-11 19:35:22 UTC,eapache
2276,GTK+ UI,RESOLVED,NOTABUG,SSAP/DSAP 0x0606 doesn't start IPv4 parsing,2/17/08 12:48,Normal,2,Linux (other),wireshark-bugs,eyals,2/17/08 10:55,2008-02-17 12:48:56 UTC,eyals
2277,GTK+ UI,RESOLVED,FIXED,Null pointer in packet-snmp.c,2/26/08 1:19,Blocker,2,Windows XP,wireshark-bugs,packetsteve,2/18/08 20:59,2008-02-26 01:19:03 UTC,gerald
2278,GTK+ UI,RESOLVED,FIXED,packet-sscop.c decode of ERAK incorrect,3/1/08 16:29,Normal,2,Windows XP,wireshark-bugs,packetsteve,2/18/08 21:18,2008-03-01 16:29:48 UTC,jeff.morriss.ws
2279,GTK+ UI,RESOLVED,FIXED,Parse GetPrinterDriverDirectory,9/25/12 21:57,Enhancement,4,Windows Vista,wireshark-bugs,feroz.samba,2/19/08 5:09,2012-09-25 21:57:35 UTC,Christopher.Maynard
2280,GTK+ UI,RESOLVED,FIXED,DHCP Civic Location Option 99 (RFC 4776),2/21/08 7:06,Enhancement,5,Linux (other),wireshark-bugs,khwolf1,2/19/08 7:29,2008-02-21 07:06:38 UTC,jaap.keuter
2281,TShark,RESOLVED,FIXED,PDML syntax error for ICMP packets,3/3/08 8:24,Major,4,All,wireshark-bugs,gkrames,2/19/08 12:52,2008-03-03 08:24:31 UTC,gkrames
2282,Extras,RESOLVED,FIXED,Extend netscreen2dump.py to work with SSG520,2/19/08 18:07,Enhancement,4,All,wireshark-bugs,pizza_4u,2/19/08 16:03,2008-02-19 17:07:32 UTC,sake
2283,GTK+ UI,RESOLVED,NOTOURBUG,Huge memory leak when using virtual desktops,2/21/08 23:11,Major,3,Windows XP,wireshark-bugs,elof,2/19/08 18:34,2008-02-21 15:50:04 UTC,jaap.keuter
2284,GTK+ UI,RESOLVED,FIXED,No support for Secure Neighbor Discovery ICMPv6 options,2/24/08 17:15,Major,4,All,wireshark-bugs,david.holder,2/19/08 20:43,2008-02-24 17:15:31 UTC,anders.broman
2285,GTK+ UI,RESOLVED,FIXED,IE Length mismatch for 802.11h TPC Report,8/19/08 14:27,Normal,7,Windows XP,wireshark-bugs,goran.edlund,2/20/08 9:53,2008-08-19 14:27:35 UTC,anders.broman
2286,GTK+ UI,RESOLVED,FIXED,Follow TCP stream window with wrapped lines,3/28/08 4:45,Major,7,Linux (other),wireshark-bugs,I.zaufi,2/20/08 10:40,2008-03-28 04:45:06 UTC,stephenfisher
2288,GTK+ UI,RESOLVED,FIXED,Selecting multiple files with any options creates an error <Child capture process exited: exit status 2>,3/3/08 15:23,Major,10,Linux (other),wireshark-bugs,mark.pride,2/20/08 17:59,2008-02-23 21:50:21 UTC,manuel.biewald
2289,GTK+ UI,RESOLVED,FIXED,Packet list filter generator doesn't handle 802.11 addresses,9/25/08 8:45,Normal,2,All,wireshark-bugs,bugzilla-admin,2/20/08 21:55,2008-09-25 08:45:26 UTC,anders.broman
2290,GTK+ UI,RESOLVED,FIXED,GPRS LLC CRC24 badly calculated for non protected frames,7/28/08 12:33,Minor,6,Windows XP,wireshark-bugs,vincent.helfre,2/21/08 15:20,2008-07-28 12:33:24 UTC,anders.broman
2291,Build process,RESOLVED,FIXED,wiretap dependencies became broken (--as-needed),1/22/16 2:15,Normal,8,Gentoo,wireshark-bugs,pva,2/21/08 20:40,2008-05-20 07:30:36 UTC,guy
2292,GTK+ UI,RESOLVED,FIXED,DISSECTOR_ASSERT_NOT_REACHED,10/29/10 9:04,Major,8,Windows XP,wireshark-bugs,jim.maynard,2/21/08 21:56,2010-10-29 09:04:17 UTC,jeff.morriss.ws
2293,GTK+ UI,RESOLVED,FIXED,BACnet dissector parses BACnetErrorCode incorrectly,2/22/08 21:40,Normal,6,All,wireshark-bugs,emezeske,2/22/08 2:06,2008-02-22 21:40:56 UTC,jeff.morriss.ws
2294,TShark,RESOLVED,FIXED,Buildbot crash output: fuzz-2008-02-21-25564.pcap,2/22/08 13:52,Critical,3,Linux (other),wireshark-bugs,buildbot-do-not-reply,2/22/08 3:10,2008-02-22 13:52:23 UTC,stig
2295,TShark,RESOLVED,FIXED,Buildbot crash output: fuzz-2008-02-21-29198.pcap,2/22/08 13:51,Critical,3,Linux (other),wireshark-bugs,buildbot-do-not-reply,2/22/08 4:30,2008-02-22 13:51:50 UTC,stig
2296,TShark,RESOLVED,FIXED,Buildbot crash output: fuzz-2008-02-21-2054.pcap,2/22/08 13:50,Critical,3,Linux (other),wireshark-bugs,buildbot-do-not-reply,2/22/08 5:30,2008-02-22 13:50:54 UTC,stig
2297,TShark,RESOLVED,FIXED,Buildbot crash output: fuzz-2008-02-22-6024.pcap,2/22/08 13:45,Critical,2,Linux (other),wireshark-bugs,buildbot-do-not-reply,2/22/08 12:32,2008-02-22 13:45:06 UTC,stig
2298,TShark,RESOLVED,FIXED,Buildbot crash output: fuzz-2008-02-22-9608.pcap,2/22/08 13:41,Critical,2,Linux (other),wireshark-bugs,buildbot-do-not-reply,2/22/08 13:20,2008-02-22 13:41:59 UTC,stig
2299,TShark,RESOLVED,FIXED,Buildbot crash output: fuzz-2008-02-22-13184.pcap,2/22/08 13:53,Critical,2,Linux (other),wireshark-bugs,buildbot-do-not-reply,2/22/08 13:50,2008-02-22 13:53:28 UTC,stig
2301,GTK+ UI,RESOLVED,FIXED,No Support for IPv6 Secure Neighbor Discovery (SEND) Certification ICMPv6 Messages,2/25/08 11:27,Major,2,Windows XP,wireshark-bugs,david.holder,2/22/08 17:39,2008-02-25 11:27:12 UTC,anders.broman
2302,GTK+ UI,RESOLVED,FIXED,Base64 decoder returns incorrect length,3/16/08 9:55,Minor,11,Linux (other),wireshark-bugs,pkj,2/22/08 19:53,2008-03-16 09:55:35 UTC,jaap.keuter
2303,GTK+ UI,RESOLVED,FIXED,Update parsing of the DirectPlay header,2/26/08 18:09,Enhancement,2,Linux (other),wireshark-bugs,kai,2/25/08 21:46,2008-02-26 18:09:58 UTC,anders.broman
2304,GTK+ UI,RESOLVED,FIXED,Correctly dissect the SessionDesc structure of DirectPlay,2/26/08 18:09,Enhancement,2,Linux (other),wireshark-bugs,kai,2/25/08 23:14,2008-02-26 18:09:50 UTC,anders.broman
2305,GTK+ UI,RESOLVED,FIXED,wireshark fails with a X11 error,2/27/08 5:57,Major,8,Mac OS X 10.5,wireshark-bugs,michel.desbiens,2/26/08 2:37,2008-02-27 03:19:54 UTC,michel.desbiens
2306,GTK+ UI,RESOLVED,FIXED,Wireshark 0.99.7 crashes on capture,2/26/08 15:43,Major,3,Windows XP,wireshark-bugs,leonidtr,2/26/08 14:44,2008-02-26 15:43:13 UTC,gerald
2307,GTK+ UI,RESOLVED,FIXED,Dissect SuperPackedPlayer struct and packet type 29,2/27/08 17:27,Enhancement,2,Linux (other),wireshark-bugs,kai,2/26/08 18:16,2008-02-27 17:27:43 UTC,anders.broman
2308,GTK+ UI,RESOLVED,FIXED,DirectPlay: Correctly dissect type 02  05 and 07 packets.,2/27/08 17:24,Enhancement,2,Linux (other),wireshark-bugs,kai,2/26/08 23:14,2008-02-27 17:24:57 UTC,anders.broman
2309,GTK+ UI,RESOLVED,FIXED,SMI paths and SMI modules only loaded on startup,5/12/10 12:08,Normal,10,All,wireshark-bugs,stig,2/27/08 19:48,2010-05-12 12:08:30 UTC,anders.broman
2310,TShark,RESOLVED,FIXED,Buildbot crash output: fuzz-2008-02-27-13330.pcap,2/28/08 8:35,Critical,2,All,wireshark-bugs,buildbot-do-not-reply,2/28/08 5:51,2008-02-28 08:35:54 UTC,guy
2311,GTK+ UI,RESOLVED,FIXED,Wrong strncat usage in epan/dissectors/packet-gtp.c,2/29/08 3:38,Normal,5,All,wireshark-bugs,stick,2/28/08 13:21,2008-02-29 03:38:45 UTC,guy
2312,GTK+ UI,RESOLVED,FIXED,RTCP dissector fail to decode the FMT field (RTCP Early Mode),2/28/08 16:15,Minor,2,Windows 2000,wireshark-bugs,jonas.lundberg,2/28/08 15:40,2008-02-28 16:15:41 UTC,martin.mathieson
2313,GTK+ UI,RESOLVED,FIXED,Add support for OLPC 802.11s-like mesh protocol,5/2/09 14:55,Enhancement,7,All,wireshark-bugs,dwmw2,2/29/08 1:56,2009-05-02 14:55:14 UTC,guy
2314,GTK+ UI,RESOLVED,WORKSFORME,mms request cannot be reassembled.,8/19/08 22:44,Major,4,Windows XP,wireshark-bugs,ghsun,2/29/08 4:44,2008-08-19 22:44:36 UTC,anders.broman
2315,GTK+ UI,RESOLVED,FIXED,Some time display formats are saved wrongly in recent.,2/29/08 20:24,Minor,2,Windows XP,wireshark-bugs,jfielding,2/29/08 19:41,2008-02-29 20:24:17 UTC,stig
2316,TShark,RESOLVED,FIXED,"Dissector bug  protocol SNMP: proto.c:2983: failed assertion ""(guint)hfindex < gpa_hfinfo.len""",3/8/08 6:35,Normal,6,Linux (other),wireshark-bugs,kabbalah74-unsec,2/29/08 22:12,2008-03-08 06:35:37 UTC,kabbalah74-unsec
2317,TShark,RESOLVED,FIXED,Buildbot crash output: fuzz-2008-02-29-26013.pcap,3/2/08 17:22,Critical,4,Linux (other),wireshark-bugs,buildbot-do-not-reply,2/29/08 23:00,2008-03-01 16:25:27 UTC,jeff.morriss.ws
2318,TShark,RESOLVED,DUPLICATE,Buildbot crash output: fuzz-2008-02-29-15412.pcap,3/1/08 16:23,Critical,2,Linux (other),wireshark-bugs,buildbot-do-not-reply,3/1/08 0:01,2008-03-01 16:23:39 UTC,jeff.morriss.ws
2319,GTK+ UI,RESOLVED,FIXED,New dissector called xcsl/xgen interface specification - call specification language,6/23/08 13:52,Normal,7,All,wireshark-bugs,gooris,3/1/08 14:26,2008-03-10 19:28:39 UTC,jaap.keuter
2320,GTK+ UI,RESOLVED,FIXED,New dissector: redback lawful intercept,3/6/08 20:11,Major,7,Linux (other),wireshark-bugs,flo,3/1/08 14:31,2008-03-06 20:11:48 UTC,jeff.morriss.ws
2321,TShark,RESOLVED,DUPLICATE,Buildbot crash output: fuzz-2008-03-01-29793.pcap,3/3/08 14:30,Critical,5,Linux (other),wireshark-bugs,buildbot-do-not-reply,3/1/08 18:40,2008-03-02 17:22:40 UTC,wmeier
2322,GTK+ UI,RESOLVED,FIXED,Added support for CIGI 3.2 protocol to packet-cigi.c,3/3/08 20:09,Enhancement,2,Windows Vista,wireshark-bugs,seeliger,3/2/08 11:33,2008-03-03 20:09:15 UTC,anders.broman
2323,GTK+ UI,RESOLVED,FIXED,Properly dissect all DirectPlay messages observed on the wire so far,3/3/08 19:57,Enhancement,2,Linux (other),wireshark-bugs,kai,3/2/08 23:18,2008-03-03 19:57:33 UTC,anders.broman
2324,GTK+ UI,RESOLVED,FIXED,DHCP coordinate-based Location Configuration Option 123 (RFC3825),10/8/08 11:27,Enhancement,7,Linux (other),wireshark-bugs,khwolf1,3/3/08 7:33,2008-10-08 11:27:29 UTC,jaap.keuter
2325,GTK+ UI,RESOLVED,FIXED,"""Type-ahead search"" accepts only one character (eg: in 'Edit Preferences -> Protocols' )",5/26/09 6:28,Normal,20,Windows XP,wireshark-bugs,rleutert,3/3/08 11:40,2008-09-08 12:23:47 UTC,wmeier
2326,GTK+ UI,RESOLVED,FIXED,Support for EtherCAT subdissectors,3/5/08 20:44,Enhancement,2,All,wireshark-bugs,PeterJohansson73,3/3/08 13:54,2008-03-05 20:44:30 UTC,anders.broman
2327,TShark,VERIFIED,NOTOURBUG,Permission issue with non root directories <Child capture process exited: exit status 2>,3/5/08 13:19,Major,5,Linux (other),wireshark-bugs,manuel.biewald,3/3/08 15:23,2008-03-05 00:18:04 UTC,manuel.biewald
2328,GTK+ UI,RESOLVED,FIXED,Wireshark crashes when trying PDML EXPORT (with protocol UNISTIM),3/10/08 15:38,Major,10,Windows XP,wireshark-bugs,fanlord,3/3/08 16:03,2008-03-06 15:46:34 UTC,fanlord
2329,TShark,RESOLVED,FIXED,Buildbot crash output: fuzz-2008-03-03-2726.pcap,3/3/08 22:29,Critical,2,Linux (other),wireshark-bugs,buildbot-do-not-reply,3/3/08 19:20,2008-03-03 22:29:16 UTC,gerald
2330,GTK+ UI,RESOLVED,FIXED,IEEE 802.15.4 dissector and DLT_ type.,3/5/08 20:30,Normal,4,Windows XP,wireshark-bugs,osk,3/3/08 22:29,2008-03-05 20:30:47 UTC,anders.broman
2331,GTK+ UI,RESOLVED,FIXED,Wireshark freezes when loading a capture file,3/5/08 18:30,Major,7,Windows XP,wireshark-bugs,peter.makrai,3/4/08 9:17,2008-03-04 20:12:23 UTC,jeff.morriss.ws
2332,GTK+ UI,RESOLVED,DUPLICATE,Everytime I or anyone in my workgroup create a Filter String on an IP address it stops when I get to the second octet for about 10 seconds and will take input during that time but not display it.,12/23/09 6:57,Minor,8,Linux (other),wireshark-bugs,mark.pride,3/4/08 16:57,2009-12-23 06:57:43 UTC,jeff.morriss.ws
2333,GTK+ UI,RESOLVED,FIXED,Decoding extended gateway information not implemented for sFlow,3/5/08 20:33,Normal,2,All,wireshark-bugs,acferen,3/4/08 21:26,2008-03-05 20:33:57 UTC,anders.broman
2334,Documentation,RESOLVED,FIXED,Trivial agreement problem in documentation,3/5/08 20:48,Trivial,2,All,wireshark-bugs,acferen,3/4/08 21:47,2008-03-05 20:48:00 UTC,anders.broman
2335,GTK+ UI,RESOLVED,FIXED,dissect TIPC encapsulated in TCP,3/17/08 21:35,Enhancement,3,All,wireshark-bugs,wireshark,3/6/08 17:58,2008-03-17 21:35:49 UTC,anders.broman
2336,Documentation,RESOLVED,FIXED,Documentation for dissector integration is misleading,3/7/08 5:14,Minor,3,Linux (other),solitaryprogrammer,solitaryprogrammer,3/6/08 22:29,2008-03-07 05:14:13 UTC,wmeier
2337,GTK+ UI,RESOLVED,WONTFIX,Auto scroll turns off when clicking other buttons on the toolbar,6/16/14 21:57,Minor,2,Windows XP,wireshark-bugs,Jim,3/6/08 23:08,2014-06-16 21:57:28 UTC,bugzilla-admin
2338,GTK+ UI,RESOLVED,DUPLICATE,New function: Delete Frame,10/20/10 22:59,Enhancement,4,Windows XP,wireshark-bugs,rstemminger,3/7/08 13:42,2010-10-20 22:41:35 UTC,stig
2339,GTK+ UI,RESOLVED,NOTABUG,init.lua script should be configured through config in sysconfdir,3/2/13 10:14,Normal,7,Linux (other),wireshark-bugs,pva,3/7/08 15:46,2013-03-02 10:14:17 UTC,eapache
2340,GTK+ UI,RESOLVED,NOTABUG,Wireshark 0.99.8 casues BSOD on Thinkpad T61 with Standard Windows XP,9/26/08 18:00,Critical,11,Windows XP,wireshark-bugs,rodelane,3/7/08 20:46,2008-09-26 18:00:51 UTC,stephenfisher
2341,GTK+ UI,RESOLVED,FIXED,OS X packaging patch,3/15/08 4:45,Major,4,Mac OS X 10.4,gerald,bugzilla-admin,3/7/08 23:58,2008-03-15 04:45:49 UTC,gerald
2342,GTK+ UI,RESOLVED,FIXED,emem_canary  confusion about EMEM_CANARY_DATA_SIZE,3/10/08 7:54,Major,2,Linux (other),wireshark-bugs,safari-hshfhqofegzrxbnw,3/9/08 12:22,2008-03-10 07:54:17 UTC,jaap.keuter
2343,GTK+ UI,RESOLVED,FIXED,Huge increase in Wireshark runtime memory foot print for recent win32 SVN buildbot images,3/11/08 4:18,Critical,5,Windows XP,wireshark-bugs,jyoung,3/9/08 16:50,2008-03-11 04:04:54 UTC,jyoung
2344,Dissection engine (libwireshark),RESOLVED,DUPLICATE,Real Time Messaging Protocol packet dissection bug,11/16/12 14:15,Normal,3,Windows 2000,wireshark-bugs,frigghanson,3/10/08 8:16,2008-03-13 16:03:49 UTC,guy
2345,Dissection engine (libwireshark),CONFIRMED, ---,setting src/dst in an encapsulated proto breaks reassembling of TCP,3/3/17 11:45,Major,6,All,bugzilla-admin,wireshark,3/10/08 14:29,,guy
2346,GTK+ UI,RESOLVED,FIXED,New WTAP_ENCAP types for wireshark,3/14/08 0:02,Enhancement,2,All,wireshark-bugs,hannes.kaelber--wireshark,3/10/08 16:30,2008-03-14 00:02:36 UTC,gerald
2347,GTK+ UI,RESOLVED,FIXED,X25 dissect checks payload and assumes IP before heuristics,3/16/08 10:20,Normal,10,All,wireshark-bugs,gerhard.nospam,3/11/08 16:13,2008-03-16 10:20:40 UTC,jaap.keuter
2348,GTK+ UI,RESOLVED,FIXED,Kademlia ID information incorrectly parsed by eDonkey dissector,8/24/08 8:17,Minor,7,Windows XP,wireshark-bugs,michael.kohnen,3/11/08 17:12,2008-08-24 08:17:41 UTC,anders.broman
2349,GTK+ UI,RESOLVED,FIXED,export as C arrays,3/11/08 18:24,Enhancement,3,All,wireshark-bugs,francesco.fondelli,3/11/08 17:54,2008-03-11 18:24:06 UTC,stig
2350,GTK+ UI,RESOLVED,FIXED,capture preferences: edit interfaces dialog highlighting,3/12/08 7:17,Trivial,3,Windows XP,wireshark-bugs,njen,3/12/08 2:49,2008-03-12 07:17:26 UTC,stig
2351,GTK+ UI,RESOLVED,NOTABUG,SNMP MIB parse error,3/12/08 15:17,Minor,4,Windows XP,wireshark-bugs,leon728,3/12/08 13:55,2008-03-12 15:04:05 UTC,luis.ontanon
2352,GTK+ UI,RESOLVED,FIXED,When using follow TCP stream function on large stream  error occurs,3/12/08 16:55,Minor,2,Windows XP,wireshark-bugs,paul.santangelo,3/12/08 15:03,2008-03-12 16:55:20 UTC,paul.santangelo
2353,GTK+ UI,RESOLVED,DUPLICATE,Display Filter Expression problem,3/12/08 19:03,Minor,2,Windows XP,wireshark-bugs,fortunatotony,3/12/08 16:43,2008-03-12 19:03:17 UTC,sake
2354,GTK+ UI,RESOLVED,DUPLICATE,wireshark: Filter Expression -- typing a filter name does not take you to the filter,3/13/08 4:04,Normal,2,Windows XP,wireshark-bugs,John.Eichenberger,3/13/08 2:09,2008-03-13 04:04:08 UTC,wmeier
2355,TShark,RESOLVED,FIXED,Buildbot crash output: fuzz-2008-03-12-20312.pcap,3/13/08 17:33,Critical,3,Linux (other),wireshark-bugs,buildbot-do-not-reply,3/13/08 4:10,2008-03-13 05:25:29 UTC,gerald
2356,TShark,RESOLVED,DUPLICATE,Buildbot crash output: fuzz-2008-03-12-6197.pcap,3/13/08 17:33,Critical,2,Linux (other),wireshark-bugs,buildbot-do-not-reply,3/13/08 5:40,2008-03-13 17:33:33 UTC,gerald
2357,GTK+ UI,RESOLVED,FIXED,Startup Error with GTK1 Interface,3/21/08 23:40,Critical,9,Windows 2000,wireshark-bugs,it-support,3/13/08 15:45,2008-03-21 23:40:45 UTC,gerald
2358,GTK+ UI,RESOLVED,FIXED,Problem decoding BACnet weekly-schedule with an array,3/16/08 8:45,Minor,8,Linux (other),wireshark-bugs,steve,3/13/08 17:01,2008-03-16 08:45:16 UTC,jaap.keuter
2359,GTK+ UI,RESOLVED,FIXED,Failure to detect/open valid ERF files,4/12/08 3:23,Major,10,All,wireshark-bugs,stephen.donnelly,3/13/08 22:08,2008-04-12 03:23:20 UTC,sake
2360,GTK+ UI,RESOLVED,FIXED,ISIS Display filter for LSP-ID and Hostname,3/13/08 23:46,Enhancement,2,Linux (other),wireshark-bugs,hariharan.a,3/13/08 22:26,2008-03-13 23:46:25 UTC,gerald
2361,GTK+ UI,RESOLVED,DUPLICATE,Wireshark crashed when changing an option,3/14/08 18:20,Minor,2,Windows XP,wireshark-bugs,abennet1,3/14/08 0:06,2008-03-14 18:20:02 UTC,jaap.keuter
2362,GTK+ UI,RESOLVED,FIXED,FIX protocol dissector does not handle FIX 5.x and beyond,3/14/08 21:36,Minor,2,Linux (other),wireshark-bugs,dtrammell,3/14/08 2:33,2008-03-14 21:36:42 UTC,jaap.keuter
2363,GTK+ UI,RESOLVED,WORKSFORME,Windows build does not decode lower layer when TCAP does not contain dialogue OID,3/16/08 20:33,Normal,4,Windows XP,wireshark-bugs,dwgoldfarb,3/14/08 3:24,2008-03-15 22:03:20 UTC,jeff.morriss.ws
2364,GTK+ UI,RESOLVED,FIXED,add support for ND RDNSS (icmpv6),3/18/08 0:54,Enhancement,7,Linux (other),wireshark-bugs,bboissin+wireshark,3/15/08 1:16,2008-03-17 21:22:47 UTC,anders.broman
2365,GTK+ UI,RESOLVED,WORKSFORME,IEEE 802.11 Null function decoded as PRP,1/6/09 0:30,Minor,6,All,wireshark-bugs,stig,3/17/08 16:22,2008-08-19 14:35:33 UTC,mesv
2366,GTK+ UI,RESOLVED,FIXED,X25 reassembly fragment table and dissected proto presented for all X25 packets,7/30/08 7:50,Normal,3,All,wireshark-bugs,gerhard.nospam,3/17/08 18:55,2008-07-30 07:50:38 UTC,anders.broman
2367,Documentation,RESOLVED,FIXED,Minor errors in the documentation  and an Ethereal reference,3/17/08 21:27,Trivial,2,Linux (other),wireshark-bugs,bill.pursell,3/17/08 20:44,2008-03-17 21:27:18 UTC,anders.broman
2368,GTK+ UI,RESOLVED,FIXED,Support SDP context over SIP to prevent incorrect decoding,6/8/13 7:50,Normal,26,All,wireshark-bugs,hscohen,3/18/08 18:26,2013-06-08 07:50:49 UTC,mmann78
2369,GTK+ UI,RESOLVED,FIXED,Enhancement providing parsing capability for TCP Options 20 & 21 (IANA assigned),8/14/08 2:20,Enhancement,6,All,wireshark-bugs,eric.dot.travis,3/18/08 20:37,2008-08-12 14:09:13 UTC,stig
2370,GTK+ UI,RESOLVED,NOTABUG,V1.0.0pre1 Fax T.38 Analysis & VoIP Calls,4/11/08 21:12,Enhancement,9,Windows XP,wireshark-bugs,keithfrench,3/18/08 22:09,2008-04-11 21:12:23 UTC,keithfrench
2372,GTK+ UI,RESOLVED,FIXED,Memory leakage in epan/oids.c,3/17/09 11:04,Normal,4,Windows XP,wireshark-bugs,stig,3/19/08 1:11,2009-03-17 11:04:33 UTC,wmeier
2373,GTK+ UI,RESOLVED,FIXED,New TeamSpeak2 dissector plugin,8/10/08 16:31,Enhancement,10,All,wireshark-bugs,brooss.teambb,3/19/08 11:01,2008-08-09 11:36:41 UTC,brooss.teambb
2374,GTK+ UI,RESOLVED,FIXED,Wireshark crashes in libcairo-2.dll on invoking preferences window.,9/3/13 7:03,Major,3,Windows XP,wireshark-bugs,engelenh,3/19/08 13:15,2008-03-19 16:09:30 UTC,fritzs
2375,GTK+ UI,RESOLVED,FIXED,Wireshark memory leak with each file open and/or display filter change,10/16/09 12:32,Normal,6,Windows XP,wireshark-bugs,jyoung,3/19/08 14:03,2009-10-16 12:32:30 UTC,wmeier
2376,GTK+ UI,RESOLVED,FIXED,"UDP packet (KLive) wrongly dissected as ""Redback Lawful Intercept""",8/29/08 4:27,Minor,8,Linux (other),wireshark-bugs,toralf.foerster,3/19/08 16:39,2008-04-10 19:57:03 UTC,sake
2377,GTK+ UI,RESOLVED,FIXED,Add % (percent) column to Summary View,9/30/12 11:28,Enhancement,4,All,wireshark-bugs,mikeswe,3/20/08 2:53,2012-09-30 11:28:55 UTC,Christopher.Maynard
2378,GTK+ UI,RESOLVED,FIXED,Window scaling bug,4/5/08 20:04,Normal,7,Windows XP,wireshark-bugs,ramin,3/20/08 3:02,2008-04-05 20:04:55 UTC,sake
2379,GTK+ UI,RESOLVED,DUPLICATE,Wireshark doesn't flush the latest packets,3/20/08 21:30,Normal,2,Linux (other),wireshark-bugs,atschi,3/20/08 10:54,2008-03-20 21:30:43 UTC,sake
2380,GTK+ UI,RESOLVED,FIXED,SMTP dissector getting confused by multiple commands/responses per packet while pipelining is in effect,6/30/10 5:30,Major,4,Windows XP,wireshark-bugs,kai-wireshark-bugs,3/20/08 15:23,2010-06-30 05:30:28 UTC,graeme
2381,GTK+ UI,RESOLVED,FIXED,bugs in eigrp dissector,7/1/08 14:49,Major,12,Windows XP,wireshark-bugs,maximivanov,3/21/08 9:32,2008-07-01 14:49:24 UTC,jeff.morriss.ws
2382,Documentation,RESOLVED,FIXED,Typos in README.developer,3/21/08 23:44,Trivial,3,Linux (other),wireshark-bugs,bill.pursell,3/21/08 19:45,2008-03-21 23:44:02 UTC,stephenfisher
2383,Documentation,RESOLVED,FIXED,Typos in documentation,3/23/08 9:07,Trivial,2,Linux (other),wireshark-bugs,bill.pursell,3/22/08 13:23,2008-03-23 09:07:46 UTC,jaap.keuter
2384,GTK+ UI,RESOLVED,FIXED,SMPP+ which is customized by Huawei company can't be decoded,9/24/11 6:30,Major,25,All,wireshark-bugs,xubo.leo,3/24/08 20:22,2011-09-24 06:29:50 UTC,alexis.lagoutte
2385,GTK+ UI,RESOLVED,FIXED,saving preferences does not handle multiline descriptions properly,7/16/08 11:10,Minor,2,All,wireshark-bugs,balint,3/26/08 14:09,2008-07-16 11:10:42 UTC,jaap.keuter
2386,GTK+ UI,RESOLVED,FIXED,packet selection lost affer a re-sort,8/25/10 7:28,Normal,3,Linux (other),wireshark-bugs,toralf.foerster,3/26/08 15:09,2010-08-25 07:28:27 UTC,jeff.morriss.ws
2387,GTK+ UI,RESOLVED,FIXED,Setting a time reference causes the first packet to be counted twice in the cum bytes field.,3/26/08 16:57,Major,2,Windows XP,wireshark-bugs,adam.wright,3/26/08 16:13,2008-03-26 16:57:40 UTC,stig
2388,GTK+ UI,RESOLVED,FIXED,Most ANSI A information elements are not displayed,4/8/08 14:44,Major,4,All,wireshark-bugs,michael.lum,3/26/08 18:19,2008-04-08 14:44:18 UTC,anders.broman
2389,GTK+ UI,RESOLVED,NOTABUG,X11 version 2.1.1 still crashes when attempting to start wireshark,3/26/08 23:40,Major,2,Mac OS X 10.5,wireshark-bugs,dave.brooks,3/26/08 23:21,2008-03-26 23:40:01 UTC,guy
2390,GTK+ UI,RESOLVED,FIXED,Show MTU discovery bytes in TIPC Link State messages,4/8/08 14:50,Enhancement,2,All,wireshark-bugs,wireshark,3/27/08 15:45,2008-04-08 14:50:57 UTC,anders.broman
2391,GTK+ UI,RESOLVED,NOTABUG,Malformed Packets: SCCP in sigtran (ip/sctp/m2pa/sccp),4/23/08 12:05,Major,4,Linux (other),wireshark-bugs,scott.garcia40,3/27/08 20:00,2008-04-23 12:05:40 UTC,anders.broman
2392,GTK+ UI,RESOLVED,FIXED,Segmentation Fault in BSSAPP,3/27/08 23:18,Critical,4,Linux (other),wireshark-bugs,rbywater,3/27/08 22:02,2008-03-27 23:18:03 UTC,gerald
2393,GTK+ UI,RESOLVED,FIXED,E212 Mobile network code 3rd digit is not correctly decoded,3/30/08 12:43,Major,3,Windows 2000,wireshark-bugs,sunyin51,3/28/08 20:40,2008-03-30 12:43:51 UTC,jaap.keuter
2395,TShark,RESOLVED,FIXED,BOOTP dissector fails to initialize/display some values,4/3/08 2:37,Major,3,All,jmayer,jmayer,3/30/08 16:13,2008-04-03 02:37:57 UTC,stephenfisher
2396,GTK+ UI,RESOLVED,FIXED,Wrong ethertype for 802.1ah (MAC-in-MAC) Instance tag,6/11/08 11:20,Normal,6,Linux (other),wireshark-bugs,johan.andersson,3/31/08 6:31,2008-06-11 11:20:40 UTC,jaap.keuter
2397,GTK+ UI,RESOLVED,NOTABUG,current svn version of wireshark crashes,4/12/08 5:43,Major,3,Linux (other),wireshark-bugs,toralf.foerster,3/31/08 14:25,2008-04-12 05:43:51 UTC,toralf.foerster
2398,GTK+ UI,RESOLVED,NOTABUG,openssl dependency and --with-ssl configure switch are redundant,4/1/08 17:20,Enhancement,4,Linux (other),wireshark-bugs,pva,3/31/08 17:30,2008-04-01 17:20:06 UTC,jmayer
2399,GTK+ UI,RESOLVED,FIXED,Patch to add Turbocell data dissection,4/10/08 23:57,Enhancement,8,All,wireshark-bugs,jeromepoulin,4/1/08 6:22,2008-04-10 23:57:54 UTC,jaap.keuter
2400,GTK+ UI,RESOLVED,FIXED,MIKEY dissector improved,4/7/08 6:37,Normal,4,All,wireshark-bugs,jerrydav,4/2/08 1:34,2008-04-07 06:37:32 UTC,jaap.keuter
2401,GTK+ UI,VERIFIED,FIXED,Wireshark will crush when decoding wimax SBC-REQ/SBC-RSP,4/24/08 23:27,Critical,12,All,wireshark-bugs,chris.yang,4/2/08 3:20,2008-04-10 07:13:08 UTC,jaap.keuter
2402,Dissection engine (libwireshark),CONFIRMED, ---,Data string filter crash,2/4/16 22:35,Major,19,Windows XP,bugzilla-admin,ssbattaglia,4/2/08 15:57,,peter
2403,GTK+ UI,RESOLVED,FIXED,Crash while closing capture file,4/8/10 19:20,Normal,2,Windows XP,wireshark-bugs,steve.gury,4/2/08 16:05,2010-04-08 19:20:21 UTC,jeff.morriss.ws
2404,GTK+ UI,RESOLVED,FIXED,Added BACnet Vendor ID names and Property ID display filter,4/7/08 6:13,Enhancement,2,Linux (other),wireshark-bugs,steve,4/2/08 17:47,2008-04-07 06:13:00 UTC,jaap.keuter
2405,Build process,RESOLVED,FIXED,build debian-package broken: misspelled variable in Makefile.am,1/26/15 22:41,Normal,3,Linux (other),wireshark-bugs,vonbraun,4/2/08 18:14,2008-04-04 06:25:56 UTC,guy
2406,GTK+ UI,RESOLVED,FIXED,Configure script detects portaudio v18 & v19 fine  so debian/control can depend on libportaudio-dev OR portaudio19-dev. Helps with building .deb packages for use under UBUNTU,4/20/08 5:30,Minor,2,Linux (other),wireshark-bugs,vonbraun,4/2/08 18:25,2008-04-20 05:30:40 UTC,stig
2407,GTK+ UI,RESOLVED,FIXED,wshark crashes expert info composite,10/1/08 18:29,Major,23,Windows XP,wireshark-bugs,patrick.weichmann,4/3/08 12:16,2008-04-07 22:32:09 UTC,jeff.morriss.ws
2408,GTK+ UI,RESOLVED,FIXED,EyeSDN trace format per packet encapsulation  SS7  layer 1 msgs,4/20/08 4:56,Enhancement,6,Linux (other),wireshark-bugs,rolf.fiedler,4/4/08 12:56,2008-04-20 04:56:53 UTC,stig
2409,GTK+ UI,RESOLVED,FIXED,Export WiMAX Management Message dissector,4/5/08 5:08,Enhancement,2,All,wireshark-bugs,hoiho.chan,4/5/08 1:12,2008-04-05 05:08:32 UTC,martin.r.mathieson
2410,TShark,RESOLVED,FIXED,Buildbot crash output: fuzz-2008-04-05-428.pcap,5/2/08 14:57,Critical,7,Linux (other),wireshark-bugs,buildbot-do-not-reply,4/5/08 17:50,2008-05-02 14:57:41 UTC,wmeier
2411,GTK+ UI,RESOLVED,FIXED,Decoding problem,10/9/08 13:15,Normal,5,Windows Vista,wireshark-bugs,link2009,4/5/08 18:59,2008-10-09 13:15:22 UTC,link2009
2412,GTK+ UI,RESOLVED,FIXED,Feature request: expert info configuration framework,6/16/14 19:20,Enhancement,21,All,wireshark-bugs,jyoung,4/6/08 1:35,2014-06-16 19:20:13 UTC,mmann78
2413,Documentation,RESOLVED,FIXED,typo in wslua_gui.c,4/10/08 15:26,Trivial,4,Linux (other),wireshark-bugs,nm127,4/6/08 13:09,2008-04-10 15:26:55 UTC,jeff.morriss.ws
2414,GTK+ UI,RESOLVED,FIXED,Statistics > Multicast Streams are broken,6/10/08 22:48,Major,3,Windows XP,wireshark-bugs,peter.cigehn,4/6/08 19:31,2008-04-07 21:22:22 UTC,jaap.keuter
2415,GTK+ UI,RESOLVED,NOTABUG,new WTAP_ENCAP files,4/7/08 9:05,Enhancement,1,All,wireshark-bugs,hannes.kaelber--wireshark,4/7/08 8:23,2008-04-07 09:05:34 UTC,hannes.kaelber--wireshark
2416,GTK+ UI,RESOLVED,FIXED,New RSVP dissector features,4/14/08 12:46,Enhancement,5,All,wireshark-bugs,roberto.morro,4/7/08 9:08,2008-04-14 12:46:06 UTC,stig
2417,GTK+ UI,RESOLVED,FIXED,A couple of new display filters for OSPF dissector,4/10/08 21:44,Enhancement,5,All,wireshark-bugs,roberto.morro,4/7/08 9:15,2008-04-10 21:44:21 UTC,jaap.keuter
2418,GTK+ UI,RESOLVED,FIXED,new WTAP_ENCAP files,4/23/08 13:23,Enhancement,3,All,wireshark-bugs,hannes.kaelber--wireshark,4/7/08 9:16,2008-04-23 13:23:37 UTC,anders.broman
2419,GTK+ UI,RESOLVED,FIXED,New features for the LMP dissector,4/14/08 23:48,Enhancement,5,All,wireshark-bugs,roberto.morro,4/7/08 9:20,2008-04-14 23:48:27 UTC,jaap.keuter
2420,GTK+ UI,RESOLVED,FIXED,CRC32C merge: iSCSI  SCTP,4/12/08 5:47,Normal,3,All,wireshark-bugs,frey.philip,4/7/08 9:24,2008-04-12 05:47:31 UTC,stig
2421,GTK+ UI,RESOLVED,FIXED,TCP Graphs and Graph control windows can not be minimised independently of the main window.,10/28/09 3:05,Normal,7,Windows Vista,wireshark-bugs,bod43,4/7/08 12:45,2009-10-28 03:05:15 UTC,jaap.keuter
2422,Qt UI,RESOLVED,FIXED,"The ""Wireless Settings"" toolbar should support non-AirPcap adapters",6/27/16 17:12,Enhancement,4,All,wireshark-bugs,gerald,4/7/08 21:53,2016-06-27 17:12:53 UTC,gerald
2423,GTK+ UI,RESOLVED,DUPLICATE,"No support for port ranges & incorrect ""dcp"" comparison.",4/9/08 19:51,Normal,4,All,wireshark-bugs,Christopher.Maynard,4/8/08 0:52,2008-04-09 19:51:00 UTC,Christopher.Maynard
2424,GTK+ UI,RESOLVED,NOTABUG,Interfaces list is empty under Mac OS X 10.4.11,5/19/10 17:59,Blocker,7,Mac OS X 10.4,wireshark-bugs,eugene.vasserman,4/8/08 3:27,2008-04-08 04:11:15 UTC,guy
2425,Documentation,RESOLVED,FIXED,"""Read me first"" file is empty in the OS X .dmg",7/7/08 16:13,Critical,7,Mac OS X 10.4,wireshark-bugs,guy,4/8/08 4:00,2008-07-07 16:12:34 UTC,jeff.morriss.ws
2426,GTK+ UI,RESOLVED,FIXED,SNMPv3 Engine ID registration,1/28/13 13:09,Normal,17,Windows XP,wireshark-bugs,wbenton,4/8/08 5:13,2013-01-28 13:09:00 UTC,mmann78
2427,GTK+ UI,RESOLVED,FIXED,Add exports for packet-gsm_a decoding functions in libwireshark.def,4/12/08 10:09,Normal,3,Windows 2000,wireshark-bugs,jonas.a.nilsson,4/8/08 13:43,2008-04-12 10:09:50 UTC,anders.broman
2428,Dissection engine (libwireshark),CONFIRMED, ---,Easier Filter on MACs,6/17/14 23:17,Enhancement,3,All,bugzilla-admin,shanon,4/9/08 0:00,,guy
2429,GTK+ UI,RESOLVED,FIXED,Shift+right arrow doesn't select characters in display filter text box,12/10/16 15:08,Minor,9,Linux (other),wireshark-bugs,jaap.keuter,4/9/08 7:00,2016-12-10 04:11:40 UTC,mmann78
2430,GTK+ UI,RESOLVED,FIXED,bogus end tag on PDML file at the end of a video streaming packet,9/22/08 21:38,Major,5,Linux (other),wireshark-bugs,diego.dujovne,4/9/08 12:16,2008-09-22 21:38:46 UTC,jaap.keuter
2431,GTK+ UI,RESOLVED,FIXED,X25 Error dissecting Packet Size Negotiation Facility,4/12/08 6:47,Normal,9,All,wireshark-bugs,jromanr,4/9/08 13:23,2008-04-12 06:43:35 UTC,stig
2432,TShark,RESOLVED,FIXED,failed tshark PDML export to file,12/12/11 10:37,Minor,8,Linux (other),wireshark-bugs,diego.dujovne,4/9/08 14:03,2011-12-12 10:37:07 UTC,Christopher.Maynard
2433,GTK+ UI,RESOLVED,FIXED,add parsing of port ranges in ./wireshark/services,4/12/08 7:09,Enhancement,8,All,wireshark-bugs,acferen,4/9/08 16:56,2008-04-12 07:09:01 UTC,stig
2434,GTK+ UI,RESOLVED,FIXED,stupid comment typos.,4/12/08 2:37,Trivial,4,All,wireshark-bugs,acferen,4/9/08 17:11,2008-04-12 02:37:32 UTC,sake
2435,GTK+ UI,RESOLVED,DUPLICATE,Typing a search for a menu only allows one character (i.e. Edit->Preferences),4/9/08 19:17,Normal,2,Windows Vista,wireshark-bugs,enfiniti27,4/9/08 17:52,2008-04-09 19:17:14 UTC,Christopher.Maynard
2436,GTK+ UI,RESOLVED,DUPLICATE,"Trying to view ""Expert Info Composite"" crashes Wireshark",4/10/08 15:25,Major,4,Windows Vista,wireshark-bugs,enfiniti27,4/9/08 18:26,2008-04-10 15:25:23 UTC,jeff.morriss.ws
2437,GTK+ UI,RESOLVED,DUPLICATE,Columns dependent upon name resolution do not update as name resolution is turned on/off.,4/10/08 1:25,Normal,5,All,wireshark-bugs,Christopher.Maynard,4/9/08 19:03,2008-04-10 01:25:02 UTC,stephenfisher
2439,GTK+ UI,RESOLVED,FIXED,patch for tvb_get_bits16 not to read past end of buffer,4/12/08 10:01,Normal,6,All,wireshark-bugs,mccart,4/9/08 21:31,2008-04-12 10:01:46 UTC,anders.broman
2440,GTK+ UI,RESOLVED,FIXED,RTCP MOS fields display wrong values,4/10/08 20:57,Minor,3,Windows XP,wireshark-bugs,blairp,4/9/08 22:13,2008-04-10 06:48:45 UTC,jaap.keuter
2441,GTK+ UI,RESOLVED,DUPLICATE,root warning dialog is behind main window but has focus,3/8/12 7:13,Normal,6,Linux (other),wireshark-bugs,ted,4/10/08 3:55,2012-03-08 07:13:46 UTC,jeff.morriss.ws
2442,GTK+ UI,RESOLVED,FIXED,some SNMP trap packets parse error,4/23/08 12:14,Major,6,Windows XP,wireshark-bugs,sciwander,4/10/08 8:58,2008-04-21 11:24:42 UTC,anders.broman
2443,GTK+ UI,RESOLVED,FIXED,New dissectors for the iWARP protocol stack (MPA DDP RDMAP),4/14/08 12:22,Normal,5,All,wireshark-bugs,frey.philip,4/10/08 9:33,2008-04-14 12:22:41 UTC,stig
2444,GTK+ UI,RESOLVED,FIXED,NTLMSSP protocol dissector doesn't parse NTLMSSP in DCERPC packets with packet level auth,7/16/13 19:45,Normal,5,Windows XP,wireshark-bugs,jlarimer,4/10/08 17:55,2008-04-23 13:29:06 UTC,jeff.morriss.ws
2445,Documentation,RESOLVED,FIXED,register_menu() Lua function has three parameters,4/10/08 23:28,Major,4,Linux (other),wireshark-bugs,nm127,4/10/08 19:14,2008-04-10 20:08:29 UTC,luis.ontanon
2446,GTK+ UI,RESOLVED,FIXED,"Painting of ""Packet Bytes"" pane",2/1/10 12:38,Minor,3,Windows Vista,wireshark-bugs,dennis_nybro,4/10/08 21:09,2010-02-01 12:38:46 UTC,anders.broman
2447,Documentation,RESOLVED,FIXED,Capitalize chapter titles under 10.4.x in help for wslua,4/12/08 6:57,Trivial,2,Linux (other),wireshark-bugs,nm127,4/10/08 21:10,2008-04-12 06:57:24 UTC,stig
2448,Documentation,RESOLVED,FIXED,wslua: the names of tvbrange:get_*() functions are incorrectly documented,4/11/08 0:00,Normal,2,Linux (other),wireshark-bugs,nm127,4/10/08 21:31,2008-04-11 00:00:20 UTC,luis.ontanon
2449,GTK+ UI,RESOLVED,FIXED,Can't stop a  live capture if network name resolution is enabled.,12/2/09 18:47,Major,2,Windows XP,wireshark-bugs,Christopher.Maynard,4/11/08 19:58,2009-12-02 18:47:06 UTC,Christopher.Maynard
2450,GTK+ UI,RESOLVED,NOTABUG,HTTP messages not being reassembled,8/9/08 0:44,Major,7,Linux (other),wireshark-bugs,yang.wiresharkbugs,4/11/08 20:15,2008-08-09 00:44:57 UTC,sake
2451,GTK+ UI,RESOLVED,FIXED,nettl (HP-UX) enhancement: Add IGSSN (AVIO) and ICXGBE (10Gbe) support,4/12/08 2:25,Enhancement,5,All,wireshark-bugs,mbrown,4/11/08 20:55,2008-04-12 02:25:01 UTC,jaap.keuter
2452,GTK+ UI,RESOLVED,FIXED,Ports incorrectly decoded as DPLAY instead of RTP,4/12/08 16:46,Major,3,Windows XP,wireshark-bugs,keithfrench,4/11/08 21:08,2008-04-12 16:46:23 UTC,jaap.keuter
2453,GTK+ UI,RESOLVED,FIXED,segmentation fault with wslua script,5/10/09 9:05,Critical,41,All,wireshark-bugs,nm127,4/12/08 1:06,2008-07-26 16:43:54 UTC,stig
2454,GTK+ UI,RESOLVED,FIXED,No decode for block type 8 in RTCP extended reports,4/12/08 15:20,Enhancement,4,All,wireshark-bugs,m.davies,4/12/08 14:39,2008-04-12 15:20:53 UTC,stig
2455,GTK+ UI,RESOLVED,FIXED,WSLUA_CLASS_DEFINE documentation,4/20/08 22:29,Enhancement,4,Linux (other),wireshark-bugs,nm127,4/13/08 12:00,2008-04-20 22:29:07 UTC,anders.broman
2456,GTK+ UI,RESOLVED,FIXED,Incorrect decoding of DST MAC address of frame containing ICMPv6 Echo Request,4/14/08 5:11,Normal,2,Windows XP,wireshark-bugs,kfall,4/13/08 18:44,2008-04-14 05:11:58 UTC,jaap.keuter
2457,GTK+ UI,RESOLVED,FIXED,patch to fix wireshark-filter man page for packet-diameter_3gpp.c fields,4/13/08 23:44,Minor,3,Linux (other),wireshark-bugs,jyoung,4/13/08 20:28,2008-04-13 23:44:43 UTC,jaap.keuter
2458,GTK+ UI,RESOLVED,FIXED,"Unknown PPPoE TAGs which are present in a PPPoE discovery packet are not displayed under ""PPPoE Tags"" subtree/section",4/18/08 1:04,Major,7,Windows XP,wireshark-bugs,Jewgenij.Bytschkow,4/14/08 1:25,2008-04-18 01:04:17 UTC,Jewgenij.Bytschkow
2459,GTK+ UI,RESOLVED,NOTABUG,New columns for automotive packets,5/7/08 4:08,Enhancement,9,All,wireshark-bugs,hannes.kaelber--wireshark,4/14/08 1:30,2008-05-07 04:08:40 UTC,hannes.kaelber--wireshark
2460,GTK+ UI,RESOLVED,FIXED,PKIXCMP: update TCP transport style  add OIDs and content types,4/20/08 22:27,Enhancement,2,All,wireshark-bugs,wireshark,4/14/08 5:31,2008-04-20 22:27:10 UTC,anders.broman
2462,Extras,RESOLVED,FIXED,Packet rate missing from capinfos output,4/14/08 13:03,Enhancement,4,All,wireshark-bugs,acferen,4/14/08 11:33,2008-04-14 13:03:11 UTC,stig
2463,GTK+ UI,RESOLVED,FIXED,Wireshark needs a command line argument to set the display filter,9/26/11 23:03,Enhancement,18,All,wireshark-bugs,vinay.chilakamarri,4/14/08 13:55,2011-09-23 07:21:46 UTC,Christopher.Maynard
2464,TShark,RESOLVED,FIXED,Buildbot crash output: fuzz-2008-04-14-19457.pcap,4/16/08 0:19,Critical,3,All,wireshark-bugs,buildbot-do-not-reply,4/14/08 16:00,2008-04-14 23:59:34 UTC,guy
2465,GTK+ UI,RESOLVED,NOTABUG,LDAP Message ID parsing error,4/15/08 5:11,Normal,4,Windows 2000,wireshark-bugs,chrisb,4/15/08 2:17,2008-04-15 03:53:57 UTC,chrisb
2466,GTK+ UI,RESOLVED,FIXED,Add XTP(Xpress Transport Protocol) dissector,8/8/08 1:31,Enhancement,13,Linux (other),wireshark-bugs,naka_shigeo,4/16/08 4:16,2008-04-19 02:21:32 UTC,xdbupt
2467,Dissection engine (libwireshark),RESOLVED,WORKSFORME,Failed assertion with decoded SNMPv3 packets (with SMI),9/17/14 20:13,Major,6,Mac OS X 10.4,wireshark-bugs,dbishop,4/16/08 11:11,2014-06-16 21:46:09 UTC,guy
2468,GTK+ UI,RESOLVED,FIXED,Dissector bug  protocol SNMP: proto.c:932: failed assertion,4/22/08 12:31,Major,6,Windows XP,wireshark-bugs,jreimer,4/16/08 13:45,2008-04-22 12:31:49 UTC,anders.broman
2469,GTK+ UI,RESOLVED,FIXED,Fix missing dissection of SignalInfo in MAP SMS operations,4/17/08 13:28,Enhancement,2,Linux (other),wireshark-bugs,vasil_vel,4/16/08 18:12,2008-04-17 13:28:03 UTC,anders.broman
2470,TShark,RESOLVED,FIXED,Buildbot crash output: fuzz-2008-04-16-7479.pcap,7/3/08 8:32,Critical,9,Linux (other),wireshark-bugs,buildbot-do-not-reply,4/16/08 18:30,2008-05-21 11:05:19 UTC,wmeier
2471,GTK+ UI,RESOLVED,FIXED,Add dissection of MAP BeginSubscriberActivity operation,4/17/08 0:47,Major,2,Linux (other),wireshark-bugs,vasil_vel,4/16/08 20:48,2008-04-17 00:47:51 UTC,stig
2472,GTK+ UI,RESOLVED,FIXED,Decoding error in protocol DNS - section Flags for AD and CD bits information,8/2/12 14:46,Major,9,Linux (other),wireshark-bugs,frank.maerz,4/16/08 23:50,2010-04-13 10:42:03 UTC,jaap.keuter
2473,Extras,RESOLVED,NOTABUG,Using GOptions instead of getopt,5/15/14 16:02,Enhancement,5,All,wireshark-bugs,acferen,4/17/08 4:23,2014-05-15 16:02:40 UTC,mmann78
2474,GTK+ UI,RESOLVED,NOTABUG,Error decoding field genericNumbers of Camel Connect,4/23/08 4:01,Major,3,Windows XP,wireshark-bugs,Eber.Mello,4/18/08 0:05,2008-04-23 04:01:52 UTC,anders.broman
2475,GTK+ UI,RESOLVED,FIXED,UDP Not Decoded as UNIStim,4/22/08 0:57,Major,5,Windows XP,wireshark-bugs,keithfrench,4/18/08 5:46,2008-04-22 00:57:02 UTC,jaap.keuter
2476,GTK+ UI,RESOLVED,FIXED,Build fails on webbrowser.c on FreeBSD,4/18/08 12:34,Major,3,FreeBSD,wireshark-bugs,mccart,4/18/08 11:02,2008-04-18 11:08:27 UTC,guy
2477,TShark,RESOLVED,FIXED,Illegal characters in XML output for ssh.padding_string,4/30/08 6:37,Normal,4,Windows XP,wireshark-bugs,robert.e.cranfill,4/18/08 11:06,2008-04-30 06:37:10 UTC,martin.r.mathieson
2478,GTK+ UI,RESOLVED,FIXED,Open file dialog always displayed when clicking anywhere on Wireshark,11/18/10 1:27,Major,11,Windows XP,wireshark-bugs,graeme,4/19/08 8:20,2010-02-25 09:42:27 UTC,jaap.keuter
2479,GTK+ UI,RESOLVED,DUPLICATE,bug in ldap dissector,4/19/08 21:42,Major,2,Linux (other),wireshark-bugs,felix-wireshark,4/19/08 16:53,2008-04-19 21:42:34 UTC,jyoung
2480,GTK+ UI,RESOLVED,FIXED,Custom column  wrong display of 802.11 Sleep mode status,4/24/08 22:18,Minor,4,Windows XP,wireshark-bugs,rleutert,4/20/08 5:24,2008-04-24 22:18:19 UTC,stephenfisher
2482,GTK+ UI,CONFIRMED, ---,Some Wireshark Firewall ACL Rules are off-the-mark,4/21/08 12:58,Minor,6,Mac OS X 10.4,wireshark-bugs,po,4/20/08 16:26,,
2483,GTK+ UI,RESOLVED,DUPLICATE,Preferences ignores key presses,4/20/08 17:56,Minor,2,Windows XP,wireshark-bugs,jrdepriest,4/20/08 17:46,2008-04-20 17:56:57 UTC,wmeier
2484,Dissection engine (libwireshark),RESOLVED,FIXED,make the visibility of some emem.c variables to file local,1/26/15 22:42,Minor,4,All,wireshark-bugs,nm127,4/20/08 23:34,2008-04-21 02:02:50 UTC,guy
2485,GTK+ UI,RESOLVED,FIXED,update to the STUN2 dissector using the last draft  draft-ietf-behave-rfc3489bis-15,4/21/08 14:13,Enhancement,2,All,wireshark-bugs,gael,4/21/08 5:48,2008-04-21 14:13:22 UTC,jaap.keuter
2486,GTK+ UI,RESOLVED,FIXED,Add SyncFork and SyncDir support to AFP dissector,4/21/08 14:42,Enhancement,4,Mac OS X 10.5,wireshark-bugs,alexthepuffin,4/21/08 14:25,2008-04-21 14:36:48 UTC,stig
2487,Documentation,RESOLVED,NOTABUG,Analyze -> Display Filter Macros -> Help = <none>,4/23/08 10:13,Minor,5,Windows XP,wireshark-bugs,Christopher.Maynard,4/21/08 19:05,2008-04-21 23:40:14 UTC,ulf.lamping
2488,GTK+ UI,RESOLVED,FIXED,Statistics support for UCP dissector,5/3/08 2:51,Enhancement,7,All,wireshark-bugs,sarkar.abhik,4/21/08 23:36,2008-05-03 02:51:10 UTC,jaap.keuter
2489,Dissection engine (libwireshark),RESOLVED,WONTFIX,show loaded MIB for index part of SNMP packet,7/30/14 20:37,Enhancement,2,All,bugzilla-admin,leon728,4/21/08 23:58,2014-07-30 20:37:04 UTC,guy
2490,GTK+ UI,RESOLVED,FIXED,Sequence Number for DTAP messages,9/29/08 9:53,Enhancement,2,Windows XP,wireshark-bugs,euzunca,4/22/08 6:00,2008-09-29 09:53:51 UTC,anders.broman
2491,GTK+ UI,RESOLVED,FIXED,Expert Info Composite dialog triggers Gtk-CRITICAL **: gtk_label_set_text: assertion,4/23/08 16:12,Minor,3,Linux (other),wireshark-bugs,jyoung,4/22/08 7:32,2008-04-23 16:12:53 UTC,jaap.keuter
2493,GTK+ UI,RESOLVED,FIXED,Wireshark compile errors for cygwin flex (v 2.5.35) generated . c files,6/9/08 5:24,Normal,24,Windows Vista,wireshark-bugs,wmeier,4/22/08 11:42,2008-05-02 15:17:38 UTC,wmeier
2494,GTK+ UI,RESOLVED,FIXED,Fix dissection of Location and Generic Number in CAMEL,4/22/08 22:18,Enhancement,1,Linux (other),wireshark-bugs,vasil_vel,4/22/08 13:28,2008-04-22 22:18:06 UTC,anders.broman
2495,GTK+ UI,CONFIRMED, ---,Wireshark does not respect user's umask; inconsistent file permissions when saving,4/25/08 12:25,Normal,5,All,wireshark-bugs,vandry,4/22/08 13:43,,
2496,GTK+ UI,RESOLVED,FIXED,UDP Not Decoded as UNIStim - Still not decoding correctly,4/23/08 0:41,Major,4,Windows XP,wireshark-bugs,keithfrench,4/22/08 14:26,2008-04-23 00:41:14 UTC,keithfrench
2497,GTK+ UI,RESOLVED,FIXED,RTP heuristic interferes with STUN/T38 portion of heuristic,4/23/08 3:47,Minor,2,Mac OS X 10.4,wireshark-bugs,randomkodemonkey,4/22/08 15:08,2008-04-23 03:47:23 UTC,jaap.keuter
2498,GTK+ UI,RESOLVED,FIXED,fix RFC4191 handling,4/23/08 13:42,Trivial,4,Linux (other),wireshark-bugs,bboissin+wireshark,4/23/08 6:17,2008-04-23 13:42:36 UTC,anders.broman
2499,GTK+ UI,RESOLVED,FIXED,PKIXCMP: fix new plain TCP transport style  add OID and preferences,4/23/08 13:50,Normal,2,All,wireshark-bugs,wireshark,4/23/08 8:21,2008-04-23 13:50:15 UTC,anders.broman
2500,GTK+ UI,RESOLVED,FIXED,last entry of a luaL_reg[] should be { NULL  NULL } instead of { 0  0 },4/25/08 12:02,Trivial,2,All,wireshark-bugs,nm127,4/24/08 8:44,2008-04-25 12:02:47 UTC,jaap.keuter
2501,GTK+ UI,RESOLVED,FIXED,"[dissector bug: proto.c:932: failed assertion ""dissector_assert_not_reached""]",4/24/08 14:52,Normal,2,Windows XP,wireshark-bugs,mohanbabu.kandra,4/24/08 13:53,2008-04-24 14:52:16 UTC,stig
2502,GTK+ UI,RESOLVED,DUPLICATE,Wireshark crashing when trying to decode SBC_REQ and SBC_RSP messages,4/24/08 23:27,Critical,2,Windows XP,wireshark-bugs,mohanbabu.kandra,4/24/08 14:25,2008-04-24 23:27:44 UTC,jaap.keuter
2503,GTK+ UI,RESOLVED,FIXED,cleanup ident of epan/wslua/init_wslua.c,4/26/08 1:19,Trivial,4,All,wireshark-bugs,nm127,4/25/08 2:39,2008-04-25 12:05:12 UTC,jaap.keuter
2504,GTK+ UI,RESOLVED,FIXED,Slow response when using Expert Info Composite,1/3/10 11:12,Normal,9,Linux (other),wireshark-bugs,andersen7,4/26/08 14:26,2010-01-03 06:57:42 UTC,anders.broman
2505,GTK+ UI,RESOLVED,FIXED,RTP header extensions with length>4 bytes dissected incorrectly,4/27/08 4:31,Normal,3,All,alon,alon,4/27/08 1:25,2008-04-27 04:31:41 UTC,jaap.keuter
2506,TShark,RESOLVED,DUPLICATE,Buildbot crash output: fuzz-2008-04-27-731.pcap,4/27/08 22:50,Critical,2,Linux (other),wireshark-bugs,buildbot-do-not-reply,4/27/08 17:21,2008-04-27 22:50:03 UTC,wmeier
2507,GTK+ UI,RESOLVED,FIXED,Decode ASN.1 BER encoded UTCTime,8/1/08 9:44,Enhancement,9,All,wireshark-bugs,wireshark,4/28/08 5:50,2008-08-01 09:44:26 UTC,stig
2508,TShark,RESOLVED,FIXED,Buildbot crash output: fuzz-2008-04-28-28082.pcap,4/29/08 5:29,Critical,2,Linux (other),wireshark-bugs,buildbot-do-not-reply,4/28/08 6:10,2008-04-29 05:29:40 UTC,jeff.morriss.ws
2509,Dissection engine (libwireshark),RESOLVED,WORKSFORME,SCCP dissector - assoc->calling_ssn or assoc->called_ssn leaks to next packets,6/20/14 19:32,Normal,13,Windows XP,bugzilla-admin,j.pedro.fonseca,4/28/08 6:23,2014-06-20 19:32:07 UTC,jeff.morriss.ws
2510,GTK+ UI,RESOLVED,FIXED,unable to build LUA plugin with Sun C on Solaris,11/18/08 6:56,Normal,7,Solaris,wireshark-bugs,io,4/28/08 13:01,2008-11-18 06:56:55 UTC,balint
2511,Dissection engine (libwireshark),RESOLVED,DUPLICATE,Wrong TCP DUP and out-of-order analysis in different VLANs,1/24/17 21:35,Minor,2,All,wireshark-bugs,cyrille.hombecq,4/28/08 14:08,2010-09-15 12:27:01 UTC,guy
2512,GTK+ UI,VERIFIED,FIXED,Need EAP decoder to decode PKM_ATTR_PKM_EAP_PAYLOAD,5/8/08 0:40,Major,5,Windows XP,wireshark-bugs,cfreeer,4/28/08 19:17,2008-04-30 02:17:37 UTC,cfreeer
2513,GTK+ UI,RESOLVED,FIXED,compilation failure on non-european windows (due to non-ascii characters),5/2/08 1:28,Minor,3,Windows XP,wireshark-bugs,suz,4/30/08 3:34,2008-05-02 01:28:14 UTC,jaap.keuter
2515,GTK+ UI,RESOLVED,DUPLICATE,"wccp decodes normal packets with message: ""Bogus IP header Length (0  must be at least 20)""",5/1/08 14:25,Normal,3,Windows XP,wireshark-bugs,darrenrivey,4/30/08 14:56,2008-05-01 14:25:38 UTC,sake
2516,GTK+ UI,RESOLVED,DUPLICATE,Compare two capture files,6/12/08 6:19,Enhancement,4,Linux (other),wireshark-bugs,vcondole,5/2/08 0:26,2008-06-12 06:19:48 UTC,jeff.morriss.ws
2517,GTK+ UI,RESOLVED,FIXED,BACnet BVLC NAK decoding,5/3/08 1:41,Normal,3,Linux (other),wireshark-bugs,steve,5/2/08 8:42,2008-05-03 01:41:59 UTC,jaap.keuter
2518,TShark,RESOLVED,FIXED,'tshark -Tfields -e data' Omits Last Character of Data,5/23/08 9:17,Normal,4,All,wireshark-bugs,alon,5/3/08 13:22,2008-05-03 15:37:06 UTC,stig
2519,GTK+ UI,RESOLVED,FIXED,cooked-capture dissector should omit the source address field if empty,9/30/10 19:13,Trivial,11,All,wireshark-bugs,toralf.foerster,5/4/08 2:17,2010-09-30 18:51:32 UTC,guy
2520,GTK+ UI,RESOLVED,FIXED,"""Follow TCP Stream"" : windows width is bigger than screen size",1/22/11 9:43,Minor,10,Linux (other),wireshark-bugs,toralf.foerster,5/5/08 7:56,2011-01-22 09:43:01 UTC,stephenfisher
2521,GTK+ UI,RESOLVED,FIXED,Add support for decoding JPEG JFIF comments,5/6/08 2:09,Minor,2,Linux (other),wireshark-bugs,pkj,5/6/08 0:45,2008-05-06 02:09:50 UTC,stig
2522,GTK+ UI,RESOLVED,FIXED,Support all 256 interleaved RTSP channels,5/6/08 22:59,Minor,3,Linux (other),wireshark-bugs,pkj,5/6/08 1:00,2008-05-06 22:59:15 UTC,jaap.keuter
2523,Documentation,RESOLVED,DUPLICATE,Missing Readme File in .dmg,5/6/08 4:29,Trivial,2,Mac OS X 10.5,wireshark-bugs,kngspook,5/6/08 1:07,2008-05-06 04:29:30 UTC,jaap.keuter
2524,Dissection engine (libwireshark),RESOLVED,LATER,SMB dissector incorrectly handling FID reuse for NT Create AndX command.,9/29/14 15:24,Normal,3,Windows XP,bugzilla-admin,kyle.kloepper,5/6/08 9:14,2014-09-29 15:24:07 UTC,eapache
2525,GTK+ UI,RESOLVED,FIXED,Custom Columns Export Empty,6/24/08 6:13,Major,7,Windows XP,wireshark-bugs,graham.lynas,5/7/08 8:25,2008-06-24 06:13:37 UTC,stig
2526,GTK+ UI,RESOLVED,NOTABUG,No Dialup Interface after upgrade to 1.0.0,5/8/08 17:32,Major,5,Windows XP,wireshark-bugs,graham.lynas,5/7/08 8:31,2008-05-08 17:32:17 UTC,graham.lynas
2527,GTK+ UI,RESOLVED,NOTABUG,Display filter should accept alternate IPv4 address formats,5/8/08 13:29,Minor,8,Windows XP,wireshark-bugs,painter,5/7/08 13:33,2008-05-08 13:29:21 UTC,gerald
2528,GTK+ UI,RESOLVED,DUPLICATE,Wireshark generates strange decoding result (MEGACO),11/16/10 11:02,Major,6,Windows XP,wireshark-bugs,zhgutov,5/8/08 4:35,2010-11-16 11:02:03 UTC,Christopher.Maynard
2530,GTK+ UI,RESOLVED,FIXED,Decode of BACnet ReadRange request with no range specified displays malformed,5/9/08 23:25,Normal,2,Linux (other),wireshark-bugs,steve,5/9/08 11:19,2008-05-09 23:25:33 UTC,jaap.keuter
2531,GTK+ UI,RESOLVED,FIXED,OICQ: UDP packet wrongly dissected is it,5/17/08 16:41,Normal,2,Linux (other),wireshark-bugs,toralf.foerster,5/10/08 2:33,2008-05-17 16:41:48 UTC,stephenfisher
2532,GTK+ UI,RESOLVED,FIXED,RTP Player - Added support to use RTP timing instead of packet arriving time,5/13/08 23:23,Enhancement,3,Windows XP,wireshark-bugs,alejandrovaquero,5/10/08 21:42,2008-05-13 23:23:17 UTC,tomas.kukosa
2533,GTK+ UI,RESOLVED,FIXED,EBCDIC display for TN3270 packet,7/17/09 13:29,Enhancement,20,Windows XP,wireshark-bugs,garyp,5/11/08 2:14,2009-07-16 23:51:24 UTC,jaap.keuter
2534,GTK+ UI,RESOLVED,FIXED,"Missing CRLF during HTTP POST in the ""packet details"" window.",10/22/08 23:58,Minor,4,Windows 2000,wireshark-bugs,vopatek,5/12/08 0:46,2008-10-22 23:58:00 UTC,jaap.keuter
2535,GTK+ UI,RESOLVED,DUPLICATE,Capture Filter yields no packets,10/29/10 12:27,Major,4,Windows XP,wireshark-bugs,spaulovich,5/12/08 12:27,2010-10-29 12:27:07 UTC,jeff.morriss.ws
2536,Dissection engine (libwireshark),RESOLVED,FIXED,Migrate ISAKMP packet decryption from libnettle to libgcrypt,1/27/15 0:14,Enhancement,4,All,wireshark-bugs,vamposdecampos,5/13/08 3:54,2008-06-09 22:41:12 UTC,guy
2537,GTK+ UI,RESOLVED,FIXED,Added dissector for BACnet MS/TP WTAP and Cimetrics U+4,5/13/08 22:45,Enhancement,2,Linux (other),wireshark-bugs,steve,5/13/08 14:20,2008-05-13 22:45:30 UTC,jaap.keuter
2538,GTK+ UI,RESOLVED,NOTABUG,Wireshark 1.0.0 shows FCoE CRC for all frames,9/22/08 21:46,Major,5,Windows Server 2003,wireshark-bugs,reachparagm,5/13/08 18:13,2008-09-22 21:46:40 UTC,jaap.keuter
2539,GTK+ UI,VERIFIED,FIXED,Bug found in decoder of PKM_ATTR_CRYPTO_SUITE,5/15/08 18:33,Major,4,Windows XP,wireshark-bugs,cfreeer,5/13/08 19:16,2008-05-13 22:53:28 UTC,cfreeer
2540,GTK+ UI,VERIFIED,FIXED,Wrongly use hf_snp_pkm_version_support for PKM_ATTR_SECURITY_NEGOTIATION_PARAMETER_SUB_AUTHORIZATION_POLICY_SUPPORT,5/15/08 18:33,Major,4,Windows XP,wireshark-bugs,cfreeer,5/14/08 1:27,2008-05-14 01:39:19 UTC,cfreeer
2541,GTK+ UI,VERIFIED,FIXED,PKM_FLOW_CONTROL & MAX_SUPPT_SECURITY_ASSNS does not be added to tlv_tree,5/15/08 18:32,Major,5,Windows XP,wireshark-bugs,cfreeer,5/14/08 1:31,2008-05-14 01:49:09 UTC,cfreeer
2542,Build process,RESOLVED,FIXED,build getting failed in nmake -f Makefile.nmake all,1/26/15 22:43,Major,3,Windows XP,wireshark-bugs,preempt,5/14/08 7:18,2008-05-14 07:28:37 UTC,guy
2543,GTK+ UI,RESOLVED,FIXED,handle LAPD over RTP,5/27/08 4:59,Enhancement,3,All,wireshark-bugs,balint,5/14/08 11:14,2008-05-27 04:59:29 UTC,balint
2544,GTK+ UI,RESOLVED,FIXED,Added src and dst addresses to BACnet MS/TP WTAP dissector,5/19/08 23:52,Enhancement,2,Linux (other),wireshark-bugs,steve,5/14/08 14:14,2008-05-19 23:52:46 UTC,jaap.keuter
2545,GTK+ UI,RESOLVED,NOTOURBUG,Lemon parser fails to compile due to MSVC++ reporting constness disagreement,5/14/08 19:40,Major,7,Windows XP,wireshark-bugs,preempt,5/14/08 17:29,2008-05-14 18:52:39 UTC,preempt
2546,GTK+ UI,RESOLVED,NOTABUG,Execution of perl fails under wslua,8/1/08 8:17,Major,4,Windows XP,wireshark-bugs,preempt,5/14/08 18:31,2008-08-01 08:17:38 UTC,anders.broman
2547,TShark,RESOLVED,NOTABUG,Tshark Aborted .,9/30/08 1:02,Critical,5,Linux (other),wireshark-bugs,jomegan_cov,5/15/08 4:59,2008-09-30 01:02:40 UTC,sake
2548,GTK+ UI,RESOLVED,FIXED,wimax UL-MAP ext IE decode error,6/23/08 6:51,Normal,14,Windows XP,wireshark-bugs,frank.wang,5/16/08 2:33,2008-06-23 06:51:34 UTC,frank.wang
2549,GTK+ UI,RESOLVED,FIXED,Wireshark 1.0 crashes on enabling/disabling protocols,10/9/08 8:07,Major,5,Linux (other),wireshark-bugs,vivek2.gupta,5/16/08 6:46,2008-05-21 07:19:48 UTC,jeff.morriss.ws
2550,TShark,RESOLVED,DUPLICATE,Buildbot crash output: fuzz-2008-05-17-10076.pcap,7/7/08 9:55,Critical,4,Linux (other),wireshark-bugs,buildbot-do-not-reply,5/18/08 1:20,2008-07-07 09:55:41 UTC,jeff.morriss.ws
2551,GTK+ UI,VERIFIED,FIXED,Incorrect SNAC(01 07) dissector for AIM protocol,7/3/08 16:19,Normal,7,Linux (other),wireshark-bugs,I.zaufi,5/18/08 12:43,2008-05-23 12:06:44 UTC,I.zaufi
2552,GTK+ UI,RESOLVED,NOTABUG,dumpcap necessary if analyzing files ?,5/20/08 6:21,Minor,2,Linux (other),wireshark-bugs,toralf.foerster,5/19/08 2:35,2008-05-20 06:21:48 UTC,jeff.morriss.ws
2553,GTK+ UI,RESOLVED,FIXED,tree_add_bits_* functions missing in libwireshark.def,7/30/08 3:12,Minor,4,Windows XP,wireshark-bugs,peclik,5/19/08 4:02,2008-07-30 03:12:33 UTC,anders.broman
2554,GTK+ UI,RESOLVED,FIXED,PIM type 9 message unsupported,5/20/08 13:06,Major,3,Windows XP,wireshark-bugs,wes_r,5/19/08 10:47,2008-05-20 13:06:53 UTC,jaap.keuter
2555,TShark,RESOLVED,FIXED,libsmi.m4 had a typo in ldflags that broke LDFLAG settings when --with-libsmi was used,6/21/08 6:12,Trivial,2,Linux (other),wireshark-bugs,randomkodemonkey,5/19/08 13:34,2008-06-21 06:12:51 UTC,anders.broman
2556,Dissection engine (libwireshark),RESOLVED,FIXED,patch to support WSA  WSMP  WRSS packets,3/6/13 20:38,Enhancement,25,All,bugzilla-admin,siva,5/20/08 4:33,2009-07-03 04:51:03 UTC,guy
2557,GTK+ UI,RESOLVED,FIXED,Show IP information in the Packet List Info column,5/22/08 4:32,Enhancement,3,Windows XP,wireshark-bugs,fortunatotony,5/21/08 16:14,2008-05-22 04:32:13 UTC,fortunatotony
2558,GTK+ UI,VERIFIED,FIXED,Enhanced decoder for SNAC(13 0e) of AIM protocol,7/3/08 16:19,Enhancement,4,All,wireshark-bugs,I.zaufi,5/22/08 14:07,2008-05-23 12:08:13 UTC,I.zaufi
2559,GTK+ UI,VERIFIED,FIXED,Wimax vals_tek_encryption_ids does not confirm the latest spec.,5/26/08 17:25,Minor,5,Windows XP,wireshark-bugs,cfreeer,5/22/08 19:44,2008-05-22 22:37:13 UTC,cfreeer
2560,Extras,RESOLVED,NOTABUG,editcap -c option drops data,5/25/08 2:56,Major,3,Windows XP,wireshark-bugs,graham.lynas,5/22/08 21:05,2008-05-25 02:56:35 UTC,graham.lynas
2561,GTK+ UI,RESOLVED,FIXED,WiMAX ASN CP Flow graph issue,6/23/08 6:04,Major,2,Windows XP,wireshark-bugs,preempt,5/22/08 23:48,2008-06-23 06:04:18 UTC,martin.r.mathieson
2562,GTK+ UI,RESOLVED,NOTOURBUG,Packet details pane do not respect desktop colors,9/30/12 19:08,Major,10,Linux (other),wireshark-bugs,I.zaufi,5/23/08 2:04,2012-09-30 19:08:34 UTC,Christopher.Maynard
2563,TShark,RESOLVED,DUPLICATE,tshark: When you use fields output format with -e data option the data lastbyte is trunked.,5/23/08 9:17,Normal,2,Linux (other),wireshark-bugs,joost+wireshark,5/23/08 8:55,2008-05-23 09:17:50 UTC,stig
2564,GTK+ UI,VERIFIED,FIXED,Enhanced dissector for SNAC(0x13 0x14) and SNAC(0x13 0x15),7/3/08 16:18,Normal,6,Linux (other),wireshark-bugs,I.zaufi,5/23/08 13:12,2008-06-21 08:39:23 UTC,I.zaufi
2565,GTK+ UI,RESOLVED,FIXED,packet-dcm  DICOM dissector bugfixes and features,7/25/08 6:20,Enhancement,6,All,wireshark-bugs,david_aggeler,5/23/08 15:56,2008-07-25 06:20:46 UTC,anders.broman
2566,GTK+ UI,RESOLVED,NOTABUG,OMAP dissector,5/26/08 10:00,Enhancement,2,Windows XP,wireshark-bugs,euzunca,5/25/08 23:11,2008-05-26 10:00:27 UTC,luis.ontanon
2567,GTK+ UI,RESOLVED,FIXED,WiMAX ASN CP  Show transaction ID direction bit fails to display the WiMAX ASN CP messages,10/1/08 2:30,Normal,4,Windows XP,wireshark-bugs,preempt,5/26/08 0:50,2008-10-01 02:30:12 UTC,anders.broman
2568,GTK+ UI,RESOLVED,DUPLICATE,wireshark crashed on exit,7/7/08 10:26,Major,2,Windows XP,wireshark-bugs,dugchin,5/26/08 2:55,2008-07-07 10:26:21 UTC,jeff.morriss.ws
2569,GTK+ UI,VERIFIED,FIXED,Wimax: TLV type 36 should be supported in REG-RSP,6/26/09 9:41,Normal,5,Windows XP,wireshark-bugs,cfreeer,5/27/08 0:26,2008-06-20 03:17:54 UTC,wmeier
2570,GTK+ UI,RESOLVED,FIXED,wimax decoding err when packing subheader present,6/20/08 3:29,Major,7,Windows XP,wireshark-bugs,frank.wang,5/27/08 1:15,2008-06-20 03:29:17 UTC,martin.r.mathieson
2571,GTK+ UI,VERIFIED,FIXED,Wimax: TLV type 48 should be supported in REG-REQ/REG-RSP,7/4/08 1:59,Normal,4,Windows XP,wireshark-bugs,cfreeer,5/27/08 1:22,2008-06-20 08:57:10 UTC,cfreeer
2572,TShark,RESOLVED,NOTABUG,Buildbot crash output: fuzz-2008-05-27-26193.pcap,5/28/08 12:17,Critical,4,Linux (other),wireshark-bugs,buildbot-do-not-reply,5/27/08 15:00,2008-05-28 10:52:02 UTC,gerald
2573,GTK+ UI,RESOLVED,DUPLICATE,ERROR: Wireshark has encountered a problem and needs to close.,10/29/10 12:33,Major,6,Windows XP,wireshark-bugs,graham.lynas,5/27/08 18:09,2010-10-29 12:33:05 UTC,jeff.morriss.ws
2574,Extras,RESOLVED,FIXED,Allow editcap to parse files into even time intervals,6/21/08 2:48,Enhancement,5,All,wireshark-bugs,smithkd,5/28/08 18:08,2008-06-21 02:46:57 UTC,sake
2575,GTK+ UI,RESOLVED,FIXED,Some iFCP packets do not decode before of non-nulls in bytes 4-7 of header,6/3/08 13:42,Normal,8,Windows XP,wireshark-bugs,fschorr,5/29/08 7:53,2008-06-03 13:42:17 UTC,jaap.keuter
2576,GTK+ UI,RESOLVED,FIXED,Packet-fc is not dissecting destination and source ID field properly,1/26/09 11:07,Minor,10,Windows XP,wireshark-bugs,fschorr,5/29/08 8:47,2009-01-26 11:07:53 UTC,fschorr
2577,GTK+ UI,RESOLVED,FIXED,[PATCH] provide more detailed SSH dissection,8/6/13 13:48,Enhancement,7,Linux (other),wireshark-bugs,kees,5/29/08 18:04,2008-05-29 19:15:07 UTC,dpb
2578,Qt UI,CONFIRMED, ---,snapshot feature: apply filter upon previous displayed packets only,11/24/16 19:03,Enhancement,10,Linux (other),wireshark-bugs,yamisoe,5/30/08 9:40,,mmann78
2579,Capture file support (libwiretap),RESOLVED,WONTFIX,u3 version not working (winpcap missing error),6/24/14 14:07,Critical,6,Windows XP,bugzilla-admin,cmeisel,5/30/08 14:36,2014-06-16 22:34:14 UTC,balint
2580,GTK+ UI,RESOLVED,NOTABUG,invalid checksum in udp header,6/2/08 18:18,Major,7,other,wireshark-bugs,rtrout,5/31/08 11:59,2008-06-02 18:18:23 UTC,Christopher.Maynard
2581,GTK+ UI,RESOLVED,FIXED,Filter Autocompletion,10/19/08 8:19,Enhancement,20,All,wireshark-bugs,b.naamneh,6/1/08 1:04,2008-10-19 08:19:05 UTC,stig
2582,GTK+ UI,RESOLVED,DUPLICATE,Wireshark 1.0.0 crashes on close without save,7/7/08 10:18,Major,3,Windows XP,wireshark-bugs,googl3meister,6/1/08 22:46,2008-07-07 10:18:51 UTC,jeff.morriss.ws
2583,GTK+ UI,RESOLVED,FIXED,Use BACnetLifesafetyMode instead of BACnetLifesafetyState,6/2/08 0:33,Normal,2,Windows XP,wireshark-bugs,rudolf.weidmann,6/2/08 0:20,2008-06-02 00:33:37 UTC,stig
2584,GTK+ UI,RESOLVED,FIXED,DOCSIS3.0 support in wireshark (MDD  REG-REQ-MP  REG-RSP-MP),7/30/08 8:13,Enhancement,6,All,wireshark-bugs,bruno.verstuyft,6/2/08 9:40,2008-07-30 08:13:37 UTC,anders.broman
2585,GTK+ UI,RESOLVED,FIXED,Problem with packet-ifcp dissector not calculating PDU length correctly,6/3/08 14:24,Major,4,Windows XP,wireshark-bugs,fschorr,6/2/08 12:52,2008-06-03 14:24:45 UTC,jaap.keuter
2587,GTK+ UI,RESOLVED,DUPLICATE,Faulting application,7/7/08 10:36,Critical,6,Windows Server 2003,wireshark-bugs,krudd,6/4/08 10:21,2008-07-07 10:36:42 UTC,jeff.morriss.ws
2588,GTK+ UI,RESOLVED,FIXED,Bad UTF-8 string from RSS dissector,6/16/14 22:55,Normal,16,Windows Server 2003,wireshark-bugs,bjoern,6/4/08 15:50,2014-06-16 22:55:35 UTC,alexis.lagoutte
2589,GTK+ UI,RESOLVED,FIXED,Compare two capture files,3/31/15 8:18,Enhancement,11,Linux (other),wireshark-bugs,vcondole,6/5/08 0:09,2010-04-23 14:25:30 UTC,alexis.lagoutte
2590,GTK+ UI,RESOLVED,FIXED,compilation failure on non-european windows (due to non-ascii characters),6/5/08 13:01,Minor,2,Windows XP,wireshark-bugs,suz,6/5/08 7:49,2008-06-05 13:01:17 UTC,jaap.keuter
2591,GTK+ UI,RESOLVED,FIXED,FCP dissector doesn't correctly show response info flag.,6/9/08 22:41,Minor,2,All,wireshark-bugs,joe,6/6/08 18:23,2008-06-09 22:41:54 UTC,jaap.keuter
2592,Extras,RESOLVED,FIXED,"Ctrl-C does not stop ""dumpcap -S""",6/19/08 17:11,Minor,4,All,wireshark-bugs,Christopher.Maynard,6/7/08 6:57,2008-06-19 17:11:17 UTC,guy
2593,GTK+ UI,RESOLVED,NOTABUG,UDP checksum error,10/9/08 12:29,Normal,5,Linux (other),wireshark-bugs,Scott.J.Wasinger2,6/9/08 14:47,2008-10-09 12:29:05 UTC,jaap.keuter
2594,GTK+ UI,RESOLVED,NOTABUG,gtk crash..,9/26/08 7:05,Major,4,Linux (other),wireshark-bugs,arun2.b,6/9/08 21:31,2008-09-26 07:05:59 UTC,anders.broman
2595,GTK+ UI,RESOLVED,WORKSFORME,IMF dissection not working,10/13/08 1:13,Normal,16,Windows XP,wireshark-bugs,sarkar.abhik,6/10/08 7:01,2008-10-13 01:13:01 UTC,sarkar.abhik
2596,GTK+ UI,RESOLVED,DUPLICATE,Multicast Streams Menu Not Functional,6/10/08 22:48,Major,2,Windows XP,wireshark-bugs,wade.schofield,6/10/08 8:34,2008-06-10 22:48:39 UTC,jaap.keuter
2597,GTK+ UI,RESOLVED,DUPLICATE,Two crashes  ring files and on exit,7/7/08 10:33,Major,7,Windows XP,wireshark-bugs,stuart.macdonald,6/10/08 13:40,2008-07-07 10:33:57 UTC,jeff.morriss.ws
2598,GTK+ UI,RESOLVED,FIXED,Wireshark allows marking default interface as hidden,7/8/12 19:41,Normal,8,Windows XP,wireshark-bugs,stuart.macdonald,6/10/08 13:57,2012-07-08 19:41:08 UTC,anders.broman
2599,GTK+ UI,RESOLVED,FIXED,"""Next file every"" inconsistent behaviour",6/20/08 9:03,Major,12,Windows XP,wireshark-bugs,stuart.macdonald,6/10/08 14:06,2008-06-20 09:03:22 UTC,stuart.macdonald
2601,GTK+ UI,RESOLVED,WORKSFORME,TPKT and H245 dissection problem,6/11/08 11:05,Normal,3,Windows XP,wireshark-bugs,vadster,6/11/08 2:11,2008-06-11 11:05:24 UTC,jaap.keuter
2602,TShark,RESOLVED,NOTABUG,dumpcap / tshark do not seem to capture all message traffic,10/26/08 10:22,Major,9,Windows XP,wireshark-bugs,g.hassler,6/11/08 6:55,2008-10-26 10:22:25 UTC,sake
2603,GTK+ UI,RESOLVED,FIXED,Register SMB dissector so that it can be called by others.,6/12/08 6:40,Enhancement,2,Linux (other),wireshark-bugs,yamisoe,6/11/08 21:13,2008-06-12 06:40:36 UTC,jeff.morriss.ws
2604,GTK+ UI,RESOLVED,FIXED,wrong fields filled in screen filters,6/16/09 12:25,Normal,9,Windows XP,wireshark-bugs,newsboonie,6/12/08 10:17,2009-06-16 12:25:21 UTC,jaap.keuter
2605,GTK+ UI,RESOLVED,DUPLICATE,Wireshark crashes on closing capture without save,7/7/08 10:31,Major,6,Linux (other),wireshark-bugs,andrew.frater,6/12/08 15:43,2008-07-07 10:31:07 UTC,jeff.morriss.ws
2606,GTK+ UI,RESOLVED,FIXED,"When I do a ""follow TCP stream""  I see ""1360 bytes missing""",6/13/08 11:23,Major,3,Windows XP,wireshark-bugs,nmeyering,6/12/08 17:00,2008-06-13 11:23:45 UTC,nmeyering
2607,Build process,RESOLVED,FIXED,Wireshark won't compile : no rule to make target `inet_pton`,1/26/15 22:43,Major,3,Linux (other),wireshark-bugs,guitreize,6/13/08 0:15,2008-06-24 10:58:18 UTC,guy
2608,GTK+ UI,RESOLVED,WORKSFORME,SCCP dissector can not decode message anymore (worked in Ethereal .99),6/17/08 12:21,Major,2,Windows XP,wireshark-bugs,nenax,6/13/08 12:11,2008-06-17 12:21:39 UTC,jeff.morriss.ws
2609,GTK+ UI,RESOLVED,DUPLICATE,No network interfaces,6/13/08 16:45,Major,2,Mac OS X 10.5,wireshark-bugs,Joao,6/13/08 16:40,2008-06-13 16:45:54 UTC,guy
2610,GTK+ UI,RESOLVED,DUPLICATE,wireshark 1.0 has no capture interfaces on mac os 10.5.3,5/19/10 17:59,Blocker,4,Mac OS X 10.5,wireshark-bugs,hans-juergen.greif,6/14/08 14:21,2010-05-19 17:59:05 UTC,guy
2611,Documentation,RESOLVED,FIXED,text2pcap.pod: add -v to od(1) options,6/15/08 22:34,Minor,2,Linux (other),wireshark-bugs,rspmn,6/15/08 8:30,2008-06-15 22:34:02 UTC,jaap.keuter
2612,Documentation,RESOLVED,FIXED,README.developer FT_UNIT_STRING,6/15/08 22:34,Enhancement,2,All,wireshark-bugs,brooss.teambb,6/15/08 19:39,2008-06-15 22:34:06 UTC,jaap.keuter
2613,Documentation,RESOLVED,FIXED,Add explination of built-in vs plugin dissectors to developer's guide,6/18/08 13:24,Enhancement,5,All,wireshark-bugs,brooss.teambb,6/16/08 3:02,2008-06-18 13:24:06 UTC,jaap.keuter
2614,GTK+ UI,RESOLVED,REMIND,LDAP stats wrong when sequence numbers repeat,12/17/12 23:39,Normal,6,Windows XP,wireshark-bugs,wayne.crosbie,6/16/08 5:33,2012-12-17 23:39:50 UTC,jaap.keuter
2615,TShark,RESOLVED,FIXED,smb-browse dissector misses server type 23 (DFS server),6/16/08 13:45,Normal,5,Linux (other),wireshark-bugs,obnox,6/16/08 7:01,2008-06-16 13:39:16 UTC,jaap.keuter
2616,GTK+ UI,RESOLVED,FIXED,wireshark doest not parse iSCSI login PDU,6/17/08 23:27,Major,5,Windows XP,wireshark-bugs,erang,6/17/08 4:41,2008-06-17 23:27:50 UTC,jaap.keuter
2617,GTK+ UI,RESOLVED,FIXED,Wrong display of USSD strings in the GSM 7-bit alphabet for non-ASCII data,9/27/08 7:17,Normal,4,Linux (other),wireshark-bugs,rspmn,6/17/08 12:56,2008-09-27 07:17:13 UTC,anders.broman
2618,GTK+ UI,RESOLVED,FIXED,GPRS Tunnel Protocoll GTP Version 1 does not decode MS Time Zone Parameter,6/18/08 13:00,Enhancement,2,All,wireshark-bugs,frank.maerz,6/17/08 23:44,2008-06-18 13:00:16 UTC,jaap.keuter
2619,Build process,RESOLVED,FIXED,URL and encoding for OUI listings in make-manuf,1/26/15 22:44,Minor,6,All,wireshark-bugs,TBoehne,6/18/08 2:22,2008-07-30 04:58:41 UTC,guy
2620,GTK+ UI,RESOLVED,FIXED,RTMP real-time video feed crashes wireshark,6/20/08 13:25,Blocker,4,Linux (other),wireshark-bugs,lkcl,6/18/08 14:19,2008-06-20 13:25:51 UTC,gerald
2621,GTK+ UI,RESOLVED,FIXED,MSDP protocol based on TFTP,6/21/08 3:05,Trivial,5,Linux (other),wireshark-bugs,cmoidavid,6/19/08 0:27,2008-06-21 03:05:43 UTC,sake
2622,GTK+ UI,RESOLVED,FIXED,Support for IAB MAC address resolution,7/30/08 4:57,Enhancement,6,All,wireshark-bugs,TBoehne,6/19/08 0:44,2008-07-30 04:57:45 UTC,anders.broman
2623,GTK+ UI,RESOLVED,FIXED,Misleading error message,11/16/10 13:10,Trivial,2,Windows XP,wireshark-bugs,c17gmaster,6/19/08 13:27,2010-11-16 13:10:27 UTC,Christopher.Maynard
2624,GTK+ UI,RESOLVED,FIXED,ASAP Dissector Patch,6/21/08 8:27,Normal,4,All,wireshark-bugs,dreibh,6/20/08 0:08,2008-06-21 08:27:18 UTC,anders.broman
2625,GTK+ UI,RESOLVED,FIXED,ENRP Dissector Patch,6/21/08 8:30,Normal,3,All,wireshark-bugs,dreibh,6/20/08 0:13,2008-06-21 08:30:03 UTC,anders.broman
2626,Dissection engine (libwireshark),RESOLVED,FIXED,OSI COTP (X.224/ISO 8073) dissector doesn't handle Microsoft's non-standard COTP extensions for RDP,2/1/16 23:20,Enhancement,8,All,wireshark-bugs,toralf.foerster,6/20/08 2:33,2016-02-01 23:20:13 UTC,gerrit-do-not-reply
2627,GTK+ UI,RESOLVED,FIXED,MPEG PES decode as RTP -- wrong display Source Destination  Protocol,11/16/13 4:50,Minor,8,Windows XP,wireshark-bugs,u.krumbuegel,6/20/08 2:46,2013-11-16 04:50:08 UTC,mmann78
2628,GTK+ UI,RESOLVED,DUPLICATE,Wireshark installer doesn't handle multiple versions gracefully,6/20/08 16:32,Normal,2,Windows XP,wireshark-bugs,stuart.macdonald,6/20/08 9:11,2008-06-20 16:32:55 UTC,sake
2629,GTK+ UI,RESOLVED,FIXED,UTC Timestamp display,6/1/16 1:44,Enhancement,12,All,wireshark-bugs,dzpimtmfvbfjx,6/20/08 19:44,2016-06-01 01:44:24 UTC,jeff.morriss.ws
2630,GTK+ UI,RESOLVED,FIXED,rtp_player crashes on decode of long call: BadAlloc (insufficient resources for operation),3/2/15 12:18,Critical,37,Solaris,wireshark-bugs,josh,6/21/08 12:35,2015-03-02 07:00:51 UTC,gerrit-do-not-reply
2631,GTK+ UI,RESOLVED,FIXED,B.A.T.M.A.N. Advanced dissector,6/3/10 11:58,Enhancement,65,All,wireshark-bugs,sven+wireshark,6/21/08 13:20,2010-06-03 11:58:27 UTC,wmeier
2632,GTK+ UI,RESOLVED,FIXED,B.A.T.M.A.N. Dissector,6/21/08 17:15,Enhancement,14,All,wireshark-bugs,sven+wireshark,6/21/08 13:27,2008-06-21 17:15:37 UTC,stig
2633,GTK+ UI,RESOLVED,FIXED,IUA dissector ignores SAPI value when decoding protocol data,6/21/08 16:40,Normal,3,Linux (other),wireshark-bugs,Peter.Hertting,6/21/08 14:36,2008-06-21 16:40:39 UTC,stig
2634,GTK+ UI,RESOLVED,FIXED,nfs4.1 dissector update,7/12/08 12:54,Normal,2,Linux (other),wireshark-bugs,bfields,6/22/08 15:42,2008-07-12 12:54:39 UTC,stig
2635,GTK+ UI,RESOLVED,FIXED,"SIP decode shows fully expanded ""Content-Length"" header instead of compact form",6/23/08 7:58,Trivial,2,All,wireshark-bugs,david.joyner,6/23/08 7:36,2008-06-23 07:58:36 UTC,martin.r.mathieson
2636,GTK+ UI,RESOLVED,FIXED,interface list isn't updated after /dev/net/tun is removed,10/1/12 9:31,Minor,6,Linux (other),wireshark-bugs,toralf.foerster,6/23/08 9:45,2012-10-01 09:31:10 UTC,toralf.foerster
2637,GTK+ UI,RESOLVED,FIXED,Add SCCP SSN preference to RANAP,7/25/08 19:05,Enhancement,4,Windows XP,wireshark-bugs,Neil,6/23/08 10:03,2008-07-25 19:05:03 UTC,jeff.morriss.ws
2638,GTK+ UI,VERIFIED,FIXED,XOT PVC Setup reported as Invalid/short X.25 packet,4/15/10 3:54,Normal,6,Linux (other),wireshark-bugs,jon.goodchild,6/24/08 3:39,2008-10-06 23:53:46 UTC,jon.goodchild
2639,GTK+ UI,RESOLVED,FIXED,bug in eigrp dissector,6/24/08 23:19,Normal,2,Windows XP,wireshark-bugs,maximivanov,6/24/08 5:57,2008-06-24 23:19:10 UTC,jaap.keuter
2640,GTK+ UI,RESOLVED,FIXED,Compressed DLMAP decode error,6/25/08 3:47,Major,3,Windows XP,wireshark-bugs,frank.wang,6/24/08 23:05,2008-06-25 03:47:28 UTC,martin.r.mathieson
2641,GTK+ UI,RESOLVED,FIXED,Wireshark 1.0.1pre1 shows Ethernet ERF files as raw data rather than Ethernet traffic,6/26/08 9:10,Major,7,All,wireshark-bugs,mike.hinz,6/25/08 12:44,2008-06-25 18:52:32 UTC,guy
2642,GTK+ UI,RESOLVED,FIXED,Better display of callback info for NFSv4 SETCLIENTID op,7/31/08 2:32,Enhancement,2,Linux (other),wireshark-bugs,Alex.Burlyga,6/25/08 17:42,2008-07-31 02:32:25 UTC,anders.broman
2643,GTK+ UI,RESOLVED,FIXED,packet-atm enhancement,7/14/08 22:47,Major,3,Windows XP,wireshark-bugs,kip.mcatee,6/25/08 18:06,2008-07-14 22:47:17 UTC,jaap.keuter
2644,GTK+ UI,RESOLVED,FIXED,Request addition of FIP dissector.,7/18/08 9:42,Enhancement,12,All,wireshark-bugs,joe,6/25/08 18:13,2008-07-15 13:58:45 UTC,jaap.keuter
2645,GTK+ UI,RESOLVED,FIXED,SERCOS III plugin,6/9/12 11:29,Major,3,All,wireshark-bugs,michael.beier,6/26/08 1:38,2012-06-09 11:29:22 UTC,mmann78
2646,GTK+ UI,RESOLVED,FIXED,Rework RTMPT dissector to correctly deal with chunked PDUs,7/12/09 8:04,Major,6,All,wireshark-bugs,jsethdev,6/26/08 10:47,2009-07-12 08:04:36 UTC,jaap.keuter
2647,GTK+ UI,RESOLVED,FIXED,incomplete paklog in syslog packet crashes Wireshark,6/30/08 8:24,Critical,6,All,wireshark-bugs,sarkar.abhik,6/26/08 12:49,2008-06-26 13:43:43 UTC,jeff.morriss.ws
2648,GTK+ UI,RESOLVED,NOTABUG,TPKT ASCII Parsing Enhancement for H.248 over TCP,8/29/12 3:05,Normal,3,Linux (other),wireshark-bugs,j.s.bach,6/27/08 7:56,2012-08-29 03:05:49 UTC,pascal.quantin
2649,TShark,RESOLVED,FIXED,Buildbot crash output: fuzz-2008-06-26-25238.pcap,7/8/08 13:05,Critical,8,Linux (other),wireshark-bugs,buildbot-do-not-reply,6/27/08 8:50,2008-07-08 13:05:03 UTC,jeff.morriss.ws
2650,GTK+ UI,RESOLVED,NOTABUG,Improper code handling..,6/29/08 2:36,Trivial,2,All,wireshark-bugs,arun2.b,6/27/08 23:27,2008-06-29 02:36:52 UTC,arun2.b
2651,GTK+ UI,RESOLVED,FIXED,Iupc interface PCAP protocol dissector bug (Wireshark 1.0.0),6/28/08 12:35,Critical,2,Linux (other),wireshark-bugs,munish.dayal,6/28/08 0:48,2008-06-28 12:35:21 UTC,anders.broman
2652,GTK+ UI,RESOLVED,FIXED,Add accelerator keys for Find Next/Previous Reference,6/29/08 1:38,Enhancement,3,Windows XP,wireshark-bugs,kovarththanan.rajaratnam,6/28/08 1:45,2008-06-29 01:38:01 UTC,sake
2653,GTK+ UI,RESOLVED,NOTABUG,Capture stops if interface goes down,7/1/08 1:06,Major,3,Linux (other),wireshark-bugs,petr.bug,6/28/08 8:25,2008-06-28 10:10:42 UTC,guy
2654,GTK+ UI,RESOLVED,FIXED,Avaya IPSI Control dissector,7/8/08 14:44,Enhancement,8,All,wireshark-bugs,rmceoin,6/28/08 13:03,2008-07-08 14:44:44 UTC,sake
2655,GTK+ UI,RESOLVED,FIXED,IUA dissector assume that Interface Identifer Field only contains one identifier,6/29/08 3:25,Minor,3,Linux (other),wireshark-bugs,Peter.Hertting,6/28/08 14:58,2008-06-29 03:25:02 UTC,Michael.Tuexen
2656,TShark,RESOLVED,DUPLICATE,tshark cannot read large files in Linux systems,5/16/10 20:10,Enhancement,3,Linux (other),wireshark-bugs,romel.khan,6/28/08 16:03,2010-05-16 20:10:02 UTC,jeff.morriss.ws
2657,GTK+ UI,RESOLVED,FIXED,Resolve accelerator ambiguity in filter toolbar,6/29/08 8:00,Enhancement,6,Windows XP,wireshark-bugs,kovarththanan.rajaratnam,6/28/08 21:51,2008-06-29 08:00:16 UTC,sake
2658,GTK+ UI,RESOLVED,FIXED,Leading $ is not propageted to display filter entry,6/29/08 5:56,Minor,7,Windows XP,wireshark-bugs,kovarththanan.rajaratnam,6/29/08 0:00,2008-06-29 05:56:10 UTC,sake
2659,GTK+ UI,RESOLVED,FIXED,Wrong Interpretation of SIP Header Fields containing IPv6 Addresses,6/29/08 23:36,Major,2,Windows XP,wireshark-bugs,flat1984,6/29/08 5:30,2008-06-29 23:36:02 UTC,jaap.keuter
2660,GTK+ UI,RESOLVED,FIXED,Display filter max recent entries should be a preference,8/9/08 10:37,Enhancement,4,Windows XP,wireshark-bugs,kovarththanan.rajaratnam,6/29/08 8:42,2008-08-08 12:42:17 UTC,stig
2661,Documentation,RESOLVED,FIXED,Error in Readme.developer,6/30/08 6:46,Major,2,Windows XP,wireshark-bugs,sarkar.abhik,6/30/08 1:09,2008-06-30 06:46:55 UTC,jeff.morriss.ws
2662,GTK+ UI,RESOLVED,FIXED,ULMAP HARQ_ULMAP_IE decode error,7/8/08 9:07,Major,7,Windows XP,wireshark-bugs,frank.wang,6/30/08 1:42,2008-07-08 09:07:45 UTC,martin.r.mathieson
2663,GTK+ UI,RESOLVED,FIXED,DLMAP HARQ_DLMAP_IE decode error,7/23/08 4:19,Major,3,Windows XP,wireshark-bugs,frank.wang,6/30/08 1:49,2008-07-23 04:19:38 UTC,martin.r.mathieson
2664,Build process,RESOLVED,FIXED,Add browse file makefile target,1/26/15 22:44,Enhancement,3,Windows XP,wireshark-bugs,kovarththanan.rajaratnam,6/30/08 8:57,2008-07-02 17:21:35 UTC,guy
2665,GTK+ UI,RESOLVED,FIXED,MEGACO packet containing Topology Descriptor without command is not dissected properly,10/30/08 2:54,Normal,2,Linux (other),wireshark-bugs,balint,6/30/08 9:08,2008-10-30 02:54:54 UTC,balint
2666,GTK+ UI,RESOLVED,FIXED,iax2 dissector always reports retransmission bit to be false,7/1/08 14:06,Normal,5,All,wireshark-bugs,jpgrayson,6/30/08 12:08,2008-07-01 14:06:54 UTC,anders.broman
2667,GTK+ UI,RESOLVED,FIXED,"The ""Set Time Reference (toggle)"" option does not work in Wireshark",2/1/10 12:45,Minor,2,Windows XP,wireshark-bugs,brian,7/1/08 4:04,2010-02-01 12:45:09 UTC,anders.broman
2668,GTK+ UI,RESOLVED,FIXED,bug in ethercat dissector when packets are smaller than 60 bytes,1/4/09 5:40,Major,5,Windows XP,wireshark-bugs,r.kuemmel,7/1/08 7:41,2008-07-14 12:58:29 UTC,sake
2669,GTK+ UI,RESOLVED,FIXED,Negative values are not graphed correctly in IO Graphs/Advanced,6/17/14 0:38,Normal,3,Windows XP,wireshark-bugs,greg.cook,7/1/08 14:02,2014-06-17 00:38:23 UTC,gerald
2670,GTK+ UI,RESOLVED,FIXED,saving config profiles on window crashes wireshark,10/17/09 1:15,Normal,5,Windows Server 2003,wireshark-bugs,leonmccalla,7/1/08 18:02,2009-10-17 01:15:12 UTC,jaap.keuter
2671,GTK+ UI,RESOLVED,FIXED,ERF dissector defaults to RAW,7/14/08 14:55,Minor,14,All,wireshark-bugs,stephen.donnelly,7/1/08 19:34,2008-07-14 12:29:52 UTC,guy
2672,Dissection engine (libwireshark),RESOLVED,FIXED,Infiniband Dissector Plugin 1.2.0,1/4/17 1:39,Enhancement,14,All,wireshark-bugs,stephen.donnelly,7/1/08 19:42,2008-07-30 08:53:12 UTC,guy
2673,GTK+ UI,RESOLVED,NOTOURBUG,Incorrect comments in radius/dictionary.nokia,8/4/08 14:10,Trivial,3,All,wireshark-bugs,sarkar.abhik,7/2/08 12:56,2008-08-04 13:50:05 UTC,anders.broman
2674,GTK+ UI,RESOLVED,DUPLICATE,Wireshark crash on opening pcap file,7/3/08 8:32,Major,6,Windows Vista,wireshark-bugs,bernard,7/3/08 4:37,2008-07-03 08:32:45 UTC,wmeier
2675,GTK+ UI,RESOLVED,FIXED,segmentation fault loading trace containing NCP packets,9/2/08 17:54,Blocker,27,All,wireshark-bugs,thnielsen,7/3/08 7:35,2008-08-01 04:57:29 UTC,gerald
2676,GTK+ UI,RESOLVED,FIXED,WTAP_ENCAP_BLUETOOTH_H4_WITH_PHDR encapsulated files not correctly saved,5/21/09 16:17,Normal,6,Windows XP,wireshark-bugs,kovarththanan.rajaratnam,7/3/08 13:07,2009-05-21 16:17:26 UTC,bugzilla-admin
2677,GTK+ UI,RESOLVED,FIXED,'dumpcap -L' crashes;,7/13/08 10:20,Major,8,Windows Vista,wireshark-bugs,wmeier,7/3/08 19:31,2008-07-13 10:20:04 UTC,guy
2678,GTK+ UI,RESOLVED,FIXED,B.A.T.M.A.N. dissector doesnt delete old udp port when changing it,7/9/08 12:11,Normal,4,Linux (other),wireshark-bugs,sven+wireshark,7/4/08 2:21,2008-07-09 12:11:19 UTC,jaap.keuter
2679,GTK+ UI,RESOLVED,FIXED,GUI crashes on OSX 10.4.11,9/16/11 9:36,Major,9,Mac OS X 10.4,wireshark-bugs,sandor.szuecs,7/4/08 3:31,2011-09-16 09:36:44 UTC,sandor.szuecs
2680,GTK+ UI,RESOLVED,FIXED,Save WTAP_ENCAP_BLUETOOTH_H4_WITH_PHDR files as btsnoop files,5/25/09 9:57,Enhancement,4,Windows XP,wireshark-bugs,kovarththanan.rajaratnam,7/4/08 5:18,2009-05-25 09:57:34 UTC,gerald
2681,GTK+ UI,RESOLVED,FIXED,glithes in current ssl decrypt code,7/12/08 7:43,Minor,13,All,wireshark-bugs,paolo.abeni,7/4/08 5:54,2008-07-10 08:36:02 UTC,jaap.keuter
2682,TShark,RESOLVED,DUPLICATE,Buildbot crash output: fuzz-2008-07-04-16393.pcap,7/7/08 9:51,Critical,3,Linux (other),wireshark-bugs,buildbot-do-not-reply,7/4/08 9:40,2008-07-07 09:51:58 UTC,jeff.morriss.ws
2683,GTK+ UI,RESOLVED,FIXED,Editcap should split file according to fileset pattern,5/23/09 0:59,Enhancement,11,Windows XP,wireshark-bugs,kovarththanan.rajaratnam,7/4/08 11:30,2009-05-23 00:59:57 UTC,sake
2684,GTK+ UI,RESOLVED,FIXED,Addition dissection for packet-gsm_a.c,7/20/08 13:45,Enhancement,2,Windows XP,wireshark-bugs,Neil,7/4/08 14:19,2008-07-20 13:45:55 UTC,anders.broman
2685,GTK+ UI,RESOLVED,FIXED,Wireless Toolbar not enabled (using AirPcap) if PCAP_REMOTE=1,10/17/08 16:51,Normal,3,Windows Vista,wireshark-bugs,wmeier,7/5/08 7:30,2008-10-17 16:51:09 UTC,gerald
2686,GTK+ UI,RESOLVED,FIXED,Wireshark uses insecure version of zlib,7/18/08 15:39,Critical,9,Windows XP,wireshark-bugs,lonedesign_2k,7/5/08 11:12,2008-07-18 15:39:32 UTC,gerald
2687,GTK+ UI,RESOLVED,FIXED,Failure to dissect long SASL wrapped LDAP response,9/25/08 12:24,Normal,13,Windows XP,wireshark-bugs,mykaul,7/6/08 2:23,2008-09-25 12:24:33 UTC,anders.broman
2688,GTK+ UI,RESOLVED,FIXED,Mojito Protocol Dissestor Plugin,7/30/12 4:11,Enhancement,27,Windows XP,wireshark-bugs,travis.dawson,7/7/08 2:04,2012-07-30 04:11:13 UTC,mmann78
2689,GTK+ UI,RESOLVED,FIXED,"[PATCH]: enhanced ""what's past last mpls label?"" heuristic",7/14/08 23:49,Normal,7,All,wireshark-bugs,francesco.fondelli,7/7/08 7:28,2008-07-13 10:36:53 UTC,jaap.keuter
2690,GTK+ UI,RESOLVED,FIXED,packet-pppoe.c has wrong types for PADG  PADC and PADQ,7/18/08 12:31,Normal,7,Linux (other),wireshark-bugs,pdice,7/7/08 11:27,2008-07-18 12:31:25 UTC,jaap.keuter
2691,TShark,RESOLVED,FIXED,mysql dissector doesn't dissect mysql stream,8/4/10 0:59,Minor,10,Linux (other),wireshark-bugs,toralf.foerster,7/7/08 12:34,2010-08-04 00:58:40 UTC,toralf.foerster
2692,GTK+ UI,RESOLVED,FIXED,ged125 dissector,9/4/12 10:55,Enhancement,13,Windows XP,wireshark-bugs,mac1190,7/7/08 14:08,2012-09-04 10:55:33 UTC,mmann78
2693,GTK+ UI,RESOLVED,FIXED,enhancements to packet-pppoe.c for rfc4938bis,7/19/08 8:05,Enhancement,10,All,pdice,pdice,7/7/08 14:43,2008-07-19 08:05:18 UTC,jeff.morriss.ws
2694,GTK+ UI,RESOLVED,FIXED,packet-dcm  multiple PDV per PDU support,7/25/08 6:46,Normal,10,All,wireshark-bugs,david_aggeler,7/7/08 22:17,2008-07-25 06:46:29 UTC,anders.broman
2695,GTK+ UI,RESOLVED,FIXED,New WiMAX OFDMA PHY SAP dissector,7/25/12 13:49,Enhancement,8,Linux (other),wireshark-bugs,stephen.d.croll,7/7/08 23:10,2012-07-19 18:22:30 UTC,mmann78
2696,GTK+ UI,RESOLVED,FIXED,ULMAP CQICH_Alloc_IE decode error,7/11/08 9:04,Major,3,Windows XP,wireshark-bugs,frank.wang,7/8/08 18:48,2008-07-11 09:04:02 UTC,jaap.keuter
2697,GTK+ UI,RESOLVED,FIXED,crash while exporting data with non-english file names,12/11/12 7:57,Major,2,Windows XP,wireshark-bugs,everwanna,7/8/08 20:34,2012-12-11 07:57:21 UTC,mmann78
2698,GTK+ UI,RESOLVED,FIXED,sFlow IPv4/v6 sample support,7/9/08 11:38,Enhancement,4,Linux (other),wireshark-bugs,motonori,7/9/08 6:19,2008-07-09 11:38:18 UTC,jaap.keuter
2699,GTK+ UI,RESOLVED,FIXED,/usr/bin/xdg-open error : kfmclient: command not found,11/8/10 7:32,Minor,3,Linux (other),wireshark-bugs,toralf.foerster,7/10/08 11:18,2010-11-08 07:32:25 UTC,toralf.foerster
2700,GTK+ UI,RESOLVED,FIXED,MySQL Dissector doesn't show field info,7/12/08 13:02,Enhancement,4,All,wireshark-bugs,jbalint,7/10/08 15:25,2008-07-12 13:02:29 UTC,stig
2701,TShark,RESOLVED,FIXED,Buildbot crash output: fuzz-2008-07-10-4356.pcap,7/11/08 8:16,Critical,2,Linux (other),wireshark-bugs,buildbot-do-not-reply,7/10/08 21:10,2008-07-11 08:16:45 UTC,jeff.morriss.ws
2703,GTK+ UI,RESOLVED,WORKSFORME,SNMP User Table stops updating after certain number of entries,3/3/10 5:16,Normal,6,Windows XP,wireshark-bugs,wbenton,7/12/08 8:26,2010-03-02 17:11:10 UTC,wbenton
2706,GTK+ UI,RESOLVED,NOTABUG,CFM - Incorrect parsing of Test TLV,12/8/10 7:11,Minor,10,Red Hat,wireshark-bugs,ksriram29,7/13/08 0:16,2010-10-21 12:01:41 UTC,Christopher.Maynard
2707,GTK+ UI,RESOLVED,FIXED,Support for SMPP 5.0,7/23/08 6:32,Enhancement,6,All,wireshark-bugs,sarkar.abhik,7/13/08 2:10,2008-07-22 05:14:56 UTC,jeff.morriss.ws
2708,GTK+ UI,VERIFIED,NOTABUG,Crash after change of display filter  then attempt at sort. Long monitor sesssion of about 3 hours.,7/13/08 19:15,Major,4,Mac OS X 10.5,wireshark-bugs,wireshark,7/13/08 13:30,2008-07-13 14:16:21 UTC,wireshark
2709,GTK+ UI,RESOLVED,NOTABUG,Opening Screen - Desktop,7/13/08 22:32,Normal,2,Windows XP,wireshark-bugs,ocsrdo,7/13/08 18:10,2008-07-13 22:32:55 UTC,jaap.keuter
2710,GTK+ UI,RESOLVED,FIXED,ERF wiretap mishandles PAD records,7/13/08 22:47,Normal,2,All,wireshark-bugs,stephen.donnelly,7/13/08 21:55,2008-07-13 22:47:05 UTC,jaap.keuter
2711,GTK+ UI,RESOLVED,NOTOURBUG,dumpcap (packet.dll) crashes when opening Capture Interface dialog,2/16/09 7:46,Critical,3,Windows XP,wireshark-bugs,ghazel,7/14/08 11:55,2009-02-16 07:46:57 UTC,wmeier
2712,GTK+ UI,RESOLVED,FIXED,problems recreating a file from capture,7/14/08 23:02,Normal,5,Windows XP,wireshark-bugs,youngba,7/14/08 14:14,2008-07-14 23:02:50 UTC,sake
2713,Documentation,RESOLVED,NOTABUG,implement ppp analysis between e.g. two serial ports,9/30/12 19:22,Enhancement,4,All,wireshark-bugs,samuel.thibault,7/15/08 15:33,2012-09-30 19:22:14 UTC,Christopher.Maynard
2714,GTK+ UI,VERIFIED,FIXED,[AIM dissector] Incorrect TLV 0x14 size in details pane,7/25/08 6:43,Normal,2,All,wireshark-bugs,I.zaufi,7/15/08 16:49,2008-07-15 22:17:59 UTC,I.zaufi
2715,GTK+ UI,VERIFIED,FIXED,dissect_aim_tlv_value_uint32 uses only 24bits to obtain a value32,7/25/08 6:42,Major,2,All,wireshark-bugs,I.zaufi,7/15/08 17:25,2008-07-15 22:33:50 UTC,I.zaufi
2716,GTK+ UI,RESOLVED,NOTABUG,Dissection of 802.16e-2005 related TLVs in WIMAXASNCP plugin,2/1/10 12:49,Minor,3,Windows XP,wireshark-bugs,smit.rastogi,7/16/08 1:46,2010-02-01 12:49:18 UTC,anders.broman
2717,GTK+ UI,RESOLVED,WORKSFORME,Unable to type in text fields when viewed through Landesk Remote,7/17/08 5:46,Minor,3,Windows XP,wireshark-bugs,mgothard,7/16/08 13:45,2008-07-17 05:46:15 UTC,mgothard
